Project ID,Project Name,Project Start Date,Project Completion Date,Building ID,Number,Street,Borough,Postcode,BBL,BIN,Community Board,Council District,Census Tract,NTA - Neighborhood Tabulation Area,Latitude,Longitude,Latitude (Internal),Longitude (Internal),Building Completion Date,Reporting Construction Type,Extended Affordability Only,Prevailing Wage Status,Extremely Low Income Units,Very Low Income Units,Low Income Units,Moderate Income Units,Middle Income Units,Other Income Units,Studio Units,1-BR Units,2-BR Units,3-BR Units,4-BR Units,5-BR Units,6-BR+ Units,Unknown-BR Units,Counted Rental Units,Counted Homeownership Units,All Counted Units,Total Units,CompletionYear
75180,BRG LAMONT HDFC.HPO.FY25,6/30/2025,6/30/2025,671869.0,91-31,LAMONT AVENUE,Queens,11373.0,4015680040.0,4039232.0,QN-04,25.0,467.0,QN0401,40.744069,-73.874149,40.7443,-73.874289,2025-06-30,Preservation,Yes,Non Prevailing Wage,1.0,34.0,44.0,3.0,,1.0,18.0,51.0,14.0,,,,,,83.0,,83.0,83,2025.0
76578,PUEBLO NUEVO.HUDMF.FY25,6/30/2025,6/30/2025,805337.0,210,STANTON STREET,Manhattan,10002.0,1003450048.0,1004151.0,MN-03,2.0,2201.0,MN0302,40.719598,-73.982363,40.720103,-73.982175,2025-06-30,Preservation,Yes,Non Prevailing Wage,139.0,19.0,12.0,1.0,,1.0,,78.0,72.0,22.0,,,,,172.0,,172.0,172,2025.0
73316,GRAND & ROGERS CLUSTER (INCREASE).MPLP.FY25,6/27/2025,6/27/2025,56818.0,1171,CLAY AVENUE,Bronx,10456.0,2024300043.0,2002159.0,BX-04,16.0,17701.0,BX0401,40.831669,-73.911023,40.831828,-73.911268,2025-06-27,Preservation,No,Non Prevailing Wage,,,,12.0,,,,,6.0,6.0,,,,,12.0,,12.0,12,2025.0
73316,GRAND & ROGERS CLUSTER (INCREASE).MPLP.FY25,6/27/2025,6/27/2025,56824.0,1183,CLAY AVENUE,Bronx,10456.0,2024300037.0,2002156.0,BX-04,16.0,17701.0,BX0401,40.831927,-73.910881,40.83216,-73.91108,2025-06-27,Preservation,No,Non Prevailing Wage,,,,12.0,,,,,6.0,6.0,,,,,12.0,,12.0,12,2025.0
73316,GRAND & ROGERS CLUSTER (INCREASE).MPLP.FY25,6/27/2025,6/27/2025,56832.0,1202,CLAY AVENUE,Bronx,10456.0,2024260059.0,2002082.0,BX-04,16.0,17701.0,BX0401,40.832377,-73.91061,40.832055,-73.910502,2025-06-27,Preservation,No,Non Prevailing Wage,,3.0,8.0,,,,,,11.0,,,,,,11.0,,11.0,11,2025.0
73316,GRAND & ROGERS CLUSTER (INCREASE).MPLP.FY25,6/27/2025,6/27/2025,81951.0,384,GRAND CONCOURSE,Bronx,10451.0,2023410055.0,2001008.0,BX-01,8.0,51.0,BX0101,40.816058,-73.928392,40.816165,-73.927969,2025-06-27,Preservation,No,Non Prevailing Wage,,7.0,19.0,,,,7.0,13.0,6.0,,,,,,26.0,,26.0,26,2025.0
73316,GRAND & ROGERS CLUSTER (INCREASE).MPLP.FY25,6/27/2025,6/27/2025,97336.0,1129,MORRIS AVENUE,Bronx,10456.0,2024490023.0,2002575.0,BX-04,16.0,18101.0,BX0401,40.83134,-73.915244,40.83145,-73.915522,2025-06-27,Preservation,No,Non Prevailing Wage,,2.0,3.0,,,,,,4.0,1.0,,,,,5.0,,5.0,5,2025.0
73316,GRAND & ROGERS CLUSTER (INCREASE).MPLP.FY25,6/27/2025,6/27/2025,107220.0,1038,ROGERS PLACE,Bronx,10459.0,2027000009.0,2005392.0,BX-02,17.0,131.0,BX0202,40.824464,-73.897761,40.82454,-73.897486,2025-06-27,Preservation,No,Non Prevailing Wage,,4.0,16.0,,,1.0,5.0,7.0,9.0,,,,,,21.0,,21.0,21,2025.0
76058,OCEAN PARK.YR15.FY25,5/6/2025,5/6/2025,631575.0,125,BEACH 17 STREET,Queens,11691.0,4156380001.0,4436178.0,QN-14,31.0,101004.0,QN1401,40.594254,-73.75121,40.594168,-73.752273,2025-05-06,Preservation,Yes,Non Prevailing Wage,,,300.0,,,1.0,,150.0,126.0,25.0,,,,,301.0,,301.0,301,2025.0
76058,OCEAN PARK.YR15.FY25,5/6/2025,5/6/2025,811186.0,120,BEACH 19 STREET,Queens,11691.0,4156380001.0,4436179.0,QN-14,31.0,101004.0,QN1401,40.593572,-73.753179,40.594168,-73.752273,2025-05-06,Preservation,Yes,Non Prevailing Wage,,,300.0,,,1.0,,150.0,126.0,25.0,,,,,301.0,,301.0,301,2025.0
75517,3044 ALBANY CRESCENT 1.HPO.FY25,4/10/2025,4/10/2025,44824.0,3044,ALBANY CRESCENT,Bronx,10463.0,2032660090.0,2016127.0,BX-08,14.0,277.0,BX0801,40.877233,-73.90365,40.877527,-73.90349,2025-04-10,Preservation,Yes,Non Prevailing Wage,1.0,8.0,25.0,2.0,,,,6.0,20.0,10.0,,,,,36.0,,36.0,36,2025.0
75994,UNION STREET HOUSES.HUDMF.FY25,4/8/2025,4/8/2025,383410.0,1678,UNION STREET,Brooklyn,11213.0,3014020021.0,3037761.0,BK-09,35.0,35102.0,BK0901,40.667904,-73.932841,40.667696,-73.932916,2025-04-08,Preservation,Yes,Non Prevailing Wage,14.0,4.0,,,2.0,,,8.0,6.0,6.0,,,,,20.0,,20.0,20,2025.0
75994,UNION STREET HOUSES.HUDMF.FY25,4/8/2025,4/8/2025,383415.0,1690,UNION STREET,Brooklyn,11213.0,3014020024.0,3037762.0,BK-09,35.0,35102.0,BK0901,40.667885,-73.93248,40.667682,-73.932614,2025-04-08,Preservation,Yes,Non Prevailing Wage,24.0,4.0,1.0,,1.0,1.0,,19.0,12.0,,,,,,31.0,,31.0,31,2025.0
75994,UNION STREET HOUSES.HUDMF.FY25,4/8/2025,4/8/2025,383419.0,1703,UNION STREET,Brooklyn,11213.0,3013960074.0,3037568.0,BK-09,35.0,35102.0,BK0901,40.667946,-73.933255,40.668141,-73.933323,2025-04-08,Preservation,Yes,Non Prevailing Wage,15.0,3.0,2.0,,,,,4.0,9.0,7.0,,,,,20.0,,20.0,20,2025.0
75994,UNION STREET HOUSES.HUDMF.FY25,4/8/2025,4/8/2025,383423.0,1715,UNION STREET,Brooklyn,11213.0,3013960070.0,3037567.0,BK-09,35.0,35102.0,BK0901,40.667924,-73.93288,40.668124,-73.933028,2025-04-08,Preservation,Yes,Non Prevailing Wage,16.0,4.0,,,,,,4.0,9.0,7.0,,,,,20.0,,20.0,20,2025.0
75994,UNION STREET HOUSES.HUDMF.FY25,4/8/2025,4/8/2025,383424.0,1719,UNION STREET,Brooklyn,11213.0,3013960068.0,3037566.0,BK-09,35.0,35102.0,BK0901,40.667918,-73.932754,40.668105,-73.93279,2025-04-08,Preservation,Yes,Non Prevailing Wage,8.0,3.0,,1.0,,,1.0,4.0,3.0,4.0,,,,,12.0,,12.0,12,2025.0
75994,UNION STREET HOUSES.HUDMF.FY25,4/8/2025,4/8/2025,383443.0,1751,UNION STREET,Brooklyn,11213.0,3013960047.0,3037557.0,BK-09,35.0,35102.0,BK0901,40.667863,-73.931756,40.668068,-73.931665,2025-04-08,Preservation,Yes,Non Prevailing Wage,14.0,2.0,,,,,,1.0,11.0,4.0,,,,,16.0,,16.0,16,2025.0
76728,131 CONCORD STREET APARTMENTS,3/12/2025,3/12/2025,1011483.0,131,CONCORD STREET,Brooklyn,11201.0,3001070048.0,3000000.0,BK-02,33.0,13.0,BK0202,40.697663,-73.986191,40.697929,-73.986231,2025-03-12,New Construction,No,Non Prevailing Wage,,,,,22.0,,4.0,7.0,11.0,,,,,,22.0,,22.0,73,2025.0
75047,3569 DEKALB CLUSTER. HPO.FY25,3/6/2025,3/6/2025,61064.0,3569,DEKALB AVENUE,Bronx,10467.0,2033290040.0,2017838.0,BX-07,11.0,43101.0,BX0703,40.884184,-73.878979,40.884319,-73.879192,2025-03-06,Preservation,Yes,Non Prevailing Wage,1.0,9.0,38.0,5.0,,1.0,2.0,32.0,19.0,1.0,,,,,54.0,,54.0,54,2025.0
76737,2112 AVE P APARTMENTS,3/3/2025,5/14/2025,1010158.0,2112,AVENUE P,Brooklyn,11229.0,3067840005.0,3182580.0,BK-15,48.0,550.0,BK1502,40.611012,-73.952343,40.610833,-73.952123,2025-05-14,New Construction,No,Non Prevailing Wage,,,,,15.0,,,1.0,14.0,,,,,,15.0,,15.0,47,2025.0
75527,219 SACKMAN STREET.YR15.FY25,2/28/2025,2/28/2025,366041.0,219,SACKMAN STREET,Brooklyn,11212.0,3036940009.0,3083613.0,BK-16,37.0,908.0,BK1602,40.672617,-73.905636,40.672584,-73.905352,2025-02-28,Preservation,Yes,Non Prevailing Wage,1.0,26.0,10.0,,,1.0,4.0,4.0,23.0,7.0,,,,,38.0,,38.0,38,2025.0
75499,142 WEST 139TH ST.HPO.FY25,2/19/2025,2/19/2025,41291.0,142,WEST 139 STREET,Manhattan,10030.0,1020070059.0,1060050.0,MN-10,9.0,230.0,MN1002,40.817591,-73.941248,40.817407,-73.941393,2025-02-19,Preservation,Yes,Non Prevailing Wage,,1.0,11.0,8.0,,,,20.0,,,,,,,20.0,,20.0,20,2025.0
76740,31-33 LINCOLD RD. APARTMENTS,2/18/2025,2/18/2025,971695.0,33,LINCOLN ROAD,Brooklyn,11225.0,3050240074.0,3426435.0,BK-09,40.0,327.0,BK0902,40.660784,-73.961484,40.6611,-73.961855,2025-02-18,New Construction,No,Non Prevailing Wage,,,,,27.0,,6.0,6.0,15.0,,,,,,27.0,,27.0,90,2025.0
76752,806 EAST 170TH STREET APARTMENTS,1/30/2025,6/9/2025,1016054.0,806,EAST 170 STREET,Bronx,10459.0,2029630018.0,2000000.0,BX-03,17.0,153.0,BX0303,40.833152,-73.895471,40.832885,-73.895681,2025-06-09,New Construction,No,Non Prevailing Wage,,,,,100.0,,18.0,7.0,75.0,,,,,,100.0,,100.0,100,2025.0
76755,25-51 38TH ST APARTMENTS,1/30/2025,1/30/2025,1000028.0,25-51,38 STREET,Queens,11103.0,4006540014.0,4607559.0,QN-01,22.0,143.0,QN0104,40.767784,-73.912924,40.766922,-73.913311,2025-01-30,New Construction,No,Non Prevailing Wage,,,,,7.0,,,5.0,2.0,,,,,,7.0,,7.0,21,2025.0
76757,237 MCGUINNESS BLVD APARTMENTS,1/28/2025,6/11/2025,1008308.0,237,MCGUINNESS BOULEVARD,Brooklyn,11222.0,3025760007.0,3000000.0,BK-01,33.0,575.0,BK0101,40.730107,-73.951295,40.730171,-73.951745,2025-06-11,New Construction,No,Non Prevailing Wage,,,,,21.0,,5.0,5.0,11.0,,,,,,21.0,,21.0,70,2025.0
76760,THE DIME,1/28/2025,1/28/2025,1012104.0,277,SOUTH 5 STREET,Brooklyn,11211.0,3024477501.0,3323539.0,BK-01,34.0,525.0,BK0102,40.70922,-73.957871,40.709598,-73.957925,2025-01-28,New Construction,No,Non Prevailing Wage,,,,,54.0,,19.0,24.0,6.0,5.0,,,,,54.0,,54.0,177,2025.0
76736,36-20 STEINWAY STREET APARTMENTS,1/7/2025,1/7/2025,999816.0,36-20,STEINWAY STREET,Queens,11101.0,4006657501.0,4619734.0,QN-01,26.0,157.0,QN0104,40.753253,-73.923688,40.75291,-73.924399,2025-01-07,New Construction,No,Non Prevailing Wage,,,,,43.0,,13.0,21.0,9.0,,,,,,43.0,,43.0,143,2025.0
76434,463 WEST 125TH STREET APARTMENTS,12/26/2024,5/28/2025,1015652.0,463,WEST 125 STREET,Manhattan,10027.0,1019660040.0,1000000.0,MN-09,7.0,20901.0,MN0901,40.812869,-73.955807,40.813159,-73.955659,2025-05-28,New Construction,No,Non Prevailing Wage,,,,,5.0,,2.0,3.0,,,,,,,5.0,,5.0,14,2025.0
74425,CROTONA VII.HUDMF.FY25,12/20/2024,12/20/2024,85555.0,1660,HOE AVENUE,Bronx,10460.0,2029900001.0,2010670.0,BX-03,17.0,161.0,BX0303,40.835496,-73.887745,40.835526,-73.887427,2024-12-20,Preservation,Yes,Non Prevailing Wage,42.0,8.0,4.0,,,1.0,5.0,27.0,17.0,5.0,1.0,,,,55.0,,55.0,55,2024.0
75549,MORNINGSIDE I.HUDMF.FY25,12/19/2024,12/19/2024,25538.0,20,MORNINGSIDE AVENUE,Manhattan,10026.0,1019430001.0,1081519.0,MN-10,9.0,20102.0,MN1001,40.805708,-73.95811,40.805656,-73.957568,2024-12-19,Preservation,Yes,Non Prevailing Wage,39.0,5.0,2.0,,6.0,1.0,2.0,28.0,15.0,7.0,1.0,,,,53.0,,53.0,53,2024.0
75549,MORNINGSIDE I.HUDMF.FY25,12/19/2024,12/19/2024,805872.0,369,WEST 116 STREET,Manhattan,10026.0,1019430001.0,1081516.0,MN-10,9.0,20102.0,MN1001,40.805277,-73.95738,40.805656,-73.957568,2024-12-19,Preservation,Yes,Non Prevailing Wage,39.0,11.0,4.0,,2.0,,,15.0,41.0,,,,,,56.0,,56.0,56,2024.0
75051,CATHEDRAL PARKWAY & MID-HARLEM.YR15.FY25,12/18/2024,12/18/2024,3494.0,2246,ADAM C POWELL BOULEVARD,Manhattan,10027.0,1019380030.0,1058779.0,MN-10,9.0,226.0,MN1002,40.813547,-73.944998,40.813709,-73.945374,2024-12-18,Preservation,Yes,Non Prevailing Wage,3.0,3.0,1.0,1.0,,,,4.0,4.0,,,,,,8.0,,8.0,8,2024.0
75051,CATHEDRAL PARKWAY & MID-HARLEM.YR15.FY25,12/18/2024,12/18/2024,3594.0,2423,ADAM C POWELL BOULEVARD,Manhattan,10030.0,1020100064.0,1060100.0,MN-10,9.0,230.0,MN1002,40.819375,-73.940716,40.81924,-73.940318,2024-12-18,Preservation,Yes,Non Prevailing Wage,2.0,7.0,2.0,,,,1.0,,5.0,5.0,,,,,11.0,,11.0,11,2024.0
75051,CATHEDRAL PARKWAY & MID-HARLEM.YR15.FY25,12/18/2024,12/18/2024,3917.0,2084,FREDERICK DOUGLASS BOULEVARD,Manhattan,10026.0,1018280061.0,1055127.0,MN-10,9.0,216.0,MN1001,40.802299,-73.956902,40.802258,-73.956537,2024-12-18,Preservation,Yes,Non Prevailing Wage,1.0,2.0,3.0,3.0,,,,,1.0,8.0,,,,,9.0,,9.0,9,2024.0
75051,CATHEDRAL PARKWAY & MID-HARLEM.YR15.FY25,12/18/2024,12/18/2024,37867.0,212,WEST 111 STREET,Manhattan,10026.0,1018260044.0,1055070.0,MN-10,9.0,216.0,MN1001,40.800333,-73.955588,40.800301,-73.956105,2024-12-18,Preservation,Yes,Non Prevailing Wage,1.0,9.0,2.0,8.0,1.0,,2.0,13.0,3.0,3.0,,,,,21.0,,21.0,21,2024.0
75051,CATHEDRAL PARKWAY & MID-HARLEM.YR15.FY25,12/18/2024,12/18/2024,37869.0,216,WEST 111 STREET,Manhattan,10026.0,1018260046.0,1055071.0,MN-10,9.0,216.0,MN1001,40.800366,-73.955668,40.800367,-73.95626,2024-12-18,Preservation,Yes,Non Prevailing Wage,2.0,8.0,3.0,7.0,,1.0,1.0,14.0,3.0,3.0,,,,,21.0,,21.0,21,2024.0
75051,CATHEDRAL PARKWAY & MID-HARLEM.YR15.FY25,12/18/2024,12/18/2024,38041.0,267,WEST 113 STREET,Manhattan,10026.0,1018290009.0,1055141.0,MN-10,9.0,216.0,MN1001,40.802087,-73.955811,40.802334,-73.955836,2024-12-18,Preservation,Yes,Non Prevailing Wage,,4.0,1.0,7.0,,,,5.0,3.0,4.0,,,,,12.0,,12.0,12,2024.0
75051,CATHEDRAL PARKWAY & MID-HARLEM.YR15.FY25,12/18/2024,12/18/2024,38050.0,280,WEST 113 STREET,Manhattan,10026.0,1018280060.0,1055126.0,MN-10,9.0,216.0,MN1001,40.802216,-73.956161,40.802082,-73.956407,2024-12-18,Preservation,Yes,Non Prevailing Wage,1.0,4.0,3.0,6.0,,1.0,,10.0,4.0,1.0,,,,,15.0,,15.0,15,2024.0
75051,CATHEDRAL PARKWAY & MID-HARLEM.YR15.FY25,12/18/2024,12/18/2024,38234.0,225,WEST 115 STREET,Manhattan,10026.0,1018310116.0,1055251.0,MN-10,9.0,218.0,MN1001,40.803067,-73.954257,40.803322,-73.9543,2024-12-18,Preservation,Yes,Non Prevailing Wage,,2.0,1.0,2.0,,,,,5.0,,,,,,5.0,,5.0,5,2024.0
75051,CATHEDRAL PARKWAY & MID-HARLEM.YR15.FY25,12/18/2024,12/18/2024,38238.0,235,WEST 115 STREET,Manhattan,10026.0,1018310012.0,1055227.0,MN-10,9.0,218.0,MN1001,40.803284,-73.954759,40.803484,-73.954661,2024-12-18,Preservation,Yes,Non Prevailing Wage,2.0,1.0,3.0,4.0,,,,5.0,5.0,,,,,,10.0,,10.0,10,2024.0
75051,CATHEDRAL PARKWAY & MID-HARLEM.YR15.FY25,12/18/2024,12/18/2024,40656.0,231,WEST 134 STREET,Manhattan,10030.0,1019400019.0,1058832.0,MN-10,9.0,228.0,MN1002,40.815098,-73.945271,40.815332,-73.945275,2024-12-18,Preservation,Yes,Non Prevailing Wage,,1.0,1.0,2.0,1.0,,,2.0,3.0,,,,,,5.0,,5.0,5,2024.0
75051,CATHEDRAL PARKWAY & MID-HARLEM.YR15.FY25,12/18/2024,12/18/2024,40745.0,241,WEST 135 STREET,Manhattan,10030.0,1019410008.0,1058875.0,MN-10,9.0,228.0,MN1002,40.816194,-73.945787,40.816427,-73.945621,2024-12-18,Preservation,Yes,Non Prevailing Wage,,4.0,3.0,2.0,1.0,,1.0,5.0,4.0,,,,,,10.0,,10.0,10,2024.0
75051,CATHEDRAL PARKWAY & MID-HARLEM.YR15.FY25,12/18/2024,12/18/2024,41097.0,67,WEST 137 STREET,Manhattan,10037.0,1017350006.0,1053902.0,MN-10,9.0,212.0,MN1002,40.814878,-73.938639,40.815326,-73.93914,2024-12-18,Preservation,Yes,Non Prevailing Wage,3.0,6.0,2.0,1.0,1.0,1.0,1.0,5.0,,8.0,,,,,14.0,,14.0,14,2024.0
75374,UPACA / 1900 LEXINGTON.YR15.FY25,12/11/2024,12/11/2024,24078.0,1900,LEXINGTON AVENUE,Manhattan,10035.0,1017670016.0,1054347.0,MN-11,9.0,182.0,MN1102,40.800055,-73.940585,40.800349,-73.940733,2024-12-11,Preservation,Yes,Non Prevailing Wage,86.0,20.0,12.0,14.0,1.0,1.0,1.0,4.0,97.0,32.0,,,,,134.0,,134.0,134,2024.0
74485,RACHEL BRIDGE HDFC.HPO.FY25,11/27/2024,11/27/2024,27974.0,1360,ST NICHOLAS AVENUE,Manhattan,10033.0,1021530001.0,1079909.0,MN-12,10.0,261.0,MN1201,40.847503,-73.935052,40.84739,-73.93421,2024-11-27,Preservation,Yes,Non Prevailing Wage,,22.0,158.0,59.0,1.0,,60.0,60.0,,120.0,,,,,240.0,,240.0,240,2024.0
74485,RACHEL BRIDGE HDFC.HPO.FY25,11/27/2024,11/27/2024,28980.0,101,WADSWORTH AVENUE,Manhattan,10033.0,1021620001.0,1079921.0,MN-12,10.0,263.0,MN1201,40.848099,-73.936215,40.84795,-73.935561,2024-11-27,Preservation,Yes,Non Prevailing Wage,,17.0,167.0,54.0,2.0,,,60.0,180.0,,,,,,240.0,,240.0,240,2024.0
74485,RACHEL BRIDGE HDFC.HPO.FY25,11/27/2024,11/27/2024,804020.0,258,AUDUBON AVENUE,Manhattan,10033.0,1021530001.0,1079908.0,MN-12,10.0,261.0,MN1201,40.847043,-73.933585,40.84739,-73.93421,2024-11-27,Preservation,Yes,Non Prevailing Wage,,7.0,187.0,44.0,1.0,1.0,,60.0,180.0,,,,,,240.0,,240.0,240,2024.0
74485,RACHEL BRIDGE HDFC.HPO.FY25,11/27/2024,11/27/2024,805325.0,1361,ST NICHOLAS AVENUE,Manhattan,10033.0,1021620001.0,1079920.0,MN-12,10.0,263.0,MN1201,40.847511,-73.93507,40.84795,-73.935561,2024-11-27,Preservation,Yes,Non Prevailing Wage,,27.0,158.0,54.0,,1.0,60.0,60.0,,120.0,,,,,240.0,,240.0,240,2024.0
76400,232 EAST 35 STREET,10/29/2024,5/2/2025,1014287.0,232,EAST 35 STREET,Brooklyn,11203.0,3048880031.0,3423163.0,BK-17,40.0,856.0,BK1701,40.649757,-73.944647,40.649592,-73.944903,2025-05-02,New Construction,No,Non Prevailing Wage,,,,,2.0,,,,1.0,1.0,,,,,2.0,,2.0,6,2025.0
76401,236 EAST 35 STREET,10/29/2024,5/2/2025,1014232.0,236,EAST 35 STREET,Brooklyn,11203.0,,,BK-17,40.0,856.0,BK1701,40.649683,-73.944639,,,2025-05-02,New Construction,No,Non Prevailing Wage,,,,,2.0,,,,1.0,1.0,,,,,2.0,,2.0,6,2025.0
76416,2301 BEAUMONT AVENUE,10/29/2024,6/16/2025,1014454.0,2301,BEAUMONT AVENUE,Bronx,10458.0,2030890065.0,2000000.0,BX-06,15.0,391.0,BX0603,40.852105,-73.885501,40.852223,-73.88562,2025-06-16,New Construction,No,Non Prevailing Wage,,,,,19.0,,9.0,6.0,4.0,,,,,,19.0,,19.0,20,2025.0
76402,3421 SNYDER AVENUE,10/28/2024,5/2/2025,1014203.0,3421,SNYDER AVENUE,Brooklyn,11203.0,3048880033.0,3109443.0,BK-17,40.0,856.0,BK1701,40.649186,-73.945238,40.649378,-73.944896,2025-05-02,New Construction,No,Non Prevailing Wage,,,,,3.0,,,,3.0,,,,,,3.0,,3.0,10,2025.0
76404,1700 JEROME AVENUE,10/15/2024,6/25/2025,369117.0,1621,SHEEPSHEAD BAY ROAD,Brooklyn,11235.0,3074620067.0,3205005.0,BK-15,48.0,600.0,BK1503,40.586866,-73.952609,40.587151,-73.951946,2025-06-25,New Construction,No,Non Prevailing Wage,,,,,11.0,,1.0,7.0,3.0,,,,,,11.0,,11.0,36,2025.0
76411,2011 VYSE AVENUE,10/8/2024,2/28/2025,1014211.0,2011,VYSE AVENUE,Bronx,10460.0,2031270025.0,2000000.0,BX-06,15.0,363.0,BX0601,40.842322,-73.8819,40.842646,-73.882033,2025-02-28,New Construction,No,Non Prevailing Wage,,,,,16.0,,10.0,6.0,,,,,,,16.0,,16.0,17,2025.0
76269,3165 VILLA AVE _ HPS,9/30/2024,12/20/2024,1012085.0,3165,VILLA AVENUE,Bronx,10468.0,2033220044.0,2000000.0,BX-07,11.0,411.0,BX0702,40.876414,-73.88696,40.876206,-73.88734,2024-12-20,New Construction,No,Non Prevailing Wage,,,,,56.0,,13.0,22.0,21.0,,,,,,56.0,,56.0,57,2024.0
76277,1848 GUERLAIN STREET,9/25/2024,6/27/2025,1013695.0,1848,GUERLAIN STREET,Bronx,10460.0,2039220004.0,2000000.0,BX-09,18.0,21601.0,BX0901,40.839612,-73.865374,40.839384,-73.865338,2025-06-27,New Construction,No,Non Prevailing Wage,,,,,9.0,,2.0,2.0,5.0,,,,,,9.0,,9.0,9,2025.0
76276,1846 GUERLAIN STREET,9/24/2024,6/16/2025,1014051.0,1846,GUERLAIN STREET,Bronx,10460.0,2039220003.0,2000000.0,BX-09,18.0,21601.0,BX0901,40.83959,-73.865443,40.839365,-73.865425,2025-06-16,New Construction,No,Non Prevailing Wage,,,,,7.0,,,7.0,,,,,,,7.0,,7.0,8,2025.0
76279,257 DRIGGS AVENUE,9/24/2024,5/30/2025,234532.0,257,DRIGGS AVENUE,Brooklyn,11222.0,3026990009.0,3067546.0,BK-01,33.0,499.0,BK0101,40.722662,-73.948013,40.72236,-73.947927,2025-05-30,New Construction,No,Non Prevailing Wage,,,,,6.0,,1.0,1.0,4.0,,,,,,6.0,,6.0,18,2025.0
76281,368 EAST 194TH STREET APARTMENTS,9/23/2024,3/20/2025,976784.0,368,EAST 194 STREET,Bronx,10458.0,2032760030.0,2016340.0,BX-07,15.0,39901.0,BX0701,40.863654,-73.890495,40.863473,-73.890626,2025-03-20,New Construction,No,Non Prevailing Wage,,,,,12.0,,1.0,,,11.0,,,,,12.0,,12.0,12,2025.0
76282,767 EAST 232ND STREET,9/23/2024,6/27/2025,1015664.0,767,EAST 232 STREET,Bronx,10466.0,,,BX-12,11.0,422.0,BX1203,40.892078,-73.855585,,,2025-06-27,New Construction,No,Non Prevailing Wage,,,,,9.0,,6.0,3.0,,,,,,,9.0,,9.0,10,2025.0
76283,831 FOREST AVENUE,9/23/2024,3/12/2025,1014054.0,831,FOREST AVENUE,Bronx,10456.0,2026470018.0,2000000.0,BX-01,17.0,77.0,BX0102,40.820252,-73.905369,40.820485,-73.905517,2025-03-12,New Construction,No,Non Prevailing Wage,,,,,12.0,,,7.0,5.0,,,,,,12.0,,12.0,15,2025.0
74737,WEST FARMS.HUDMF.FY25,9/19/2024,9/19/2024,79328.0,1011,FREEMAN STREET,Bronx,10459.0,2030060067.0,2010904.0,BX-03,17.0,123.0,BX0303,40.829029,-73.887148,40.829273,-73.887,2024-09-19,Preservation,Yes,Non Prevailing Wage,131.0,25.0,6.0,7.0,,,2.0,67.0,95.0,5.0,,,,,169.0,,169.0,169,2024.0
74737,WEST FARMS.HUDMF.FY25,9/19/2024,9/19/2024,79331.0,1029,FREEMAN STREET,Bronx,10459.0,2030060053.0,2010903.0,BX-03,17.0,123.0,BX0303,40.828774,-73.886773,40.828935,-73.886527,2024-09-19,Preservation,Yes,Non Prevailing Wage,44.0,7.0,1.0,1.0,,1.0,,18.0,35.0,1.0,,,,,54.0,,54.0,54,2024.0
74737,WEST FARMS.HUDMF.FY25,9/19/2024,9/19/2024,122054.0,1314,WEST FARMS ROAD,Bronx,10459.0,2030060084.0,2010905.0,BX-03,17.0,123.0,BX0303,40.829567,-73.887213,40.829517,-73.886638,2024-09-19,Preservation,Yes,Non Prevailing Wage,73.0,21.0,7.0,6.0,,,6.0,31.0,69.0,1.0,,,,,107.0,,107.0,107,2024.0
76290,135 MARCY PLACE,9/17/2024,2/5/2025,94273.0,135,MARCY PLACE,Bronx,10452.0,2028410082.0,2008070.0,BX-04,16.0,22102.0,BX0403,40.837966,-73.915929,40.838095,-73.915654,2025-02-05,New Construction,No,Non Prevailing Wage,,,,,8.0,,8.0,,,,,,,,8.0,,8.0,26,2025.0
76299,177-44 129 AVENUE,9/6/2024,4/16/2025,1013923.0,177-44,129 AVENUE,Queens,11434.0,4125380130.0,4000000.0,QN-12,27.0,33401.0,QN1204,40.680537,-73.764812,40.680522,-73.763785,2025-04-16,New Construction,No,Non Prevailing Wage,,,,,16.0,,1.0,6.0,9.0,,,,,,16.0,,16.0,16,2025.0
76302,633 EAST 230 STREET,9/5/2024,4/17/2025,1013796.0,633,EAST 230 STREET,Bronx,10466.0,2048330041.0,2129682.0,BX-12,11.0,420.0,BX1203,40.892055,-73.860743,40.892293,-73.860757,2025-04-17,New Construction,No,Non Prevailing Wage,,,,,14.0,,1.0,,13.0,,,,,,14.0,,14.0,25,2025.0
75450,METROCOURT.HUDMF.FY25,8/29/2024,8/29/2024,1122.0,1952,2 AVENUE,Manhattan,10029.0,1016720001.0,1052651.0,MN-11,8.0,164.0,MN1101,40.787105,-73.945002,40.786995,-73.94467,2024-08-29,Preservation,Yes,Non Prevailing Wage,66.0,14.0,7.0,,3.0,1.0,,16.0,63.0,12.0,,,,,91.0,,91.0,91,2024.0
76305,2026 HONEYWELL AVE APARTMENTS,8/29/2024,4/9/2025,1013950.0,2026,HONEYWELL AVENUE,Bronx,10460.0,2031220010.0,2000000.0,BX-06,15.0,363.0,BX0601,40.843496,-73.883683,40.843575,-73.883253,2025-04-09,New Construction,No,Non Prevailing Wage,,,,,59.0,,,,59.0,,,,,,59.0,,59.0,59,2025.0
76309,1845 PITKINS AVE APARTMENTS,8/27/2024,12/19/2024,1013970.0,1845,PITKIN AVENUE,Brooklyn,11212.0,3037090135.0,3000000.0,BK-16,37.0,908.0,BK1602,40.670588,-73.904745,40.670816,-73.904817,2024-12-19,New Construction,No,Non Prevailing Wage,,,,,8.0,,1.0,,7.0,,,,,,8.0,,8.0,8,2024.0
77185,THE TRIO APARTMENTS,8/27/2024,8/27/2024,1006161.0,27-19,THOMSON AVENUE,Queens,11101.0,4000817502.0,4000694.0,QN-02,26.0,1901.0,QN0201,40.746303,-73.942452,40.746454,-73.942231,2024-08-27,New Construction,No,Non Prevailing Wage,,,,,11.0,,1.0,7.0,3.0,,,,,,11.0,,11.0,34,2024.0
76229,34-31 9TH STREET,8/16/2024,4/16/2025,400528.0,34-29,9 STREET,Queens,11106.0,4003240013.0,4003849.0,QN-01,22.0,39.0,QN0105,40.764359,-73.939941,40.764205,-73.939758,2025-04-16,New Construction,No,Non Prevailing Wage,,,,,2.0,,,,2.0,,,,,,2.0,,2.0,6,2025.0
76342,2423 BARKER AVENUE APARTMENTS,8/16/2024,5/23/2025,47147.0,2423,BARKER AVENUE,Bronx,10467.0,2044240048.0,2000000.0,BX-11,15.0,33202.0,BX1104,40.861955,-73.869429,40.862151,-73.869699,2025-05-23,New Construction,No,Non Prevailing Wage,,,,,12.0,,1.0,8.0,2.0,1.0,,,,,12.0,,12.0,38,2025.0
76242,931 NEW YORK AVENUE,8/14/2024,5/28/2025,344068.0,931,NEW YORK AVENUE,Brooklyn,11203.0,3048870063.0,3109420.0,BK-17,40.0,856.0,BK1701,40.650427,-73.946607,40.650592,-73.946314,2025-05-28,New Construction,No,Non Prevailing Wage,,,,,4.0,,1.0,1.0,2.0,,,,,,4.0,,4.0,12,2025.0
76258,372 EAST 194TH STREET APARTMENTS,8/9/2024,4/23/2025,976785.0,372,EAST 194 STREET,Bronx,10458.0,2032760031.0,2016341.0,BX-07,15.0,39901.0,BX0701,40.86361,-73.890419,40.863432,-73.890554,2025-04-23,New Construction,No,Non Prevailing Wage,,,,,7.0,,,6.0,1.0,,,,,,7.0,,7.0,8,2025.0
76262,258 ROCKAWAY AVENUE APARTMENTS,7/31/2024,2/12/2025,1014482.0,258,ROCKAWAY AVENUE,Brooklyn,11233.0,3014480037.0,3000000.0,BK-16,41.0,36501.0,BK1601,40.67437,-73.911124,40.674401,-73.91142,2025-02-12,New Construction,No,Non Prevailing Wage,,,,,7.0,,,7.0,,,,,,,7.0,,7.0,8,2025.0
76263,260 ROCKAWAY AVENUE APARTMENTS,7/31/2024,2/12/2025,1014516.0,260,ROCKAWAY AVENUE,Brooklyn,11233.0,3014480037.0,3000000.0,BK-16,41.0,36501.0,BK1601,40.674301,-73.911132,40.674401,-73.91142,2025-02-12,New Construction,No,Non Prevailing Wage,,,,,7.0,,,7.0,,,,,,,7.0,,7.0,8,2025.0
76264,262 ROCKAWAY AVENUE APARTMENTS,7/31/2024,2/12/2025,1014484.0,262,ROCKAWAY AVENUE,Brooklyn,11233.0,3014480039.0,3000000.0,BK-16,41.0,36501.0,BK1601,40.674233,-73.911139,40.674263,-73.911434,2025-02-12,New Construction,No,Non Prevailing Wage,,,,,7.0,,,7.0,,,,,,,7.0,,7.0,8,2025.0
76307,1907 HARRISON AVENUE,7/18/2024,2/20/2025,1013510.0,1907,HARRISON AVENUE,Bronx,10453.0,2028680161.0,2008565.0,BX-05,14.0,243.0,BX0501,40.85305,-73.911019,40.853157,-73.911243,2025-02-20,New Construction,No,Non Prevailing Wage,,,,,14.0,,4.0,5.0,5.0,,,,,,14.0,,14.0,15,2025.0
76313,364 EAST 194TH STREET APARTMENTS,7/17/2024,4/23/2025,976783.0,364,EAST 194 STREET,Bronx,10458.0,2032760028.0,2016339.0,BX-07,15.0,39901.0,BX0701,40.863698,-73.890571,40.863523,-73.890709,2025-04-23,New Construction,No,Non Prevailing Wage,,,,,12.0,,1.0,2.0,,9.0,,,,,12.0,,12.0,12,2025.0
76266,344 LORIMER STREET,7/16/2024,2/7/2025,1014111.0,344,LORIMER STREET,Brooklyn,11206.0,3030500004.0,3071063.0,BK-01,34.0,511.0,BK0104,40.707201,-73.948235,40.707223,-73.948004,2025-02-07,New Construction,No,Non Prevailing Wage,,,,,3.0,,,,3.0,,,,,,3.0,,3.0,8,2025.0
76316,1847 PITKINS AVE APARTMENTS,7/15/2024,3/5/2025,1013551.0,1847,PITKIN AVENUE,Brooklyn,11212.0,3037090134.0,3000000.0,BK-16,37.0,908.0,BK1602,40.670596,-73.904687,40.670827,-73.904752,2025-03-05,New Construction,No,Non Prevailing Wage,,,,,8.0,,1.0,,7.0,,,,,,8.0,,8.0,8,2025.0
76317,2525 GRAND AVENUE,7/15/2024,2/5/2025,1013351.0,2525,GRAND AVENUE,Bronx,10468.0,2032140051.0,2000000.0,BX-07,14.0,265.0,BX0701,40.865168,-73.901491,40.865366,-73.90165,2025-02-05,New Construction,No,Non Prevailing Wage,,,,,8.0,,8.0,,,,,,,,8.0,,8.0,24,2025.0
76329,2783 WEBB AVE APARTMENTS,7/4/2024,5/14/2025,120399.0,2783,WEBB AVENUE,Bronx,10468.0,2032490221.0,2015388.0,BX-08,14.0,26702.0,BX0801,40.871453,-73.901214,40.871396,-73.901558,2025-05-14,New Construction,No,Non Prevailing Wage,,,,,18.0,,11.0,6.0,,1.0,,,,,18.0,,18.0,19,2025.0
76330,2958 MARION AVE APARTMENTS,7/3/2024,6/24/2025,1013073.0,2958,MARION AVENUE,Bronx,10458.0,2032850007.0,2000000.0,BX-07,11.0,415.0,BX0702,40.868981,-73.884246,40.868838,-73.884011,2025-06-24,New Construction,No,Non Prevailing Wage,,,,,3.0,,,2.0,1.0,,,,,,3.0,,3.0,10,2025.0
76332,2960 MARION AVE APARTMENTS,7/3/2024,6/24/2025,1013074.0,2960,MARION AVENUE,Bronx,10458.0,2032850009.0,2000000.0,BX-07,11.0,415.0,BX0702,40.869014,-73.884188,40.868879,-73.883946,2025-06-24,New Construction,No,Non Prevailing Wage,,,,,3.0,,,2.0,1.0,,,,,,3.0,,3.0,10,2025.0
76335,65 STANHOPE,7/3/2024,6/16/2025,375679.0,65,STANHOPE STREET,Brooklyn,11221.0,3032540066.0,3000000.0,BK-04,34.0,421.0,BK0401,40.696217,-73.924849,40.696324,-73.92508,2025-06-16,New Construction,No,Non Prevailing Wage,,,,,3.0,,,3.0,,,,,,,3.0,,3.0,7,2025.0
76336,63 STANHOPE STREET,7/3/2024,6/16/2025,1017218.0,63,STANHOPE STREET,Brooklyn,11221.0,,,BK-04,34.0,421.0,BK0401,40.696179,-73.924889,,,2025-06-16,New Construction,No,Non Prevailing Wage,,,,,3.0,,,3.0,,,,,,,3.0,,3.0,7,2025.0
74330,FAC 341 10TH STREET HDFC.HPO.FY24,6/28/2024,6/28/2024,135263.0,341,10 STREET,Brooklyn,11215.0,3010100026.0,3022261.0,BK-06,38.0,139.0,BK0602,40.669057,-73.987762,40.66934,-73.987686,2024-06-28,Preservation,Yes,Non Prevailing Wage,2.0,3.0,98.0,9.0,41.0,1.0,5.0,36.0,76.0,37.0,,,,,154.0,,154.0,154,2024.0
74482,ANDERSON AVENUE HDFC.HPO.FY24,6/28/2024,6/28/2024,45412.0,1038,ANDERSON AVENUE,Bronx,10452.0,2025040094.0,2003052.0,BX-04,16.0,193.0,BX0402,40.833167,-73.926487,40.833238,-73.925916,2024-06-28,Preservation,Yes,Non Prevailing Wage,1.0,51.0,34.0,,,,,65.0,20.0,1.0,,,,,86.0,,86.0,86,2024.0
74482,ANDERSON AVENUE HDFC.HPO.FY24,6/28/2024,6/28/2024,45414.0,1060,ANDERSON AVENUE,Bronx,10452.0,2025050001.0,2003055.0,BX-04,16.0,193.0,BX0402,40.83373,-73.926053,40.833595,-73.925717,2024-06-28,Preservation,Yes,Non Prevailing Wage,,24.0,11.0,,,,,27.0,8.0,,,,,,35.0,,35.0,35,2024.0
74482,ANDERSON AVENUE HDFC.HPO.FY24,6/28/2024,6/28/2024,45417.0,1080,ANDERSON AVENUE,Bronx,10452.0,2025050006.0,2003056.0,BX-04,16.0,193.0,BX0402,40.834171,-73.925716,40.834053,-73.925431,2024-06-28,Preservation,Yes,Non Prevailing Wage,3.0,44.0,42.0,1.0,,1.0,19.0,60.0,11.0,1.0,,,,,91.0,,91.0,91,2024.0
74482,ANDERSON AVENUE HDFC.HPO.FY24,6/28/2024,6/28/2024,806241.0,1050,ANDERSON AVENUE,Bronx,10452.0,2025040094.0,2098174.0,BX-04,16.0,193.0,BX0402,40.833387,-73.926317,40.833238,-73.925916,2024-06-28,Preservation,Yes,Non Prevailing Wage,,60.0,25.0,,,1.0,1.0,70.0,14.0,1.0,,,,,86.0,,86.0,86,2024.0
74483,CROTONA PARK WEST HDFC.HPO.FY24,6/28/2024,6/28/2024,60076.0,1451,CROTONA PLACE,Bronx,10456.0,2029270031.0,2009638.0,BX-03,16.0,169.0,BX0302,40.836267,-73.901563,40.835965,-73.901993,2024-06-28,Preservation,Yes,Non Prevailing Wage,,15.0,6.0,,,,,,20.0,1.0,,,,,21.0,,21.0,21,2024.0
74483,CROTONA PARK WEST HDFC.HPO.FY24,6/28/2024,6/28/2024,79777.0,1409,FULTON AVENUE,Bronx,10456.0,2029260027.0,2009629.0,BX-03,16.0,14702.0,BX0302,40.834845,-73.901731,40.8349,-73.902092,2024-06-28,Preservation,Yes,Non Prevailing Wage,,36.0,14.0,,,,,27.0,23.0,,,,,,50.0,,50.0,50,2024.0
74483,CROTONA PARK WEST HDFC.HPO.FY24,6/28/2024,6/28/2024,79778.0,1413,FULTON AVENUE,Bronx,10456.0,2029260023.0,2009628.0,BX-03,16.0,14702.0,BX0302,40.834941,-73.901669,40.835136,-73.901937,2024-06-28,Preservation,Yes,Non Prevailing Wage,,20.0,11.0,,,1.0,,15.0,17.0,,,,,,32.0,,32.0,32,2024.0
74483,CROTONA PARK WEST HDFC.HPO.FY24,6/28/2024,6/28/2024,79780.0,1465,FULTON AVENUE,Bronx,10456.0,2029270059.0,2009643.0,BX-03,16.0,169.0,BX0302,40.836049,-73.900905,40.835989,-73.901245,2024-06-28,Preservation,Yes,Non Prevailing Wage,,12.0,7.0,,,,,13.0,5.0,1.0,,,,,19.0,,19.0,19,2024.0
74483,CROTONA PARK WEST HDFC.HPO.FY24,6/28/2024,6/28/2024,79781.0,1469,FULTON AVENUE,Bronx,10456.0,2029270057.0,2009642.0,BX-03,16.0,169.0,BX0302,40.836096,-73.900876,40.836113,-73.901165,2024-06-28,Preservation,Yes,Non Prevailing Wage,,16.0,4.0,,,,,15.0,5.0,,,,,,20.0,,20.0,20,2024.0
74483,CROTONA PARK WEST HDFC.HPO.FY24,6/28/2024,6/28/2024,79783.0,1485,FULTON AVENUE,Bronx,10456.0,2029270050.0,2009641.0,BX-03,16.0,169.0,BX0302,40.836274,-73.900768,40.836483,-73.900923,2024-06-28,Preservation,Yes,Non Prevailing Wage,1.0,30.0,13.0,,,,,13.0,30.0,1.0,,,,,44.0,,44.0,44,2024.0
74483,CROTONA PARK WEST HDFC.HPO.FY24,6/28/2024,6/28/2024,79791.0,1573,FULTON AVENUE,Bronx,10457.0,2029290035.0,2009653.0,BX-03,15.0,167.0,BX0302,40.838277,-73.89963,40.838606,-73.899868,2024-06-28,Preservation,Yes,Non Prevailing Wage,1.0,16.0,3.0,,,,,,7.0,13.0,,,,,20.0,,20.0,20,2024.0
74483,CROTONA PARK WEST HDFC.HPO.FY24,6/28/2024,6/28/2024,79792.0,1581,FULTON AVENUE,Bronx,10457.0,2029290031.0,2009652.0,BX-03,15.0,167.0,BX0302,40.838411,-73.899557,40.838777,-73.899759,2024-06-28,Preservation,Yes,Non Prevailing Wage,,35.0,11.0,,,,,5.0,36.0,5.0,,,,,46.0,,46.0,46,2024.0
74483,CROTONA PARK WEST HDFC.HPO.FY24,6/28/2024,6/28/2024,79793.0,1591,FULTON AVENUE,Bronx,10457.0,2029290028.0,2009651.0,BX-03,15.0,167.0,BX0302,40.838579,-73.899463,40.838996,-73.899618,2024-06-28,Preservation,Yes,Non Prevailing Wage,,28.0,17.0,,,1.0,,12.0,29.0,5.0,,,,,46.0,,46.0,46,2024.0
74483,CROTONA PARK WEST HDFC.HPO.FY24,6/28/2024,6/28/2024,79794.0,1605,FULTON AVENUE,Bronx,10457.0,2029290024.0,2009650.0,BX-03,15.0,167.0,BX0302,40.838815,-73.899333,40.839207,-73.899408,2024-06-28,Preservation,Yes,Non Prevailing Wage,,34.0,14.0,,,,,2.0,46.0,,,,,,48.0,,48.0,48,2024.0
74483,CROTONA PARK WEST HDFC.HPO.FY24,6/28/2024,6/28/2024,79799.0,1727,FULTON AVENUE,Bronx,10457.0,2029300074.0,2009669.0,BX-03,15.0,165.0,BX0302,40.842318,-73.897361,40.842277,-73.89765,2024-06-28,Preservation,Yes,Non Prevailing Wage,,15.0,7.0,,,,,4.0,18.0,,,,,,22.0,,22.0,22,2024.0
74483,CROTONA PARK WEST HDFC.HPO.FY24,6/28/2024,6/28/2024,79800.0,1729,FULTON AVENUE,Bronx,10457.0,2029300072.0,2009668.0,BX-03,15.0,165.0,BX0302,40.842345,-73.897347,40.8424,-73.897585,2024-06-28,Preservation,Yes,Non Prevailing Wage,,7.0,8.0,,,,2.0,8.0,5.0,,,,,,15.0,,15.0,15,2024.0
74483,CROTONA PARK WEST HDFC.HPO.FY24,6/28/2024,6/28/2024,79801.0,1735,FULTON AVENUE,Bronx,10457.0,2029300070.0,2009667.0,BX-03,15.0,165.0,BX0302,40.842428,-73.8973,40.842573,-73.897495,2024-06-28,Preservation,Yes,Non Prevailing Wage,,30.0,11.0,,,,,25.0,15.0,1.0,,,,,41.0,,41.0,41,2024.0
74483,CROTONA PARK WEST HDFC.HPO.FY24,6/28/2024,6/28/2024,79802.0,1743,FULTON AVENUE,Bronx,10457.0,2029300066.0,2009666.0,BX-03,15.0,165.0,BX0302,40.842537,-73.897234,40.842823,-73.89736,2024-06-28,Preservation,Yes,Non Prevailing Wage,,31.0,13.0,,,1.0,,28.0,16.0,1.0,,,,,45.0,,45.0,45,2024.0
74483,CROTONA PARK WEST HDFC.HPO.FY24,6/28/2024,6/28/2024,79803.0,1763,FULTON AVENUE,Bronx,10457.0,2029300065.0,2009665.0,BX-03,15.0,165.0,BX0302,40.842814,-73.897079,40.843001,-73.897266,2024-06-28,Preservation,Yes,Non Prevailing Wage,,10.0,5.0,,,,1.0,5.0,5.0,4.0,,,,,15.0,,15.0,15,2024.0
74483,CROTONA PARK WEST HDFC.HPO.FY24,6/28/2024,6/28/2024,79804.0,1767,FULTON AVENUE,Bronx,10457.0,2029300063.0,2009664.0,BX-03,15.0,165.0,BX0302,40.842869,-73.897046,40.843105,-73.897212,2024-06-28,Preservation,Yes,Non Prevailing Wage,,8.0,7.0,,,,1.0,5.0,5.0,4.0,,,,,15.0,,15.0,15,2024.0
74483,CROTONA PARK WEST HDFC.HPO.FY24,6/28/2024,6/28/2024,79805.0,1771,FULTON AVENUE,Bronx,10457.0,2029300062.0,2009663.0,BX-03,15.0,165.0,BX0302,40.842924,-73.897017,40.843207,-73.897157,2024-06-28,Preservation,Yes,Non Prevailing Wage,,9.0,6.0,,,,1.0,5.0,5.0,4.0,,,,,15.0,,15.0,15,2024.0
74483,CROTONA PARK WEST HDFC.HPO.FY24,6/28/2024,6/28/2024,79806.0,1775,FULTON AVENUE,Bronx,10457.0,2029300061.0,2009662.0,BX-03,15.0,165.0,BX0302,40.842979,-73.896984,40.843308,-73.897103,2024-06-28,Preservation,Yes,Non Prevailing Wage,,10.0,5.0,,,,1.0,5.0,5.0,4.0,,,,,15.0,,15.0,15,2024.0
74483,CROTONA PARK WEST HDFC.HPO.FY24,6/28/2024,6/28/2024,79807.0,1779,FULTON AVENUE,Bronx,10457.0,2029300060.0,2009661.0,BX-03,15.0,165.0,BX0302,40.843037,-73.896952,40.84341,-73.897049,2024-06-28,Preservation,Yes,Non Prevailing Wage,,10.0,5.0,,,,1.0,5.0,5.0,4.0,,,,,15.0,,15.0,15,2024.0
74483,CROTONA PARK WEST HDFC.HPO.FY24,6/28/2024,6/28/2024,110993.0,547,ST PAULS PLACE,Bronx,10456.0,2029270033.0,2009639.0,BX-03,16.0,169.0,BX0302,40.835743,-73.902149,40.83602,-73.902159,2024-06-28,Preservation,Yes,Non Prevailing Wage,,15.0,3.0,,,,,10.0,8.0,,,,,,18.0,,18.0,18,2024.0
72693,BR AFFORDABLE HDFC.YR15.FY24,6/27/2024,6/17/2025,50351.0,1038,BOSTON ROAD,Bronx,10456.0,2026220040.0,2004403.0,BX-03,17.0,18502.0,BX0301,40.826269,-73.906304,40.826052,-73.906217,2025-06-17,Preservation,No,Non Prevailing Wage,6.0,16.0,2.0,,,,,2.0,22.0,,,,,,24.0,,24.0,24,2025.0
72693,BR AFFORDABLE HDFC.YR15.FY24,6/27/2024,6/17/2025,50356.0,1056,BOSTON ROAD,Bronx,10456.0,2026220048.0,2004404.0,BX-03,17.0,18502.0,BX0301,40.826576,-73.90583,40.826425,-73.905761,2025-06-17,Preservation,No,Non Prevailing Wage,2.0,6.0,1.0,1.0,,,,,10.0,,,,,,10.0,,10.0,10,2025.0
72693,BR AFFORDABLE HDFC.YR15.FY24,6/27/2024,6/17/2025,50357.0,1065,BOSTON ROAD,Bronx,10456.0,2026070072.0,2004188.0,BX-03,17.0,18502.0,BX0301,40.826554,-73.905895,40.82673,-73.906162,2025-06-17,Preservation,No,Non Prevailing Wage,2.0,10.0,3.0,,,1.0,1.0,5.0,10.0,,,,,,16.0,,16.0,16,2025.0
72693,BR AFFORDABLE HDFC.YR15.FY24,6/27/2024,6/17/2025,50359.0,1077,BOSTON ROAD,Bronx,10456.0,2026070068.0,2004187.0,BX-03,17.0,18502.0,BX0301,40.826699,-73.905671,40.827004,-73.905789,2025-06-17,Preservation,No,Non Prevailing Wage,3.0,19.0,8.0,2.0,,,,10.0,12.0,10.0,,,,,32.0,,32.0,32,2025.0
72693,BR AFFORDABLE HDFC.YR15.FY24,6/27/2024,6/17/2025,806298.0,1051,BOSTON ROAD,Bronx,10456.0,2026070072.0,2004191.0,BX-03,17.0,18502.0,BX0301,40.826387,-73.906155,40.82673,-73.906162,2025-06-17,Preservation,No,Non Prevailing Wage,2.0,27.0,6.0,,,,,6.0,28.0,1.0,,,,,35.0,,35.0,35,2025.0
72693,BR AFFORDABLE HDFC.YR15.FY24,6/27/2024,6/17/2025,806299.0,1057,BOSTON ROAD,Bronx,10456.0,2026070072.0,2004190.0,BX-03,17.0,18502.0,BX0301,40.826458,-73.906043,40.82673,-73.906162,2025-06-17,Preservation,No,Non Prevailing Wage,1.0,7.0,4.0,2.0,1.0,1.0,1.0,5.0,10.0,,,,,,16.0,,16.0,16,2025.0
72693,BR AFFORDABLE HDFC.YR15.FY24,6/27/2024,6/17/2025,806300.0,1061,BOSTON ROAD,Bronx,10456.0,2026070072.0,2004189.0,BX-03,17.0,18502.0,BX0301,40.826507,-73.905967,40.82673,-73.906162,2025-06-17,Preservation,No,Non Prevailing Wage,1.0,13.0,1.0,,,,1.0,6.0,8.0,,,,,,15.0,,15.0,15,2025.0
74887,FULTON STREET SOUTH.HUDMF.FY24,6/27/2024,6/27/2024,808353.0,1330,FULTON STREET,Brooklyn,11216.0,3018610020.0,3053758.0,BK-03,36.0,247.0,BK0301,40.680269,-73.94747,40.680025,-73.947246,2024-06-27,Preservation,Yes,Non Prevailing Wage,49.0,8.0,3.0,4.0,,1.0,,28.0,37.0,,,,,,65.0,,65.0,65,2024.0
75189,FLUSHING PRESERVATION HDFC.HPO.FY24,6/25/2024,4/21/2025,433240.0,137-20,45 AVENUE,Queens,11355.0,4051460026.0,4116425.0,QN-07,20.0,845.0,QN0705,40.751157,-73.822506,40.750901,-73.822344,2025-04-21,Preservation,Yes,Non Prevailing Wage,1.0,18.0,54.0,71.0,4.0,1.0,16.0,70.0,50.0,13.0,,,,,149.0,,149.0,149,2025.0
75189,FLUSHING PRESERVATION HDFC.HPO.FY24,6/25/2024,4/21/2025,644826.0,44-15,COLDEN STREET,Queens,11355.0,4051450024.0,4116405.0,QN-07,20.0,845.0,QN0705,40.751557,-73.823995,40.751603,-73.823638,2025-04-21,Preservation,Yes,Non Prevailing Wage,1.0,10.0,50.0,73.0,4.0,,2.0,73.0,43.0,20.0,,,,,138.0,,138.0,138,2025.0
75189,FLUSHING PRESERVATION HDFC.HPO.FY24,6/25/2024,4/21/2025,644828.0,44-35,COLDEN STREET,Queens,11355.0,4051450001.0,4116404.0,QN-07,20.0,845.0,QN0705,40.751398,-73.823844,40.75104,-73.823091,2025-04-21,Preservation,Yes,Non Prevailing Wage,,4.0,23.0,39.0,4.0,1.0,13.0,28.0,23.0,7.0,,,,,71.0,,71.0,71,2025.0
75189,FLUSHING PRESERVATION HDFC.HPO.FY24,6/25/2024,4/21/2025,644829.0,45-15,COLDEN STREET,Queens,11355.0,4051460001.0,4116424.0,QN-07,20.0,845.0,QN0705,40.750512,-73.823013,40.750426,-73.822446,2025-04-21,Preservation,Yes,Non Prevailing Wage,2.0,25.0,48.0,67.0,5.0,1.0,20.0,72.0,37.0,19.0,,,,,148.0,,148.0,148,2025.0
75657,2422 LYVERE ST,6/24/2024,12/5/2024,1013293.0,2422,LYVERE STREET,Bronx,10461.0,2039970017.0,2042235.0,BX-10,18.0,204.0,BX1001,40.841572,-73.852377,40.841541,-73.852063,2024-12-05,New Construction,No,Non Prevailing Wage,,,,,31.0,,3.0,17.0,11.0,,,,,,31.0,,31.0,32,2024.0
75658,218 FRONT STREET APARTMENTS,6/10/2024,5/23/2025,296347.0,218,FRONT STREET,Brooklyn,11201.0,3000550020.0,3000000.0,BK-02,33.0,21.0,BK0202,40.702309,-73.983698,40.701876,-73.983742,2025-05-23,New Construction,No,Non Prevailing Wage,,,,,66.0,,16.0,17.0,33.0,,,,,,66.0,,66.0,218,2025.0
75659,390 EAST MOSHOLU PKWY,6/6/2024,11/6/2024,1013192.0,390,EAST MOSHOLU PARKWAY SOU,Bronx,10458.0,2032810075.0,2000000.0,BX-07,11.0,415.0,BX0702,40.869129,-73.881635,40.869023,-73.881932,2024-11-06,New Construction,No,Non Prevailing Wage,,,,,51.0,,11.0,37.0,3.0,,,,,,51.0,,51.0,52,2024.0
75660,2380 DEAN STREET APARTMENTS,6/6/2024,11/27/2024,1013355.0,2380,DEAN STREET,Brooklyn,11233.0,3014490057.0,3038957.0,BK-16,37.0,36502.0,BK1601,40.674615,-73.908608,40.674396,-73.908925,2024-11-27,New Construction,No,Non Prevailing Wage,,,,,21.0,,,9.0,11.0,1.0,,,,,21.0,,21.0,21,2024.0
75661,2316 GRAND AVE APARTMENTS_HPS,6/5/2024,6/23/2025,81550.0,2316,GRAND AVENUE,Bronx,10468.0,2031980017.0,2014244.0,BX-07,14.0,253.0,BX0701,40.860524,-73.904777,40.86062,-73.904419,2025-06-23,New Construction,No,Non Prevailing Wage,,,,,14.0,,11.0,3.0,,,,,,,14.0,,14.0,15,2025.0
75413,RYANLEACOCK.PPP.FY24,6/4/2024,7/3/2024,695668.0,108-04,SPA PLACE,Queens,11435.0,4119440016.0,4258207.0,QN-12,28.0,198.0,QN1202,40.691559,-73.800329,40.691623,-73.800786,2024-07-03,Preservation,No,Non Prevailing Wage,,,,,,1.0,,,,1.0,,,,,1.0,,1.0,2,2024.0
75665,HILLSIDE HOMES,6/4/2024,3/7/2025,122092.0,215,WEST KINGSBRIDGE ROAD,Bronx,10463.0,2032560043.0,2000000.0,BX-08,14.0,273.0,BX0801,40.871832,-73.904435,40.872051,-73.904095,2025-03-07,New Construction,No,Non Prevailing Wage,,,,,8.0,,1.0,3.0,4.0,,,,,,8.0,,8.0,23,2025.0
74536,ALLEN CATHEDRAL SENIOR RESIDENCES.Y15.FY24,5/30/2024,5/30/2024,822102.0,107-02,MERRICK BOULEVARD,Queens,11433.0,4101700050.0,4529895.0,QN-12,27.0,25402.0,QN1202,40.699926,-73.788619,40.69932,-73.788722,2024-05-30,Preservation,Yes,Non Prevailing Wage,27.0,116.0,71.0,6.0,,1.0,,209.0,12.0,,,,,,221.0,,221.0,221,2024.0
75063,LENOXVILLE.HUDMF.FY24,5/23/2024,5/23/2024,23461.0,20,LENOX AVENUE,Manhattan,10026.0,1015950001.0,1051407.0,MN-10,9.0,186.0,MN1001,40.798962,-73.951905,40.798984,-73.951392,2024-05-23,Preservation,Yes,Non Prevailing Wage,51.0,6.0,4.0,1.0,,1.0,14.0,26.0,16.0,7.0,,,,,63.0,,63.0,63,2024.0
75063,LENOXVILLE.HUDMF.FY24,5/23/2024,5/23/2024,955154.0,30,LENOX AVENUE,Manhattan,10026.0,1015950001.0,1083918.0,MN-10,9.0,186.0,MN1001,40.799163,-73.95175,40.798984,-73.951392,2024-05-23,Preservation,Yes,Non Prevailing Wage,38.0,6.0,10.0,1.0,,,,20.0,21.0,14.0,,,,,55.0,,55.0,55,2024.0
75670,1425 FULTON STREET APARTMENTS,5/22/2024,9/2/2024,1000435.0,1425,FULTON STREET,Brooklyn,11216.0,3018540049.0,3323647.0,BK-03,36.0,269.0,BK0301,40.680122,-73.944434,40.680344,-73.944196,2024-09-02,New Construction,No,Non Prevailing Wage,,,,,8.0,,2.0,2.0,4.0,,,,,,8.0,,8.0,26,2024.0
75672,65 4TH AVE APARTMENTS,5/20/2024,11/27/2024,1013180.0,65,4 AVENUE,Brooklyn,11217.0,3009320007.0,3000000.0,BK-06,39.0,12901.0,BK0602,40.682242,-73.97977,40.68214,-73.979438,2024-11-27,New Construction,No,Non Prevailing Wage,,,,,9.0,,,9.0,,,,,,,9.0,,9.0,9,2024.0
75673,961 WESTCHESTER AVE APARTMENTS,5/16/2024,7/24/2024,1012099.0,961,WESTCHESTER AVENUE,Bronx,10459.0,2027150001.0,2000000.0,BX-02,17.0,12901.0,BX0202,40.822714,-73.895719,40.823051,-73.895653,2024-07-24,New Construction,No,Non Prevailing Wage,,,,,22.0,,1.0,1.0,20.0,,,,,,22.0,,22.0,47,2024.0
75677,2081 ANTHONY AVE APARTMENTS,5/15/2024,8/9/2024,1012447.0,2081,ANTHONY AVENUE,Bronx,10457.0,2031560127.0,2129714.0,BX-05,15.0,23502.0,BX0502,40.853344,-73.901639,40.853375,-73.901899,2024-08-09,New Construction,No,Non Prevailing Wage,,,,,32.0,,,,32.0,,,,,,32.0,,32.0,54,2024.0
75678,83-61 116TH STREET APARTMENTS,5/15/2024,2/26/2025,530523.0,83-61,116 STREET,Queens,11418.0,4033210177.0,4000000.0,QN-09,29.0,134.0,QN0901,40.704642,-73.835877,40.704845,-73.835725,2025-02-26,New Construction,No,Non Prevailing Wage,,,,,9.0,,1.0,4.0,4.0,,,,,,9.0,,9.0,29,2025.0
75679,968 ROGERS PLACE,5/14/2024,2/5/2025,1012907.0,968,ROGERS PLACE,Bronx,10459.0,2026990019.0,2129680.0,BX-02,17.0,12901.0,BX0202,40.822984,-73.897821,40.823089,-73.897582,2025-02-05,New Construction,No,Non Prevailing Wage,,,,,7.0,,,7.0,,,,,,,7.0,,7.0,8,2025.0
75680,408 HAWTHORNE ST,5/14/2024,9/19/2024,1012969.0,408,HAWTHORNE STREET,Brooklyn,11203.0,3048200016.0,3000000.0,BK-09,40.0,810.0,BK0902,40.658072,-73.946712,40.657863,-73.946694,2024-09-19,New Construction,No,Non Prevailing Wage,,,,,3.0,,1.0,2.0,,,,,,,3.0,,3.0,9,2024.0
75681,855A MOTHER GASTON BLVD,5/13/2024,3/20/2025,1012971.0,855A,MOTHER GASTON BOULEVARD,Brooklyn,11212.0,3038550001.0,3000000.0,BK-16,42.0,920.0,BK1602,40.657621,-73.903754,40.657643,-73.903441,2025-03-20,New Construction,No,Non Prevailing Wage,,,,,5.0,,,3.0,2.0,,,,,,5.0,,5.0,16,2025.0
75682,1688 EAST 18 APARTMENTS,5/13/2024,7/24/2024,1012988.0,1688,EAST 18 STREET,Brooklyn,11229.0,3067800037.0,3000000.0,BK-15,48.0,552.0,BK1502,40.60899,-73.955424,40.608963,-73.955701,2024-07-24,New Construction,No,Non Prevailing Wage,,,,,18.0,,4.0,6.0,8.0,,,,,,18.0,,18.0,19,2024.0
74418,1350 BEDFORD AVENUE.HUDMF.FY24,5/9/2024,5/9/2024,303335.0,1350,BEDFORD AVENUE,Brooklyn,11216.0,3012050028.0,3029966.0,BK-08,35.0,221.0,BK0802,40.677214,-73.952718,40.677392,-73.953211,2024-05-09,Preservation,Yes,Non Prevailing Wage,55.0,13.0,10.0,,,1.0,,49.0,30.0,,,,,,79.0,,79.0,79,2024.0
75684,2532 GRAND AVENUE,5/9/2024,8/28/2024,1010253.0,2532,GRAND AVENUE,Bronx,10468.0,2032040019.0,2129685.0,BX-07,14.0,265.0,BX0701,40.865273,-73.901386,40.865508,-73.900905,2024-08-28,New Construction,No,Non Prevailing Wage,,,,,15.0,,5.0,10.0,,,,,,,15.0,,15.0,16,2024.0
75685,1678 DAVIDSON AVE APARTMENTS,5/6/2024,5/14/2025,60416.0,1678,DAVIDSON AVENUE,Bronx,10453.0,2028610017.0,2008345.0,BX-05,14.0,217.0,BX0501,40.846569,-73.914292,40.84649,-73.914046,2025-05-14,New Construction,No,Non Prevailing Wage,,,,,16.0,,14.0,2.0,,,,,,,16.0,,16.0,17,2025.0
75686,1041 BOYNTON AVENUE,5/6/2024,11/20/2024,1013303.0,1041,BOYNTON AVENUE,Bronx,10472.0,2037140048.0,2129695.0,BX-09,18.0,5001.0,BX0901,40.824883,-73.877367,40.82513,-73.877706,2024-11-20,New Construction,No,Non Prevailing Wage,,,,,15.0,,5.0,10.0,,,,,,,15.0,,15.0,16,2024.0
75687,368 EAST 152 ST,5/2/2024,11/20/2024,1012773.0,368,EAST 152 STREET,Bronx,10455.0,2023980011.0,2000000.0,BX-01,17.0,67.0,BX0102,40.818565,-73.918118,40.818343,-73.918125,2024-11-20,New Construction,No,Non Prevailing Wage,,,,,32.0,,7.0,6.0,14.0,5.0,,,,,32.0,,32.0,32,2024.0
74360,WEST 107TH STREET.HUDMF.FY24,4/30/2024,4/30/2024,37656.0,14,WEST 107 STREET,Manhattan,10025.0,1018420042.0,1055663.0,MN-07,7.0,193.0,MN0703,40.798943,-73.960097,40.798974,-73.960729,2024-04-30,Preservation,Yes,Non Prevailing Wage,46.0,11.0,1.0,1.0,1.0,1.0,2.0,36.0,23.0,,,,,,61.0,,61.0,61,2024.0
75690,229 WEST KINGSBRIDGE,4/30/2024,5/14/2025,1012904.0,229,WEST KINGSBRIDGE ROAD,Bronx,10463.0,2032560048.0,2000000.0,BX-08,14.0,273.0,BX0801,40.872362,-73.904442,40.872326,-73.904069,2025-05-14,New Construction,No,Non Prevailing Wage,,,,,12.0,,,12.0,,,,,,,12.0,,12.0,37,2025.0
75693,446 CYRUS PLACE,4/23/2024,11/22/2024,991364.0,446,CYRUS PLACE,Bronx,10458.0,2030410008.0,2011408.0,BX-06,15.0,385.0,BX0603,40.858666,-73.89183,40.85854,-73.892065,2024-11-22,New Construction,No,Non Prevailing Wage,,,,,9.0,,3.0,6.0,,,,,,,9.0,,9.0,10,2024.0
75695,2414 CAMBRELENG AVE APARTMENTS,4/18/2024,5/14/2025,1013453.0,2414,CAMBRELENG AVENUE,Bronx,10458.0,2030900006.0,2000000.0,BX-06,15.0,389.0,BX0603,40.854899,-73.885069,40.854833,-73.884871,2025-05-14,New Construction,No,Non Prevailing Wage,,,,,4.0,,,4.0,,,,,,,4.0,,4.0,13,2025.0
75696,208 EAST MOSHOLU PARKWAY APARTMENTS,4/16/2024,6/25/2025,1003012.0,208,EAST MOSHOLU PARKWAY S,Bronx,10458.0,2033090068.0,2017287.0,BX-07,11.0,413.0,BX0702,40.873619,-73.883309,40.873616,-73.883529,2025-06-25,New Construction,No,Non Prevailing Wage,,,,,18.0,,15.0,3.0,,,,,,,18.0,,18.0,19,2025.0
75697,649 HART STREET APARTMENTS,4/16/2024,12/18/2024,1013122.0,649,HART STREET,Brooklyn,11221.0,3032170034.0,3073106.0,BK-04,34.0,423.0,BK0401,40.69853,-73.926668,40.698733,-73.926664,2024-12-18,New Construction,No,Non Prevailing Wage,,,,,12.0,,2.0,6.0,4.0,,,,,,12.0,,12.0,12,2024.0
75698,3056 DECATUR AVENUE,4/15/2024,2/5/2025,60895.0,3056,DECATUR AVENUE,Bronx,10467.0,2033310019.0,2000000.0,BX-07,11.0,425.0,BX0703,40.870949,-73.879105,40.870678,-73.879055,2025-02-05,New Construction,No,Non Prevailing Wage,,,,,3.0,,,3.0,,,,,,,3.0,,3.0,9,2025.0
75700,HANOVER HOUSE,4/15/2024,6/18/2025,307563.0,15,HANOVER PLACE,Brooklyn,11201.0,3001610003.0,3000000.0,BK-02,33.0,37.0,BK0202,40.688827,-73.982454,40.688569,-73.982216,2025-06-18,New Construction,No,Non Prevailing Wage,,,,,95.0,,,87.0,8.0,,,,,,95.0,,95.0,314,2025.0
75703,807 WASHINGTON AVENUE,4/9/2024,6/6/2025,971016.0,807,WASHINGTON AVENUE,Brooklyn,11238.0,3011800005.0,3029644.0,BK-08,35.0,215.0,BK0801,40.672277,-73.962682,40.672205,-73.962368,2025-06-06,New Construction,No,Non Prevailing Wage,,,,,4.0,,1.0,1.0,2.0,,,,,,4.0,,4.0,11,2025.0
75705,62 MARTENSE STREET,4/9/2024,6/27/2025,1013455.0,62,MARTENSE STREET,Brooklyn,11226.0,3050890131.0,3000000.0,BK-14,40.0,79602.0,BK1401,40.65131,-73.956909,40.65109,-73.956859,2025-06-27,New Construction,No,Non Prevailing Wage,,,,,3.0,,,2.0,1.0,,,,,,3.0,,3.0,10,2025.0
75707,4568 BROADWAY,4/5/2024,6/10/2025,1013451.0,4560,BROADWAY,Manhattan,10040.0,1021720001.0,1087037.0,MN-12,10.0,283.0,MN1202,40.858831,-73.93152,40.859684,-73.930767,2025-06-10,New Construction,No,Non Prevailing Wage,,,,,28.0,,,21.0,7.0,,,,,,28.0,,28.0,92,2025.0
75710,773 GROTE STREET,4/4/2024,12/18/2024,1012528.0,773,GROTE STREET,Bronx,10460.0,2031130006.0,2129718.0,BX-06,15.0,393.0,BX0603,40.850539,-73.883606,40.850758,-73.883464,2024-12-18,New Construction,No,Non Prevailing Wage,,,,,11.0,,2.0,3.0,6.0,,,,,,11.0,,11.0,34,2024.0
75712,2339 NOSTRAND AVE APARTMENTS,4/4/2024,6/9/2025,346486.0,2339,NOSTRAND AVENUE,Brooklyn,11210.0,3075940016.0,3207054.0,BK-18,45.0,742.0,BK1801,40.627775,-73.947053,40.627618,-73.9467,2025-06-09,New Construction,No,Non Prevailing Wage,,,,,16.0,,,10.0,6.0,,,,,,16.0,,16.0,53,2025.0
75714,MASON GRAY,4/3/2024,6/20/2025,1013454.0,955,STERLING PLACE,Brooklyn,11213.0,3012420070.0,3000000.0,BK-08,36.0,341.0,BK0802,40.672347,-73.946733,40.672578,-73.946751,2025-06-20,New Construction,No,Non Prevailing Wage,,,,,48.0,,10.0,31.0,7.0,,,,,,48.0,,48.0,157,2025.0
75715,88 NORTH 1ST STREET APARTMENTS,4/3/2024,12/27/2024,1013120.0,88,NORTH 1 STREET,Brooklyn,11249.0,3023790009.0,3000000.0,BK-01,34.0,555.0,BK0102,40.716105,-73.963393,40.715927,-73.963584,2024-12-27,New Construction,No,Non Prevailing Wage,,,,,14.0,,11.0,3.0,,,,,,,14.0,,14.0,46,2024.0
75716,2829 VALENTINE AVE,4/2/2024,8/7/2024,1012601.0,2829,VALENTINE AVENUE,Bronx,10458.0,2033040136.0,2129688.0,BX-07,15.0,40302.0,BX0702,40.869061,-73.890324,40.869281,-73.890562,2024-08-07,New Construction,No,Non Prevailing Wage,,,,,81.0,,,6.0,75.0,,,,,,81.0,,81.0,81,2024.0
75717,391 MEEKER AVENUE,4/1/2024,6/13/2025,335464.0,391,MEEKER AVENUE,Brooklyn,11222.0,3027230033.0,3067912.0,BK-01,33.0,499.0,BK0101,40.718685,-73.947032,40.718745,-73.947133,2025-06-13,New Construction,No,Non Prevailing Wage,,,,,3.0,,,,3.0,,,,,,3.0,,3.0,10,2025.0
75443,1499 BEDFORD AVE,3/26/2024,1/30/2025,996625.0,1499,BEDFORD AVENUE,Brooklyn,11216.0,3012530007.0,3000000.0,BK-08,35.0,219.0,BK0802,40.671552,-73.95474,40.671585,-73.954369,2025-01-30,New Construction,No,Non Prevailing Wage,,,,,30.0,,7.0,8.0,,15.0,,,,,30.0,,30.0,99,2025.0
75454,1896 UNIVERSITY AVE APARTMENTS,3/21/2024,1/23/2025,1012397.0,1896,UNIVERSITY AVENUE,Bronx,10453.0,2028680042.0,2000000.0,BX-05,14.0,243.0,BX0501,40.852807,-73.913011,40.852673,-73.91273,2025-01-23,New Construction,No,Non Prevailing Wage,,,,,53.0,,13.0,5.0,28.0,7.0,,,,,53.0,,53.0,53,2025.0
75455,3082 VILLA AVENUE APARTMENTS,3/21/2024,8/9/2024,1012477.0,3082,VILLA AVENUE,Bronx,10468.0,2033100019.0,2000000.0,BX-07,14.0,411.0,BX0702,40.874238,-73.887932,40.874005,-73.887745,2024-08-09,New Construction,No,Non Prevailing Wage,,,,,59.0,,14.0,12.0,33.0,,,,,,59.0,,59.0,59,2024.0
75457,415 EAST 162 STREET,3/19/2024,3/26/2025,994296.0,415,EAST 162 STREET,Bronx,10451.0,2023840056.0,2001531.0,BX-03,17.0,141.0,BX0301,40.824641,-73.91299,40.824808,-73.912842,2025-03-26,New Construction,No,Non Prevailing Wage,,,,,11.0,,,11.0,,,,,,,11.0,,11.0,12,2025.0
75474,255 LORIMER STREET & 28 BOERUM,3/13/2024,12/5/2024,210985.0,24,BOERUM STREET,Brooklyn,11206.0,3030760018.0,3071329.0,BK-01,34.0,491.0,BK0104,40.705349,-73.948723,40.704986,-73.948345,2024-12-05,New Construction,No,Non Prevailing Wage,,,,,20.0,,6.0,9.0,5.0,,,,,,20.0,,20.0,66,2024.0
75464,1266 CHISHOLM STREET APARTMENTS,3/12/2024,7/15/2024,1012116.0,1266,CHISHOLM STREET,Bronx,10459.0,2029730052.0,2130430.0,BX-03,17.0,125.0,BX0303,40.829616,-73.894981,40.829836,-73.895122,2024-07-15,New Construction,No,Non Prevailing Wage,,,,,6.0,,1.0,1.0,3.0,1.0,,,,,6.0,,6.0,17,2024.0
75473,597 GRAND STREET APARTMENTS,3/8/2024,11/21/2024,302758.0,597,GRAND STREET,Brooklyn,11211.0,3027800001.0,3000000.0,BK-01,34.0,503.0,BK0104,40.711255,-73.948069,40.711469,-73.948336,2024-11-21,New Construction,No,Non Prevailing Wage,,,,,56.0,,6.0,43.0,7.0,,,,,,56.0,,56.0,185,2024.0
75422,388 VERNON AVENUE,3/7/2024,4/16/2025,396519.0,825,WILLOUGHBY AVENUE,Brooklyn,11206.0,3015890154.0,3000000.0,BK-03,36.0,287.0,BK0302,40.695444,-73.935593,40.695686,-73.935398,2025-04-16,New Construction,No,Non Prevailing Wage,,,,,8.0,,,2.0,,6.0,,,,,8.0,,8.0,8,2025.0
75422,388 VERNON AVENUE,3/7/2024,4/16/2025,1012784.0,388,VERNON AVENUE,Brooklyn,11206.0,3015890035.0,3394657.0,BK-03,36.0,287.0,BK0302,40.696172,-73.935647,40.695968,-73.935423,2025-04-16,New Construction,No,Non Prevailing Wage,,,,,3.0,,,3.0,,,,,,,3.0,,3.0,27,2025.0
75468,510 EAST 148 ST,3/7/2024,6/7/2024,934667.0,510,EAST 148 STREET,Bronx,10455.0,2022740008.0,2130748.0,BX-01,8.0,43.0,BX0101,40.814235,-73.915258,40.814034,-73.915132,2024-06-07,New Construction,No,Non Prevailing Wage,,,,,19.0,,,10.0,9.0,,,,,,19.0,,19.0,21,2024.0
75423,2411 64 STREET,3/6/2024,4/23/2025,164724.0,2411,64 STREET,Brooklyn,11204.0,3065610057.0,3000000.0,BK-11,44.0,436.0,BK1101,40.611511,-73.975926,40.611716,-73.975883,2025-04-23,New Construction,No,Non Prevailing Wage,,,,,3.0,,,1.0,2.0,,,,,,3.0,,3.0,10,2025.0
75424,2758 CRESTON AVE,3/5/2024,8/28/2024,1012287.0,2758,CRESTON AVENUE,Bronx,10468.0,2033150031.0,2129722.0,BX-07,14.0,40303.0,BX0702,40.869459,-73.893154,40.869626,-73.892684,2024-08-28,New Construction,No,Non Prevailing Wage,,,,,20.0,,20.0,,,,,,,,20.0,,20.0,21,2024.0
75425,676 MYRTLE AVENUE APARTMENTS,3/5/2024,4/16/2025,340928.0,676,MYRTLE AVENUE,Brooklyn,11205.0,3019140022.0,3000000.0,BK-03,33.0,235.0,BK0301,40.694502,-73.956755,40.69426,-73.956683,2025-04-16,New Construction,No,Non Prevailing Wage,,,,,6.0,,,,6.0,,,,,,6.0,,6.0,50,2025.0
75427,129-24 MERRICK BLVD APARTMENTS,2/29/2024,9/12/2024,1012750.0,129-24,MERRICK BOULEVARD,Queens,11434.0,4125380001.0,4270383.0,QN-12,27.0,33401.0,QN1204,40.680562,-73.763384,40.680359,-73.763609,2024-09-12,New Construction,No,Non Prevailing Wage,,,,,8.0,,,,8.0,,,,,,8.0,,8.0,8,2024.0
75428,2093 MATTHEWS AVENUE,2/29/2024,10/17/2024,94875.0,2093,MATTHEWS AVENUE,Bronx,10462.0,2042930046.0,2000000.0,BX-11,13.0,228.0,BX1101,40.853541,-73.862971,40.853681,-73.863242,2024-10-17,New Construction,No,Non Prevailing Wage,,,,,13.0,,2.0,9.0,2.0,,,,,,13.0,,13.0,37,2024.0
75430,138 BRUCKNER BOULEVARD,2/22/2024,12/20/2024,1012777.0,138,BRUCKNER BOULEVARD,Bronx,10454.0,2022600010.0,2129717.0,BX-01,8.0,1902.0,BX0101,40.803902,-73.920534,40.803457,-73.920629,2024-12-20,New Construction,No,Non Prevailing Wage,,,,,135.0,,8.0,93.0,34.0,,,,,,135.0,,135.0,448,2024.0
75431,154 LENOX ROAD,2/22/2024,2/5/2025,1012751.0,154,LENOX ROAD,Brooklyn,11226.0,3050840038.0,3000000.0,BK-17,40.0,822.0,BK1701,40.653873,-73.954424,40.653552,-73.95436,2025-02-05,New Construction,No,Non Prevailing Wage,,,,,13.0,,,6.0,7.0,,,,,,13.0,,13.0,42,2025.0
75434,22 EAST 177 ST,2/8/2024,6/11/2024,65879.0,22,EAST 177 STREET,Bronx,10453.0,2028520018.0,2008235.0,BX-05,14.0,23301.0,BX0502,40.850005,-73.909747,40.849769,-73.909813,2024-06-11,New Construction,No,Non Prevailing Wage,,,,,17.0,,17.0,,,,,,,,17.0,,17.0,18,2024.0
75435,3336 HULL AVENUE APARTMENTS,2/8/2024,5/1/2025,87522.0,3336,HULL AVENUE,Bronx,10467.0,2033520023.0,2018497.0,BX-07,11.0,42902.0,BX0703,40.87774,-73.873834,40.87772,-73.873552,2025-05-01,New Construction,No,Non Prevailing Wage,,,,,7.0,,4.0,2.0,1.0,,,,,,7.0,,7.0,14,2025.0
75436,3377 SEDGWICK AVENUE APARTMENTS,2/8/2024,3/12/2025,1013842.0,3377,SEDGWICK AVENUE,Bronx,10463.0,2032550055.0,2129698.0,BX-08,11.0,279.0,BX0801,40.880474,-73.896666,40.880573,-73.896948,2025-03-12,New Construction,No,Non Prevailing Wage,,,,,9.0,,2.0,4.0,3.0,,,,,,9.0,,9.0,30,2025.0
75437,101-07 91 STREET,2/7/2024,12/13/2024,1012778.0,101-07,91 STREET,Queens,11416.0,4090980001.0,4000000.0,QN-09,32.0,4001.0,QN0904,40.683051,-73.849289,40.683113,-73.849123,2024-12-13,New Construction,No,Non Prevailing Wage,,,,,4.0,,,4.0,,,,,,,4.0,,4.0,12,2024.0
75438,1148 WASHINGTON AVE APARTMENTS,2/6/2024,2/28/2025,939579.0,1148,WASHINGTON AVENUE,Bronx,10456.0,2023710022.0,2001293.0,BX-03,16.0,18501.0,BX0301,40.828897,-73.908226,40.829462,-73.907625,2025-02-28,New Construction,No,Non Prevailing Wage,,,,,8.0,,2.0,6.0,,,,,,,8.0,,8.0,9,2025.0
75439,95-08 147TH PLACE.,2/6/2024,6/10/2024,1011919.0,95-08,147 PLACE,Queens,11435.0,4100270010.0,4000000.0,QN-12,27.0,208.0,QN1201,40.698515,-73.805595,40.698169,-73.805646,2024-06-10,New Construction,No,Non Prevailing Wage,,,,,117.0,,19.0,39.0,59.0,,,,,,117.0,,117.0,117,2024.0
75378,873 EAST 28 ST,2/5/2024,5/22/2024,1011843.0,873,EAST 228 STREET,Bronx,10466.0,2048530011.0,2000000.0,BX-12,12.0,406.0,BX1201,40.888407,-73.854501,40.888409,-73.853778,2024-05-22,New Construction,No,Non Prevailing Wage,,,,,15.0,,5.0,9.0,1.0,,,,,,15.0,,15.0,16,2024.0
73814,164 4TH AVENUE,2/2/2024,6/5/2025,1016760.0,336,DOUGLASS STREET,Brooklyn,11217.0,,,BK-06,39.0,11901.0,BK0601,40.679558,-73.982406,,,2025-06-05,New Construction,No,Non Prevailing Wage,,38.0,,,,,3.0,29.0,6.0,,,,,,38.0,,38.0,188,2025.0
75379,1014 OGDEN AVE APARTMENTS,1/30/2024,12/27/2024,1012674.0,1014,OGDEN AVENUE,Bronx,10452.0,2025120005.0,2000000.0,BX-04,16.0,189.0,BX0402,40.833391,-73.929107,40.833221,-73.928948,2024-12-27,New Construction,No,Non Prevailing Wage,,,,,16.0,,6.0,10.0,,,,,,,16.0,,16.0,17,2024.0
75380,2067 ANTHONY AVE,1/30/2024,6/26/2024,1011555.0,2067,ANTHONY AVENUE,Bronx,10457.0,2031560024.0,2129658.0,BX-05,15.0,23502.0,BX0502,40.852648,-73.902106,40.852749,-73.902315,2024-06-26,New Construction,No,Non Prevailing Wage,,,,,51.0,,51.0,,,,,,,,51.0,,51.0,52,2024.0
75381,385 RUTLAND RD,1/25/2024,5/10/2024,1011727.0,385,RUTLAND ROAD,Brooklyn,11225.0,3048010054.0,3429355.0,BK-09,40.0,804.0,BK0902,40.659552,-73.948272,40.659774,-73.948109,2024-05-10,New Construction,No,Non Prevailing Wage,,,,,3.0,,,3.0,,,,,,,3.0,,3.0,8,2024.0
75382,53 EAST 177 ST,1/25/2024,5/21/2025,1011838.0,53,EAST 177 STREET,Bronx,10453.0,2028280001.0,2128940.0,BX-05,14.0,23301.0,BX0502,40.849961,-73.909017,40.850062,-73.908873,2025-05-21,New Construction,No,Non Prevailing Wage,,,,,80.0,,12.0,38.0,30.0,,,,,,80.0,,80.0,81,2025.0
75385,1654 GRAND APTS,1/17/2024,12/18/2024,81410.0,1654,GRAND AVENUE,Bronx,10453.0,2028670012.0,2008481.0,BX-05,14.0,217.0,BX0501,40.847152,-73.914989,40.847146,-73.914649,2024-12-18,New Construction,No,Non Prevailing Wage,,,,,19.0,,16.0,3.0,,,,,,,19.0,,19.0,20,2024.0
75388,1629 BROOKLYN AVENUE,1/15/2024,5/22/2024,1011580.0,1629,BROOKLYN AVENUE,Brooklyn,11210.0,3075640026.0,3427373.0,BK-17,45.0,784.0,BK1702,40.633292,-73.941886,40.63333,-73.94158,2024-05-22,New Construction,No,Non Prevailing Wage,,,,,7.0,,,,7.0,,,,,,7.0,,7.0,22,2024.0
75389,60 CEDAR STREET,1/15/2024,4/10/2025,218408.0,60,CEDAR STREET,Brooklyn,11221.0,3032320005.0,3000000.0,BK-04,34.0,423.0,BK0401,40.69721,-73.927329,40.697124,-73.927048,2025-04-10,New Construction,No,Non Prevailing Wage,,,,,42.0,,9.0,11.0,22.0,,,,,,42.0,,42.0,139,2025.0
75390,1598 EASTERN PARKWAY APARTMENTS,1/10/2024,1/10/2024,287676.0,1598,EASTERN PARKWAY,Brooklyn,11233.0,3014680052.0,3421424.0,BK-16,41.0,363.0,BK1601,40.67119,-73.915779,40.671167,-73.91504,2024-01-10,New Construction,No,Non Prevailing Wage,,,,,6.0,,,3.0,,3.0,,,,,6.0,,6.0,19,2024.0
75412,88-36 139 STREET,1/5/2024,6/20/2025,667616.0,138-45,JAMAICA AVENUE,Queens,11435.0,4096200033.0,4000000.0,QN-12,24.0,214.0,QN0805,40.702547,-73.813885,40.702785,-73.813668,2025-06-20,New Construction,No,Non Prevailing Wage,,,,,25.0,,6.0,15.0,4.0,,,,,,25.0,,25.0,81,2025.0
75391,1670 TOWNSEND AVE,1/4/2024,11/26/2024,115662.0,1670,TOWNSEND AVENUE,Bronx,10453.0,2028480050.0,2000000.0,BX-05,14.0,22701.0,BX0502,40.845937,-73.912449,40.845577,-73.912388,2024-11-26,New Construction,No,Non Prevailing Wage,,,,,24.0,,24.0,,,,,,,,24.0,,24.0,25,2024.0
75393,2798 WEBB AVE APARTMENTS,1/3/2024,9/19/2024,120406.0,2798,WEBB AVENUE,Bronx,10468.0,2032490141.0,2015354.0,BX-08,14.0,26702.0,BX0801,40.871692,-73.901123,40.871722,-73.90083,2024-09-19,New Construction,No,Non Prevailing Wage,,,,,16.0,,5.0,11.0,,,,,,,16.0,,16.0,17,2024.0
75395,219 EAST 203 ST,1/2/2024,5/29/2024,1010888.0,219,EAST 203 STREET,Bronx,10458.0,2033090036.0,2129681.0,BX-07,14.0,413.0,BX0702,40.873794,-73.885854,40.874011,-73.885756,2024-05-29,New Construction,No,Non Prevailing Wage,,,,,27.0,,27.0,,,,,,,,27.0,,27.0,28,2024.0
75396,2311 WHITE PLAINS ROAD,1/2/2024,8/30/2024,1011901.0,2311,WHITE PLAINS ROAD,Bronx,10467.0,2043420094.0,2129690.0,BX-11,15.0,33201.0,BX1104,40.860468,-73.867519,40.860373,-73.867967,2024-08-30,New Construction,No,Non Prevailing Wage,,,,,15.0,,3.0,4.0,8.0,,,,,,15.0,,15.0,50,2024.0
75398,1395 BRISTOW ST,1/1/2024,4/16/2025,1011401.0,1395,BRISTOW STREET,Bronx,10459.0,2029630022.0,2129728.0,BX-03,17.0,153.0,BX0303,40.832934,-73.895088,40.832954,-73.895291,2025-04-16,New Construction,No,Non Prevailing Wage,,,,,29.0,,6.0,,22.0,1.0,,,,,29.0,,29.0,29,2025.0
74954,161 MESEROLE AVENUE,12/29/2023,2/12/2025,336233.0,161,MESEROLE AVENUE,Brooklyn,11222.0,3025990025.0,3000000.0,BK-01,33.0,573.0,BK0101,40.727908,-73.950275,40.728054,-73.950412,2025-02-12,New Construction,No,Non Prevailing Wage,,,,,15.0,,5.0,10.0,,,,,,,15.0,,15.0,29,2025.0
74955,5-22 49TH AVENUE,12/29/2023,4/23/2025,438858.0,2025-05-22T00:00:00.000,49 AVENUE,Queens,11101.0,4000320035.0,4000000.0,QN-02,26.0,701.0,QN0201,40.743795,-73.95585,40.743525,-73.955561,2025-04-23,New Construction,No,Non Prevailing Wage,,,,,9.0,,,4.0,5.0,,,,,,9.0,,9.0,29,2025.0
74956,2621 GRAND AVENUE APARTMENTS,12/29/2023,7/15/2024,81630.0,2621,GRAND AVENUE,Bronx,10468.0,2032150044.0,2129696.0,BX-07,14.0,265.0,BX0701,40.867135,-73.900002,40.867234,-73.900237,2024-07-15,New Construction,No,Non Prevailing Wage,,,,,11.0,,2.0,9.0,,,,,,,11.0,,11.0,34,2024.0
74958,1058 UNIVERSITY AVE,12/28/2023,11/6/2024,1004446.0,1058,UNIVERSITY AVENUE,Bronx,10452.0,2025260040.0,2129665.0,BX-04,16.0,193.0,BX0402,40.834836,-73.930157,40.834712,-73.929987,2024-11-06,New Construction,No,Non Prevailing Wage,,,,,27.0,,1.0,11.0,15.0,,,,,,27.0,,27.0,27,2024.0
74959,39-04 29 STREET,12/28/2023,2/26/2025,415775.0,39-04,29 STREET,Queens,11101.0,4003980026.0,4004829.0,QN-01,26.0,31.0,QN0105,40.753306,-73.934682,40.753435,-73.934895,2025-02-26,New Construction,No,Non Prevailing Wage,,,,,6.0,,1.0,3.0,2.0,,,,,,6.0,,6.0,20,2025.0
73169,PARADISE MANAGEMENT CLUSTER 4.HPO.FY23,12/27/2023,12/27/2023,81719.0,1749,GRAND CONCOURSE,Bronx,10453.0,2028220019.0,2007857.0,BX-05,14.0,22701.0,BX0502,40.84593,-73.910093,40.846048,-73.910837,2023-12-27,Preservation,Yes,Non Prevailing Wage,,16.0,247.0,7.0,,1.0,,44.0,108.0,85.0,34.0,,,,271.0,,271.0,271,2023.0
73169,PARADISE MANAGEMENT CLUSTER 4.HPO.FY23,12/27/2023,12/27/2023,108509.0,2755,SEDGWICK AVENUE,Bronx,10468.0,2032530054.0,2015516.0,BX-08,14.0,273.0,BX0801,40.871273,-73.90248,40.871427,-73.902744,2023-12-27,Preservation,Yes,Non Prevailing Wage,3.0,35.0,24.0,,,1.0,,28.0,25.0,10.0,,,,,63.0,,63.0,63,2023.0
73169,PARADISE MANAGEMENT CLUSTER 4.HPO.FY23,12/27/2023,12/27/2023,108511.0,2763,SEDGWICK AVENUE,Bronx,10468.0,2032530051.0,2015515.0,BX-08,14.0,273.0,BX0801,40.871419,-73.902443,40.871765,-73.902671,2023-12-27,Preservation,Yes,Non Prevailing Wage,4.0,33.0,25.0,1.0,,,,29.0,24.0,10.0,,,,,63.0,,63.0,63,2023.0
73170,PARADISE MANAGEMENT CLUSTER 5.HPO.FY23,12/27/2023,12/27/2023,52051.0,984,BRONX PARK SOUTH,Bronx,10460.0,2031340014.0,2013274.0,BX-06,15.0,361.0,BX0601,40.844819,-73.878502,40.844682,-73.878726,2023-12-27,Preservation,Yes,Non Prevailing Wage,,,47.0,,,,,11.0,30.0,6.0,,,,,47.0,,47.0,47,2023.0
73170,PARADISE MANAGEMENT CLUSTER 5.HPO.FY23,12/27/2023,12/27/2023,52052.0,990,BRONX PARK SOUTH,Bronx,10460.0,2031340020.0,2013275.0,BX-06,15.0,361.0,BX0601,40.844728,-73.878368,40.844446,-73.878434,2023-12-27,Preservation,Yes,Non Prevailing Wage,,,52.0,,,1.0,,15.0,35.0,3.0,,,,,53.0,,53.0,53,2023.0
73483,PARADISE MANAGEMENT CLUSTER 6.HPO.FY23,12/27/2023,12/27/2023,52048.0,960,BRONX PARK SOUTH,Bronx,10460.0,2031340007.0,2013271.0,BX-06,15.0,361.0,BX0601,40.84519,-73.879025,40.845023,-73.87922,2023-12-27,Preservation,Yes,Non Prevailing Wage,,,21.0,,,,,2.0,18.0,1.0,,,,,21.0,,21.0,21,2023.0
73483,PARADISE MANAGEMENT CLUSTER 6.HPO.FY23,12/27/2023,12/27/2023,52049.0,968,BRONX PARK SOUTH,Bronx,10460.0,2031340009.0,2013272.0,BX-06,15.0,361.0,BX0601,40.845067,-73.878848,40.844908,-73.879054,2023-12-27,Preservation,Yes,Non Prevailing Wage,,,28.0,,,,,11.0,13.0,4.0,,,,,28.0,,28.0,28,2023.0
73483,PARADISE MANAGEMENT CLUSTER 6.HPO.FY23,12/27/2023,12/27/2023,97525.0,2238,MORRIS AVENUE,Bronx,10453.0,2031710001.0,2013860.0,BX-05,14.0,23704.0,BX0503,40.857059,-73.902562,40.856847,-73.902443,2023-12-27,Preservation,Yes,Non Prevailing Wage,2.0,10.0,20.0,4.0,,1.0,,25.0,12.0,,,,,,37.0,,37.0,37,2023.0
73484,PARADISE MANAGEMENT CLUSTER 7.HPO.FY23,12/27/2023,12/27/2023,49397.0,1893,BELMONT AVENUE,Bronx,10457.0,2029470040.0,2009914.0,BX-06,15.0,36901.0,BX0602,40.844789,-73.892901,40.845037,-73.892948,2023-12-27,Preservation,Yes,Non Prevailing Wage,,,28.0,,,,,10.0,12.0,6.0,,,,,28.0,,28.0,28,2023.0
73484,PARADISE MANAGEMENT CLUSTER 7.HPO.FY23,12/27/2023,12/27/2023,60381.0,2132,DALY AVENUE,Bronx,10460.0,2031290001.0,2013236.0,BX-06,15.0,363.0,BX0601,40.845524,-73.880958,40.845434,-73.880702,2023-12-27,Preservation,Yes,Non Prevailing Wage,,,37.0,,,,,12.0,15.0,5.0,5.0,,,,37.0,,37.0,37,2023.0
73484,PARADISE MANAGEMENT CLUSTER 7.HPO.FY23,12/27/2023,12/27/2023,60383.0,2138,DALY AVENUE,Bronx,10460.0,2031290004.0,2013237.0,BX-06,15.0,363.0,BX0601,40.845574,-73.880922,40.845617,-73.880571,2023-12-27,Preservation,Yes,Non Prevailing Wage,1.0,,30.0,,,,,6.0,15.0,10.0,,,,,31.0,,31.0,31,2023.0
73489,PARADISE MANAGEMENT CLUSTER 8.HPO.FY23,12/27/2023,12/27/2023,60069.0,2078,CROTONA PARKWAY,Bronx,10460.0,2031180056.0,2013098.0,BX-06,15.0,363.0,BX0601,40.845201,-73.884624,40.845116,-73.884418,2023-12-27,Preservation,Yes,Non Prevailing Wage,,,21.0,,,,,5.0,16.0,,,,,,21.0,,21.0,21,2023.0
73489,PARADISE MANAGEMENT CLUSTER 8.HPO.FY23,12/27/2023,12/27/2023,96756.0,2075,MOHEGAN AVENUE,Bronx,10460.0,2031180039.0,2092361.0,BX-06,15.0,363.0,BX0601,40.844841,-73.884049,40.844902,-73.884414,2023-12-27,Preservation,Yes,Non Prevailing Wage,,1.0,20.0,,,,,4.0,17.0,,,,,,21.0,,21.0,21,2023.0
73489,PARADISE MANAGEMENT CLUSTER 8.HPO.FY23,12/27/2023,12/27/2023,96757.0,2079,MOHEGAN AVENUE,Bronx,10460.0,2031180036.0,2013095.0,BX-06,15.0,363.0,BX0601,40.844924,-73.883981,40.845003,-73.884183,2023-12-27,Preservation,Yes,Non Prevailing Wage,,,20.0,1.0,,1.0,,6.0,16.0,,,,,,22.0,,22.0,22,2023.0
73489,PARADISE MANAGEMENT CLUSTER 8.HPO.FY23,12/27/2023,12/27/2023,806415.0,2074,CROTONA PARKWAY,Bronx,10460.0,2031180039.0,2092362.0,BX-06,15.0,363.0,BX0601,40.845105,-73.884678,40.844902,-73.884414,2023-12-27,Preservation,Yes,Non Prevailing Wage,,1.0,21.0,,,,,11.0,7.0,4.0,,,,,22.0,,22.0,22,2023.0
73490,PARADISE MANAGEMENT CLUSTER 9.HPO.FY23,12/27/2023,12/27/2023,100146.0,1146,OGDEN AVENUE,Bronx,10452.0,2025140050.0,2003265.0,BX-04,16.0,199.0,BX0402,40.836503,-73.927351,40.836335,-73.927091,2023-12-27,Preservation,Yes,Non Prevailing Wage,,4.0,44.0,,,,,36.0,12.0,,,,,,48.0,,48.0,48,2023.0
73490,PARADISE MANAGEMENT CLUSTER 9.HPO.FY23,12/27/2023,12/27/2023,121007.0,80,WEST 170 STREET,Bronx,10452.0,2025060121.0,2003099.0,BX-04,16.0,211.0,BX0402,40.840342,-73.922157,40.840114,-73.922139,2023-12-27,Preservation,Yes,Non Prevailing Wage,1.0,6.0,49.0,,,2.0,7.0,24.0,26.0,1.0,,,,,58.0,,58.0,58,2023.0
73491,PARADISE MANAGEMENT CLUSTER 10.HPO.FY23,12/27/2023,12/27/2023,65811.0,250,EAST 176 STREET,Bronx,10457.0,2028000068.0,2007537.0,BX-05,14.0,22901.0,BX0502,40.847418,-73.904936,40.847171,-73.904922,2023-12-27,Preservation,Yes,Non Prevailing Wage,1.0,1.0,50.0,7.0,,1.0,11.0,43.0,6.0,,,,,,60.0,,60.0,60,2023.0
73491,PARADISE MANAGEMENT CLUSTER 10.HPO.FY23,12/27/2023,12/27/2023,109334.0,1234,SHAKESPEARE AVENUE,Bronx,10452.0,2025060033.0,2003081.0,BX-04,16.0,199.0,BX0402,40.838034,-73.923233,40.837924,-73.923045,2023-12-27,Preservation,Yes,Non Prevailing Wage,,4.0,32.0,1.0,,1.0,,32.0,6.0,,,,,,38.0,,38.0,38,2023.0
73492,PARADISE MANAGEMENT CLUSTER 11.HPO.FY23,12/27/2023,12/27/2023,95691.0,1261,MERRIAM AVENUE,Bronx,10452.0,2025290063.0,2003518.0,BX-04,16.0,201.0,BX0402,40.839584,-73.926339,40.839252,-73.926535,2023-12-27,Preservation,Yes,Non Prevailing Wage,6.0,17.0,52.0,2.0,,1.0,,58.0,19.0,,1.0,,,,78.0,,78.0,78,2023.0
73493,PARADISE MANAGEMENT CLUSTER 12.HPO.FY23,12/27/2023,12/27/2023,88745.0,1055,JEROME AVENUE,Bronx,10452.0,2025040105.0,2003053.0,BX-04,16.0,193.0,BX0402,40.832955,-73.925212,40.833098,-73.925457,2023-12-27,Preservation,Yes,Non Prevailing Wage,1.0,11.0,51.0,1.0,,1.0,,46.0,17.0,1.0,1.0,,,,65.0,,65.0,65,2023.0
73494,PARADISE MANAGEMENT CLUSTER 13.HPO.FY23,12/27/2023,12/27/2023,65392.0,306,EAST 171 STREET,Bronx,10457.0,2027840010.0,2007237.0,BX-04,16.0,225.0,BX0403,40.838562,-73.909477,40.838368,-73.909676,2023-12-27,Preservation,Yes,Non Prevailing Wage,1.0,9.0,37.0,32.0,,,,51.0,23.0,5.0,,,,,79.0,,79.0,79,2023.0
74960,723 ARNOW AVE APARTMENTS,12/27/2023,6/5/2024,1011372.0,723,ARNOW AVENUE,Bronx,10467.0,2045460004.0,2130552.0,BX-11,12.0,33801.0,BX1104,40.867886,-73.866416,40.868043,-73.866654,2024-06-05,New Construction,No,Non Prevailing Wage,,,,,9.0,,6.0,3.0,,,,,,,9.0,,9.0,10,2024.0
74961,180 WEST 166TH STREET AKA 1095 SUMMIT AVENUE,12/26/2023,3/12/2025,112047.0,1095,SUMMIT AVENUE,Bronx,10452.0,2025260064.0,2130623.0,BX-04,16.0,193.0,BX0402,40.835625,-73.928851,40.835834,-73.929025,2025-03-12,New Construction,No,Non Prevailing Wage,,,,,9.0,,,8.0,1.0,,,,,,9.0,,9.0,30,2025.0
74464,WHGA DUNBAR HDFC.HPO.FY24,12/22/2023,12/22/2023,4168.0,2816,FREDERICK DOUGLASS BOULEVARD,Manhattan,10039.0,1020350001.0,1084148.0,MN-10,9.0,234.0,MN1002,40.825756,-73.939619,40.825088,-73.93842,2023-12-22,Preservation,Yes,Non Prevailing Wage,16.0,25.0,38.0,27.0,1.0,,,48.0,40.0,19.0,,,,,107.0,,107.0,107,2023.0
74464,WHGA DUNBAR HDFC.HPO.FY24,12/22/2023,12/22/2023,803888.0,2588,7 AVENUE,Manhattan,10039.0,1020350001.0,1084144.0,MN-10,9.0,234.0,MN1002,40.824478,-73.937033,40.825088,-73.93842,2023-12-22,Preservation,Yes,Non Prevailing Wage,9.0,16.0,22.0,40.0,7.0,,,35.0,49.0,10.0,,,,,94.0,,94.0,94,2023.0
74464,WHGA DUNBAR HDFC.HPO.FY24,12/22/2023,12/22/2023,805985.0,211,WEST 149 STREET,Manhattan,10039.0,1020350001.0,1084145.0,MN-10,9.0,234.0,MN1002,40.82449,-73.937914,40.825088,-73.93842,2023-12-22,Preservation,Yes,Non Prevailing Wage,12.0,14.0,28.0,28.0,2.0,,,17.0,62.0,5.0,,,,,84.0,,84.0,84,2023.0
74464,WHGA DUNBAR HDFC.HPO.FY24,12/22/2023,12/22/2023,805986.0,231,WEST 149 STREET,Manhattan,10039.0,1020350001.0,1084146.0,MN-10,9.0,234.0,MN1002,40.824655,-73.938308,40.825088,-73.93842,2023-12-22,Preservation,Yes,Non Prevailing Wage,19.0,16.0,26.0,22.0,1.0,,,17.0,61.0,6.0,,,,,84.0,,84.0,84,2023.0
74464,WHGA DUNBAR HDFC.HPO.FY24,12/22/2023,12/22/2023,805989.0,210,WEST 150 STREET,Manhattan,10039.0,1020350001.0,1084147.0,MN-10,9.0,234.0,MN1002,40.825066,-73.937404,40.825088,-73.93842,2023-12-22,Preservation,Yes,Non Prevailing Wage,13.0,17.0,25.0,28.0,1.0,,,20.0,62.0,2.0,,,,,84.0,,84.0,84,2023.0
74464,WHGA DUNBAR HDFC.HPO.FY24,12/22/2023,12/22/2023,805990.0,230,WEST 150 STREET,Manhattan,10039.0,1020350001.0,1084151.0,MN-10,9.0,234.0,MN1002,40.825217,-73.937762,40.825088,-73.93842,2023-12-22,Preservation,Yes,Non Prevailing Wage,12.0,15.0,27.0,29.0,1.0,,,17.0,58.0,9.0,,,,,84.0,,84.0,84,2023.0
74539,OGDEN PORTFOLIO HDFC.Y15.FY24,12/21/2023,12/21/2023,875328.0,1434,OGDEN AVENUE,Bronx,10452.0,2025220070.0,2113099.0,BX-04,16.0,211.0,BX0402,40.84337,-73.923736,40.843527,-73.923389,2023-12-21,Preservation,Yes,Non Prevailing Wage,,117.0,9.0,3.0,,1.0,24.0,41.0,63.0,2.0,,,,,130.0,,130.0,130,2023.0
74539,OGDEN PORTFOLIO HDFC.Y15.FY24,12/21/2023,12/21/2023,875382.0,228,NAGLE AVENUE,Manhattan,10034.0,1022180035.0,1087447.0,MN-12,10.0,291.0,MN1203,40.862659,-73.921856,40.863007,-73.922015,2023-12-21,Preservation,Yes,Non Prevailing Wage,,89.0,8.0,2.0,,1.0,16.0,34.0,50.0,,,,,,100.0,,100.0,100,2023.0
74539,OGDEN PORTFOLIO HDFC.Y15.FY24,12/21/2023,12/21/2023,877867.0,1457,OGDEN AVENUE,Bronx,10452.0,2025360015.0,2115561.0,BX-04,16.0,201.0,BX0402,40.843752,-73.923703,40.843763,-73.923942,2023-12-21,Preservation,Yes,Non Prevailing Wage,,48.0,11.0,,,,14.0,15.0,30.0,,,,,,59.0,,59.0,59,2023.0
74539,OGDEN PORTFOLIO HDFC.Y15.FY24,12/21/2023,12/21/2023,879907.0,2060,WHITE PLAINS ROAD,Bronx,10462.0,2042847501.0,2114768.0,BX-11,13.0,22404.0,BX1101,40.852125,-73.867771,40.851916,-73.867413,2023-12-21,Preservation,Yes,Non Prevailing Wage,,60.0,35.0,4.0,,1.0,6.0,44.0,44.0,6.0,,,,,100.0,,100.0,100,2023.0
74910,383 RUTLAND RD,12/21/2023,5/10/2024,1010222.0,383,RUTLAND ROAD,Brooklyn,11225.0,3048010154.0,3427372.0,BK-09,40.0,804.0,BK0902,40.659549,-73.948318,40.659769,-73.948181,2024-05-10,New Construction,No,Non Prevailing Wage,,,,,2.0,,,2.0,,,,,,,2.0,,2.0,6,2024.0
73431,1889 ATLANTIC AVENUE,12/19/2023,6/24/2025,1007984.0,1889,ATLANTIC AVENUE,Brooklyn,11233.0,3017140030.0,3000000.0,BK-03,41.0,299.0,BK0302,40.676975,-73.922355,40.677255,-73.922131,2025-06-24,New Construction,No,Non Prevailing Wage,,,16.0,,,,3.0,5.0,8.0,,,,,,16.0,,16.0,89,2025.0
74911,1543 BERGEN STREET,12/19/2023,3/5/2025,1015557.0,1543,BERGEN STREET,Brooklyn,11213.0,3013480077.0,3000000.0,BK-08,36.0,309.0,BK0802,40.675148,-73.932354,40.675389,-73.932476,2025-03-05,New Construction,No,Non Prevailing Wage,,,,,3.0,,,2.0,1.0,,,,,,3.0,,3.0,8,2025.0
74913,28-57 45TH STREET,12/19/2023,2/7/2025,434400.0,28-57,45 STREET,Queens,11103.0,4007190003.0,4620904.0,QN-01,22.0,147.0,QN0104,40.763299,-73.909941,40.762131,-73.91056,2025-02-07,New Construction,No,Non Prevailing Wage,,,,,3.0,,,1.0,2.0,,,,,,3.0,,3.0,9,2025.0
74944,689 EAST 223RD STREET,12/19/2023,4/23/2025,1011440.0,689,EAST 223 STREET,Bronx,10466.0,2048250012.0,2115530.0,BX-12,12.0,394.0,BX1201,40.886621,-73.861926,40.886764,-73.861604,2025-04-23,New Construction,No,Non Prevailing Wage,,,,,22.0,,6.0,4.0,12.0,,,,,,22.0,,22.0,23,2025.0
74945,17 SOMERS ST,12/18/2023,6/20/2024,1010902.0,17,SOMERS STREET,Brooklyn,11233.0,3015380061.0,3424509.0,BK-16,41.0,371.0,BK1601,40.678598,-73.912582,40.678796,-73.912874,2024-06-20,New Construction,No,Non Prevailing Wage,,,,,12.0,,1.0,8.0,3.0,,,,,,12.0,,12.0,39,2024.0
74282,SUMET I.HUDMF.FY24,12/11/2023,12/11/2023,371814.0,198,SOUTH 1 STREET,Brooklyn,11211.0,3024070012.0,3062982.0,BK-01,34.0,523.0,BK0102,40.713063,-73.959419,40.712887,-73.959535,2023-12-11,Preservation,No,Non Prevailing Wage,12.0,1.0,2.0,,,,,4.0,6.0,5.0,,,,,15.0,,15.0,15,2023.0
74282,SUMET I.HUDMF.FY24,12/11/2023,12/11/2023,371817.0,202,SOUTH 1 STREET,Brooklyn,11211.0,3024070014.0,3062983.0,BK-01,34.0,523.0,BK0102,40.713022,-73.9593,40.712843,-73.959412,2023-12-11,Preservation,No,Non Prevailing Wage,14.0,1.0,,,,,,4.0,6.0,5.0,,,,,15.0,,15.0,15,2023.0
74282,SUMET I.HUDMF.FY24,12/11/2023,12/11/2023,371819.0,204,SOUTH 1 STREET,Brooklyn,11211.0,3024070015.0,3062984.0,BK-01,34.0,523.0,BK0102,40.713,-73.959243,40.712799,-73.95929,2023-12-11,Preservation,No,Non Prevailing Wage,8.0,3.0,1.0,1.0,,,1.0,1.0,,5.0,6.0,,,,13.0,,13.0,13,2023.0
74282,SUMET I.HUDMF.FY24,12/11/2023,12/11/2023,371822.0,208,SOUTH 1 STREET,Brooklyn,11211.0,3024070017.0,3062985.0,BK-01,34.0,523.0,BK0102,40.712956,-73.959127,40.712753,-73.959167,2023-12-11,Preservation,No,Non Prevailing Wage,18.0,1.0,,,,,1.0,13.0,,5.0,,,,,19.0,,19.0,19,2023.0
74282,SUMET I.HUDMF.FY24,12/11/2023,12/11/2023,371828.0,226,SOUTH 1 STREET,Brooklyn,11211.0,3024080007.0,3063001.0,BK-01,34.0,523.0,BK0102,40.712607,-73.958175,40.712566,-73.958453,2023-12-11,Preservation,No,Non Prevailing Wage,15.0,2.0,3.0,,,1.0,,,10.0,11.0,,,,,21.0,,21.0,21,2023.0
74282,SUMET I.HUDMF.FY24,12/11/2023,12/11/2023,371830.0,228,SOUTH 1 STREET,Brooklyn,11211.0,3024080012.0,3063002.0,BK-01,34.0,523.0,BK0102,40.712582,-73.958107,40.712417,-73.958248,2023-12-11,Preservation,No,Non Prevailing Wage,17.0,2.0,,,,1.0,,,18.0,,2.0,,,,20.0,,20.0,20,2023.0
74282,SUMET I.HUDMF.FY24,12/11/2023,12/11/2023,371831.0,234,SOUTH 1 STREET,Brooklyn,11211.0,3024080014.0,3063003.0,BK-01,34.0,523.0,BK0102,40.712511,-73.957905,40.712357,-73.958082,2023-12-11,Preservation,No,Non Prevailing Wage,18.0,6.0,,,,,,2.0,22.0,,,,,,24.0,,24.0,24,2023.0
74282,SUMET I.HUDMF.FY24,12/11/2023,12/11/2023,371979.0,215,ROEBLING STREET,Brooklyn,11211.0,3024200005.0,3063142.0,BK-01,34.0,523.0,BK0102,40.711957,-73.959182,40.711926,-73.95898,2023-12-11,Preservation,No,Non Prevailing Wage,15.0,1.0,,1.0,,,1.0,5.0,6.0,5.0,,,,,17.0,,17.0,17,2023.0
74282,SUMET I.HUDMF.FY24,12/11/2023,12/11/2023,371985.0,231,SOUTH 2 STREET,Brooklyn,11211.0,3024080040.0,3063012.0,BK-01,34.0,523.0,BK0102,40.711945,-73.958435,40.712121,-73.958284,2023-12-11,Preservation,No,Non Prevailing Wage,8.0,2.0,,,,,1.0,4.0,,5.0,,,,,10.0,,10.0,10,2023.0
74282,SUMET I.HUDMF.FY24,12/11/2023,12/11/2023,371987.0,233,SOUTH 2 STREET,Brooklyn,11211.0,3024080038.0,3063011.0,BK-01,34.0,523.0,BK0102,40.711926,-73.958378,40.712082,-73.958183,2023-12-11,Preservation,No,Non Prevailing Wage,9.0,1.0,1.0,,,,,,2.0,9.0,,,,,11.0,,11.0,11,2023.0
74282,SUMET I.HUDMF.FY24,12/11/2023,12/11/2023,371990.0,237,SOUTH 2 STREET,Brooklyn,11211.0,3024080037.0,3063010.0,BK-01,34.0,523.0,BK0102,40.711885,-73.958266,40.712039,-73.95806,2023-12-11,Preservation,No,Non Prevailing Wage,12.0,2.0,2.0,,,,,10.0,2.0,4.0,,,,,16.0,,16.0,16,2023.0
74282,SUMET I.HUDMF.FY24,12/11/2023,12/11/2023,372104.0,209,SOUTH 3 STREET,Brooklyn,11211.0,3024200043.0,3063161.0,BK-01,34.0,523.0,BK0102,40.711257,-73.959045,40.711504,-73.958926,2023-12-11,Preservation,No,Non Prevailing Wage,15.0,3.0,2.0,,,,,,18.0,,2.0,,,,20.0,,20.0,20,2023.0
74918,1309 FINDLAY APARTMENTS,12/11/2023,8/21/2024,1011197.0,1309,FINDLAY AVENUE,Bronx,10456.0,2027830072.0,2007212.0,BX-04,16.0,17702.0,BX0403,40.835352,-73.910844,40.835399,-73.911115,2024-08-21,New Construction,No,Non Prevailing Wage,,,,,24.0,,13.0,10.0,,,,1.0,,,24.0,,24.0,25,2024.0
74919,1668 BERGEN STREET APARTMENTS_HPS,12/11/2023,12/27/2024,1011195.0,1668,BERGEN STREET,Brooklyn,11213.0,3013560010.0,3427364.0,BK-08,41.0,307.0,BK0802,40.674845,-73.927177,40.674587,-73.927257,2024-12-27,New Construction,No,Non Prevailing Wage,,,,,6.0,,2.0,4.0,,,,,,,6.0,,6.0,10,2024.0
73843,RED OAK.HUDMF.FY24,12/8/2023,12/8/2023,37598.0,149,WEST 106 STREET,Manhattan,10025.0,1018610010.0,1055957.0,MN-07,7.0,193.0,MN0703,40.800111,-73.964914,40.800281,-73.964199,2023-12-08,Preservation,Yes,Non Prevailing Wage,210.0,12.0,3.0,,4.0,1.0,26.0,203.0,1.0,,,,,,230.0,,230.0,230,2023.0
74920,2754 CRESTON AVENUE,12/8/2023,6/10/2025,59296.0,2754,CRESTON AVENUE,Bronx,10468.0,2033150029.0,2129723.0,BX-07,14.0,40303.0,BX0702,40.869377,-73.89323,40.869511,-73.892782,2025-06-10,New Construction,No,Non Prevailing Wage,,,,,21.0,,21.0,,,,,,,,21.0,,21.0,22,2025.0
74254,VILLA HERMOSA.HUDMF.FY24,12/7/2023,12/7/2023,804646.0,22,EAST 108 STREET,Manhattan,10029.0,1016130006.0,1076337.0,MN-11,9.0,17401.0,MN1101,40.795201,-73.949264,40.79485,-73.949384,2023-12-07,Preservation,Yes,Non Prevailing Wage,189.0,53.0,20.0,5.0,4.0,1.0,,50.0,162.0,60.0,,,,,272.0,,272.0,272,2023.0
74921,139 FROST ST,12/7/2023,8/30/2024,994162.0,137,FROST STREET,Brooklyn,11211.0,3027340035.0,3429170.0,BK-01,34.0,497.0,BK0104,40.717979,-73.945986,40.718176,-73.946098,2024-08-30,New Construction,No,Non Prevailing Wage,,,,,9.0,,2.0,2.0,5.0,,,,,,9.0,,9.0,28,2024.0
74923,950 OGDEN AVENUE APARTMENTS,12/6/2023,5/24/2024,1011336.0,950,OGDEN AVENUE,Bronx,10452.0,2025110055.0,2000000.0,BX-04,16.0,189.0,BX0402,40.831734,-73.930044,40.831657,-73.929792,2024-05-24,New Construction,No,Non Prevailing Wage,,,,,13.0,,2.0,3.0,7.0,1.0,,,,,13.0,,13.0,13,2024.0
74925,3854 BAILEY AVE,12/5/2023,8/1/2024,46592.0,3854,BAILEY AVENUE,Bronx,10463.0,2032630039.0,2092479.0,BX-08,11.0,279.0,BX0801,40.885227,-73.895968,40.88498,-73.895802,2024-08-01,New Construction,No,Non Prevailing Wage,,,,,14.0,,14.0,,,,,,,,14.0,,14.0,15,2024.0
74844,148-15 89 AVE,11/30/2023,10/8/2024,1010942.0,148-15,89 AVENUE,Queens,11435.0,4096930060.0,4310504.0,QN-12,27.0,238.0,QN1201,40.704238,-73.80728,40.704638,-73.807121,2024-10-08,New Construction,No,Non Prevailing Wage,,,,,21.0,,1.0,20.0,,,,,,,21.0,,21.0,69,2024.0
74846,3633 KINGSBRIDGE AVENUE APARTMENTS,11/30/2023,3/26/2025,89762.0,3633,KINGSBRIDGE AVENUE,Bronx,10463.0,2057660882.0,2000000.0,BX-08,11.0,285.0,BX0802,40.884601,-73.901733,40.884727,-73.901947,2025-03-26,New Construction,No,Non Prevailing Wage,,,,,3.0,,,3.0,,,,,,,3.0,,3.0,9,2025.0
74847,491 EVERGREEN AVENUE,11/30/2023,6/20/2024,290786.0,491,EVERGREEN AVENUE,Brooklyn,11221.0,3033680007.0,3000000.0,BK-04,37.0,415.0,BK0402,40.690955,-73.916666,40.69115,-73.9165,2024-06-20,New Construction,No,Non Prevailing Wage,,,,,3.0,,,1.0,2.0,,,,,,3.0,,3.0,10,2024.0
73164,ST. MATTHEW & ST. TIMOTHY'S HDFC.HPO.FY23,11/29/2023,11/29/2023,35998.0,122,WEST 83 STREET,Manhattan,10024.0,1012130042.0,1032080.0,MN-07,6.0,169.0,MN0702,40.784897,-73.974473,40.784807,-73.974824,2023-11-29,Preservation,Yes,Non Prevailing Wage,,35.0,36.0,,,1.0,16.0,38.0,13.0,5.0,,,,,72.0,,72.0,72,2023.0
74848,1166 FOX STREET_HPS,11/29/2023,8/20/2024,996231.0,1166,FOX STREET,Bronx,10459.0,2029740030.0,2000000.0,BX-03,17.0,125.0,BX0303,40.828723,-73.89383,40.828898,-73.893552,2024-08-20,New Construction,No,Non Prevailing Wage,,,,,58.0,,,58.0,,,,,,,58.0,,58.0,59,2024.0
74849,2-24 26TH AVE APARTMENTS,11/29/2023,9/26/2024,412315.0,2025-02-24T00:00:00.000,26 AVENUE,Queens,11102.0,4009140022.0,4000000.0,QN-01,22.0,87.0,QN0102,40.776661,-73.9342,40.776241,-73.93411,2024-09-26,New Construction,No,Non Prevailing Wage,,,,,42.0,,3.0,29.0,10.0,,,,,,42.0,,42.0,137,2024.0
74851,1716 EAST 54 STREET,11/27/2023,3/12/2025,270046.0,1716,EAST 54 STREET,Brooklyn,11234.0,3084930061.0,3239752.0,BK-18,46.0,682.0,BK1801,40.615785,-73.922653,40.615712,-73.922923,2025-03-12,New Construction,No,Non Prevailing Wage,,,,,4.0,,,,4.0,,,,,,4.0,,4.0,11,2025.0
74852,654 MADISON STREET APARTMENTS,11/27/2023,5/31/2024,1010976.0,654,MADISON STREET,Brooklyn,11221.0,3016460011.0,3000000.0,BK-03,36.0,293.0,BK0302,40.686862,-73.931877,40.686615,-73.932072,2024-05-31,New Construction,No,Non Prevailing Wage,,,,,12.0,,2.0,4.0,6.0,,,,,,12.0,,12.0,38,2024.0
74853,3103 SEDGWICK AVE APARTMENTS,11/23/2023,12/18/2024,973914.0,3103,SEDGWICK AVENUE,Bronx,10463.0,2032540072.0,2000000.0,BX-08,14.0,277.0,BX0801,40.876766,-73.899398,40.876909,-73.899662,2024-12-18,New Construction,No,Non Prevailing Wage,,,,,13.0,,,,12.0,1.0,,,,,13.0,,13.0,42,2024.0
74854,61 DELMONICA PLACE APARTMENTS,11/22/2023,7/3/2024,1011921.0,61,DELMONICO PLACE,Brooklyn,11206.0,3017320001.0,3428846.0,BK-03,36.0,257.0,BK0301,40.698411,-73.945234,40.698438,-73.94505,2024-07-03,New Construction,No,Non Prevailing Wage,,,,,3.0,,,3.0,,,,,,,3.0,,3.0,8,2024.0
74855,261 BEDFORD PARK BLVD APARTMENTS,11/21/2023,7/24/2024,1008155.0,261,BEDFORD PARK BOULEVARD,Bronx,10458.0,2032980009.0,2000000.0,BX-07,11.0,415.0,BX0702,40.870674,-73.886087,40.870852,-73.885826,2024-07-24,New Construction,No,Non Prevailing Wage,,,,,27.0,,12.0,15.0,,,,,,,27.0,,27.0,29,2024.0
74856,236 BERRY STREET APARTMENTS,11/20/2023,2/20/2025,302492.0,123,GRAND STREET,Brooklyn,11249.0,3023790024.0,3000000.0,BK-01,34.0,555.0,BK0102,40.715227,-73.963076,40.715438,-73.962719,2025-02-20,New Construction,No,Non Prevailing Wage,,,,,15.0,,,15.0,,,,,,,15.0,,15.0,50,2025.0
74857,3002 PERRY AVENUE,11/20/2023,6/26/2024,1010792.0,3002,PERRY AVENUE,Bronx,10458.0,2032810010.0,2129686.0,BX-07,11.0,415.0,BX0702,40.870821,-73.882865,40.870758,-73.882489,2024-06-26,New Construction,No,Non Prevailing Wage,,,,,23.0,,23.0,,,,,,,,23.0,,23.0,24,2024.0
74859,1720 LINCOLN PLACE APARTMENTS,11/15/2023,5/22/2024,1010806.0,1720,LINCOLN PLACE,Brooklyn,11233.0,,,BK-16,41.0,361.0,BK1601,40.669065,-73.918831,,,2024-05-22,New Construction,No,Non Prevailing Wage,,,,,11.0,,2.0,,3.0,6.0,,,,,11.0,,11.0,11,2024.0
74981,721 ARNOW AVENUE APARTMENTS,11/14/2023,6/5/2024,1010777.0,721,ARNOW AVENUE,Bronx,10467.0,2045460001.0,2130551.0,BX-11,12.0,33801.0,BX1104,40.867886,-73.866481,40.86804,-73.866463,2024-06-05,New Construction,No,Non Prevailing Wage,,,,,9.0,,,5.0,4.0,,,,,,9.0,,9.0,10,2024.0
74982,43-15 63RD STREET,11/13/2023,12/12/2024,454706.0,43-15,63 STREET,Queens,11377.0,4013400009.0,4623654.0,QN-02,26.0,249.0,QN0203,40.742002,-73.90225,40.742005,-73.901962,2024-12-12,New Construction,No,Non Prevailing Wage,,,,,3.0,,,1.0,2.0,,,,,,3.0,,3.0,7,2024.0
74984,50 VARET STREET APARTMENTS,11/13/2023,4/23/2025,989432.0,43,GRAHAM AVENUE,Brooklyn,11206.0,3031130017.0,3000000.0,BK-01,34.0,491.0,BK0104,40.702875,-73.942478,40.702845,-73.942781,2025-04-23,New Construction,No,Non Prevailing Wage,,,,,11.0,,3.0,6.0,2.0,,,,,,11.0,,11.0,35,2025.0
74986,959 ANDERSON AVE,11/13/2023,5/22/2024,1010742.0,959,ANDERSON AVENUE,Bronx,10452.0,2025070032.0,2129679.0,BX-04,16.0,189.0,BX0402,40.831343,-73.927888,40.831486,-73.928126,2024-05-22,New Construction,No,Non Prevailing Wage,,,,,24.0,,,15.0,9.0,,,,,,24.0,,24.0,25,2024.0
74988,536 EAST 183 STREET APARTMENTS,11/10/2023,8/30/2024,1010805.0,536,EAST 183 STREET,Bronx,10458.0,2030510026.0,2128521.0,BX-06,15.0,385.0,BX0603,40.854417,-73.891461,40.85428,-73.891649,2024-08-30,New Construction,No,Non Prevailing Wage,,,,,37.0,,26.0,10.0,1.0,,,,,,37.0,,37.0,38,2024.0
74989,32-53 101 STREET,11/9/2023,8/28/2024,684438.0,101-01,NORTHERN BOULEVARD,Queens,11368.0,4016967501.0,4000000.0,QN-03,21.0,365.0,QN0302,40.757464,-73.86733,40.757728,-73.867287,2024-08-28,New Construction,No,Non Prevailing Wage,,,,,8.0,,,,8.0,,,,,,8.0,,8.0,24,2024.0
74991,2001 CRESTON AVENUE APARTMENTS,11/8/2023,2/28/2024,1010901.0,2001,CRESTON AVENUE,Bronx,10453.0,2028070079.0,2129667.0,BX-05,14.0,241.0,BX0502,40.851487,-73.905986,40.851665,-73.906058,2024-02-28,New Construction,No,Non Prevailing Wage,,,,,48.0,,4.0,23.0,17.0,,4.0,,,,48.0,,48.0,49,2024.0
74992,2270 BRONX PARK EAST APARTMENTS,11/8/2023,8/28/2024,51999.0,2270,BRONX PARK EAST,Bronx,10467.0,2043400006.0,2129683.0,BX-11,15.0,33201.0,BX1104,40.859399,-73.870811,40.859316,-73.870417,2024-08-28,New Construction,No,Non Prevailing Wage,,,,,10.0,,2.0,5.0,3.0,,,,,,10.0,,10.0,33,2024.0
74993,779 FLATBUSH AVENUE APARTMENTS,11/8/2023,6/16/2025,292926.0,779,FLATBUSH AVENUE,Brooklyn,11226.0,3050640001.0,3328167.0,BK-14,40.0,79602.0,BK1401,40.653853,-73.959495,40.653756,-73.95916,2025-06-16,New Construction,No,Non Prevailing Wage,,,,,9.0,,,6.0,3.0,,,,,,9.0,,9.0,27,2025.0
74995,53-10 102ND STREET,11/7/2023,11/27/2024,513538.0,53-10,102 STREET,Queens,11368.0,4019380018.0,4000000.0,QN-04,21.0,44301.0,QN0402,40.741214,-73.859207,40.740959,-73.859305,2024-11-27,New Construction,No,Non Prevailing Wage,,,,,3.0,,,2.0,1.0,,,,,,3.0,,3.0,7,2024.0
73465,828 METROPOLITAN AVENUE,11/1/2023,,1010645.0,828,METROPOLITAN AVENUE,Brooklyn,11211.0,3029160014.0,3000000.0,BK-01,34.0,481.0,BK0104,40.71468,-73.940816,40.714466,-73.941437,2024-12-19,New Construction,No,Non Prevailing Wage,,12.0,15.0,5.0,,,2.0,18.0,12.0,,,,,,32.0,,32.0,136,2024.0
74998,49 BORINQUEN PLACE,10/31/2023,6/20/2024,1011516.0,49,BORINQUEN PLACE,Brooklyn,11211.0,,,BK-01,34.0,523.0,BK0102,40.710487,-73.956705,,,2024-06-20,New Construction,No,Non Prevailing Wage,,,,,5.0,,,,5.0,,,,,,5.0,,5.0,16,2024.0
74999,115 WEST 190 STREET APARTMENTS,10/30/2023,6/12/2024,121294.0,115,WEST 190 STREET,Bronx,10468.0,2032200115.0,2000000.0,BX-07,14.0,263.0,BX0701,40.865596,-73.903819,40.865799,-73.903717,2024-06-12,New Construction,No,Non Prevailing Wage,,,,,12.0,,1.0,8.0,3.0,,,,,,12.0,,12.0,37,2024.0
74814,3001 GRAND CONCOURSE,10/29/2023,6/25/2025,81912.0,3003,GRAND CONCOURSE,Bronx,10468.0,2033100074.0,2000000.0,BX-07,14.0,411.0,BX0702,40.873137,-73.887204,40.87297,-73.88779,2025-06-25,New Construction,No,Non Prevailing Wage,,,,,43.0,,8.0,27.0,8.0,,,,,,43.0,,43.0,44,2025.0
74815,88-06 161 STREET,10/29/2023,7/24/2024,1012319.0,88-06,161 STREET,Queens,11432.0,4097640063.0,4000000.0,QN-12,24.0,44602.0,QN1201,40.707847,-73.800871,40.707856,-73.801145,2024-07-24,New Construction,No,Non Prevailing Wage,,,,,14.0,,,12.0,2.0,,,,,,14.0,,14.0,45,2024.0
75399,840 NEW YORK AVENUE,10/27/2023,11/27/2024,1010703.0,840,NEW YORK AVENUE,Brooklyn,11203.0,3048530064.0,3427334.0,BK-17,40.0,818.0,BK1701,40.653296,-73.946936,40.653266,-73.947267,2024-11-27,New Construction,No,Non Prevailing Wage,,,,,5.0,,,2.0,3.0,,,,,,5.0,,5.0,15,2024.0
74817,2680 CRESTON AVENUE APARTMENTS,10/26/2023,1/9/2024,1010534.0,2680,CRESTON AVENUE,Bronx,10468.0,2033140011.0,2129661.0,BX-07,14.0,40304.0,BX0702,40.867249,-73.894962,40.867021,-73.894865,2024-01-09,New Construction,No,Non Prevailing Wage,,,,,53.0,,,39.0,14.0,,,,,,53.0,,53.0,54,2024.0
74818,499 CONCORD AVENUE APARTMENTS,10/26/2023,6/12/2024,58356.0,495,CONCORD AVENUE,Bronx,10455.0,2025790040.0,2000000.0,BX-01,8.0,35.0,BX0101,40.811853,-73.908596,40.811792,-73.908799,2024-06-12,New Construction,No,Non Prevailing Wage,,,,,10.0,,,5.0,5.0,,,,,,10.0,,10.0,33,2024.0
74819,413 THROOP AVENUE APARTMENTS,10/24/2023,6/23/2025,381193.0,413,THROOP AVENUE,Brooklyn,11221.0,3018010001.0,3000000.0,BK-03,36.0,279.0,BK0302,40.688874,-73.942101,40.688852,-73.941802,2025-06-23,New Construction,No,Non Prevailing Wage,,,,,2.0,,,1.0,1.0,,,,,,2.0,,2.0,6,2025.0
74820,11 WEIRFIELD STREET,10/23/2023,5/3/2024,1010492.0,11,WEIRFIELD STREET,Brooklyn,11221.0,3033947501.0,3427369.0,BK-04,37.0,397.0,BK0402,40.686338,-73.915799,40.686506,-73.915979,2024-05-03,New Construction,No,Non Prevailing Wage,,,,,3.0,,,1.0,2.0,,,,,,3.0,,3.0,10,2024.0
74821,27-16 21 ST,10/23/2023,5/15/2024,1010454.0,27-16,21 STREET,Queens,11102.0,4005390032.0,4620917.0,QN-01,22.0,83.0,QN0102,40.771855,-73.926244,40.7719,-73.92658,2024-05-15,New Construction,No,Non Prevailing Wage,,,,,15.0,,,7.0,8.0,,,,,,15.0,,15.0,49,2024.0
74823,1297 COLLEGE AVE,10/19/2023,7/15/2024,1010339.0,1297,COLLEGE AVENUE,Bronx,10456.0,2027850075.0,2000000.0,BX-04,16.0,17702.0,BX0403,40.835257,-73.911928,40.835257,-73.912062,2024-07-15,New Construction,No,Non Prevailing Wage,,,,,11.0,,,8.0,,3.0,,,,,11.0,,11.0,12,2024.0
74824,2638 DECATUR AVE,10/19/2023,12/27/2023,991367.0,2638,DECATUR AVENUE,Bronx,10458.0,2032770008.0,2016360.0,BX-07,15.0,397.0,BX0603,40.863802,-73.889826,40.863689,-73.88962,2023-12-27,New Construction,No,Non Prevailing Wage,,,,,23.0,,16.0,5.0,2.0,,,,,,23.0,,23.0,24,2023.0
74825,751 ROSEDALE AVE,10/19/2023,8/21/2024,1010336.0,751,ROSEDALE AVENUE,Bronx,10473.0,2035940041.0,2130545.0,BX-09,18.0,2002.0,BX0902,40.819826,-73.866462,40.820329,-73.866898,2024-08-21,New Construction,No,Non Prevailing Wage,,,,,32.0,,4.0,22.0,6.0,,,,,,32.0,,32.0,33,2024.0
74826,80 LINDEN BOULEVARD,10/19/2023,8/21/2024,327524.0,80,LINDEN BOULEVARD,Brooklyn,11226.0,3050870008.0,3000000.0,BK-17,40.0,822.0,BK1701,40.652336,-73.955452,40.65204,-73.95577,2024-08-21,New Construction,No,Non Prevailing Wage,,,,,14.0,,,8.0,6.0,,,,,,14.0,,14.0,45,2024.0
74828,146-61 105 AVENUE APARTMENTS,10/17/2023,9/26/2024,968509.0,146-61,105 AVENUE,Queens,11435.0,4100550019.0,4539499.0,QN-12,28.0,204.0,QN1201,40.695227,-73.804212,40.695606,-73.804114,2024-09-26,New Construction,No,Non Prevailing Wage,,,,,6.0,,,6.0,,,,,,,6.0,,6.0,7,2024.0
73495,PARADISE MANAGEMENT CLUSTER 14.HPO.FY23,10/16/2023,10/16/2023,92670.0,1871,LORING PLACE,Bronx,10453.0,2028790192.0,2009117.0,BX-05,14.0,24501.0,BX0501,40.853234,-73.915303,40.853827,-73.915201,2023-10-16,Preservation,Yes,Non Prevailing Wage,,14.0,48.0,1.0,,1.0,,19.0,28.0,17.0,,,,,64.0,,64.0,64,2023.0
73496,PARADISE MANAGEMENT CLUSTER 15.HPO.FY23,10/16/2023,10/16/2023,122007.0,190,WEST BURNSIDE AVENUE,Bronx,10453.0,2028790170.0,2009110.0,BX-05,14.0,24501.0,BX0501,40.854459,-73.915981,40.854391,-73.916393,2023-10-16,Preservation,Yes,Non Prevailing Wage,,10.0,60.0,,,1.0,,17.0,44.0,10.0,,,,,71.0,,71.0,71,2023.0
74830,763 PARK AVENUE APARTMENTS,10/16/2023,7/3/2024,351315.0,763,PARK AVENUE,Brooklyn,11206.0,3017320136.0,3429283.0,BK-03,36.0,257.0,BK0301,40.698136,-73.944805,40.698331,-73.944974,2024-07-03,New Construction,No,Non Prevailing Wage,,,,,3.0,,,,3.0,,,,,,3.0,,3.0,8,2024.0
74831,3418 3RD AVENUE APARTMENTS,10/12/2023,8/9/2024,113759.0,3418,3 AVENUE,Bronx,10456.0,2026080034.0,2129677.0,BX-03,17.0,18502.0,BX0301,40.828616,-73.906886,40.828704,-73.906531,2024-08-09,New Construction,No,Non Prevailing Wage,,,,,13.0,,3.0,8.0,2.0,,,,,,13.0,,13.0,43,2024.0
74834,254 AMBOY STREET,10/9/2023,6/7/2024,184205.0,254,AMBOY STREET,Brooklyn,11212.0,3035560041.0,3081733.0,BK-16,41.0,898.0,BK1602,40.664205,-73.913261,40.664238,-73.913538,2024-06-07,New Construction,No,Non Prevailing Wage,,,,,10.0,,2.0,3.0,5.0,,,,,,10.0,,10.0,11,2024.0
74558,352 MEEKER AVENUE APARTMENTS,9/29/2023,9/19/2024,1010119.0,352,MEEKER AVENUE,Brooklyn,11211.0,3027380010.0,3429036.0,BK-01,34.0,501.0,BK0104,40.717639,-73.947895,40.717573,-73.947649,2024-09-19,New Construction,No,Non Prevailing Wage,,,,,9.0,,,9.0,,,,,,,9.0,,9.0,27,2024.0
74560,2008 CROTONA AVENUE APARTMENTS,9/28/2023,11/27/2024,59859.0,2008,CROTONA AVENUE,Bronx,10457.0,2030950006.0,2012657.0,BX-06,15.0,371.0,BX0602,40.846933,-73.889836,40.847051,-73.889384,2024-11-27,New Construction,No,Non Prevailing Wage,,,,,3.0,,,1.0,2.0,,,,,,3.0,,3.0,8,2024.0
74561,209 NORTH 11 STREET,9/27/2023,12/6/2024,345740.0,203,NORTH 11 STREET,Brooklyn,11211.0,3022920029.0,3429695.0,BK-01,33.0,519.0,BK0102,40.718943,-73.953557,40.71905,-73.953301,2024-12-06,New Construction,No,Non Prevailing Wage,,,,,16.0,,,16.0,,,,,,,16.0,,16.0,53,2024.0
74562,37-25 32ND STREET APARTMENTS,9/26/2023,9/18/2024,1010366.0,37-25,32 STREET,Queens,11101.0,4003740010.0,4531227.0,QN-01,26.0,55.0,QN0105,40.754168,-73.930595,40.753778,-73.930603,2024-09-18,New Construction,No,Non Prevailing Wage,,,,,7.0,,,,7.0,,,,,,7.0,,7.0,21,2024.0
74563,26-31 3RD STREET,9/26/2023,2/20/2025,399229.0,26-33,3 STREET,Queens,11102.0,4009107503.0,4000000.0,QN-01,22.0,87.0,QN0102,40.775892,-73.933782,40.775447,-73.93375,2025-02-20,New Construction,No,Non Prevailing Wage,,,,,5.0,,1.0,3.0,1.0,,,,,,5.0,,5.0,16,2025.0
74947,488 MARCUS GARVEY BOULEVARD,9/22/2023,5/7/2024,1010785.0,488,MARCUS GARVEY BOULEVARD,Brooklyn,11216.0,3018590029.0,3332256.0,BK-03,36.0,273.0,BK0302,40.680204,-73.937501,40.680165,-73.937757,2024-05-07,New Construction,No,Non Prevailing Wage,,,,,6.0,,,6.0,,,,,,,6.0,,6.0,18,2024.0
74564,3308 GLENWOOD ROAD APARTMENTS,9/21/2023,2/28/2024,1010117.0,3308,GLENWOOD ROAD,Brooklyn,11210.0,3075610041.0,3000000.0,BK-17,45.0,784.0,BK1702,40.634183,-73.944678,40.633947,-73.944429,2024-02-28,New Construction,No,Non Prevailing Wage,,,,,12.0,,,7.0,5.0,,,,,,12.0,,12.0,38,2024.0
74566,351 EAST 10TH STREET,9/21/2023,6/18/2025,11556.0,351,EAST 10 STREET,Manhattan,10009.0,1003930059.0,1091774.0,MN-03,2.0,28.0,MN0303,40.726671,-73.979417,40.726819,-73.979226,2025-06-18,New Construction,No,Non Prevailing Wage,,,3.0,,8.0,,2.0,6.0,3.0,,,,,,11.0,,11.0,28,2025.0
74567,833 & 837 MAPLE STREET,9/20/2023,12/20/2024,332437.0,837,MAPLE STREET,Brooklyn,11203.0,3045880098.0,3000000.0,BK-09,41.0,88001.0,BK0902,40.662016,-73.932144,40.662228,-73.932042,2024-12-05,New Construction,No,Non Prevailing Wage,,,,,4.0,,,2.0,2.0,,,,,,4.0,,4.0,13,2024.0
74567,833 & 837 MAPLE STREET,9/20/2023,12/20/2024,1004447.0,833,MAPLE STREET,Brooklyn,11203.0,3045880102.0,3000000.0,BK-09,41.0,88001.0,BK0902,40.662008,-73.932266,40.66222,-73.932165,2024-12-20,New Construction,No,Non Prevailing Wage,,,,,6.0,,,6.0,,,,,,,6.0,,6.0,20,2024.0
74568,637 EAST 223RD STREET,9/20/2023,12/7/2023,1010177.0,637,EAST 223 STREET,Bronx,10466.0,2048250041.0,2062952.0,BX-12,12.0,394.0,BX1201,40.887037,-73.863231,40.887296,-73.863306,2023-12-07,New Construction,No,Non Prevailing Wage,,,,,43.0,,3.0,29.0,10.0,1.0,,,,,43.0,,43.0,44,2023.0
74569,148-09 90 AVE,9/19/2023,9/18/2024,1009581.0,148-09,90 AVENUE,Queens,11435.0,4096810095.0,4623824.0,QN-12,27.0,240.0,QN1201,40.703296,-73.80698,40.703554,-73.806832,2024-09-18,New Construction,No,Non Prevailing Wage,,,,,9.0,,,6.0,2.0,1.0,,,,,9.0,,9.0,10,2024.0
74573,26-36 4TH STREET,9/19/2023,5/30/2025,992498.0,26-36,4 STREET,Queens,11102.0,4009100039.0,4000000.0,QN-01,22.0,87.0,QN0102,40.775573,-73.932938,40.775247,-73.933433,2025-05-30,New Construction,No,Non Prevailing Wage,,,,,3.0,,,3.0,,,,,,,3.0,,3.0,10,2025.0
68119,TBK1005 - 685 NOSTRAND AVENUE,9/15/2023,11/15/2024,346909.0,685,NOSTRAND AVENUE,Brooklyn,11216.0,3012340001.0,3031228.0,BK-08,36.0,31701.0,BK0802,40.673817,-73.950117,40.673844,-73.949749,2024-11-15,Preservation,No,Non Prevailing Wage,,8.0,15.0,,,1.0,1.0,7.0,11.0,5.0,,,,,24.0,,24.0,24,2024.0
74579,42 GROVE ST,9/13/2023,2/5/2024,1009767.0,42,GROVE STREET,Brooklyn,11221.0,3033210019.0,3076032.0,BK-04,37.0,397.0,BK0402,40.691396,-73.922641,40.691226,-73.922522,2024-02-05,New Construction,No,Non Prevailing Wage,,,,,3.0,,,3.0,,,,,,,3.0,,3.0,7,2024.0
74580,1244 NEW YORK AVE,9/13/2023,12/20/2023,1010025.0,1244,NEW YORK AVENUE,Brooklyn,11203.0,3049490021.0,3111366.0,BK-17,45.0,830.0,BK1702,40.64253,-73.945788,40.642497,-73.94609,2023-12-20,New Construction,No,Non Prevailing Wage,,,,,5.0,,1.0,,,4.0,,,,,5.0,,5.0,16,2023.0
74581,52 WEST 176TH STREET,9/13/2023,6/12/2024,121085.0,52,WEST 176 STREET,Bronx,10453.0,2028660077.0,2008464.0,BX-05,14.0,21502.0,BX0501,40.848655,-73.914257,40.848538,-73.914774,2024-06-12,New Construction,No,Non Prevailing Wage,,,,,24.0,,15.0,7.0,2.0,,,,,,24.0,,24.0,25,2024.0
74583,923 BROADWAY APARTMENTS,9/12/2023,5/31/2024,214348.0,923,BROADWAY,Brooklyn,11206.0,3031500001.0,3071866.0,BK-04,34.0,389.0,BK0401,40.697476,-73.936111,40.697659,-73.935934,2024-05-31,New Construction,No,Non Prevailing Wage,,,,,3.0,,,,3.0,,,,,,3.0,,3.0,10,2024.0
74660,2330 CAMBRELENG AVENUE,9/11/2023,12/27/2024,54870.0,2330,CAMBRELENG AVENUE,Bronx,10458.0,2030890018.0,2000000.0,BX-06,15.0,391.0,BX0603,40.85345,-73.88577,40.853371,-73.885531,2024-12-27,New Construction,No,Non Prevailing Wage,,,,,14.0,,3.0,4.0,7.0,,,,,,14.0,,14.0,44,2024.0
74948,1707 DEAN STREET APARTMENTS,9/7/2023,9/7/2023,965078.0,1705,DEAN STREET,Brooklyn,11213.0,3013420066.0,3000000.0,BK-08,36.0,309.0,BK0802,40.675883,-73.931502,40.676116,-73.931552,2023-09-07,New Construction,No,Non Prevailing Wage,,,,,4.0,,,4.0,,,,,,,4.0,,4.0,13,2023.0
74661,1417 AVENUE J,9/6/2023,6/26/2025,188866.0,1417,AVENUE J,Brooklyn,11230.0,3067077501.0,3179617.0,BK-14,44.0,530.0,BK1403,40.625116,-73.962074,40.625398,-73.961688,2025-06-26,New Construction,No,Non Prevailing Wage,,,,,6.0,,,5.0,1.0,,,,,,6.0,,6.0,17,2025.0
74662,318 & 322 EAST 32ND STREET,9/5/2023,3/5/2025,257630.0,322,EAST 32 STREET,Brooklyn,11226.0,3049480015.0,3429316.0,BK-17,45.0,830.0,BK1702,40.642657,-73.946793,40.642742,-73.947074,2025-03-05,New Construction,No,Non Prevailing Wage,,,,,2.0,,,1.0,,1.0,,,,,2.0,,2.0,6,2025.0
74663,2180 ARTHUR AVENUE,9/5/2023,4/24/2025,46198.0,2180,ARTHUR AVENUE,Bronx,10457.0,2030700288.0,2000000.0,BX-06,15.0,373.0,BX0602,40.851531,-73.890302,40.851714,-73.889814,2025-04-24,New Construction,No,Non Prevailing Wage,,,,,45.0,,5.0,35.0,5.0,,,,,,45.0,,45.0,46,2025.0
74929,26-12 4TH STREET,9/5/2023,3/15/2024,1011370.0,26-12,4 STREET,Queens,11102.0,4009100027.0,4000000.0,QN-01,22.0,87.0,QN0102,40.775823,-73.932808,40.775848,-73.933118,2024-03-15,New Construction,No,Non Prevailing Wage,,,,,7.0,,,7.0,,,,,,,7.0,,7.0,22,2024.0
74930,285 EAST 169 ST,9/4/2023,7/15/2024,1009956.0,285,EAST 169 STREET,Bronx,10456.0,2027850075.0,2000000.0,BX-04,16.0,17702.0,BX0403,40.835136,-73.912395,40.835257,-73.912062,2024-07-15,New Construction,No,Non Prevailing Wage,,,,,9.0,,8.0,1.0,,,,,,,9.0,,9.0,10,2024.0
74664,435 CENTRAL AVE,9/1/2023,6/16/2025,218689.0,431,CENTRAL AVENUE,Brooklyn,11221.0,3033690006.0,3425663.0,BK-04,37.0,415.0,BK0402,40.69247,-73.915272,40.692601,-73.915052,2025-06-16,New Construction,No,Non Prevailing Wage,,,,,5.0,,,1.0,4.0,,,,,,5.0,,5.0,14,2025.0
74666,127-131 CONCORD STREET APARTMENTS,8/31/2023,6/12/2024,224371.0,127,CONCORD STREET,Brooklyn,11201.0,3001070048.0,3000000.0,BK-02,33.0,13.0,BK0202,40.697666,-73.986282,40.697929,-73.986231,2024-06-12,New Construction,No,Non Prevailing Wage,,,,,22.0,,4.0,7.0,11.0,,,,,,22.0,,22.0,73,2024.0
74667,630 GRAND STREET APARTMENTS,8/31/2023,7/24/2024,1009974.0,630,GRAND STREET,Brooklyn,11211.0,3027870010.0,3000000.0,BK-01,34.0,503.0,BK0104,40.711356,-73.946843,40.711117,-73.946886,2024-07-24,New Construction,No,Non Prevailing Wage,,,,,6.0,,,6.0,,,,,,,6.0,,6.0,20,2024.0
74668,179 MARTENSE STREET,8/31/2023,11/21/2023,333338.0,179,MARTENSE STREET,Brooklyn,11226.0,3050870063.0,3116774.0,BK-17,40.0,822.0,BK1701,40.651514,-73.953348,40.651786,-73.953121,2023-11-21,New Construction,No,Non Prevailing Wage,,,,,4.0,,4.0,,,,,,,,4.0,,4.0,12,2023.0
74669,731 LIBERTY AVENUE APARTMENTS,8/30/2023,8/30/2023,989464.0,735,LIBERTY AVENUE,Brooklyn,11208.0,3039710049.0,3328398.0,BK-05,37.0,1168.0,BK0501,40.676466,-73.882637,40.676669,-73.882701,2023-08-30,New Construction,No,Non Prevailing Wage,,,,,3.0,,3.0,,,,,,,,3.0,,3.0,10,2023.0
69911,HAMILTON HEIGHTS II LLC.PLP.FY24 (HAMILTON HEIGHTS CLUSTER),8/29/2023,,22510.0,110,HAMILTON PLACE,Manhattan,10031.0,1020740025.0,1061858.0,MN-09,7.0,229.0,MN0903,40.823738,-73.949499,40.823842,-73.949636,2025-06-01,Preservation,No,Non Prevailing Wage,11.0,4.0,3.0,,,,,,6.0,12.0,,,,,18.0,,18.0,18,2025.0
69911,HAMILTON HEIGHTS II LLC.PLP.FY24 (HAMILTON HEIGHTS CLUSTER),8/29/2023,,41476.0,542,WEST 140 STREET,Manhattan,10031.0,1020710056.0,1061748.0,MN-09,7.0,225.0,MN0903,40.822789,-73.951653,40.822718,-73.951931,2024-05-17,Preservation,No,Non Prevailing Wage,5.0,2.0,1.0,,,,8.0,,,,,,,,8.0,,8.0,8,2024.0
69911,HAMILTON HEIGHTS II LLC.PLP.FY24 (HAMILTON HEIGHTS CLUSTER),8/29/2023,,41632.0,504,WEST 142 STREET,Manhattan,10031.0,1020730043.0,1061807.0,MN-09,7.0,225.0,MN0903,40.823727,-73.950008,40.823576,-73.950186,2024-05-17,Preservation,No,Non Prevailing Wage,1.0,5.0,2.0,,,,8.0,,,,,,,,8.0,,8.0,8,2024.0
69911,HAMILTON HEIGHTS II LLC.PLP.FY24 (HAMILTON HEIGHTS CLUSTER),8/29/2023,,41993.0,531,WEST 145 STREET,Manhattan,10031.0,1020770012.0,1061931.0,MN-09,7.0,229.0,MN0903,40.825661,-73.948598,40.826197,-73.949175,2025-06-01,Preservation,No,Non Prevailing Wage,5.0,7.0,1.0,,,,,,1.0,12.0,,,,,13.0,,13.0,13,2025.0
69911,HAMILTON HEIGHTS II LLC.PLP.FY24 (HAMILTON HEIGHTS CLUSTER),8/29/2023,,992562.0,529,WEST 145 STREET,Manhattan,10031.0,1020770013.0,1061932.0,MN-09,7.0,229.0,MN0903,40.825645,-73.948558,40.826153,-73.949071,2025-06-01,Preservation,No,Non Prevailing Wage,7.0,4.0,2.0,,,,,,1.0,12.0,,,,,13.0,,13.0,13,2025.0
74670,2072 ANTHONY AVENUE,8/29/2023,1/30/2025,45680.0,2072,ANTHONY AVENUE,Bronx,10457.0,2031560049.0,2129647.0,BX-05,15.0,381.0,BX0502,40.852746,-73.902001,40.852644,-73.901712,2025-01-30,New Construction,No,Non Prevailing Wage,,,,,110.0,,29.0,59.0,22.0,,,,,,110.0,,110.0,111,2025.0
74671,729 731 EAST 32ND ST,8/29/2023,12/27/2023,1006551.0,729,EAST 32 STREET,Brooklyn,11210.0,3075600033.0,3428585.0,BK-17,45.0,78602.0,BK1702,40.633299,-73.94577,40.633431,-73.945496,2023-12-27,New Construction,No,Non Prevailing Wage,,,,,2.0,,,2.0,,,,,,,2.0,,2.0,6,2023.0
74671,729 731 EAST 32ND ST,8/29/2023,12/27/2023,1006620.0,731,EAST 32 STREET,Brooklyn,11210.0,3075600032.0,3424762.0,BK-17,45.0,78602.0,BK1702,40.633267,-73.945766,40.633379,-73.945489,2023-12-27,New Construction,No,Non Prevailing Wage,,,,,2.0,,,2.0,,,,,,,2.0,,2.0,6,2023.0
74672,91-15 101 AVENUE APARTMENTS,8/28/2023,4/9/2025,512031.0,91-15,101 AVENUE,Queens,11416.0,4090657501.0,4188499.0,QN-09,32.0,38.0,QN0904,40.683366,-73.849205,40.683722,-73.84884,2025-04-09,New Construction,No,Non Prevailing Wage,,,,,3.0,,,1.0,2.0,,,,,,3.0,,3.0,10,2025.0
74673,61 EAST 53 ST,8/24/2023,11/15/2023,1009851.0,61,EAST 53 STREET,Brooklyn,11203.0,3046070031.0,3428686.0,BK-17,41.0,866.0,BK1703,40.658937,-73.928211,40.65891,-73.927894,2023-11-15,New Construction,No,Non Prevailing Wage,,,,,20.0,,5.0,5.0,,10.0,,,,,20.0,,20.0,20,2023.0
74674,286 EAST 163RD STREET APARTMENTS,8/23/2023,6/5/2024,64577.0,286,EAST 163 STREET,Bronx,10451.0,2024220015.0,2129701.0,BX-04,16.0,173.0,BX0401,40.827054,-73.916937,40.826821,-73.916991,2024-06-05,New Construction,No,Non Prevailing Wage,,,,,6.0,,1.0,2.0,3.0,,,,,,6.0,,6.0,18,2024.0
74675,340 LENOX ROAD APARTMENTS,8/22/2023,10/31/2024,324145.0,342,LENOX ROAD,Brooklyn,11226.0,3048530041.0,3000000.0,BK-17,40.0,818.0,BK1701,40.654254,-73.948222,40.653906,-73.948121,2024-10-31,New Construction,No,Non Prevailing Wage,,,,,14.0,,4.0,10.0,,,,,,,14.0,,14.0,46,2024.0
74676,1047 OGDEN AVE,8/21/2023,12/5/2024,1009802.0,1047,OGDEN AVENUE,Bronx,10452.0,2025250025.0,2129641.0,BX-04,16.0,189.0,BX0402,40.834151,-73.928701,40.834335,-73.928907,2024-12-05,New Construction,No,Non Prevailing Wage,,,,,45.0,,11.0,11.0,23.0,,,,,,45.0,,45.0,45,2024.0
74678,80-12 JAMAICA AVENUE APARTMENT,8/17/2023,6/11/2024,668645.0,80-12,JAMAICA AVENUE,Queens,11421.0,4089190002.0,4183700.0,QN-09,32.0,10.0,QN0905,40.692201,-73.861709,40.691962,-73.86185,2024-06-11,New Construction,No,Non Prevailing Wage,,,,,3.0,,,,3.0,,,,,,3.0,,3.0,10,2024.0
74584,1946 OCEAN AVE APARTMENTS,8/16/2023,3/26/2025,993101.0,1946,OCEAN AVENUE,Brooklyn,11230.0,3067570038.0,3181613.0,BK-14,48.0,546.0,BK1403,40.614586,-73.9543,40.614436,-73.954671,2025-03-26,New Construction,No,Non Prevailing Wage,,,,,15.0,,,2.0,13.0,,,,,,15.0,,15.0,47,2025.0
74585,69 ADAMS ST APARTMENTS,8/16/2023,6/13/2025,182583.0,61,ADAMS STREET,Brooklyn,11201.0,3000520004.0,3000000.0,BK-02,33.0,21.0,BK0202,40.702354,-73.988538,40.702104,-73.988333,2025-06-13,New Construction,No,Non Prevailing Wage,,,,,70.0,,18.0,23.0,29.0,,,,,,70.0,,70.0,231,2025.0
74586,138-25 BARCLAY AVE APARTMENTS,8/16/2023,11/26/2024,630358.0,138-25,BARCLAY AVENUE,Queens,11355.0,4050440074.0,4000000.0,QN-07,20.0,853.0,QN0707,40.758262,-73.827147,40.758427,-73.827579,2024-11-26,New Construction,No,Non Prevailing Wage,,,,,15.0,,1.0,6.0,8.0,,,,,,15.0,,15.0,48,2024.0
74587,26-25 4TH ST APARTMENTS,8/16/2023,5/22/2024,399272.0,26-25,4 STREET,Queens,11102.0,4009090009.0,4620901.0,QN-01,22.0,87.0,QN0102,40.775691,-73.932855,40.775191,-73.932209,2024-05-22,New Construction,No,Non Prevailing Wage,,,,,50.0,,9.0,22.0,19.0,,,,,,50.0,,50.0,165,2024.0
74588,2976 3RD AVE APARTMENTS,8/16/2023,5/7/2025,63939.0,481,EAST 153 STREET,Bronx,10455.0,2023630012.0,2000000.0,BX-01,17.0,71.0,BX0102,40.818464,-73.914342,40.818543,-73.914071,2025-05-07,New Construction,No,Non Prevailing Wage,,,,,21.0,,7.0,10.0,4.0,,,,,,21.0,,21.0,69,2025.0
74680,35 KINGSTON AVE,8/16/2023,4/5/2024,1004331.0,35,KINGSTON AVENUE,Brooklyn,11213.0,3018710006.0,3427357.0,BK-03,36.0,271.0,BK0302,40.678638,-73.941309,40.678682,-73.940945,2024-04-05,New Construction,No,Non Prevailing Wage,,,,,7.0,,,7.0,,,,,,,7.0,,7.0,21,2024.0
74681,45 LENOX ROAD APARTMENTS,8/16/2023,11/26/2024,324161.0,45,LENOX ROAD,Brooklyn,11226.0,3050640097.0,3116214.0,BK-14,40.0,79602.0,BK1401,40.653676,-73.957928,40.65403,-73.958007,2024-11-26,New Construction,No,Non Prevailing Wage,,,,,14.0,,1.0,10.0,3.0,,,,,,14.0,,14.0,46,2024.0
74589,3333 GILES PLACE,8/15/2023,4/11/2024,1009803.0,3333,GILES PLACE,Bronx,10463.0,2032580005.0,2015801.0,BX-08,11.0,279.0,BX0801,40.879309,-73.89832,40.879584,-73.898508,2024-04-11,New Construction,No,Non Prevailing Wage,,,,,15.0,,,12.0,3.0,,,,,,15.0,,15.0,49,2024.0
74590,81-07 KEW GARDENS ROAD,8/14/2023,12/18/2024,1010410.0,81-07,KEW GARDENS ROAD,Queens,11415.0,4033580062.0,4000000.0,QN-09,29.0,21601.0,QN0901,40.712925,-73.829706,40.713012,-73.829421,2024-12-18,New Construction,No,Non Prevailing Wage,,,,,16.0,,,11.0,5.0,,,,,,16.0,,16.0,51,2024.0
74950,2361 MORRIS AVE,8/8/2023,4/10/2024,1009736.0,2361,MORRIS AVENUE,Bronx,10468.0,2031830043.0,2000000.0,BX-05,14.0,239.0,BX0503,40.859832,-73.900884,40.859874,-73.901163,2024-04-10,New Construction,No,Non Prevailing Wage,,,,,44.0,,18.0,26.0,,,,,,,44.0,,44.0,45,2024.0
74591,3525 BRUCKNER BOULEVARD,8/7/2023,7/24/2024,53111.0,3525,BRUCKNER BOULEVARD,Bronx,10461.0,2041780021.0,2130895.0,BX-10,13.0,26602.0,BX1003,40.847408,-73.827222,40.847463,-73.827573,2024-07-24,New Construction,No,Non Prevailing Wage,,,,,3.0,,1.0,2.0,,,,,,,3.0,,3.0,10,2024.0
74951,2460 WHITE PLAINS ROAD,8/7/2023,6/6/2024,1009737.0,2460,WHITE PLAINS ROAD,Bronx,10467.0,2044300024.0,2000000.0,BX-11,13.0,330.0,BX1104,40.862428,-73.867439,40.862979,-73.866961,2024-06-06,New Construction,No,Non Prevailing Wage,,,,,31.0,,6.0,23.0,2.0,,,,,,31.0,,31.0,32,2024.0
74594,681 DUMONT AVENUE,8/4/2023,7/3/2024,1010349.0,681,DUMONT AVENUE,Brooklyn,11207.0,3037890054.0,3401198.0,BK-05,42.0,1156.0,BK0502,40.666423,-73.893652,40.666505,-73.893768,2024-07-03,New Construction,No,Non Prevailing Wage,,,,,2.0,,,,2.0,,,,,,2.0,,2.0,6,2024.0
74953,55 DASH PLACE,8/2/2023,6/20/2024,1010097.0,55,DASH PLACE,Bronx,10463.0,2057787501.0,2130635.0,BX-08,11.0,335.0,BX0803,40.889557,-73.903896,40.88948,-73.903589,2024-06-20,New Construction,No,Non Prevailing Wage,,,,,9.0,,,7.0,2.0,,,,,,9.0,,9.0,29,2024.0
74643,599 PROSPECT AVE,8/1/2023,11/9/2023,950443.0,599,PROSPECT AVENUE,Bronx,10455.0,2026740040.0,2000000.0,BX-01,8.0,79.0,BX0102,40.813649,-73.903991,40.813858,-73.904262,2023-11-09,New Construction,No,Non Prevailing Wage,,,,,11.0,,8.0,3.0,,,,,,,11.0,,11.0,12,2023.0
74644,1541 NEW YORK AVENUE,7/31/2023,4/16/2025,343561.0,1541,NEW YORK AVENUE,Brooklyn,11210.0,3050080021.0,3114069.0,BK-17,45.0,784.0,BK1702,40.635204,-73.944979,40.635193,-73.944662,2025-04-16,New Construction,No,Non Prevailing Wage,,,,,3.0,,,,3.0,,,,,,3.0,,3.0,10,2025.0
74931,2136-2138 BEDFORD AVE,7/31/2023,5/15/2024,1009535.0,2136,BEDFORD AVENUE,Brooklyn,11226.0,,,BK-14,40.0,79602.0,BK1401,40.652084,-73.955997,,,2024-05-15,New Construction,No,Non Prevailing Wage,,,,,5.0,,,,5.0,,,,,,5.0,,5.0,7,2024.0
74645,1315 FINDLAY AVENUE,7/26/2023,2/16/2024,78328.0,1315,FINDLAY AVENUE,Bronx,10456.0,2027830070.0,2007211.0,BX-04,16.0,17702.0,BX0403,40.835459,-73.910779,40.835495,-73.911057,2024-02-16,New Construction,No,Non Prevailing Wage,,,,,18.0,,14.0,4.0,,,,,,,18.0,,18.0,19,2024.0
74646,950 & 954 ROGERS PLACE,7/26/2023,12/7/2023,994365.0,950,ROGERS PLACE,Bronx,10459.0,2026990011.0,2005375.0,BX-02,17.0,12901.0,BX0202,40.822479,-73.897833,40.822542,-73.897587,2023-12-07,New Construction,No,Non Prevailing Wage,,,,,5.0,,3.0,2.0,,,,,,,5.0,,5.0,11,2023.0
74646,950 & 954 ROGERS PLACE,7/26/2023,12/7/2023,994401.0,954,ROGERS PLACE,Bronx,10459.0,2026990012.0,2005376.0,BX-02,17.0,12901.0,BX0202,40.822592,-73.897829,40.822611,-73.897587,2023-12-07,New Construction,No,Non Prevailing Wage,,,,,4.0,,2.0,2.0,,,,,,,4.0,,4.0,11,2023.0
72716,92 TOMPKINS AVENUE,7/25/2023,9/13/2024,1010022.0,88,TOMPKINS AVENUE,Brooklyn,11206.0,3017470030.0,3048525.0,BK-03,36.0,257.0,BK0301,40.696419,-73.946494,40.696186,-73.946757,2024-09-13,New Construction,No,Non Prevailing Wage,,,13.0,,4.0,,,6.0,11.0,,,,,,17.0,,17.0,55,2024.0
74647,5 WITHERS STREET APARTMENT,7/25/2023,6/20/2024,1009474.0,5,WITHERS STREET,Brooklyn,11211.0,3023070022.0,3429469.0,BK-01,33.0,519.0,BK0102,40.716615,-73.952466,40.716785,-73.952574,2024-06-20,New Construction,No,Non Prevailing Wage,,,,,7.0,,,5.0,2.0,,,,,,7.0,,7.0,23,2024.0
74649,521 WEST 134TH STREET APARTMENTS,7/24/2023,3/15/2024,1009820.0,521,WEST 134 STREET,Manhattan,10031.0,1019880014.0,1000000.0,MN-09,7.0,22301.0,MN0902,40.818857,-73.954181,40.819085,-73.954156,2024-03-15,New Construction,No,Non Prevailing Wage,,,,,9.0,,,8.0,1.0,,,,,,9.0,,9.0,28,2024.0
74653,3408 GLENWOOD ROAD,7/19/2023,11/9/2023,1009566.0,3408,GLENWOOD ROAD,Brooklyn,11210.0,3075620041.0,3427371.0,BK-17,45.0,784.0,BK1702,40.63424,-73.943719,40.634001,-73.943564,2023-11-09,New Construction,No,Non Prevailing Wage,,,,,19.0,,4.0,5.0,5.0,5.0,,,,,19.0,,19.0,19,2023.0
74551,1441 TELLER APARTMENTS,7/18/2023,10/25/2024,112859.0,1441,TELLER AVENUE,Bronx,10456.0,2027840017.0,2007238.0,BX-04,16.0,225.0,BX0403,40.838098,-73.908983,40.838334,-73.909189,2024-10-25,New Construction,No,Non Prevailing Wage,,,,,15.0,,5.0,4.0,6.0,,,,,,15.0,,15.0,16,2024.0
74654,285 EAST 163 STREET,7/18/2023,11/26/2024,64576.0,285,EAST 163 STREET,Bronx,10451.0,2024230048.0,2129676.0,BX-04,16.0,173.0,BX0401,40.827048,-73.916857,40.827202,-73.916669,2024-11-26,New Construction,No,Non Prevailing Wage,,,,,11.0,,,7.0,4.0,,,,,,11.0,,11.0,36,2024.0
74655,872 EAST 164 STREET,7/18/2023,6/26/2024,890767.0,872,EAST 164 STREET,Bronx,10459.0,2026900144.0,2129642.0,BX-02,17.0,12901.0,BX0202,40.823274,-73.899179,40.823071,-73.899089,2024-06-26,New Construction,No,Non Prevailing Wage,,,,,17.0,,8.0,6.0,,3.0,,,,,17.0,,17.0,18,2024.0
74597,75 MCGUINNESS BOULEVARD,7/17/2023,9/22/2023,1009886.0,75,MCGUINNESS BOULEVARD,Brooklyn,11222.0,3026490024.0,3000000.0,BK-01,33.0,571.0,BK0101,40.725212,-73.948509,40.724993,-73.948762,2023-09-22,New Construction,No,Non Prevailing Wage,,,,,7.0,,,4.0,3.0,,,,,,7.0,,7.0,21,2023.0
74598,2973 OCEAN PARKWAY,7/14/2023,2/12/2025,348518.0,2973,OCEAN PARKWAY,Brooklyn,11235.0,3086610068.0,3244263.0,BK-13,48.0,364.0,BK1303,40.578634,-73.967986,40.578711,-73.96741,2025-02-12,New Construction,No,Non Prevailing Wage,,,,,3.0,,,2.0,1.0,,,,,,3.0,,3.0,8,2025.0
74599,1595 & 1597 NEW YORK AVENUE APARTMENTS,7/13/2023,10/4/2023,1009488.0,1595,NEW YORK AVENUE,Brooklyn,11210.0,3075610038.0,3428839.0,BK-17,45.0,784.0,BK1702,40.633579,-73.944804,40.633763,-73.944527,2023-10-04,New Construction,No,Non Prevailing Wage,,,,,3.0,,1.0,2.0,,,,,,,3.0,,3.0,9,2023.0
74599,1595 & 1597 NEW YORK AVENUE APARTMENTS,7/13/2023,10/4/2023,1009489.0,1597,NEW YORK AVENUE,Brooklyn,11210.0,3075610037.0,3428759.0,BK-03,45.0,784.0,BK1702,40.633543,-73.944801,40.633711,-73.944523,2023-10-04,New Construction,No,Non Prevailing Wage,,,,,3.0,,1.0,2.0,,,,,,,3.0,,3.0,9,2023.0
74600,1073 TIFFANY STREET,7/12/2023,11/27/2024,114961.0,1073,TIFFANY STREET,Bronx,10459.0,2027160048.0,2130636.0,BX-02,17.0,131.0,BX0202,40.825197,-73.894862,40.825452,-73.895176,2024-11-27,New Construction,No,Non Prevailing Wage,,,,,13.0,,13.0,,,,,,,,13.0,,13.0,14,2024.0
74601,VISTA 65 APARTMENTS AKA 98-08 QUEENS BLVD,7/12/2023,8/28/2024,690151.0,98-04,QUEENS BOULEVARD,Queens,11374.0,4030860007.0,4619386.0,QN-06,29.0,71306.0,QN0602,40.728509,-73.857946,40.727922,-73.857579,2024-08-28,New Construction,No,Non Prevailing Wage,,,,,56.0,,16.0,31.0,9.0,,,,,,56.0,,56.0,186,2024.0
74602,21 MT HOPE PLACE,7/12/2023,12/22/2023,1009435.0,21,MT HOPE PLACE,Bronx,10453.0,2028520036.0,2129694.0,BX-05,14.0,23301.0,BX0502,40.849276,-73.910381,40.849503,-73.910319,2023-12-22,New Construction,No,Non Prevailing Wage,,,,,54.0,,22.0,16.0,16.0,,,,,,54.0,,54.0,55,2023.0
74603,1694 ST. MARKS AVENUE APARTMENTS,7/12/2023,9/26/2023,1009437.0,1694,ST MARKS AVENUE,Brooklyn,11233.0,3014610014.0,3039270.0,BK-16,41.0,363.0,BK1601,40.673019,-73.910452,40.672838,-73.910643,2023-09-26,New Construction,No,Non Prevailing Wage,,,,,7.0,,,,6.0,1.0,,,,,7.0,,7.0,7,2023.0
74604,27-23 27 STREET,7/11/2023,8/1/2024,413442.0,27-23,27 STREET,Queens,11102.0,4005750037.0,4006900.0,QN-01,22.0,71.0,QN0103,40.769353,-73.923344,40.769122,-73.923168,2024-08-01,New Construction,No,Non Prevailing Wage,,,,,3.0,,1.0,2.0,,,,,,,3.0,,3.0,8,2024.0
74607,1699 TOPPING AVE,7/10/2023,9/12/2024,1009287.0,1699,TOPPING AVENUE,Bronx,10457.0,2027910050.0,2129687.0,BX-04,15.0,22902.0,BX0403,40.844106,-73.905827,40.844159,-73.906087,2024-09-12,New Construction,No,Non Prevailing Wage,,,,,7.0,,,7.0,,,,,,,7.0,,7.0,23,2024.0
74609,61-13 UTOPIA PARKWAY,7/10/2023,9/26/2024,701201.0,61-13,UTOPIA PARKWAY,Queens,11365.0,4070700047.0,4000000.0,QN-08,24.0,1341.0,QN0803,40.73866,-73.792942,40.73842,-73.792376,2024-09-26,New Construction,No,Non Prevailing Wage,,,,,3.0,,,1.0,2.0,,,,,,3.0,,3.0,7,2024.0
74610,2264 ATLANTIC AVENUE,7/10/2023,8/21/2024,185936.0,2264,ATLANTIC AVENUE,Brooklyn,11233.0,3014350010.0,3428754.0,BK-16,37.0,36501.0,BK1601,40.676307,-73.910444,40.676014,-73.910354,2024-08-21,New Construction,No,Non Prevailing Wage,,,,,3.0,,,1.0,2.0,,,,,,3.0,,3.0,10,2024.0
74611,3408 & 3410 FARRAGUT ROAD APARTMENTS,7/10/2023,9/26/2023,1009533.0,3410,FARRAGUT ROAD,Brooklyn,11210.0,3050090040.0,3429007.0,BK-17,45.0,784.0,BK1702,40.636513,-73.943944,40.636277,-73.943764,2023-09-26,New Construction,No,Non Prevailing Wage,,,,,3.0,,1.0,2.0,,,,,,,3.0,,3.0,9,2023.0
74612,2882 86TH STREET APARTMENT,7/6/2023,5/7/2024,991001.0,2882,86 STREET,Brooklyn,11223.0,3071670128.0,3429074.0,BK-13,47.0,386.0,BK1501,40.591331,-73.976319,40.591059,-73.976405,2024-05-07,New Construction,No,Non Prevailing Wage,,,,,2.0,,,,2.0,,,,,,2.0,,2.0,6,2024.0
73165,PARADISE MANAGEMENT CLUSTER 1.HPO.FY23,7/5/2023,6/21/2024,41884.0,135,WEST 145 STREET,Manhattan,10039.0,1020140018.0,1060185.0,MN-10,9.0,232.0,MN1002,40.820899,-73.937304,40.821226,-73.937375,2024-06-21,Preservation,Yes,Non Prevailing Wage,,5.0,12.0,13.0,,1.0,1.0,12.0,17.0,1.0,,,,,31.0,,31.0,31,2024.0
73165,PARADISE MANAGEMENT CLUSTER 1.HPO.FY23,7/5/2023,6/21/2024,41885.0,139,WEST 145 STREET,Manhattan,10039.0,1020140016.0,1060184.0,MN-10,9.0,232.0,MN1002,40.820932,-73.937383,40.821284,-73.937516,2024-06-21,Preservation,Yes,Non Prevailing Wage,1.0,4.0,9.0,17.0,,,1.0,12.0,17.0,1.0,,,,,31.0,,31.0,31,2024.0
73165,PARADISE MANAGEMENT CLUSTER 1.HPO.FY23,7/5/2023,6/21/2024,41887.0,143,WEST 145 STREET,Manhattan,10039.0,1020140014.0,1060183.0,MN-10,9.0,232.0,MN1002,40.820968,-73.937462,40.821344,-73.937654,2024-06-21,Preservation,Yes,Non Prevailing Wage,1.0,3.0,8.0,19.0,,,1.0,12.0,18.0,,,,,,31.0,,31.0,31,2024.0
73166,PARADISE MANAGEMENT CLUSTER 2.HPO.FY23,7/5/2023,,40785.0,609,WEST 135 STREET,Manhattan,10031.0,1020020026.0,1059957.0,MN-09,7.0,22301.0,MN0902,40.820362,-73.955672,40.82062,-73.955607,2024-06-05,Preservation,Yes,Non Prevailing Wage,,7.0,4.0,10.0,,,,7.0,9.0,5.0,,,,,21.0,,21.0,21,2024.0
73166,PARADISE MANAGEMENT CLUSTER 2.HPO.FY23,7/5/2023,,40787.0,615,WEST 135 STREET,Manhattan,10031.0,1020020022.0,1059955.0,MN-09,7.0,22301.0,MN0902,40.820403,-73.95577,40.820729,-73.95586,2024-06-05,Preservation,Yes,Non Prevailing Wage,,8.0,5.0,8.0,,,,7.0,10.0,4.0,,,,,21.0,,21.0,21,2024.0
73166,PARADISE MANAGEMENT CLUSTER 2.HPO.FY23,7/5/2023,,40788.0,617,WEST 135 STREET,Manhattan,10031.0,1020020021.0,1059954.0,MN-09,7.0,22301.0,MN0902,40.820419,-73.955806,40.820784,-73.955986,2024-06-05,Preservation,Yes,Non Prevailing Wage,1.0,7.0,3.0,9.0,,1.0,,7.0,7.0,7.0,,,,,21.0,,21.0,21,2024.0
73166,PARADISE MANAGEMENT CLUSTER 2.HPO.FY23,7/5/2023,,40790.0,619,WEST 135 STREET,Manhattan,10031.0,1020020019.0,1059953.0,MN-09,7.0,22301.0,MN0902,40.820433,-73.955839,40.820837,-73.956113,2024-06-05,Preservation,Yes,Non Prevailing Wage,1.0,7.0,3.0,10.0,,,,7.0,7.0,7.0,,,,,21.0,,21.0,21,2024.0
73167,PARADISE MANAGEMENT CLUSTER 3.HPO.FY23,7/5/2023,6/5/2024,46674.0,2706,BAINBRIDGE AVENUE,Bronx,10458.0,2032870043.0,2016624.0,BX-07,15.0,40502.0,BX0702,40.865897,-73.891052,40.865771,-73.890738,2024-06-05,Preservation,Yes,Non Prevailing Wage,,18.0,37.0,,,1.0,,34.0,14.0,8.0,,,,,56.0,,56.0,56,2024.0
73167,PARADISE MANAGEMENT CLUSTER 3.HPO.FY23,7/5/2023,6/5/2024,92616.0,2356,LORILLARD PLACE,Bronx,10458.0,2030540006.0,2011652.0,BX-06,15.0,387.0,BX0603,40.855447,-73.890068,40.855293,-73.889851,2024-06-05,Preservation,Yes,Non Prevailing Wage,1.0,7.0,23.0,,,,,20.0,11.0,,,,,,31.0,,31.0,31,2024.0
73497,PARADISE MANAGEMENT CLUSTER 16.HPO.FY23,7/5/2023,6/5/2024,110162.0,540,SOUTHERN BOULEVARD,Bronx,10455.0,2026037501.0,2004121.0,BX-02,17.0,83.0,BX0202,40.812269,-73.903643,40.812038,-73.903499,2024-06-05,Preservation,Yes,Non Prevailing Wage,5.0,8.0,37.0,14.0,,1.0,,45.0,20.0,,,,,,65.0,,65.0,65,2024.0
74613,2150 CLINTON AVENUE,7/5/2023,12/6/2024,57132.0,2150,CLINTON AVENUE,Bronx,10457.0,2030970012.0,2129653.0,BX-06,15.0,371.0,BX0602,40.849106,-73.886507,40.848922,-73.886244,2024-12-06,New Construction,No,Non Prevailing Wage,,,,,35.0,,15.0,1.0,19.0,,,,,,35.0,,35.0,36,2024.0
74614,128 WEST 167TH STREET,7/5/2023,9/26/2024,1005071.0,128,WEST 167 STREET,Bronx,10452.0,2025140061.0,2000000.0,BX-04,16.0,199.0,BX0402,40.836752,-73.926545,40.836532,-73.926552,2024-09-26,New Construction,No,Non Prevailing Wage,,,,,32.0,,10.0,17.0,5.0,,,,,,32.0,,32.0,33,2024.0
74615,2136 HONEYWELL AVENUE,7/5/2023,10/26/2023,1009388.0,2136,HONEYWELL AVENUE,Bronx,10460.0,2031250026.0,2129644.0,BX-06,15.0,363.0,BX0601,40.845964,-73.881583,40.845923,-73.881351,2023-10-26,New Construction,No,Non Prevailing Wage,,,,,101.0,,19.0,17.0,64.0,1.0,,,,,101.0,,101.0,101,2023.0
74616,1546 AND 1548 JESUP AVENUE APARTMENTS,7/4/2023,9/18/2024,1009545.0,1550,JESUP AVENUE,Bronx,10452.0,2028720273.0,2130659.0,BX-05,16.0,21302.0,BX0403,40.844613,-73.918447,40.844643,-73.918115,2024-09-18,New Construction,No,Non Prevailing Wage,,,,,15.0,,2.0,13.0,,,,,,,15.0,,15.0,16,2024.0
73371,WEST 148TH STREET HEIGHLINER PORTFOLIO.HPO.FY23,6/30/2023,6/30/2023,868558.0,201,WEST 148 STREET,Manhattan,10039.0,1020340029.0,1087428.0,MN-10,9.0,234.0,MN1002,40.823779,-73.938157,40.823864,-73.937962,2023-06-30,Preservation,Yes,Non Prevailing Wage,,6.0,19.0,,,,7.0,1.0,17.0,,,,,,25.0,,25.0,25,2023.0
73526,MCKINLEY SQUARE PHASE 1 HDFC.HPO.FY23,6/30/2023,6/30/2023,50384.0,1222,BOSTON ROAD,Bronx,10456.0,2026630007.0,2004743.0,BX-03,17.0,151.0,BX0301,40.829992,-73.901763,40.82992,-73.901117,2023-06-30,Preservation,Yes,Non Prevailing Wage,,13.0,7.0,,,,,,12.0,8.0,,,,,20.0,,20.0,20,2023.0
73526,MCKINLEY SQUARE PHASE 1 HDFC.HPO.FY23,6/30/2023,6/30/2023,50386.0,1226,BOSTON ROAD,Bronx,10456.0,2026630009.0,2004744.0,BX-03,17.0,151.0,BX0301,40.83005,-73.901698,40.830033,-73.901033,2023-06-30,Preservation,Yes,Non Prevailing Wage,,12.0,8.0,,,1.0,,,13.0,8.0,,,,,21.0,,21.0,21,2023.0
73526,MCKINLEY SQUARE PHASE 1 HDFC.HPO.FY23,6/30/2023,6/30/2023,50390.0,1234,BOSTON ROAD,Bronx,10456.0,2026630013.0,2004746.0,BX-03,17.0,151.0,BX0301,40.830165,-73.901564,40.830255,-73.90086,2023-06-30,Preservation,Yes,Non Prevailing Wage,,15.0,5.0,,,,,,12.0,8.0,,,,,20.0,,20.0,20,2023.0
73526,MCKINLEY SQUARE PHASE 1 HDFC.HPO.FY23,6/30/2023,6/30/2023,50391.0,1239,BOSTON ROAD,Bronx,10456.0,2026150050.0,2004308.0,BX-03,17.0,149.0,BX0301,40.830149,-73.901611,40.830484,-73.901813,2023-06-30,Preservation,Yes,Non Prevailing Wage,,14.0,6.0,,,1.0,,12.0,9.0,,,,,,21.0,,21.0,21,2023.0
73526,MCKINLEY SQUARE PHASE 1 HDFC.HPO.FY23,6/30/2023,6/30/2023,50392.0,1245,BOSTON ROAD,Bronx,10456.0,2026150048.0,2004307.0,BX-03,17.0,149.0,BX0301,40.830204,-73.90155,40.830561,-73.901723,2023-06-30,Preservation,Yes,Non Prevailing Wage,,11.0,3.0,,,,3.0,6.0,4.0,1.0,,,,,14.0,,14.0,14,2023.0
73526,MCKINLEY SQUARE PHASE 1 HDFC.HPO.FY23,6/30/2023,6/30/2023,115184.0,1181,TINTON AVENUE,Bronx,10456.0,2026620023.0,2004718.0,BX-03,17.0,135.0,BX0301,40.828474,-73.900721,40.828762,-73.900959,2023-06-30,Preservation,Yes,Non Prevailing Wage,,11.0,9.0,,,1.0,,3.0,14.0,4.0,,,,,21.0,,21.0,21,2023.0
73527,MCKINLEY SQUARE PHASE 2 HDFC.HPO.FY23,6/30/2023,6/30/2023,50387.0,1227,BOSTON ROAD,Bronx,10456.0,2026150053.0,2004310.0,BX-03,17.0,149.0,BX0301,40.830039,-73.901738,40.8303,-73.902027,2023-06-30,Preservation,Yes,Non Prevailing Wage,,16.0,9.0,,,,,6.0,15.0,4.0,,,,,25.0,,25.0,25,2023.0
73527,MCKINLEY SQUARE PHASE 2 HDFC.HPO.FY23,6/30/2023,6/30/2023,65203.0,750,EAST 169 STREET,Bronx,10456.0,2026630031.0,2004753.0,BX-03,17.0,151.0,BX0301,40.831133,-73.900183,40.830894,-73.900118,2023-06-30,Preservation,Yes,Non Prevailing Wage,,11.0,3.0,,,,,1.0,9.0,4.0,,,,,14.0,,14.0,14,2023.0
68258,TBX1003-SANDRA ERICKSON REAL ESTATE,6/29/2023,6/17/2025,55756.0,1033,CAULDWELL AVENUE,Bronx,10456.0,2026220052.0,2004405.0,BX-03,17.0,18502.0,BX0301,40.826021,-73.905744,40.826,-73.905968,2024-12-18,Preservation,No,Non Prevailing Wage,,19.0,5.0,,,,,8.0,16.0,,,,,,24.0,,24.0,24,2024.0
68258,TBX1003-SANDRA ERICKSON REAL ESTATE,6/29/2023,6/17/2025,82034.0,1113,GRANT AVENUE,Bronx,10456.0,2024520029.0,2002660.0,BX-04,16.0,18101.0,BX0401,40.831437,-73.916252,40.83119,-73.916697,2025-05-20,Preservation,No,Non Prevailing Wage,,31.0,36.0,,,1.0,,45.0,17.0,6.0,,,,,68.0,,68.0,68,2025.0
68258,TBX1003-SANDRA ERICKSON REAL ESTATE,6/29/2023,6/17/2025,119687.0,1211,WASHINGTON AVENUE,Bronx,10456.0,2023890031.0,2001603.0,BX-03,16.0,145.0,BX0302,40.831084,-73.90702,40.83126,-73.907326,2025-06-17,Preservation,No,Non Prevailing Wage,,1.0,7.0,,,1.0,,,9.0,,,,,,9.0,,9.0,9,2025.0
73350,QUEENSWOOD.YR15.FY23,6/29/2023,6/29/2023,810777.0,54-39,100 STREET,Queens,11368.0,4019370001.0,4047631.0,QN-04,21.0,44301.0,QN0402,40.73973,-73.860033,40.739482,-73.859139,2023-06-29,Preservation,Yes,Non Prevailing Wage,38.0,8.0,141.0,109.0,,,40.0,139.0,102.0,15.0,,,,,296.0,,296.0,296,2023.0
73525,2460 DAVIDSON REALTY HDFC.HPO.FY23,6/29/2023,6/29/2023,60528.0,2450,DAVIDSON AVENUE,Bronx,10468.0,2032000001.0,2014355.0,BX-07,14.0,265.0,BX0701,40.862935,-73.902116,40.863115,-73.901696,2023-06-29,Preservation,Yes,Non Prevailing Wage,,11.0,47.0,,,1.0,,29.0,21.0,9.0,,,,,59.0,,59.0,59,2023.0
66045,RISLEY DENT TOWERS.HUDMF.FY23,6/28/2023,6/28/2023,297545.0,1593,FULTON STREET,Brooklyn,11213.0,3016840001.0,3047699.0,BK-03,36.0,273.0,BK0302,40.679718,-73.937018,40.680258,-73.936477,2023-06-28,Preservation,Yes,Non Prevailing Wage,159.0,40.0,42.0,6.0,,1.0,12.0,50.0,166.0,20.0,,,,,248.0,,248.0,248,2023.0
70450,2017 GRAND CONCOURSE,6/28/2023,4/24/2025,1002864.0,2017,GRAND CONCOURSE,Bronx,10453.0,2028080090.0,2000000.0,BX-05,14.0,23501.0,BX0502,40.851716,-73.904197,40.851867,-73.904655,2025-04-24,New Construction,No,Non Prevailing Wage,9.0,16.0,8.0,,,1.0,9.0,16.0,9.0,,,,,,34.0,,34.0,34,2025.0
73524,1020 ASSOCIATES HDFC.HPO.FY23 (1988 NEWBOLD),6/28/2023,6/28/2023,99517.0,1988,NEWBOLD AVENUE,Bronx,10472.0,2037940034.0,2025917.0,BX-09,18.0,72.0,BX0903,40.832358,-73.858906,40.832138,-73.858625,2023-06-28,Preservation,Yes,Non Prevailing Wage,,8.0,43.0,,,1.0,,45.0,7.0,,,,,,52.0,,52.0,52,2023.0
74218,40 BRUCKNER BOULEVARD,6/28/2023,7/12/2024,1000143.0,42,BRUCKNER BOULEVARD,Bronx,10454.0,2022950051.0,2129670.0,BX-01,8.0,1901.0,BX0101,40.806656,-73.927073,40.806294,-73.927228,2024-07-12,New Construction,No,Non Prevailing Wage,,,,,110.0,,16.0,54.0,40.0,,,,,,110.0,,110.0,365,2024.0
74219,1258 SHAKESPEARE AVENUE,6/28/2023,11/7/2024,1005067.0,1258,SHAKESPEARE AVENUE,Bronx,10452.0,2025060082.0,2130883.0,BX-04,16.0,211.0,BX0402,40.83877,-73.922903,40.838693,-73.922607,2024-11-07,New Construction,No,Non Prevailing Wage,,,,,89.0,,44.0,45.0,,,,,,,89.0,,89.0,90,2024.0
73523,1500 HONE HDFC.HPO.FY23,6/27/2023,6/27/2023,86654.0,1500,HONE AVENUE,Bronx,10461.0,2040680001.0,2044027.0,BX-11,13.0,256.0,BX1102,40.84292,-73.850911,40.843082,-73.850701,2023-06-27,Preservation,Yes,Non Prevailing Wage,,8.0,40.0,,,1.0,5.0,40.0,4.0,,,,,,49.0,,49.0,49,2023.0
73421,EAST NEW YORK - EMERALD GREEN  YR15.FY23,6/26/2023,6/26/2023,817281.0,1426,LORING AVENUE,Brooklyn,11208.0,3045170001.0,3347342.0,BK-05,42.0,1220.0,BK0505,40.668279,-73.858835,40.667802,-73.859067,2023-06-26,Preservation,Yes,Non Prevailing Wage,7.0,83.0,9.0,,,1.0,20.0,20.0,60.0,,,,,,100.0,,100.0,100,2023.0
74093,EAST NEW YORK - EMERALD GREEN PHASE II YR15.FY23,6/26/2023,6/26/2023,997079.0,646,EMERALD STREET,Brooklyn,11208.0,3045170003.0,3387751.0,BK-05,42.0,1220.0,BK0505,40.667019,-73.858383,40.667099,-73.858855,2023-06-26,Preservation,Yes,Non Prevailing Wage,,75.0,7.0,,,1.0,16.0,14.0,47.0,6.0,,,,,83.0,,83.0,83,2023.0
74094,EAST NEW YORK - GRANT FORBELL  YR15.FY23,6/26/2023,6/26/2023,827402.0,922,FORBELL STREET,Brooklyn,11208.0,3045710050.0,3350235.0,BK-05,42.0,1220.0,BK0505,40.661976,-73.859987,40.661963,-73.860427,2023-06-26,Preservation,Yes,Non Prevailing Wage,,52.0,2.0,,,,6.0,18.0,30.0,,,,,,54.0,,54.0,54,2023.0
74094,EAST NEW YORK - GRANT FORBELL  YR15.FY23,6/26/2023,6/26/2023,837064.0,1101,ELDERT LANE,Brooklyn,11208.0,3045710001.0,3350152.0,BK-05,42.0,1220.0,BK0505,40.662559,-73.861085,40.662693,-73.860678,2023-06-26,Preservation,Yes,Non Prevailing Wage,1.0,45.0,1.0,,,1.0,6.0,18.0,24.0,,,,,,48.0,,48.0,48,2023.0
74095,EAST NEW YORK - RUBY DUMONT YR15.FY23,6/26/2023,6/26/2023,819825.0,458,RUBY STREET,Brooklyn,11208.0,3044710109.0,3389792.0,BK-05,42.0,120803.0,BK0505,40.670998,-73.860332,40.670716,-73.860538,2023-06-26,Preservation,Yes,Non Prevailing Wage,,16.0,1.0,,,1.0,,,18.0,,,,,,18.0,,18.0,18,2023.0
74095,EAST NEW YORK - RUBY DUMONT YR15.FY23,6/26/2023,6/26/2023,819826.0,472,RUBY STREET,Brooklyn,11208.0,3044710109.0,3389791.0,BK-05,42.0,120803.0,BK0505,40.670532,-73.860218,40.670716,-73.860538,2023-06-26,Preservation,Yes,Non Prevailing Wage,,16.0,2.0,,,,,,18.0,,,,,,18.0,,18.0,18,2023.0
74096,EAST NEW YORK - THE WYONA  YR15.FY23,6/26/2023,6/26/2023,815839.0,549,VERMONT STREET,Brooklyn,11207.0,3038080010.0,3347583.0,BK-05,42.0,1126.0,BK0503,40.665864,-73.89233,40.665859,-73.892042,2023-06-26,Preservation,Yes,Non Prevailing Wage,,19.0,1.0,,,,,,20.0,,,,,,20.0,,20.0,20,2023.0
74096,EAST NEW YORK - THE WYONA  YR15.FY23,6/26/2023,6/26/2023,877599.0,510,WYONA STREET,Brooklyn,11207.0,3038080036.0,3348360.0,BK-05,42.0,1126.0,BK0503,40.666039,-73.891447,40.665908,-73.891696,2023-06-26,Preservation,Yes,Non Prevailing Wage,4.0,16.0,,,,,,,20.0,,,,,,20.0,,20.0,20,2023.0
74220,1296 AND 1298 NEW YORK AVE,6/26/2023,9/13/2023,1009334.0,1298,NEW YORK AVENUE,Brooklyn,11203.0,3049490042.0,3428709.0,BK-17,45.0,830.0,BK1702,40.641545,-73.94568,40.64138,-73.945972,2023-09-13,New Construction,No,Non Prevailing Wage,,,,,3.0,,1.0,2.0,,,,,,,3.0,,3.0,9,2023.0
74220,1296 AND 1298 NEW YORK AVE,6/26/2023,9/13/2023,1009335.0,1296,NEW YORK AVENUE,Brooklyn,11203.0,3049490041.0,3428918.0,BK-17,45.0,830.0,BK1702,40.64158,-73.945684,40.641432,-73.945976,2023-09-13,New Construction,No,Non Prevailing Wage,,,,,3.0,,1.0,2.0,,,,,,,3.0,,3.0,9,2023.0
74221,3408 FARRAGUT ROAD,6/26/2023,9/26/2023,1009336.0,3408,FARRAGUT ROAD,Brooklyn,11210.0,3050090039.0,3428731.0,BK-17,45.0,784.0,BK1702,40.63651,-73.943959,40.636271,-73.943836,2023-09-26,New Construction,No,Non Prevailing Wage,,,,,3.0,,1.0,2.0,,,,,,,3.0,,3.0,9,2023.0
73507,RENWICK GARDEN.HUDMF.FY23,6/23/2023,6/23/2023,12851.0,329,EAST 28 STREET,Manhattan,10016.0,1009340015.0,1020612.0,MN-06,4.0,66.0,MN0603,40.740441,-73.977266,40.740792,-73.976998,2023-06-23,Preservation,Yes,Non Prevailing Wage,205.0,13.0,2.0,,4.0,,56.0,140.0,28.0,,,,,,224.0,,224.0,224,2023.0
74224,1359 NOSTRAND AVE,6/21/2023,11/9/2023,809028.0,1359,NOSTRAND AVENUE,Brooklyn,11226.0,3048530013.0,3108053.0,BK-17,40.0,818.0,BK1701,40.653503,-73.949851,40.65347,-73.94944,2023-11-09,New Construction,No,Non Prevailing Wage,,,,,6.0,,6.0,,,,,,,,6.0,,6.0,17,2023.0
74225,237 BUFFALO AVENUE,6/19/2023,12/31/2024,971095.0,237,BUFFALO AVENUE,Brooklyn,11213.0,3013810011.0,3036908.0,BK-08,41.0,359.0,BK0802,40.670966,-73.925336,40.670976,-73.925047,2024-12-31,New Construction,No,Non Prevailing Wage,,,,,2.0,,,1.0,1.0,,,,,,2.0,,2.0,6,2024.0
72692,TRINITY APARTMENTS.HUDMF.FY23,6/16/2023,6/16/2023,66281.0,901,EAST 180 STREET,Bronx,10460.0,2031250001.0,2013174.0,BX-06,15.0,363.0,BX0601,40.844905,-73.882257,40.845034,-73.881729,2023-06-16,Preservation,Yes,Non Prevailing Wage,63.0,8.0,3.0,1.0,,1.0,,25.0,33.0,9.0,9.0,,,,76.0,,76.0,76,2023.0
73027,38-38 32ND STREET,6/15/2023,5/13/2025,1006182.0,38-38,32 STREET,Queens,11101.0,4003820029.0,4000000.0,QN-01,26.0,31.0,QN0105,40.752928,-73.931632,40.752577,-73.932214,2025-05-13,New Construction,No,Non Prevailing Wage,,,12.0,,8.0,,3.0,13.0,4.0,,,,,,20.0,,20.0,64,2025.0
74237,25-70 32 STREET APARTMENTS,6/15/2023,11/13/2024,1009453.0,25-70,32 STREET,Queens,11102.0,4006200046.0,4000000.0,QN-01,22.0,6501.0,QN0103,40.768666,-73.918605,40.768307,-73.919111,2024-11-13,New Construction,No,Non Prevailing Wage,,,,,5.0,,1.0,1.0,3.0,,,,,,5.0,,5.0,15,2024.0
74230,219 LENOX ROAD APARTMENTS,6/14/2023,6/6/2024,1008752.0,219,LENOX ROAD,Brooklyn,11226.0,3050660091.0,3429008.0,BK-17,40.0,820.0,BK1701,40.654036,-73.951959,40.654377,-73.952143,2024-06-06,New Construction,No,Non Prevailing Wage,,,,,15.0,,4.0,11.0,,,,,,,15.0,,15.0,50,2024.0
74238,2085 MOHEGAN APTS.,6/8/2023,11/29/2024,1009452.0,2085,MOHEGAN AVENUE,Bronx,10460.0,2031180130.0,2130549.0,BX-06,15.0,363.0,BX0601,40.845047,-73.883876,40.845275,-73.883908,2024-11-29,New Construction,No,Non Prevailing Wage,,,,,14.0,,2.0,3.0,9.0,,,,,,14.0,,14.0,14,2024.0
74943,210 CLARKSON APARTMENTS,6/8/2023,9/26/2024,1011107.0,210,CLARKSON AVENUE,Brooklyn,11226.0,3050660011.0,3000000.0,BK-17,40.0,820.0,BK1701,40.655272,-73.952477,40.654918,-73.952535,2024-09-26,New Construction,No,Non Prevailing Wage,,,,,50.0,,10.0,29.0,11.0,,,,,,50.0,,50.0,165,2024.0
74208,253 CLARKSON AVENUE,6/6/2023,11/2/2023,221379.0,253,CLARKSON AVENUE,Brooklyn,11226.0,3050570074.0,3116081.0,BK-09,40.0,820.0,BK1701,40.655351,-73.951443,40.655581,-73.951471,2023-11-02,New Construction,No,Non Prevailing Wage,,,,,3.0,,3.0,,,,,,,,3.0,,3.0,9,2023.0
74234,101 MACOMBS PLACE,6/6/2023,5/30/2025,24526.0,101,MACOMBS PLACE,Manhattan,10039.0,1020400023.0,1060632.0,MN-10,9.0,236.0,MN1002,40.827809,-73.935425,40.827895,-73.935696,2025-05-30,New Construction,No,Non Prevailing Wage,,,,,9.0,,,7.0,2.0,,,,,,9.0,,9.0,29,2025.0
74235,1311 MORRIS AVENUE APARTMENTS,6/6/2023,2/26/2024,97367.0,1311,MORRIS AVENUE,Bronx,10456.0,2028160065.0,2007803.0,BX-04,16.0,17902.0,BX0403,40.836072,-73.912459,40.836051,-73.912809,2024-02-26,New Construction,No,Non Prevailing Wage,,,,,19.0,,15.0,4.0,,,,,,,19.0,,19.0,20,2024.0
74236,1319 CLAY AVENUE,6/6/2023,11/16/2023,1009184.0,1319,CLAY AVENUE,Bronx,10456.0,2027820200.0,2000000.0,BX-04,16.0,17702.0,BX0403,40.835249,-73.90899,40.835057,-73.909359,2023-11-16,New Construction,No,Non Prevailing Wage,,,,,13.0,,,13.0,,,,,,,13.0,,13.0,14,2023.0
73193,SITE 15 HEIGHLINER PORTFOLIO YR15.FY23,6/2/2023,6/2/2023,42211.0,203,WEST 148 STREET,Manhattan,10039.0,1020340027.0,1060563.0,MN-10,9.0,234.0,MN1002,40.823795,-73.938193,40.824004,-73.938146,2023-06-02,Preservation,Yes,Non Prevailing Wage,,12.0,3.0,,,,2.0,5.0,8.0,,,,,,15.0,,15.0,15,2023.0
73193,SITE 15 HEIGHLINER PORTFOLIO YR15.FY23,6/2/2023,6/2/2023,42213.0,205,WEST 148 STREET,Manhattan,10039.0,1020340025.0,1060562.0,MN-10,9.0,234.0,MN1002,40.823812,-73.938233,40.824053,-73.938269,2023-06-02,Preservation,Yes,Non Prevailing Wage,,10.0,4.0,1.0,,,2.0,5.0,8.0,,,,,,15.0,,15.0,15,2023.0
73193,SITE 15 HEIGHLINER PORTFOLIO YR15.FY23,6/2/2023,6/2/2023,42215.0,207,WEST 148 STREET,Manhattan,10039.0,1020340024.0,1060561.0,MN-10,9.0,234.0,MN1002,40.823828,-73.938273,40.824106,-73.938388,2023-06-02,Preservation,Yes,Non Prevailing Wage,,14.0,1.0,,,,2.0,5.0,8.0,,,,,,15.0,,15.0,15,2023.0
73193,SITE 15 HEIGHLINER PORTFOLIO YR15.FY23,6/2/2023,6/2/2023,42217.0,209,WEST 148 STREET,Manhattan,10039.0,1020340022.0,1060560.0,MN-10,9.0,234.0,MN1002,40.823845,-73.938312,40.824152,-73.938504,2023-06-02,Preservation,Yes,Non Prevailing Wage,,10.0,4.0,,,1.0,,6.0,7.0,2.0,,,,,15.0,,15.0,15,2023.0
73193,SITE 15 HEIGHLINER PORTFOLIO YR15.FY23,6/2/2023,6/2/2023,966646.0,211,WEST 148 STREET,Manhattan,10039.0,1020340021.0,1060559.0,MN-10,9.0,234.0,MN1002,40.823861,-73.938352,40.824202,-73.938623,2023-06-02,Preservation,Yes,Non Prevailing Wage,,14.0,1.0,,,,,4.0,11.0,,,,,,15.0,,15.0,15,2023.0
73193,SITE 15 HEIGHLINER PORTFOLIO YR15.FY23,6/2/2023,6/2/2023,966647.0,215,WEST 148 STREET,Manhattan,10039.0,1020340019.0,1060558.0,MN-10,9.0,234.0,MN1002,40.823894,-73.938432,40.824251,-73.938738,2023-06-02,Preservation,Yes,Non Prevailing Wage,,10.0,,2.0,,,,4.0,8.0,,,,,,12.0,,12.0,12,2023.0
73373,WASHINGTON AVENUE HEIGHLINER PORTFOLIO.YR15.FY23,6/2/2023,6/2/2023,864860.0,1011,WASHINGTON AVENUE,Bronx,10456.0,2023860144.0,2114125.0,BX-03,16.0,18501.0,BX0301,40.826184,-73.909747,40.826483,-73.909964,2023-06-02,Preservation,Yes,Non Prevailing Wage,,89.0,43.0,3.0,,1.0,6.0,47.0,75.0,8.0,,,,,136.0,,136.0,136,2023.0
73374,FRANKLIN AVENUE HEIGHLINER PORTFOLIO.YR15.FY23,6/2/2023,6/2/2023,875658.0,1090,FRANKLIN AVENUE,Bronx,10456.0,2026070038.0,2114987.0,BX-03,17.0,18502.0,BX0301,40.827669,-73.906479,40.827197,-73.906436,2023-06-02,Preservation,Yes,Non Prevailing Wage,,39.0,20.0,,,1.0,10.0,20.0,30.0,,,,,,60.0,,60.0,60,2023.0
74209,168 WEST 136 STREET APARTMENTS,6/2/2023,5/8/2024,1009966.0,168,WEST 136 STREET,Manhattan,10030.0,1019200057.0,1091040.0,MN-10,9.0,228.0,MN1002,40.815514,-73.942142,40.815498,-73.942652,2024-05-08,New Construction,No,Non Prevailing Wage,,,,,9.0,,,2.0,2.0,2.0,3.0,,,,9.0,,9.0,27,2024.0
74211,2741 CRESTON AVENUE,6/2/2023,8/22/2023,1009132.0,2741,CRESTON AVENUE,Bronx,10468.0,2033180150.0,2129724.0,BX-07,14.0,40303.0,BX0702,40.868998,-73.893603,40.869284,-73.893686,2023-08-22,New Construction,No,Non Prevailing Wage,,,,,43.0,,19.0,20.0,4.0,,,,,,43.0,,43.0,44,2023.0
74212,2895 VALENTINE APARTMENTS_HPS,6/1/2023,5/8/2024,1009007.0,2895,VALENTINE AVENUE,Bronx,10458.0,2033050051.0,2129666.0,BX-07,15.0,40702.0,BX0702,40.870262,-73.888633,40.87049,-73.888839,2024-05-08,New Construction,No,Non Prevailing Wage,,,,,61.0,,16.0,18.0,27.0,,,,,,61.0,,61.0,62,2024.0
73360,GRAND STREET.HUDMF.FY23,5/31/2023,5/31/2023,872914.0,711,EAST 6 STREET,Manhattan,10009.0,1003760058.0,1075828.0,MN-03,2.0,2602.0,MN0303,40.723369,-73.978931,40.723386,-73.978462,2023-05-31,Preservation,Yes,Non Prevailing Wage,74.0,,,,,1.0,,74.0,1.0,,,,,,75.0,,75.0,75,2023.0
74213,1775 CONEY ISLAND AVENUE,5/26/2023,6/11/2024,224673.0,1769,CONEY ISLAND AVENUE,Brooklyn,11230.0,3067490078.0,3429339.0,BK-14,48.0,542.0,BK1403,40.614142,-73.96315,40.614211,-73.962815,2024-06-11,New Construction,No,Non Prevailing Wage,,,,,23.0,,3.0,10.0,8.0,2.0,,,,,23.0,,23.0,74,2024.0
74248,SEA PARK WEST,5/23/2023,5/23/2023,394885.0,2929,WEST 31 ST,Brooklyn,11224.0,3070500001.0,3321834.0,BK-13,47.0,342.0,BK1302,40.575048,-73.997455,40.57383,-73.996685,2023-05-23,Preservation,Yes,Non Prevailing Wage,,73.0,288.0,,,1.0,30.0,78.0,121.0,103.0,30.0,,,,362.0,,362.0,362,2023.0
74249,SEA PARK NORTH (STATE),5/23/2023,5/23/2023,814498.0,2828,WEST 28 STREET,Brooklyn,11224.0,3070110011.0,3259642.0,BK-13,47.0,328.0,BK1302,40.57703,-73.9946,40.576553,-73.994917,2023-05-23,Preservation,Yes,Non Prevailing Wage,,19.0,102.0,,,1.0,,19.0,53.0,31.0,19.0,,,,122.0,,122.0,122,2023.0
74251,SEA PARK EAST,5/23/2023,5/23/2023,809859.0,2970,WEST 27 STREET,Brooklyn,11224.0,3070520034.0,3339183.0,BK-13,47.0,342.0,BK1302,40.573495,-73.992837,40.57369,-73.993683,2023-05-23,Preservation,Yes,Non Prevailing Wage,,67.0,264.0,,,1.0,18.0,45.0,129.0,106.0,34.0,,,,332.0,,332.0,332,2023.0
74214,2454 EAST 15TH STREET APARTMENTS,5/22/2023,7/24/2024,245576.0,2454,EAST 15 STREET,Brooklyn,11235.0,3074160028.0,3254241.0,BK-15,48.0,590.0,BK1503,40.591069,-73.954942,40.590817,-73.955187,2024-07-24,New Construction,No,Non Prevailing Wage,,,,,3.0,,,2.0,1.0,,,,,,3.0,,3.0,9,2024.0
71266,EASTERN PARKWAY PORTFOLIO HDFC.HPO.FY23,5/17/2023,5/17/2023,287679.0,1613,EASTERN PARKWAY EXTENSION,Brooklyn,11233.0,3014640053.0,3039337.0,BK-16,41.0,363.0,BK1601,40.671647,-73.914708,40.671837,-73.915043,2023-05-17,Preservation,Yes,Non Prevailing Wage,,7.0,7.0,2.0,,,,8.0,8.0,,,,,,16.0,,16.0,16,2023.0
71266,EASTERN PARKWAY PORTFOLIO HDFC.HPO.FY23,5/17/2023,5/17/2023,287680.0,1617,EASTERN PARKWAY EXTENSION,Brooklyn,11233.0,3014640050.0,3039336.0,BK-16,41.0,363.0,BK1601,40.671675,-73.914639,40.671883,-73.914866,2023-05-17,Preservation,Yes,Non Prevailing Wage,,2.0,7.0,4.0,,,1.0,3.0,6.0,3.0,,,,,13.0,,13.0,13,2023.0
71266,EASTERN PARKWAY PORTFOLIO HDFC.HPO.FY23,5/17/2023,5/17/2023,287681.0,1621,EASTERN PARKWAY EXTENSION,Brooklyn,11233.0,3014640049.0,3039335.0,BK-16,41.0,363.0,BK1601,40.671702,-73.914574,40.671922,-73.914732,2023-05-17,Preservation,Yes,Non Prevailing Wage,,,4.0,4.0,,,1.0,6.0,1.0,,,,,,8.0,,8.0,8,2023.0
71266,EASTERN PARKWAY PORTFOLIO HDFC.HPO.FY23,5/17/2023,5/17/2023,287682.0,1623,EASTERN PARKWAY,Brooklyn,11233.0,3014640047.0,3039334.0,BK-16,41.0,363.0,BK1601,40.671716,-73.914542,40.671955,-73.914617,2023-05-17,Preservation,Yes,Non Prevailing Wage,,1.0,10.0,1.0,,,,6.0,6.0,,,,,,12.0,,12.0,12,2023.0
71266,EASTERN PARKWAY PORTFOLIO HDFC.HPO.FY23,5/17/2023,5/17/2023,287686.0,1631,EASTERN PARKWAY EXTENSION,Brooklyn,11233.0,3014640043.0,3039332.0,BK-16,41.0,363.0,BK1601,40.671773,-73.914408,40.672086,-73.91431,2023-05-17,Preservation,Yes,Non Prevailing Wage,,2.0,8.0,1.0,,1.0,,1.0,11.0,,,,,,12.0,,12.0,12,2023.0
74195,MAVEN MOTT HAVEN,5/16/2023,10/25/2024,113511.0,2413,3 AVENUE,Bronx,10451.0,2023190109.0,2130650.0,BX-01,8.0,51.0,BX0101,40.808361,-73.930997,40.80877,-73.931394,2024-10-25,New Construction,No,Non Prevailing Wage,,,,,60.0,,,46.0,11.0,3.0,,,,,60.0,,60.0,200,2024.0
74199,514 HERKIMER STREET,5/10/2023,2/5/2024,988070.0,514,HERKIMER STREET,Brooklyn,11213.0,3017050039.0,3048075.0,BK-03,36.0,271.0,BK0302,40.678919,-73.936482,40.678567,-73.936496,2024-02-05,New Construction,No,Non Prevailing Wage,,,,,5.0,,,5.0,,,,,,,5.0,,5.0,15,2024.0
69435,TBK1002 RISEBORO,5/2/2023,10/28/2024,210667.0,160,BLEECKER STREET,Brooklyn,11221.0,3033060022.0,3075647.0,BK-04,37.0,419.0,BK0402,40.696455,-73.919901,40.696387,-73.919631,2024-08-19,Preservation,No,Non Prevailing Wage,,4.0,2.0,,,,,4.0,2.0,,,,,,6.0,,6.0,6,2024.0
69435,TBK1002 RISEBORO,5/2/2023,10/28/2024,307996.0,301,HARMAN STREET,Brooklyn,11237.0,3032790048.0,3074838.0,BK-04,37.0,431.0,BK0401,40.700072,-73.918721,40.700232,-73.918909,2024-10-28,Preservation,No,Non Prevailing Wage,,4.0,2.0,,,,,4.0,2.0,,,,,,6.0,,6.0,6,2024.0
69435,TBK1002 RISEBORO,5/2/2023,10/28/2024,327608.0,111,LINDEN STREET,Brooklyn,11221.0,3033230062.0,3076111.0,BK-04,37.0,417.0,BK0402,40.69312,-73.919689,40.693247,-73.919909,2024-10-18,Preservation,No,Non Prevailing Wage,,10.0,6.0,,,,,3.0,13.0,,,,,,16.0,,16.0,16,2024.0
69435,TBK1002 RISEBORO,5/2/2023,10/28/2024,327611.0,113,LINDEN STREET,Brooklyn,11221.0,3033230060.0,3076110.0,BK-04,37.0,417.0,BK0402,40.693162,-73.919649,40.69334,-73.919815,2024-10-02,Preservation,No,Non Prevailing Wage,,9.0,7.0,,,1.0,6.0,2.0,6.0,3.0,,,,,17.0,,17.0,17,2024.0
69435,TBK1002 RISEBORO,5/2/2023,10/28/2024,335743.0,135,MENAHAN STREET,Brooklyn,11221.0,3033060053.0,3075660.0,BK-04,37.0,419.0,BK0402,40.695648,-73.919542,40.69578,-73.919769,2024-08-30,Preservation,No,Non Prevailing Wage,,,5.0,,,,1.0,2.0,1.0,1.0,,,,,5.0,,5.0,5,2024.0
69435,TBK1002 RISEBORO,5/2/2023,10/28/2024,338416.0,230,MOFFAT STREET,Brooklyn,11207.0,3034470033.0,3080172.0,BK-04,37.0,411.0,BK0402,40.688638,-73.905318,40.688591,-73.905029,2024-10-28,Preservation,No,Non Prevailing Wage,,3.0,3.0,,,,,6.0,,,,,,,6.0,,6.0,6,2024.0
74200,2114 FULTON STREET APARTMENTS,5/1/2023,8/8/2023,1008816.0,2114,FULTON STREET,Brooklyn,11233.0,3015510009.0,3042166.0,BK-16,41.0,301.0,BK1601,40.678356,-73.912388,40.678134,-73.912659,2023-08-08,New Construction,No,Non Prevailing Wage,,,,,3.0,,1.0,2.0,,,,,,,3.0,,3.0,8,2023.0
74201,3311 3RD AVENUE APARTMENTS,5/1/2023,8/28/2023,1008852.0,3311,3 AVENUE,Bronx,10456.0,2023690032.0,2000000.0,BX-03,16.0,18501.0,BX0301,40.826048,-73.907923,40.826166,-73.908244,2023-08-28,New Construction,No,Non Prevailing Wage,,,,,15.0,,,8.0,4.0,3.0,,,,,15.0,,15.0,19,2023.0
70584,VERMONT_EAST NEW YORK.YR15.FY23,4/28/2023,4/28/2023,386800.0,523,VERMONT STREET,Brooklyn,11207.0,3038080011.0,3084735.0,BK-05,42.0,1126.0,BK0503,40.66635,-73.892456,40.66629,-73.891976,2023-04-28,Preservation,Yes,Non Prevailing Wage,15.0,58.0,1.0,,,,10.0,22.0,42.0,,,,,,74.0,,74.0,74,2023.0
74202,540 GRAHAM AVENUE,4/27/2023,3/19/2024,302221.0,540,GRAHAM AVENUE,Brooklyn,11222.0,3027010001.0,3426408.0,BK-01,33.0,499.0,BK0101,40.721575,-73.947008,40.721641,-73.946741,2024-03-19,New Construction,No,Non Prevailing Wage,,,,,8.0,,1.0,7.0,,,,,,,8.0,,8.0,25,2024.0
74203,2434 WALTON AVENUE,4/25/2023,9/28/2023,1004816.0,2436,WALTON AVENUE,Bronx,10468.0,2031840034.0,2130756.0,BX-05,14.0,239.0,BX0503,40.861734,-73.900722,40.861698,-73.900495,2023-09-28,New Construction,No,Non Prevailing Wage,,,,,35.0,,,17.0,18.0,,,,,,35.0,,35.0,35,2023.0
74204,449 LIBERTY AVENUE APARTMENTS,4/21/2023,12/7/2023,1007115.0,449,LIBERTY AVENUE,Brooklyn,11207.0,3036900027.0,3083572.0,BK-05,37.0,1198.0,BK0502,40.674893,-73.89325,40.67511,-73.893235,2023-12-07,New Construction,No,Non Prevailing Wage,,,,,3.0,,1.0,1.0,1.0,,,,,,3.0,,3.0,10,2023.0
72169,JAMES LENOX HOUSE,4/20/2023,2/28/2025,15977.0,49,EAST 73 STREET,Manhattan,10021.0,1013880026.0,1041499.0,MN-08,4.0,130.0,MN0802,40.77228,-73.964474,40.77237,-73.964117,2025-02-28,Preservation,No,Non Prevailing Wage,,,99.0,,,,88.0,11.0,,,,,,,99.0,,99.0,100,2025.0
74167,634 POWELL STREET APARTMENTS,4/19/2023,11/15/2023,354883.0,634,POWELL STREET,Brooklyn,11212.0,3038570123.0,3322628.0,BK-16,42.0,920.0,BK1602,40.658489,-73.901086,40.658401,-73.90127,2023-11-15,New Construction,No,Non Prevailing Wage,,,,,14.0,,1.0,4.0,9.0,,,,,,14.0,,14.0,14,2023.0
74168,311 FRANKLIN AVENUE,4/18/2023,10/17/2023,295719.0,313,FRANKLIN AVENUE,Brooklyn,11238.0,3019500005.0,3424967.0,BK-03,36.0,233.0,BK0301,40.688834,-73.957166,40.688902,-73.956964,2023-10-17,New Construction,No,Non Prevailing Wage,,,,,3.0,,,,3.0,,,,,,3.0,,3.0,10,2023.0
74169,921 EAGLE AVENUE,4/18/2023,8/18/2023,1005039.0,921,EAGLE AVENUE,Bronx,10456.0,2026200032.0,2000000.0,BX-03,17.0,141.0,BX0301,40.823185,-73.908013,40.823523,-73.908139,2023-08-18,New Construction,No,Non Prevailing Wage,,,,,10.0,,,,10.0,,,,,,10.0,,10.0,10,2023.0
74171,65-27 ROOSEVELT AVENUE APARTMENTS,4/14/2023,9/28/2023,1008743.0,65-27,ROOSEVELT AVENUE,Queens,11377.0,4012237505.0,4623223.0,QN-02,26.0,263.0,QN0203,40.746168,-73.897979,40.746431,-73.898079,2023-09-28,New Construction,No,Non Prevailing Wage,,,,,3.0,,,3.0,,,,,,,3.0,,3.0,9,2023.0
74173,99-49 66 AVENUE,4/4/2023,11/25/2024,458510.0,99-49,66 AVENUE,Queens,11374.0,4021160056.0,4050957.0,QN-06,29.0,71304.0,QN0602,40.728447,-73.854436,40.729028,-73.853247,2024-11-25,New Construction,No,Non Prevailing Wage,,,,,6.0,,2.0,2.0,2.0,,,,,,6.0,,6.0,18,2024.0
74174,2556 BRIGGS AVENUE APARTMENTS,4/4/2023,9/12/2023,1008717.0,2556,BRIGGS AVENUE,Bronx,10458.0,2032930021.0,2129672.0,BX-07,15.0,39901.0,BX0701,40.863465,-73.893753,40.863128,-73.893605,2023-09-12,New Construction,No,Non Prevailing Wage,,,,,31.0,,,,28.0,3.0,,,,,31.0,,31.0,31,2023.0
72110,BK-2715 FULTON STREET_MIH72082,4/3/2023,12/4/2024,1002332.0,2715,FULTON STREET,Brooklyn,11207.0,3036620048.0,3000000.0,BK-05,37.0,1146.0,BK0501,40.67762,-73.894532,40.677757,-73.894745,2024-12-04,New Construction,No,Non Prevailing Wage,,7.0,5.0,3.0,,,,,15.0,,,,,,15.0,,15.0,60,2024.0
73669,101 AVENUE,3/28/2023,5/24/2024,994402.0,129-19,101 AVENUE,Queens,11419.0,4094730026.0,4000000.0,QN-09,29.0,154.0,QN0903,40.692307,-73.81774,40.692579,-73.8177,2024-05-24,New Construction,No,Non Prevailing Wage,,,,,3.0,,,1.0,,2.0,,,,,3.0,,3.0,10,2024.0
73669,101 AVENUE,3/28/2023,5/24/2024,1008703.0,129-21,101 AVENUE,Queens,11419.0,4094730024.0,4000000.0,QN-09,29.0,154.0,QN0903,40.69231,-73.817729,40.692614,-73.81758,2024-05-24,New Construction,No,Non Prevailing Wage,,,,,3.0,,,1.0,,2.0,,,,,3.0,,3.0,10,2024.0
73669,101 AVENUE,3/28/2023,5/24/2024,1008705.0,129-25,101 AVENUE,Queens,11419.0,4094730022.0,4000000.0,QN-09,29.0,154.0,QN0903,40.692315,-73.817708,40.692644,-73.817476,2024-05-24,New Construction,No,Non Prevailing Wage,,,,,3.0,,,1.0,,2.0,,,,,3.0,,3.0,7,2024.0
73670,1181 & 1183 NEW YORK AVENUE,3/28/2023,6/7/2024,1006448.0,1183,NEW YORK AVENUE,Brooklyn,11203.0,3049330053.0,3110834.0,BK-17,45.0,854.0,BK1702,40.644163,-73.945938,40.64421,-73.945635,2024-06-07,New Construction,No,Non Prevailing Wage,,,,,3.0,,1.0,2.0,,,,,,,3.0,,3.0,9,2024.0
73670,1181 & 1183 NEW YORK AVENUE,3/28/2023,6/7/2024,1008525.0,1181,NEW YORK AVENUE,Brooklyn,11203.0,3049330054.0,3428623.0,BK-17,45.0,854.0,BK1702,40.644205,-73.945941,40.644265,-73.945642,2024-06-07,New Construction,No,Non Prevailing Wage,,,,,3.0,,1.0,2.0,,,,,,,3.0,,3.0,9,2024.0
73671,106 MT HOPE,3/27/2023,7/27/2023,1008530.0,106,MT HOPE PLACE,Bronx,10453.0,2028050010.0,2007617.0,BX-05,14.0,23301.0,BX0502,40.84878,-73.907992,40.848571,-73.908022,2023-07-27,New Construction,No,Non Prevailing Wage,,,,,14.0,,9.0,5.0,,,,,,,14.0,,14.0,44,2023.0
74175,230 BOERUM STREET,3/23/2023,8/30/2024,950113.0,230,BOERUM STREET,Brooklyn,11206.0,3030820019.0,3325886.0,BK-01,34.0,485.0,BK0104,40.706337,-73.938194,40.706115,-73.938483,2024-08-30,New Construction,No,Non Prevailing Wage,,,,,3.0,,,3.0,,,,,,,3.0,,3.0,8,2024.0
73672,317 FRANKLIN AVENUE,3/20/2023,9/6/2023,295722.0,317,FRANKLIN AVENUE,Brooklyn,11238.0,3019500003.0,3321884.0,BK-03,36.0,233.0,BK0301,40.688705,-73.957148,40.688762,-73.956878,2023-09-06,New Construction,No,Non Prevailing Wage,,,,,5.0,,,2.0,3.0,,,,,,5.0,,5.0,10,2023.0
73673,2801 TILDEN AVENUE,3/20/2023,8/30/2024,381334.0,2801,TILDEN AVENUE,Brooklyn,11226.0,3051300125.0,3117838.0,BK-17,40.0,824.0,BK1701,40.646825,-73.950919,40.647042,-73.950912,2024-08-30,New Construction,No,Non Prevailing Wage,,,,,4.0,,,2.0,2.0,,,,,,4.0,,4.0,13,2024.0
73674,1135 TELLER AVENUE,3/20/2023,2/5/2024,112760.0,1137,TELLER AVENUE,Bronx,10456.0,2024340070.0,2000000.0,BX-04,16.0,175.0,BX0401,40.830737,-73.912527,40.830726,-73.91282,2024-02-05,New Construction,No,Non Prevailing Wage,,,,,43.0,,,28.0,15.0,,,,,,43.0,,43.0,44,2024.0
73675,94 EAST 208 STREET,3/17/2023,10/17/2023,67511.0,94,EAST 208 STREET,Bronx,10467.0,2033260034.0,2000000.0,BX-07,11.0,419.0,BX0703,40.878503,-73.881691,40.878283,-73.881872,2023-10-17,New Construction,No,Non Prevailing Wage,,,,,7.0,,,7.0,,,,,,,7.0,,7.0,8,2023.0
73676,577 EAST 161 STREET,3/16/2023,9/20/2023,1008704.0,577,EAST 161 STREET,Bronx,10456.0,2026200053.0,2130585.0,BX-03,17.0,141.0,BX0301,40.822283,-73.908806,40.822508,-73.908907,2023-09-20,New Construction,No,Non Prevailing Wage,,,,,4.0,,2.0,1.0,1.0,,,,,,4.0,,4.0,13,2023.0
73678,92 WEST 169 STREET APARTMENTS,3/15/2023,2/27/2024,839351.0,92,WEST 169 STREET,Bronx,10452.0,2025170028.0,2127053.0,BX-04,16.0,211.0,BX0402,40.839533,-73.923209,40.839294,-73.923376,2024-02-27,New Construction,No,Non Prevailing Wage,,,,,12.0,,6.0,4.0,2.0,,,,,,12.0,,12.0,38,2024.0
73689,865 ROGERS AVENUE APARTMENTS,3/15/2023,12/27/2024,364014.0,865,ROGERS AVENUE,Brooklyn,11226.0,3051080011.0,3429174.0,BK-17,40.0,824.0,BK1701,40.649335,-73.952316,40.649469,-73.952042,2024-12-27,New Construction,No,Non Prevailing Wage,,,,,8.0,,1.0,5.0,2.0,,,,,,8.0,,8.0,26,2024.0
73690,1950 AMSTERDAM AVENUE APARMTENTS,3/15/2023,6/14/2023,5719.0,1950,AMSTERDAM AVENUE,Manhattan,10032.0,1021150036.0,1062715.0,MN-12,10.0,241.0,MN1201,40.832655,-73.9422,40.832776,-73.942507,2023-06-14,New Construction,No,Non Prevailing Wage,,,,,5.0,,2.0,,3.0,,,,,,5.0,,5.0,14,2023.0
73691,1818 PROSPECT AVENUE APARTMENTS,3/14/2023,10/4/2023,104361.0,1818,PROSPECT AVENUE,Bronx,10457.0,2029530006.0,2128688.0,BX-06,15.0,367.0,BX0602,40.841944,-73.891232,40.841974,-73.890878,2023-10-04,New Construction,No,Non Prevailing Wage,,,,,44.0,,,22.0,13.0,9.0,,,,,44.0,,44.0,44,2023.0
73692,1412 COLLEGE AVENUE APARTMENTS,3/14/2023,2/6/2024,57860.0,1412,COLLEGE AVENUE,Bronx,10456.0,2027840003.0,2007236.0,BX-04,16.0,225.0,BX0403,40.837827,-73.910393,40.837813,-73.910049,2024-02-06,New Construction,No,Non Prevailing Wage,,,,,5.0,,2.0,3.0,,,,,,,5.0,,5.0,16,2024.0
73693,94-50 45TH AVENUE,3/10/2023,12/19/2024,433760.0,94-50,45 AVENUE,Queens,11373.0,4016020028.0,4618175.0,QN-04,25.0,463.0,QN0401,40.744021,-73.870147,40.744217,-73.868905,2024-12-19,New Construction,No,Non Prevailing Wage,,,,,3.0,,,,3.0,,,,,,3.0,,3.0,7,2024.0
73694,1755 BROOKLYN AVENUE,3/10/2023,11/15/2023,1008010.0,1755,BROOKLYN AVENUE,Brooklyn,11210.0,3075820013.0,3206522.0,BK-18,45.0,776.0,BK1801,40.630204,-73.941554,40.630264,-73.941255,2023-11-15,New Construction,No,Non Prevailing Wage,,,,,4.0,,1.0,1.0,2.0,,,,,,4.0,,4.0,9,2023.0
69647,DONA ROSITA I.YR15.FY23,3/8/2023,6/25/2024,63593.0,315,EAST 148 STREET,Bronx,10451.0,2023300059.0,2000907.0,BX-01,17.0,65.0,BX0102,40.8163,-73.921517,40.816418,-73.921159,2024-06-25,Preservation,No,Non Prevailing Wage,39.0,1.0,,,,,40.0,,,,,,,,40.0,,40.0,40,2024.0
73696,36-10 31ST STREET,3/6/2023,8/28/2024,418155.0,36-10,31 STREET,Queens,11106.0,4005997501.0,4007869.0,QN-01,26.0,51.0,QN0105,40.756229,-73.930052,40.756342,-73.930365,2024-08-28,New Construction,No,Non Prevailing Wage,,,,,13.0,,3.0,9.0,1.0,,,,,,13.0,,13.0,41,2024.0
73697,3436 KINGSBRIDGE AVE APARTMENTS,3/2/2023,10/17/2023,89750.0,3436,KINGSBRIDGE AVENUE,Bronx,10463.0,2057600123.0,2083687.0,BX-08,11.0,287.0,BX0802,40.882783,-73.903645,40.883172,-73.902904,2023-10-17,New Construction,No,Non Prevailing Wage,,,,,12.0,,3.0,3.0,6.0,,,,,,12.0,,12.0,39,2023.0
73698,290 LINDEN BOULEVARD APARTMENTS,3/2/2023,3/19/2024,1007968.0,290,LINDEN BOULEVARD,Brooklyn,11226.0,3048680031.0,3428811.0,BK-17,40.0,818.0,BK1701,40.652709,-73.948392,40.652382,-73.94832,2024-03-19,New Construction,No,Non Prevailing Wage,,,,,10.0,,5.0,5.0,,,,,,,10.0,,10.0,33,2024.0
73699,26-19 2ND STREET,3/2/2023,12/27/2023,969667.0,26-19,2 STREET,Queens,11102.0,4009140008.0,4020682.0,QN-01,22.0,87.0,QN0102,40.776365,-73.934728,40.776106,-73.934519,2023-12-27,New Construction,No,Non Prevailing Wage,,,,,8.0,,,7.0,1.0,,,,,,8.0,,8.0,25,2023.0
65254,CB WHCO PORTFOLIO.YR15.FY23,2/28/2023,,28070.0,202,ST NICHOLAS AVENUE,Manhattan,10027.0,1019260008.0,1058463.0,MN-10,9.0,220.0,MN1001,40.8069,-73.952857,40.806793,-73.952568,2024-12-17,Preservation,No,Non Prevailing Wage,6.0,4.0,,,,,,5.0,5.0,,,,,,10.0,,10.0,10,2024.0
65254,CB WHCO PORTFOLIO.YR15.FY23,2/28/2023,,28073.0,208,ST NICHOLAS AVENUE,Manhattan,10027.0,1019260061.0,1058485.0,MN-10,9.0,220.0,MN1001,40.807095,-73.952867,40.807199,-73.952636,2024-12-26,Preservation,No,Non Prevailing Wage,5.0,12.0,,,,,,,17.0,,,,,,17.0,,17.0,17,2024.0
65254,CB WHCO PORTFOLIO.YR15.FY23,2/28/2023,,38110.0,102,WEST 114 STREET,Manhattan,10026.0,1018230037.0,1055020.0,MN-10,9.0,216.0,MN1001,40.800872,-73.951019,40.800741,-73.951279,2024-10-22,Preservation,No,Non Prevailing Wage,,5.0,,,,,,,,5.0,,,,,5.0,,5.0,5,2024.0
65254,CB WHCO PORTFOLIO.YR15.FY23,2/28/2023,,38111.0,104,WEST 114 STREET,Manhattan,10026.0,1018230038.0,1055021.0,MN-10,9.0,216.0,MN1001,40.800911,-73.951113,40.800774,-73.951358,2024-10-22,Preservation,No,Non Prevailing Wage,3.0,6.0,1.0,,,1.0,1.0,1.0,9.0,,,,,,11.0,,11.0,11,2024.0
73700,1760 GRAND AVENUE,2/28/2023,6/20/2024,996766.0,1760,GRAND AVENUE,Bronx,10453.0,2028670123.0,2008515.0,BX-05,14.0,217.0,BX0501,40.849456,-73.913345,40.849854,-73.912701,2024-06-20,New Construction,No,Non Prevailing Wage,,,,,5.0,,1.0,1.0,3.0,,,,,,5.0,,5.0,15,2024.0
73702,97 VARET STREET APARTMENT,2/23/2023,11/15/2023,386512.0,97,VARET STREET,Brooklyn,11206.0,3031060031.0,3429676.0,BK-01,34.0,491.0,BK0104,40.70316,-73.941504,40.703341,-73.941652,2023-11-15,New Construction,No,Non Prevailing Wage,,,,,3.0,,,,3.0,,,,,,3.0,,3.0,10,2023.0
73703,33-19 103RD STREET APARTMENTS,2/23/2023,7/27/2023,991701.0,33-19,103 STREET,Queens,11368.0,4017180069.0,4042646.0,QN-03,21.0,379.0,QN0303,40.757133,-73.865573,40.757006,-73.865252,2023-07-27,New Construction,No,Non Prevailing Wage,,,,,2.0,,,1.0,,1.0,,,,,2.0,,2.0,6,2023.0
73704,785 FAIRMOUNT PLACE APARTMENTS,2/22/2023,6/16/2023,1007976.0,785,FAIRMOUNT PLACE,Bronx,10460.0,2029550048.0,2010052.0,BX-06,15.0,36502.0,BX0602,40.842835,-73.88929,40.842856,-73.88886,2023-06-16,New Construction,No,Non Prevailing Wage,,,,,24.0,,17.0,5.0,2.0,,,,,,24.0,,24.0,25,2023.0
73705,282 EAST 32ND STREET APARTMENTS,2/22/2023,2/22/2023,991560.0,282,EAST 32 STREET,Brooklyn,11226.0,3049310031.0,3110728.0,BK-17,45.0,826.0,BK1701,40.64381,-73.946914,40.643761,-73.947181,2023-02-22,New Construction,No,Non Prevailing Wage,,,,,5.0,,,5.0,,,,,,,5.0,,5.0,14,2023.0
73706,1526 SEDGWICK AVENUE APARTMENTS,2/22/2023,7/31/2023,1004926.0,1526,SEDGWICK AVENUE,Bronx,10453.0,2028800027.0,2009172.0,BX-05,14.0,20501.0,BX0501,40.84684,-73.9249,40.847367,-73.924227,2023-07-31,New Construction,No,Non Prevailing Wage,,,,,12.0,,,7.0,5.0,,,,,,12.0,,12.0,39,2023.0
73707,1001 BUSHWICK AVENUE,2/22/2023,7/27/2023,215610.0,1001,BUSHWICK AVENUE,Brooklyn,11221.0,3033220001.0,3429085.0,BK-04,37.0,399.0,BK0402,40.691761,-73.922099,40.691909,-73.921854,2023-07-27,New Construction,No,Non Prevailing Wage,,,,,11.0,,,5.0,6.0,,,,,,11.0,,11.0,34,2023.0
73708,157 WEST KINGSBRIDGE ROAD,2/21/2023,6/22/2023,1007815.0,157,WEST KINGSBRIDGE ROAD,Bronx,10463.0,2032530008.0,2129015.0,BX-08,14.0,273.0,BX0801,40.87013,-73.904192,40.870163,-73.903812,2023-06-22,New Construction,No,Non Prevailing Wage,,,,,6.0,,,4.0,2.0,,,,,,6.0,,6.0,20,2023.0
73710,69-03/69-05 DITMARS BOULEVARD,2/15/2023,2/5/2025,982250.0,69-05,DITMARS BOULEVARD,Queens,11370.0,4009660001.0,4617726.0,QN-01,22.0,317.0,QN0101,40.768245,-73.899512,40.768387,-73.899147,2025-02-05,New Construction,No,Non Prevailing Wage,,,,,5.0,,,,5.0,,,,,,5.0,,5.0,15,2025.0
74188,375 LEFFERTS AVENUE,2/15/2023,9/6/2023,1009075.0,375,LEFFERTS AVENUE,Brooklyn,11225.0,3013210050.0,3429150.0,BK-09,40.0,329.0,BK0902,40.662483,-73.948878,40.662692,-73.948947,2023-09-06,New Construction,No,Non Prevailing Wage,,,,,13.0,,3.0,10.0,,,,,,,13.0,,13.0,41,2023.0
73711,40-43 68TH STREET APARTMENTS,2/13/2023,4/15/2024,1006501.0,40-43,68 STREET,Queens,11377.0,4013000006.0,4623384.0,QN-02,26.0,263.0,QN0203,40.745492,-73.89707,40.744989,-73.89671,2024-04-15,New Construction,No,Non Prevailing Wage,,,,,3.0,,,1.0,2.0,,,,,,3.0,,3.0,10,2024.0
73713,139 15TH STREET APARTMENTS,2/13/2023,10/4/2024,1008706.0,139,15 STREET,Brooklyn,11215.0,3010400051.0,3425920.0,BK-06,38.0,117.0,BK0601,40.667032,-73.992329,40.667139,-73.992052,2024-10-04,New Construction,No,Non Prevailing Wage,,,,,3.0,,,3.0,,,,,,,3.0,,3.0,8,2024.0
73714,132-53 41ST AVENUE APARTMENTS,2/13/2023,8/9/2024,992554.0,132-53,41 AVENUE,Queens,11355.0,4050370089.0,4602879.0,QN-07,20.0,871.0,QN0707,40.757231,-73.831658,40.757314,-73.832022,2024-08-09,New Construction,No,Non Prevailing Wage,,,,,5.0,,,4.0,,1.0,,,,,5.0,,5.0,14,2024.0
73715,104-18 NORTHERN BLVD APARTMENTS,2/13/2023,6/26/2024,684504.0,104-18,NORTHERN BOULEVARD,Queens,11368.0,4017190008.0,4042655.0,QN-03,21.0,379.0,QN0303,40.757694,-73.864367,40.757441,-73.863934,2024-06-26,New Construction,No,Non Prevailing Wage,,,,,3.0,,,2.0,1.0,,,,,,3.0,,3.0,7,2024.0
73716,83-15 PARSONS BOULEVARD APARTMENTS,2/10/2023,11/22/2024,687552.0,83-15,PARSONS BOULEVARD,Queens,11432.0,4068620331.0,4620899.0,QN-08,24.0,450.0,QN0805,40.715355,-73.807692,40.715305,-73.807331,2024-11-22,New Construction,No,Non Prevailing Wage,,,,,10.0,,2.0,3.0,5.0,,,,,,10.0,,10.0,33,2024.0
73717,3823 CARPENTER AVENUE APARTMENTS,2/10/2023,8/17/2023,1007911.0,3823,CARPENTER AVENUE,Bronx,10467.0,2046530090.0,2130569.0,BX-12,12.0,394.0,BX1201,40.885302,-73.865231,40.885284,-73.865531,2023-08-17,New Construction,No,Non Prevailing Wage,,,,,4.0,,3.0,1.0,,,,,,,4.0,,4.0,13,2023.0
73718,2761 BRONXWOOD AVENUE,2/10/2023,6/13/2023,995696.0,2761,BRONXWOOD AVENUE,Bronx,10469.0,2045140030.0,2130539.0,BX-11,13.0,340.0,BX1104,40.866695,-73.861537,40.867581,-73.861861,2023-06-13,New Construction,No,Non Prevailing Wage,,,,,31.0,,3.0,25.0,3.0,,,,,,31.0,,31.0,32,2023.0
74189,1295 RODMAN PLACE APARTMENTS,2/10/2023,5/12/2023,1007826.0,1295,RODMAN PLACE,Bronx,10460.0,2030160071.0,2092211.0,BX-06,15.0,359.0,BX0601,40.838715,-73.881274,40.839067,-73.881418,2023-05-12,New Construction,No,Non Prevailing Wage,,,,,45.0,,14.0,30.0,1.0,,,,,,45.0,,45.0,46,2023.0
73719,584 4TH AVE,2/8/2023,2/26/2024,129340.0,584,4 AVENUE,Brooklyn,11215.0,3010510039.0,3024085.0,BK-07,38.0,117.0,BK0601,40.665827,-73.992513,40.66584,-73.992939,2024-02-26,New Construction,No,Non Prevailing Wage,,,,,14.0,,1.0,10.0,3.0,,,,,,14.0,,14.0,46,2024.0
73720,12-22 ASTORIA BLVD,2/8/2023,12/27/2024,1012396.0,2025-12-22T00:00:00.000,ASTORIA BOULEVARD,Queens,11102.0,4005120001.0,4000000.0,QN-01,22.0,83.0,QN0102,40.77211,-73.929937,40.771896,-73.929306,2024-12-27,New Construction,No,Non Prevailing Wage,,,,,3.0,,,,3.0,,,,,,3.0,,3.0,10,2024.0
73721,3128 BAILY AVE,2/8/2023,2/12/2025,46537.0,3128,BAILEY AVENUE,Bronx,10463.0,2032610033.0,2129659.0,BX-08,14.0,277.0,BX0801,40.878695,-73.901847,40.878521,-73.901616,2025-02-12,New Construction,No,Non Prevailing Wage,,,,,40.0,,,20.0,20.0,,,,,,40.0,,40.0,40,2025.0
73722,26-24 4TH STREET,2/8/2023,6/5/2024,399271.0,26-24,4 STREET,Queens,11102.0,4009100009.0,4623596.0,QN-01,22.0,87.0,QN0102,40.775699,-73.932873,40.775535,-73.933447,2024-06-05,New Construction,No,Non Prevailing Wage,,,,,30.0,,6.0,19.0,5.0,,,,,,30.0,,30.0,99,2024.0
73725,1230 PROSPECT AVE,2/8/2023,7/15/2024,104266.0,1230,PROSPECT AVENUE,Bronx,10459.0,2026930022.0,2129160.0,BX-02,17.0,131.0,BX0202,40.82699,-73.898566,40.827401,-73.898107,2024-07-15,New Construction,No,Non Prevailing Wage,,,,,6.0,,2.0,3.0,1.0,,,,,,6.0,,6.0,17,2024.0
73726,1015 ATLANTIC AVE,2/8/2023,6/11/2024,185555.0,1013,ATLANTIC AVENUE,Brooklyn,11238.0,3020190051.0,3000000.0,BK-02,35.0,227.0,BK0301,40.67998,-73.958967,40.680199,-73.958542,2024-06-11,New Construction,No,Non Prevailing Wage,,,,,12.0,,4.0,4.0,4.0,,,,,,12.0,,12.0,38,2024.0
74190,492 KINGS HIGHWAY,2/8/2023,2/28/2025,320336.0,492,KINGS HIGHWAY,Brooklyn,11223.0,3066810119.0,3178563.0,BK-15,44.0,41401.0,BK1501,40.60425,-73.971582,40.604055,-73.971453,2025-02-28,New Construction,No,Non Prevailing Wage,,,,,4.0,,,2.0,2.0,,,,,,4.0,,4.0,12,2025.0
73727,24-28 BARTLETT STREET APARTMENTS,2/6/2023,7/15/2024,199153.0,24,BARTLETT STREET,Brooklyn,11206.0,3022720006.0,3429096.0,BK-01,33.0,507.0,BK0103,40.700805,-73.946945,40.700607,-73.94684,2024-07-15,New Construction,No,Non Prevailing Wage,,,,,4.0,,,,,4.0,,,,,4.0,,4.0,12,2024.0
73728,762 MADISON STREET APARTMENTS,2/2/2023,6/9/2023,1007570.0,762,MADISON STREET,Brooklyn,11221.0,3016470044.0,3337993.0,BK-03,36.0,385.0,BK0302,40.687351,-73.927657,40.687219,-73.92725,2023-06-09,New Construction,No,Non Prevailing Wage,,,,,3.0,,3.0,,,,,,,,3.0,,3.0,10,2023.0
70562,253 MOTHER GASTON_MIH70552,2/1/2023,2/1/2024,996963.0,253,MOTHER GASTON BOULEVARD,Brooklyn,11212.0,3036750005.0,3083402.0,BK-16,37.0,908.0,BK1602,40.673201,-73.90777,40.673187,-73.907413,2024-02-01,New Construction,No,Non Prevailing Wage,,2.0,2.0,1.0,,,1.0,2.0,2.0,,,,,,5.0,,5.0,19,2024.0
73730,SUNROSE TOWER,2/1/2023,11/21/2023,42644.0,614,WEST 153 STREET,Manhattan,10031.0,1020990040.0,1062471.0,MN-09,7.0,237.0,MN0903,40.831784,-73.947545,40.831642,-73.947769,2023-11-21,New Construction,No,Non Prevailing Wage,,,,,72.0,,18.0,18.0,36.0,,,,,,72.0,,72.0,238,2023.0
73731,85 & 87 HERKIMER STREET,1/31/2023,8/3/2023,1008549.0,87,HERKIMER STREET,Brooklyn,11216.0,3018600064.0,3323683.0,BK-03,36.0,247.0,BK0301,40.679705,-73.950679,40.679908,-73.950365,2023-08-03,New Construction,No,Non Prevailing Wage,,,,,2.0,,,1.0,1.0,,,,,,2.0,,2.0,6,2023.0
73731,85 & 87 HERKIMER STREET,1/31/2023,8/3/2023,1008550.0,85,HERKIMER STREET,Brooklyn,11216.0,3018600066.0,3323684.0,BK-03,36.0,247.0,BK0301,40.679705,-73.950726,40.679913,-73.950455,2023-08-03,New Construction,No,Non Prevailing Wage,,,,,2.0,,,1.0,1.0,,,,,,2.0,,2.0,6,2023.0
73732,1554 AND 1556 NEW YORK AVE,1/31/2023,1/9/2024,1007557.0,1556,NEW YORK AVENUE,Brooklyn,11210.0,3050070068.0,3114056.0,BK-17,45.0,78602.0,BK1702,40.634951,-73.944972,40.634809,-73.945268,2024-01-09,New Construction,No,Non Prevailing Wage,,,,,3.0,,1.0,2.0,,,,,,,3.0,,3.0,9,2024.0
73732,1554 AND 1556 NEW YORK AVE,1/31/2023,1/9/2024,1007631.0,1554,NEW YORK AVENUE,Brooklyn,11210.0,3050070067.0,3429051.0,BK-17,45.0,78602.0,BK1702,40.634987,-73.944976,40.634864,-73.945275,2024-01-09,New Construction,No,Non Prevailing Wage,,,,,3.0,,1.0,2.0,,,,,,,3.0,,3.0,9,2024.0
71747,2767 ATLANTIC AVE_MIH71508,1/25/2023,12/17/2024,999867.0,2767,ATLANTIC AVENUE,Brooklyn,11207.0,3039460045.0,3427363.0,BK-05,37.0,1198.0,BK0502,40.676311,-73.892029,40.676607,-73.892082,2024-12-17,New Construction,No,Non Prevailing Wage,,5.0,5.0,,3.0,,2.0,4.0,7.0,,,,,,13.0,,13.0,41,2024.0
71748,BROOKLYN - 2777 ATLANTIC AVE_MIH71620,1/25/2023,12/17/2024,1013699.0,2777,ATLANTIC AVENUE,Brooklyn,11207.0,3039460042.0,3427362.0,BK-05,37.0,1198.0,BK0502,40.67636,-73.891747,40.676637,-73.891909,2024-12-17,New Construction,No,Non Prevailing Wage,,6.0,8.0,,5.0,,6.0,13.0,,,,,,,19.0,,19.0,63,2024.0
73733,672 UNION AVENUE,1/20/2023,5/19/2023,116459.0,672,UNION AVENUE,Bronx,10455.0,2026750006.0,2129643.0,BX-01,8.0,79.0,BX0102,40.815752,-73.904252,40.815645,-73.903988,2023-05-19,New Construction,No,Non Prevailing Wage,,,,,36.0,,,25.0,11.0,,,,,,36.0,,36.0,37,2023.0
73734,596 METROPOLITAN AVENUE APARTMENTS,1/16/2023,6/30/2023,1007834.0,596,METROPOLITAN AVENUE,Brooklyn,11211.0,3027620005.0,3322912.0,BK-01,34.0,503.0,BK0104,40.714093,-73.94898,40.713846,-73.949001,2023-06-30,New Construction,No,Non Prevailing Wage,,,,,4.0,,,4.0,,,,,,,4.0,,4.0,12,2023.0
73736,2441 CROTONA AVENUE APARTMENTS,1/16/2023,3/4/2024,1008796.0,2441,CROTONA AVENUE,Bronx,10458.0,2031050041.0,2130595.0,BX-06,15.0,389.0,BX0603,40.855034,-73.883074,40.855463,-73.883275,2024-03-04,New Construction,No,Non Prevailing Wage,,,,,17.0,,3.0,12.0,1.0,1.0,,,,,17.0,,17.0,50,2024.0
73738,2427 CROTONA AVENUE,1/16/2023,7/17/2023,59958.0,2427,CROTONA AVENUE,Bronx,10458.0,2031050047.0,2012919.0,BX-06,15.0,389.0,BX0603,40.854757,-73.883215,40.854925,-73.883414,2023-07-17,New Construction,No,Non Prevailing Wage,,,,,6.0,,,6.0,,,,,,,6.0,,6.0,17,2023.0
74193,438 UNION AVENUE,1/16/2023,8/22/2023,1007606.0,438,UNION AVENUE,Brooklyn,11211.0,3027610005.0,3068769.0,BK-01,34.0,513.0,BK0102,40.713455,-73.951519,40.713529,-73.951202,2023-08-22,New Construction,No,Non Prevailing Wage,,,,,4.0,,,4.0,,,,,,,4.0,,4.0,13,2023.0
73737,1777 WEEKS AVENUE,1/13/2023,4/30/2025,120826.0,1777,WEEKS AVENUE,Bronx,10457.0,2027960037.0,2129689.0,BX-05,14.0,22901.0,BX0502,40.846207,-73.90745,40.84626,-73.907714,2025-04-30,New Construction,No,Non Prevailing Wage,,,,,14.0,,6.0,8.0,,,,,,,14.0,,14.0,45,2025.0
74194,3573 LACONIA AVENUE APARTMENTS,1/12/2023,9/6/2023,1009236.0,3573,LACONIA AVENUE,Bronx,10469.0,2046950070.0,2059316.0,BX-12,12.0,368.0,BX1201,40.875733,-73.854706,40.875925,-73.854973,2023-09-06,New Construction,No,Non Prevailing Wage,,,,,6.0,,1.0,2.0,3.0,,,,,,6.0,,6.0,20,2023.0
73740,1677 TOWNSEND AVENUE,1/10/2023,6/22/2023,1007186.0,1677,TOWNSEND AVENUE,Bronx,10453.0,2028480024.0,2008159.0,BX-05,14.0,22701.0,BX0502,40.845986,-73.912438,40.845937,-73.912778,2023-06-22,New Construction,No,Non Prevailing Wage,,,,,34.0,,13.0,1.0,14.0,6.0,,,,,34.0,,34.0,35,2023.0
73741,69 AMBOY STREET,1/9/2023,7/27/2023,1008057.0,69,AMBOY STREET,Brooklyn,11212.0,3035180133.0,3429479.0,BK-16,41.0,902.0,BK1602,40.668507,-73.91434,40.668784,-73.914135,2023-07-27,New Construction,No,Non Prevailing Wage,,,,,8.0,,2.0,6.0,,,,,,,8.0,,8.0,9,2023.0
73742,4829-4831 WHITE PLAINS ROAD,1/9/2023,6/22/2023,1006597.0,4829,WHITE PLAINS ROAD,Bronx,10470.0,2051100102.0,2130656.0,BX-12,11.0,414.0,BX1203,40.906595,-73.848829,40.906787,-73.849016,2023-06-22,New Construction,No,Non Prevailing Wage,,,,,3.0,,,3.0,,,,,,,3.0,,3.0,10,2023.0
73742,4829-4831 WHITE PLAINS ROAD,1/9/2023,6/22/2023,1006649.0,4831,WHITE PLAINS ROAD,Bronx,10470.0,2051100001.0,2071813.0,BX-12,11.0,414.0,BX1203,40.90663,-73.8488,40.906877,-73.848933,2023-06-22,New Construction,No,Non Prevailing Wage,,,,,3.0,,,3.0,,,,,,,3.0,,3.0,10,2023.0
73744,113 E 184TH STREET,1/6/2023,12/27/2024,66573.0,113,EAST 184 STREET,Bronx,10468.0,2031730064.0,2013917.0,BX-05,14.0,23703.0,BX0503,40.859823,-73.900313,40.859944,-73.899944,2024-12-27,New Construction,No,Non Prevailing Wage,,,,,16.0,,8.0,8.0,,,,,,,16.0,,16.0,51,2024.0
74196,17-11 HANCOCK STREET,1/5/2023,11/2/2023,1007176.0,1711,HANCOCK STREET,Queens,11385.0,4035600045.0,4085882.0,QN-05,34.0,553.0,QN0502,40.699534,-73.904545,40.699803,-73.904577,2023-11-02,New Construction,No,Non Prevailing Wage,,,,,18.0,,,15.0,3.0,,,,,,18.0,,18.0,60,2023.0
73751,11 LEWIS AVENUE,1/4/2023,7/14/2023,324753.0,11,LEWIS AVENUE,Brooklyn,11206.0,3015820002.0,3427315.0,BK-03,36.0,287.0,BK0302,40.697617,-73.937982,40.697666,-73.937683,2023-07-14,New Construction,No,Non Prevailing Wage,,,,,4.0,,4.0,,,,,,,,4.0,,4.0,13,2023.0
73753,3327 WHITE PLAINS ROAD,1/3/2023,6/20/2025,123251.0,3327,WHITE PLAINS ROAD,Bronx,10467.0,2046240049.0,2000000.0,BX-12,12.0,374.0,BX1201,40.874054,-73.867083,40.874044,-73.867449,2025-06-20,New Construction,No,Non Prevailing Wage,,,,,7.0,,1.0,3.0,3.0,,,,,,7.0,,7.0,22,2025.0
73326,2316 CLARENDON ROAD,12/30/2022,8/28/2024,220777.0,2316,CLARENDON ROAD,Brooklyn,11226.0,3051890007.0,3119670.0,BK-14,45.0,79001.0,BK1401,40.642836,-73.955239,40.642603,-73.954857,2024-08-28,New Construction,No,Non Prevailing Wage,,,,,5.0,,,2.0,3.0,,,,,,5.0,,5.0,15,2024.0
73324,659 EAST 222 STREET,12/28/2022,1/5/2024,1007124.0,659,EAST 222 STREET,Bronx,10467.0,2048240025.0,2130470.0,BX-12,12.0,394.0,BX1201,40.886192,-73.863179,40.886381,-73.8629,2024-01-05,New Construction,No,Non Prevailing Wage,,,,,3.0,,1.0,2.0,,,,,,,3.0,,3.0,10,2024.0
73323,130 HOPE STREET,12/27/2022,5/29/2024,983645.0,130,HOPE STREET,Brooklyn,11211.0,3023860007.0,3428907.0,BK-01,34.0,513.0,BK0102,40.712207,-73.953118,40.71207,-73.953382,2024-05-29,New Construction,No,Non Prevailing Wage,,,,,43.0,,8.0,22.0,10.0,3.0,,,,,43.0,,43.0,143,2024.0
73755,3301 NEWKIRK AVE _HPS,12/27/2022,8/9/2023,343520.0,1335,NEW YORK AVENUE,Brooklyn,11203.0,3049670025.0,3000000.0,BK-17,45.0,830.0,BK1702,40.640513,-73.945551,40.640315,-73.945249,2023-08-09,New Construction,No,Non Prevailing Wage,,,,,3.0,,,3.0,,,,,,,3.0,,3.0,9,2023.0
71471,HP BRIARWOOD HDFC.HPO.FY23,12/23/2022,12/23/2022,548350.0,80-09,134 STREET,Queens,11435.0,4096630002.0,4206529.0,QN-08,24.0,22001.0,QN0805,40.715527,-73.82435,40.715463,-73.823838,2022-12-23,Preservation,Yes,Non Prevailing Wage,,22.0,88.0,79.0,3.0,,22.0,100.0,69.0,1.0,,,,,192.0,,192.0,192,2022.0
71471,HP BRIARWOOD HDFC.HPO.FY23,12/23/2022,12/23/2022,548357.0,81-09,134 STREET,Queens,11435.0,4096630020.0,4206530.0,QN-08,24.0,22001.0,QN0805,40.714379,-73.823884,40.714697,-73.823555,2022-12-23,Preservation,Yes,Non Prevailing Wage,1.0,18.0,89.0,78.0,4.0,,22.0,100.0,68.0,,,,,,190.0,,190.0,190,2022.0
71703,FINCH GROUP. 4746-4750 WHITE PLAINS RD. WAKEFIELD SENIORS,12/23/2022,12/23/2024,1004586.0,4750,WHITE PLAINS ROAD,Bronx,10470.0,2051130031.0,2000000.0,BX-12,11.0,442.0,BX1203,40.904834,-73.849625,40.904753,-73.849252,2024-12-23,New Construction,No,Prevailing Wage,72.0,,,,,1.0,71.0,1.0,1.0,,,,,,73.0,,73.0,73,2024.0
72746,BORINQUEN COURT ASSOCIATES LP.HUDMF.FY23,12/23/2022,12/23/2022,62749.0,285,EAST 138 STREET,Bronx,10454.0,2023140010.0,2000689.0,BX-01,8.0,39.0,BX0101,40.810666,-73.926487,40.810888,-73.925952,2022-12-23,Preservation,No,Non Prevailing Wage,139.0,5.0,,,,1.0,,122.0,23.0,,,,,,145.0,,145.0,145,2022.0
64415,SPRING CREEK PHASE 4C,12/22/2022,12/13/2024,991851.0,429,VANDALIA AVENUE,Brooklyn,11239.0,3044520110.0,3000000.0,BK-05,42.0,107001.0,BK0504,40.654644,-73.87586,40.654815,-73.876829,2024-10-30,New Construction,No,Non Prevailing Wage,,,8.0,,,,,,1.0,7.0,,,,,8.0,,8.0,8,2024.0
64415,SPRING CREEK PHASE 4C,12/22/2022,12/13/2024,991858.0,71,GATEWAY DRIVE,Brooklyn,11239.0,3044520237.0,3000000.0,BK-05,42.0,107001.0,BK0504,40.654333,-73.877782,40.654448,-73.877551,2024-12-11,New Construction,No,Non Prevailing Wage,,,8.0,,,,,,1.0,7.0,,,,,8.0,,8.0,8,2024.0
64415,SPRING CREEK PHASE 4C,12/22/2022,12/13/2024,991859.0,77,GATEWAY DRIVE,Brooklyn,11239.0,3044520236.0,3000000.0,BK-05,42.0,107001.0,BK0504,40.654204,-73.877789,40.654335,-73.877533,2024-12-13,New Construction,No,Non Prevailing Wage,6.0,2.0,,,,,,1.0,7.0,,,,,,8.0,,8.0,8,2024.0
64415,SPRING CREEK PHASE 4C,12/22/2022,12/13/2024,991860.0,79,GATEWAY DRIVE,Brooklyn,11239.0,3044520234.0,3000000.0,BK-05,42.0,107001.0,BK0504,40.65416,-73.877789,40.654247,-73.877537,2024-12-10,New Construction,No,Non Prevailing Wage,,8.0,,,,,,1.0,7.0,,,,,,8.0,,8.0,8,2024.0
64415,SPRING CREEK PHASE 4C,12/22/2022,12/13/2024,991861.0,81,GATEWAY DRIVE,Brooklyn,11239.0,3044520233.0,3000000.0,BK-05,42.0,107001.0,BK0504,40.654116,-73.877786,40.654157,-73.877544,2024-12-02,New Construction,No,Non Prevailing Wage,5.0,3.0,,,,,,1.0,7.0,,,,,,8.0,,8.0,8,2024.0
64415,SPRING CREEK PHASE 4C,12/22/2022,12/13/2024,991862.0,83,GATEWAY DRIVE,Brooklyn,11239.0,3044520232.0,3000000.0,BK-05,42.0,107001.0,BK0504,40.654072,-73.877782,40.654069,-73.877494,2024-12-02,New Construction,No,Non Prevailing Wage,,,8.0,,,,,1.0,7.0,,,,,,8.0,,8.0,8,2024.0
64415,SPRING CREEK PHASE 4C,12/22/2022,12/13/2024,991863.0,85,GATEWAY DRIVE,Brooklyn,11239.0,3044520231.0,3000000.0,BK-05,42.0,107001.0,BK0504,40.654028,-73.877779,40.653954,-73.877487,2024-11-25,New Construction,No,Non Prevailing Wage,4.0,4.0,,,,,,1.0,7.0,,,,,,8.0,,8.0,8,2024.0
64415,SPRING CREEK PHASE 4C,12/22/2022,12/13/2024,991864.0,87,GATEWAY DRIVE,Brooklyn,11239.0,3044520230.0,3000000.0,BK-05,42.0,107001.0,BK0504,40.653987,-73.877775,40.653849,-73.877465,2024-11-25,New Construction,No,Non Prevailing Wage,,,8.0,,,,1.0,1.0,6.0,,,,,,8.0,,8.0,8,2024.0
64415,SPRING CREEK PHASE 4C,12/22/2022,12/13/2024,991865.0,89,GATEWAY DRIVE,Brooklyn,11239.0,3044520229.0,3000000.0,BK-05,42.0,107001.0,BK0504,40.653943,-73.877768,40.653756,-73.87744,2024-11-25,New Construction,No,Non Prevailing Wage,3.0,5.0,,,,,,1.0,7.0,,,,,,8.0,,8.0,8,2024.0
64415,SPRING CREEK PHASE 4C,12/22/2022,12/13/2024,991866.0,91,GATEWAY DRIVE,Brooklyn,11239.0,3044520228.0,3000000.0,BK-05,42.0,107001.0,BK0504,40.653899,-73.877757,40.653668,-73.877404,2024-12-10,New Construction,No,Non Prevailing Wage,,,8.0,,,,,1.0,7.0,,,,,,8.0,,8.0,8,2024.0
64415,SPRING CREEK PHASE 4C,12/22/2022,12/13/2024,991867.0,93,GATEWAY DRIVE,Brooklyn,11239.0,3044520227.0,3000000.0,BK-05,42.0,107001.0,BK0504,40.653858,-73.877747,40.653583,-73.877369,2024-11-25,New Construction,No,Non Prevailing Wage,6.0,2.0,,,,,,1.0,7.0,,,,,,8.0,,8.0,8,2024.0
64415,SPRING CREEK PHASE 4C,12/22/2022,12/13/2024,991868.0,95,GATEWAY DRIVE,Brooklyn,11239.0,3044520226.0,3000000.0,BK-05,42.0,107001.0,BK0504,40.653814,-73.877736,40.653498,-73.877326,2024-11-25,New Construction,No,Non Prevailing Wage,,,8.0,,,,,1.0,7.0,,,,,,8.0,,8.0,8,2024.0
64415,SPRING CREEK PHASE 4C,12/22/2022,12/13/2024,991869.0,406,VANDALIA AVENUE,Brooklyn,11239.0,3044520204.0,3000000.0,BK-05,42.0,107001.0,BK0504,40.65456,-73.877097,40.654324,-73.87731,2024-10-24,New Construction,No,Non Prevailing Wage,,,8.0,,,,1.0,1.0,6.0,,,,,,8.0,,8.0,8,2024.0
64415,SPRING CREEK PHASE 4C,12/22/2022,12/13/2024,991870.0,408,VANDALIA AVENUE,Brooklyn,11239.0,3044520205.0,3000000.0,BK-05,42.0,107001.0,BK0504,40.654546,-73.876992,40.654316,-73.877187,2024-10-31,New Construction,No,Non Prevailing Wage,5.0,3.0,,,,,1.0,1.0,6.0,,,,,,8.0,,8.0,8,2024.0
64415,SPRING CREEK PHASE 4C,12/22/2022,12/13/2024,991872.0,410,VANDALIA AVENUE,Brooklyn,11239.0,3044520206.0,3000000.0,BK-05,42.0,107001.0,BK0504,40.654538,-73.876884,40.654313,-73.877068,2024-10-25,New Construction,No,Non Prevailing Wage,,,8.0,,,,,1.0,7.0,,,,,,8.0,,8.0,8,2024.0
64415,SPRING CREEK PHASE 4C,12/22/2022,12/13/2024,991873.0,412,VANDALIA AVENUE,Brooklyn,11239.0,3044520207.0,3000000.0,BK-05,42.0,107001.0,BK0504,40.654532,-73.876776,40.65431,-73.876935,2024-10-25,New Construction,No,Non Prevailing Wage,4.0,4.0,,,,,1.0,1.0,6.0,,,,,,8.0,,8.0,8,2024.0
64415,SPRING CREEK PHASE 4C,12/22/2022,12/13/2024,991874.0,414,VANDALIA AVENUE,Brooklyn,11239.0,3044520249.0,3000000.0,BK-05,42.0,107001.0,BK0504,40.654526,-73.876642,40.65423,-73.876621,2024-09-10,New Construction,No,Non Prevailing Wage,,,8.0,,,,1.0,1.0,6.0,,,,,,8.0,,8.0,8,2024.0
64415,SPRING CREEK PHASE 4C,12/22/2022,12/13/2024,991875.0,416,VANDALIA AVENUE,Brooklyn,11239.0,3044520250.0,3000000.0,BK-05,42.0,107001.0,BK0504,40.654529,-73.87652,40.654271,-73.876488,2024-09-06,New Construction,No,Non Prevailing Wage,4.0,4.0,,,,,,1.0,7.0,,,,,,8.0,,8.0,8,2024.0
64415,SPRING CREEK PHASE 4C,12/22/2022,12/13/2024,991876.0,418,VANDALIA AVENUE,Brooklyn,11239.0,3044520251.0,3000000.0,BK-05,42.0,107001.0,BK0504,40.654534,-73.876397,40.654296,-73.876373,2024-09-10,New Construction,No,Non Prevailing Wage,,,8.0,,,,,1.0,7.0,,,,,,8.0,,8.0,8,2024.0
64415,SPRING CREEK PHASE 4C,12/22/2022,12/13/2024,991877.0,422,VANDALIA AVENUE,Brooklyn,11239.0,3044520252.0,3000000.0,BK-05,42.0,107001.0,BK0504,40.654564,-73.876152,40.654331,-73.876225,2024-09-10,New Construction,No,Non Prevailing Wage,5.0,3.0,,,,,,,1.0,7.0,,,,,8.0,,8.0,8,2024.0
64415,SPRING CREEK PHASE 4C,12/22/2022,12/13/2024,991879.0,433,VANDALIA AVENUE,Brooklyn,11239.0,3044520111.0,3000000.0,BK-05,42.0,107001.0,BK0504,40.65466,-73.875792,40.65485,-73.876689,2024-10-30,New Construction,No,Non Prevailing Wage,,8.0,,,,,,1.0,7.0,,,,,,8.0,,8.0,8,2024.0
64415,SPRING CREEK PHASE 4C,12/22/2022,12/13/2024,991880.0,435,VANDALIA AVENUE,Brooklyn,11239.0,3044520112.0,3000000.0,BK-05,42.0,107001.0,BK0504,40.654671,-73.875763,40.654875,-73.876573,2024-11-15,New Construction,No,Non Prevailing Wage,,,7.0,,,1.0,,1.0,7.0,,,,,,8.0,,8.0,8,2024.0
64415,SPRING CREEK PHASE 4C,12/22/2022,12/13/2024,991881.0,437,VANDALIA AVENUE,Brooklyn,11239.0,3044520113.0,3000000.0,BK-05,42.0,107001.0,BK0504,40.654679,-73.87573,40.654902,-73.876458,2024-11-01,New Construction,No,Non Prevailing Wage,4.0,4.0,,,,,,1.0,7.0,,,,,,8.0,,8.0,8,2024.0
64415,SPRING CREEK PHASE 4C,12/22/2022,12/13/2024,991882.0,441,VANDALIA AVENUE,Brooklyn,11239.0,3044520114.0,3000000.0,BK-05,42.0,107001.0,BK0504,40.654701,-73.875665,40.654899,-73.876332,2024-08-30,New Construction,No,Non Prevailing Wage,,,8.0,,,,1.0,1.0,6.0,,,,,,8.0,,8.0,8,2024.0
64415,SPRING CREEK PHASE 4C,12/22/2022,12/13/2024,991883.0,451,VANDALIA AVENUE,Brooklyn,11239.0,3044520115.0,3000000.0,BK-05,42.0,107001.0,BK0504,40.654759,-73.875514,40.654858,-73.876119,2024-07-24,New Construction,No,Non Prevailing Wage,6.0,2.0,,,,,1.0,1.0,6.0,,,,,,8.0,,8.0,8,2024.0
64415,SPRING CREEK PHASE 4C,12/22/2022,12/13/2024,991884.0,455,VANDALIA AVENUE,Brooklyn,11239.0,3044520116.0,3000000.0,BK-05,42.0,107001.0,BK0504,40.654786,-73.875453,40.654915,-73.875961,2024-07-24,New Construction,No,Non Prevailing Wage,,,8.0,,,,,1.0,7.0,,,,,,8.0,,8.0,8,2024.0
64415,SPRING CREEK PHASE 4C,12/22/2022,12/13/2024,991885.0,457,VANDALIA AVENUE,Brooklyn,11239.0,3044520117.0,3000000.0,BK-05,42.0,107001.0,BK0504,40.6548,-73.875424,40.654957,-73.875856,2024-07-24,New Construction,No,Non Prevailing Wage,5.0,3.0,,,,,,1.0,7.0,,,,,,8.0,,8.0,8,2024.0
64415,SPRING CREEK PHASE 4C,12/22/2022,12/13/2024,991886.0,459,VANDALIA AVENUE,Brooklyn,11239.0,3044520118.0,3000000.0,BK-05,42.0,107001.0,BK0504,40.654813,-73.875395,40.654995,-73.875748,2024-07-25,New Construction,No,Non Prevailing Wage,,,8.0,,,,1.0,1.0,6.0,,,,,,8.0,,8.0,8,2024.0
64415,SPRING CREEK PHASE 4C,12/22/2022,12/13/2024,991887.0,461,VANDALIA AVENUE,Brooklyn,11239.0,3044520119.0,3000000.0,BK-05,42.0,107001.0,BK0504,40.654827,-73.875366,40.655039,-73.875647,2024-07-24,New Construction,No,Non Prevailing Wage,5.0,3.0,,,,,,1.0,7.0,,,,,,8.0,,8.0,8,2024.0
64415,SPRING CREEK PHASE 4C,12/22/2022,12/13/2024,991889.0,465,VANDALIA AVENUE,Brooklyn,11239.0,3044520121.0,3000000.0,BK-05,42.0,107001.0,BK0504,40.654857,-73.875308,40.655093,-73.875524,2024-07-31,New Construction,No,Non Prevailing Wage,,,8.0,,,,,,1.0,7.0,,,,,8.0,,8.0,8,2024.0
67005,IMPACCT BK. 776-780 MYRTLE AVE,12/22/2022,1/31/2025,998808.0,778,MYRTLE AVENUE,Brooklyn,11206.0,3017540020.0,3000000.0,BK-03,36.0,253.0,BK0301,40.695079,-73.95176,40.694895,-73.951288,2024-10-18,New Construction,No,Non Prevailing Wage,36.0,8.0,15.0,,,1.0,45.0,8.0,7.0,,,,,,60.0,,60.0,60,2024.0
69325,TBX1002-MBD,12/22/2022,,45452.0,970,ANDERSON AVENUE,Bronx,10452.0,2025040070.0,2003046.0,BX-04,16.0,189.0,BX0402,40.831609,-73.927667,40.831595,-73.927269,2024-10-17,Preservation,No,Non Prevailing Wage,7.0,,1.0,,,1.0,,,1.0,8.0,,,,,9.0,,9.0,9,2024.0
69325,TBX1002-MBD,12/22/2022,,53581.0,1120,BRYANT AVENUE,Bronx,10459.0,2027540061.0,2006204.0,BX-03,17.0,12101.0,BX0303,40.826953,-73.888854,40.827005,-73.888727,2025-02-14,Preservation,No,Non Prevailing Wage,,10.0,1.0,,,,,1.0,,10.0,,,,,11.0,,11.0,11,2025.0
69325,TBX1002-MBD,12/22/2022,,115154.0,1105,TINTON AVENUE,Bronx,10456.0,2026610052.0,2004707.0,BX-03,17.0,135.0,BX0301,40.826737,-73.901457,40.826674,-73.901747,2024-12-05,Preservation,No,Non Prevailing Wage,9.0,16.0,20.0,,,1.0,,29.0,17.0,,,,,,46.0,,46.0,46,2024.0
70054,1305 MORRIS AVENUE HDFC.YR15.FY23,12/22/2022,12/22/2022,994213.0,1305,MORRIS AVENUE,Bronx,10456.0,2028160066.0,2114110.0,BX-04,16.0,17902.0,BX0403,40.835976,-73.912517,40.835881,-73.912907,2022-12-22,Preservation,Yes,Non Prevailing Wage,45.0,1.0,18.0,10.0,,,74.0,,,,,,,,74.0,,74.0,74,2022.0
73322,187 20 STREET,12/22/2022,5/10/2024,144990.0,187,20 STREET,Brooklyn,11232.0,3006370076.0,3388089.0,BK-07,38.0,143.0,BK0702,40.662884,-73.994456,40.663104,-73.994363,2024-05-10,New Construction,No,Non Prevailing Wage,,,,,3.0,,,3.0,,,,,,,3.0,,3.0,8,2024.0
63260,ENNIS FRANCIS III B1,12/20/2022,10/2/2024,1006138.0,212,WEST 124 STREET,Manhattan,10027.0,1019290057.0,1091647.0,MN-10,9.0,222.0,MN1001,40.808595,-73.949557,40.808661,-73.950283,2024-10-02,New Construction,No,Non Prevailing Wage,51.0,43.0,74.0,,,1.0,81.0,43.0,45.0,,,,,,169.0,,169.0,169,2024.0
68462,BEACH GREEN DUNES 3,12/19/2022,4/8/2025,1004802.0,35-01,BEACH CHANNEL DRIVE,Queens,11691.0,4158250007.0,4000000.0,QN-14,31.0,992.0,QN1401,40.596262,-73.767871,40.595884,-73.768193,2025-04-08,New Construction,No,Non Prevailing Wage,37.0,43.0,65.0,,,1.0,36.0,70.0,37.0,3.0,,,,,146.0,,146.0,146,2025.0
73321,1757 BROOKLYN AVE,12/19/2022,11/15/2023,1007125.0,1757,BROOKLYN AVENUE,Brooklyn,11210.0,3075820012.0,3429101.0,BK-18,45.0,776.0,BK1801,40.630171,-73.94155,40.630207,-73.941247,2023-11-15,New Construction,No,Non Prevailing Wage,,,,,4.0,,1.0,1.0,2.0,,,,,,4.0,,4.0,9,2023.0
71949,772 E 168TH STREET.YR15.FY23,12/16/2022,12/16/2022,878031.0,772,EAST 168 STREET,Bronx,10456.0,2026620019.0,2113382.0,BX-03,17.0,135.0,BX0301,40.829231,-73.900753,40.828971,-73.900764,2022-12-16,Preservation,Yes,Non Prevailing Wage,53.0,6.0,,,,1.0,60.0,,,,,,,,60.0,,60.0,60,2022.0
73320,329-335 LINDEN BOULEVARD APARTMENTS,12/16/2022,7/14/2023,327272.0,335,LINDEN BOULEVARD,Brooklyn,11226.0,3048530075.0,3000000.0,BK-17,40.0,818.0,BK1701,40.652783,-73.947311,40.653074,-73.947156,2023-07-14,New Construction,No,Non Prevailing Wage,,,,,13.0,,,6.0,7.0,,,,,,13.0,,13.0,41,2023.0
62194,ATLANTIC CHESTNUT - LOT 2,12/15/2022,,1006279.0,254,EUCLID AVENUE,Brooklyn,11208.0,3041430002.0,3000000.0,BK-05,37.0,1178.0,BK0501,40.682273,-73.873905,40.681903,-73.874468,2025-04-16,New Construction,No,Non Prevailing Wage,109.0,109.0,217.0,,,1.0,60.0,154.0,155.0,67.0,,,,,436.0,,436.0,436,2025.0
70189,SHERWOOD LLC.HUDMF.FY23,12/15/2022,4/2/2025,445366.0,99-11,57 AVENUE,Queens,11368.0,4019090001.0,4431639.0,QN-04,21.0,44301.0,QN0402,40.738453,-73.859834,40.738961,-73.859822,2025-04-02,Preservation,No,Non Prevailing Wage,58.0,5.0,2.0,3.0,,1.0,6.0,24.0,31.0,7.0,1.0,,,,69.0,,69.0,69,2025.0
70189,SHERWOOD LLC.HUDMF.FY23,12/15/2022,4/2/2025,642307.0,60-15,CALLOWAY STREET,Queens,11368.0,4019560029.0,4048141.0,QN-04,21.0,43702.0,QN0402,40.737232,-73.855744,40.737314,-73.855336,2025-04-02,Preservation,No,Non Prevailing Wage,55.0,8.0,3.0,,,1.0,12.0,12.0,37.0,6.0,,,,,67.0,,67.0,67,2025.0
70189,SHERWOOD LLC.HUDMF.FY23,12/15/2022,4/2/2025,951629.0,55-15,99 STREET,Queens,11368.0,4019090001.0,4431640.0,QN-04,21.0,44301.0,QN0402,40.739025,-73.860399,40.738961,-73.859822,2025-04-02,Preservation,No,Non Prevailing Wage,58.0,6.0,4.0,1.0,,,7.0,24.0,32.0,6.0,,,,,69.0,,69.0,69,2025.0
69291,1700 HARRISON LLC.YR15.FY23,12/14/2022,12/14/2022,83648.0,1700,HARRISON AVENUE,Bronx,10453.0,2028670060.0,2008505.0,BX-05,14.0,21502.0,BX0501,40.848969,-73.914813,40.849092,-73.91439,2022-12-14,Preservation,No,Non Prevailing Wage,,45.0,33.0,,,1.0,,8.0,49.0,22.0,,,,,79.0,,79.0,79,2022.0
69422,1730 HARRISON LLC.YR15.FY23,12/14/2022,12/14/2022,83650.0,1730,HARRISON AVENUE,Bronx,10453.0,2028670070.0,2008506.0,BX-05,14.0,21502.0,BX0501,40.849218,-73.914646,40.849619,-73.913963,2022-12-14,Preservation,No,Non Prevailing Wage,,54.0,22.0,,,1.0,1.0,28.0,43.0,5.0,,,,,77.0,,77.0,77,2022.0
73248,3321 GLENWOOD ROAD APARTMENTS,12/14/2022,6/21/2023,1006823.0,3321,GLENWOOD ROAD,Brooklyn,11210.0,3050080001.0,3429240.0,BK-17,45.0,784.0,BK1702,40.634202,-73.944598,40.634482,-73.944112,2023-06-21,New Construction,No,Non Prevailing Wage,,,,,9.0,,,5.0,4.0,,,,,,9.0,,9.0,27,2023.0
73756,440 E 115TH STREET APARTMENTS,12/14/2022,9/6/2023,1007285.0,440,EAST 115 STREET,Manhattan,10029.0,1017080033.0,1090220.0,MN-11,8.0,178.0,MN1102,40.794897,-73.93493,40.79457,-73.934685,2023-09-06,New Construction,No,Non Prevailing Wage,,,,,5.0,,1.0,1.0,3.0,,,,,,5.0,,5.0,15,2023.0
72135,16 DUPONT STREET,12/12/2022,5/29/2025,1006239.0,16,DUPONT STREET,Brooklyn,11222.0,3024940006.0,3000000.0,BK-01,33.0,56302.0,BK0101,40.735419,-73.95985,40.735205,-73.959716,2025-05-29,New Construction,No,Non Prevailing Wage,,,37.0,,,,9.0,9.0,19.0,,,,,,37.0,,37.0,381,2025.0
73300,25-15 36 STREET APARTMENTS,12/9/2022,6/5/2024,972645.0,25-15,36 STREET,Queens,11103.0,4006520035.0,4010087.0,QN-01,22.0,6502.0,QN0103,40.768899,-73.914222,40.768833,-73.913948,2024-06-05,New Construction,No,Non Prevailing Wage,,,,,3.0,,,2.0,1.0,,,,,,3.0,,3.0,7,2024.0
73314,25-56 97 STREET APARTMENTS,12/9/2022,11/28/2023,1006526.0,25-56,97 STREET,Queens,11369.0,4013700038.0,4032662.0,QN-03,21.0,361.0,QN0302,40.76291,-73.872417,40.762908,-73.872767,2023-11-28,New Construction,No,Non Prevailing Wage,,,,,3.0,,,,3.0,,,,,,3.0,,3.0,8,2023.0
74197,8 COURT SQUARE APARTMENTS,12/8/2022,4/10/2025,432643.0,27-10,44 DRIVE,Queens,11101.0,4000810005.0,4000000.0,QN-02,26.0,1901.0,QN0201,40.746865,-73.94222,40.746668,-73.942484,2025-04-10,New Construction,No,Non Prevailing Wage,,,,,48.0,,17.0,25.0,6.0,,,,,,48.0,,48.0,157,2025.0
73246,1215 FULTON STREET,12/7/2022,8/28/2024,1009578.0,1215,FULTON AVENUE,Bronx,10456.0,2026090033.0,2130365.0,BX-03,16.0,145.0,BX0302,40.830338,-73.904712,40.830574,-73.904939,2024-08-28,New Construction,No,Non Prevailing Wage,,,,,10.0,,2.0,3.0,5.0,,,,,,10.0,,10.0,31,2024.0
73296,61 THOMPSON STREET,12/7/2022,7/24/2024,988134.0,61,THOMPSON STREET,Staten Island,10304.0,5005240039.0,5174441.0,SI-01,49.0,27.0,SI0102,40.625934,-74.076127,40.626115,-74.076192,2024-07-24,New Construction,No,Non Prevailing Wage,,,,,9.0,,,8.0,,1.0,,,,,9.0,,9.0,10,2024.0
73757,1701 CLAY AVENUE APARTMENTS_HPS,12/5/2022,4/15/2024,56959.0,1701,CLAY AVENUE,Bronx,10457.0,2027900049.0,2129660.0,BX-04,15.0,22902.0,BX0403,40.84424,-73.904883,40.844276,-73.905176,2024-04-15,New Construction,No,Non Prevailing Wage,,,,,16.0,,5.0,5.0,5.0,1.0,,,,,16.0,,16.0,17,2024.0
73313,422 EAST 31 STREET,12/1/2022,7/15/2024,256929.0,422,EAST 31 STREET,Brooklyn,11226.0,3049640016.0,3428876.0,BK-17,45.0,828.0,BK1701,40.640426,-73.947494,40.640451,-73.947778,2024-07-15,New Construction,No,Non Prevailing Wage,,,,,3.0,,,1.0,2.0,,,,,,3.0,,3.0,10,2024.0
73319,3254 PARKSIDE PLACE,12/1/2022,9/28/2023,1007099.0,3254,PARKSIDE PLACE,Bronx,10467.0,2033550061.0,2128980.0,BX-07,11.0,42901.0,BX0703,40.875159,-73.87355,40.87554,-73.873148,2023-09-28,New Construction,No,Non Prevailing Wage,,,,,30.0,,8.0,10.0,9.0,3.0,,,,,30.0,,30.0,98,2023.0
72413,375 DEAN STREET,11/30/2022,9/25/2024,1001963.0,375,DEAN STREET,Brooklyn,11217.0,3009280001.0,3429236.0,BK-06,39.0,12901.0,BK0602,40.682925,-73.978634,40.683134,-73.978565,2024-09-25,New Construction,No,Non Prevailing Wage,,28.0,,5.0,3.0,,7.0,24.0,5.0,,,,,,36.0,,36.0,143,2024.0
74205,1285 EDWARD L GRANT HIGHWAY APARTMENTS,11/30/2022,5/19/2023,839284.0,1285,EDWARD L GRANT HIGHWAY,Bronx,10452.0,2025060100.0,2129283.0,BX-04,16.0,211.0,BX0402,40.83839,-73.921978,40.838536,-73.922296,2023-05-19,New Construction,No,Non Prevailing Wage,,,,,9.0,,,5.0,4.0,,,,,,9.0,,9.0,29,2023.0
73312,28-15 35TH STREET,11/29/2022,7/13/2023,422857.0,28-15,35 STREET,Queens,11103.0,4006290015.0,4623972.0,QN-01,22.0,6502.0,QN0103,40.766727,-73.917091,40.766475,-73.916951,2023-07-13,New Construction,No,Non Prevailing Wage,,,,,6.0,,,6.0,,,,,,,6.0,,6.0,20,2023.0
73318,6020 3RD AVENUE,11/29/2022,10/17/2023,127854.0,6016,3 AVENUE,Brooklyn,11220.0,3057800045.0,3429099.0,BK-07,38.0,22.0,BK0702,40.641718,-74.020744,40.642003,-74.021119,2023-10-17,New Construction,No,Non Prevailing Wage,,,,,16.0,,,1.0,15.0,,,,,,16.0,,16.0,53,2023.0
73758,422 RUTLAND ROAD,11/29/2022,4/5/2023,1006515.0,422,RUTLAND ROAD,Brooklyn,11203.0,3048100018.0,3429437.0,BK-09,40.0,810.0,BK0902,40.659633,-73.946668,40.659428,-73.946625,2023-04-05,New Construction,No,Non Prevailing Wage,,,,,2.0,,,2.0,,,,,,,2.0,,2.0,6,2023.0
73299,104-08 NORTHERN BOULEVARD,11/28/2022,11/22/2024,684494.0,104-08,NORTHERN BOULEVARD,Queens,11368.0,4017190003.0,4042651.0,QN-03,21.0,379.0,QN0303,40.757691,-73.864432,40.757417,-73.864299,2024-11-22,New Construction,No,Non Prevailing Wage,,,,,3.0,,,3.0,,,,,,,3.0,,3.0,7,2024.0
73311,3029 AND 3031 BRONXWOOD AVENUE,11/28/2022,8/1/2024,52399.0,3031,BRONXWOOD AVENUE,Bronx,10469.0,2045730038.0,2055725.0,BX-12,12.0,340.0,BX1104,40.870087,-73.861429,40.870639,-73.861685,2024-08-01,New Construction,No,Non Prevailing Wage,,,,,3.0,,1.0,2.0,,,,,,,3.0,,3.0,8,2024.0
73311,3029 AND 3031 BRONXWOOD AVENUE,11/28/2022,8/1/2024,1007120.0,3029,BRONXWOOD AVENUE,Bronx,10469.0,2045730138.0,2130396.0,BX-12,12.0,340.0,BX1104,40.870068,-73.861429,40.87057,-73.861764,2024-08-01,New Construction,No,Non Prevailing Wage,,,,,3.0,,,3.0,,,,,,,3.0,,3.0,8,2024.0
71243,2508 FOSTER AVENUE,11/23/2022,5/22/2025,999221.0,2508,FOSTER AVENUE,Brooklyn,11210.0,3052270017.0,3000000.0,BK-14,45.0,78801.0,BK1401,40.638416,-73.953228,40.638161,-73.952987,2025-05-22,New Construction,No,Non Prevailing Wage,,,9.0,,46.0,,4.0,5.0,31.0,15.0,,,,,55.0,,55.0,55,2025.0
71450,369 ETNA STREET BROOKLYN.PPP.FY.23,11/22/2022,7/27/2023,290282.0,369,ETNA STREET,Brooklyn,11208.0,3041080089.0,3091150.0,BK-05,37.0,118201.0,BK0501,40.687652,-73.870397,40.687849,-73.870437,2023-07-27,Preservation,No,Non Prevailing Wage,,,1.0,,,2.0,,,,3.0,,,,,2.0,1.0,3.0,3,2023.0
71833,106 GERRY STREET,11/22/2022,11/21/2024,819577.0,106,GERRY STREET,Brooklyn,11206.0,3022700001.0,3061454.0,BK-01,33.0,507.0,BK0103,40.702358,-73.946049,40.702141,-73.945739,2024-11-21,Preservation,No,Non Prevailing Wage,,,45.0,,,,,,24.0,21.0,,,,,45.0,,45.0,46,2024.0
74133,2061 CROTONA AVENUE,11/22/2022,5/15/2024,1006446.0,2061,CROTONA AVENUE,Bronx,10457.0,2030800099.0,2130820.0,BX-06,15.0,373.0,BX0602,40.847503,-73.889383,40.847603,-73.889665,2024-05-15,New Construction,No,Non Prevailing Wage,,,,,26.0,,6.0,3.0,6.0,11.0,,,,,26.0,,26.0,26,2024.0
73759,LINCOLN AT BANKSIDE APARTMENTS,11/21/2022,6/18/2025,92017.0,101,LINCOLN AVENUE,Bronx,10454.0,2023160001.0,2130763.0,BX-01,8.0,1901.0,BX0101,40.807149,-73.929969,40.807509,-73.93068,2025-06-18,New Construction,No,Non Prevailing Wage,,,,,277.0,,57.0,138.0,71.0,11.0,,,,,277.0,,277.0,921,2025.0
71519,139 E 38TH STREET.PPP.FY23,11/17/2022,2/9/2023,261513.0,139,EAST 38 STREET,Brooklyn,11203.0,3048590047.0,3108220.0,BK-17,40.0,814.0,BK1703,40.653958,-73.942178,40.654015,-73.941918,2023-02-09,Preservation,No,Non Prevailing Wage,,,1.0,,,,,,,1.0,,,,,,1.0,1.0,1,2023.0
68726,SOUTHERN & WILLIS.YR15.FY23,11/16/2022,10/4/2023,63011.0,401,EAST 140 STREET,Bronx,10454.0,2022850001.0,2000331.0,BX-01,8.0,39.0,BX0101,40.810191,-73.921415,40.810366,-73.92156,2023-10-04,Preservation,No,Non Prevailing Wage,,7.0,,,,1.0,,,3.0,5.0,,,,,8.0,,8.0,8,2023.0
68726,SOUTHERN & WILLIS.YR15.FY23,11/16/2022,10/4/2023,63260.0,520,EAST 142 STREET,Bronx,10454.0,2022680013.0,2000095.0,BX-01,8.0,41.0,BX0101,40.810163,-73.917055,40.80996,-73.917128,2023-10-04,Preservation,No,Non Prevailing Wage,,9.0,,,,,,8.0,,1.0,,,,,9.0,,9.0,9,2023.0
68726,SOUTHERN & WILLIS.YR15.FY23,11/16/2022,10/4/2023,110183.0,651,SOUTHERN BOULEVARD,Bronx,10455.0,2026830090.0,2005090.0,BX-02,17.0,83.0,BX0202,40.813117,-73.900697,40.813438,-73.9007,2023-10-04,Preservation,No,Non Prevailing Wage,7.0,28.0,5.0,,,1.0,,11.0,28.0,2.0,,,,,41.0,,41.0,41,2023.0
68726,SOUTHERN & WILLIS.YR15.FY23,11/16/2022,10/4/2023,125025.0,304,WILLIS AVENUE,Bronx,10454.0,2022850002.0,2000332.0,BX-01,8.0,39.0,BX0101,40.810559,-73.921823,40.810429,-73.921513,2023-10-04,Preservation,No,Non Prevailing Wage,,15.0,3.0,,,,,8.0,10.0,,,,,,18.0,,18.0,18,2023.0
73760,THIRD AVENUE AND EAST 134TH STREET,11/10/2022,11/20/2024,1002413.0,2457,3 AVENUE,Bronx,10451.0,2023190038.0,2129674.0,BX-01,8.0,51.0,BX0101,40.809112,-73.929812,40.809425,-73.930003,2024-11-20,New Construction,No,Non Prevailing Wage,,,,,43.0,,24.0,1.0,18.0,,,,,,43.0,,43.0,141,2024.0
74135,627 FRANKLIN AVE,11/9/2022,7/11/2023,1009038.0,627,FRANKLIN AVENUE,Brooklyn,11238.0,3012110003.0,3429055.0,BK-08,35.0,221.0,BK0802,40.677031,-73.95566,40.676951,-73.955425,2023-07-11,New Construction,No,Non Prevailing Wage,,,,,3.0,,,,3.0,,,,,,3.0,,3.0,10,2023.0
74136,1661 MADISON AVENUE APARTMENTS,11/8/2022,11/2/2023,1009040.0,1661,MADISON AVENUE,Manhattan,10029.0,1016160052.0,1091690.0,MN-11,8.0,17402.0,MN1101,40.796517,-73.947367,40.796457,-73.947071,2023-11-02,New Construction,No,Non Prevailing Wage,,,,,5.0,,,5.0,,,,,,,5.0,,5.0,14,2023.0
69505,COMUNILIFE. 171 THROOP AVE. WOODHULL II,11/4/2022,9/26/2024,1006443.0,171,THROOP AVENUE,Brooklyn,11206.0,3017230003.0,3000000.0,BK-03,36.0,28501.0,BK0302,40.698685,-73.944029,40.698863,-73.943776,2024-09-26,New Construction,No,Non Prevailing Wage,77.0,,15.0,,,1.0,71.0,22.0,,,,,,,93.0,,93.0,93,2024.0
73252,451 10TH AVENUE,11/3/2022,12/17/2024,5064.0,451,10 AVENUE,Manhattan,10018.0,1007077501.0,1091604.0,MN-04,3.0,9903.0,MN0401,40.755303,-73.998636,40.755619,-73.998892,2024-12-17,New Construction,No,Non Prevailing Wage,,54.0,54.0,27.0,,,64.0,60.0,11.0,,,,,,135.0,,135.0,532,2024.0
73761,282 GRAND STREET APARTMENTS,11/3/2022,8/28/2024,991290.0,286,GRAND STREET,Manhattan,10002.0,1004180051.0,1000000.0,MN-03,1.0,18.0,MN0302,40.717725,-73.992417,40.717933,-73.99237,2024-08-28,New Construction,No,Non Prevailing Wage,,,3.0,,5.0,,,8.0,,,,,,,8.0,,8.0,25,2024.0
71613,DOVID PERL AND CHANA SLAVA PERL.PPP.FY23,11/2/2022,12/22/2022,221476.0,890,CLARKSON AVENUE,Brooklyn,11203.0,3046390106.0,3100914.0,BK-17,41.0,868.0,BK1703,40.656766,-73.928448,40.656541,-73.928441,2022-12-22,Preservation,No,Non Prevailing Wage,,,1.0,,,,,,,,1.0,,,,,1.0,1.0,1,2022.0
74137,269 WALLABOUT STREET,11/2/2022,1/5/2024,997430.0,58,UNION AVENUE,Brooklyn,11206.0,3022490023.0,3428618.0,BK-01,33.0,507.0,BK0103,40.701383,-73.950266,40.701292,-73.949985,2024-01-05,New Construction,No,Non Prevailing Wage,,,,,77.0,,,27.0,24.0,15.0,11.0,,,,77.0,,77.0,77,2024.0
73242,2438 LYVERE STREET,11/1/2022,7/24/2024,979527.0,2438,LYVERE STREET,Bronx,10461.0,2039970046.0,2042240.0,BX-10,18.0,204.0,BX1001,40.842175,-73.852195,40.842065,-73.851614,2024-07-24,New Construction,No,Non Prevailing Wage,,,,,14.0,,2.0,11.0,1.0,,,,,,14.0,,14.0,45,2024.0
73294,433 VERMONT STREET APARTMENTS,11/1/2022,2/1/2023,386731.0,433,VERMONT STREET,Brooklyn,11207.0,3037740114.0,3330434.0,BK-05,42.0,1158.0,BK0502,40.668887,-73.893104,40.669016,-73.892859,2023-02-01,New Construction,No,Non Prevailing Wage,,,,,8.0,,,3.0,5.0,,,,,,8.0,,8.0,11,2023.0
73235,46 STOCKHOLM STREET,10/31/2022,7/11/2023,377737.0,46,STOCKHOLM STREET,Brooklyn,11221.0,3032540011.0,3428829.0,BK-04,34.0,421.0,BK0401,40.696204,-73.926003,40.695897,-73.925968,2023-07-11,New Construction,No,Non Prevailing Wage,,,,,2.0,,,1.0,1.0,,,,,,2.0,,2.0,6,2023.0
73236,363 EAST 145TH STREET,10/31/2022,9/26/2023,63408.0,363,EAST 145 STREET,Bronx,10454.0,2023070030.0,2000667.0,BX-01,8.0,43.0,BX0101,40.813975,-73.920721,40.814068,-73.920374,2023-09-26,New Construction,No,Non Prevailing Wage,,,,,3.0,,,3.0,,,,,,,3.0,,3.0,8,2023.0
71969,1640 PARK AVENUE,10/28/2022,4/23/2025,1006419.0,1638,PARK AVENUE,Manhattan,10029.0,1016220033.0,1000000.0,MN-11,8.0,184.0,MN1102,40.799208,-73.94332,40.799606,-73.943489,2025-04-23,New Construction,No,Non Prevailing Wage,,3.0,3.0,,,,2.0,2.0,2.0,,,,,,6.0,,6.0,24,2025.0
73249,828 NEW YORK AVENUE,10/28/2022,4/4/2024,344032.0,828,NEW YORK AVENUE,Brooklyn,11203.0,3048530060.0,3425679.0,BK-17,40.0,818.0,BK1701,40.653529,-73.946961,40.653548,-73.947296,2024-04-04,New Construction,No,Non Prevailing Wage,,,,,8.0,,,8.0,,,,,,,8.0,,8.0,24,2024.0
73185,1565 NEW YORK,10/27/2022,8/25/2023,989571.0,1565,NEW YORK AVENUE,Brooklyn,11210.0,3050080011.0,3114064.0,BK-17,45.0,784.0,BK1702,40.63477,-73.944933,40.634647,-73.944601,2023-08-25,New Construction,No,Non Prevailing Wage,,,,,7.0,,,4.0,3.0,,,,,,7.0,,7.0,22,2023.0
74138,14-43 31ST AVENUE,10/27/2022,12/7/2023,1007131.0,14-43,31 AVENUE,Queens,11106.0,4005340007.0,4619752.0,QN-01,22.0,79.0,QN0102,40.767686,-73.930671,40.767892,-73.930361,2023-12-07,New Construction,No,Non Prevailing Wage,,,,,7.0,,3.0,4.0,,,,,,,7.0,,7.0,21,2023.0
73230,576 LENOX ROAD APARTMENTS,10/25/2022,11/26/2024,324196.0,576,LENOX ROAD,Brooklyn,11203.0,3048620004.0,3108299.0,BK-17,40.0,814.0,BK1703,40.654815,-73.939031,40.654609,-73.93893,2024-11-26,New Construction,No,Non Prevailing Wage,,,,,3.0,,,1.0,2.0,,,,,,3.0,,3.0,8,2024.0
73240,26-41 3RD STREET,10/25/2022,11/2/2023,399231.0,26-35,3 STREET,Queens,11102.0,4009107502.0,4623290.0,QN-01,22.0,87.0,QN0102,40.77587,-73.933793,40.775198,-73.933884,2023-11-02,New Construction,No,Non Prevailing Wage,,,,,18.0,,2.0,12.0,4.0,,,,,,18.0,,18.0,60,2023.0
73247,82 4TH AVENUE,10/25/2022,9/12/2023,129636.0,82,4 AVENUE,Brooklyn,11217.0,3003890041.0,3429634.0,BK-02,39.0,127.0,BK0601,40.682028,-73.979936,40.682148,-73.980246,2023-09-12,New Construction,No,Non Prevailing Wage,,,,,9.0,,,9.0,,,,,,,9.0,,9.0,28,2023.0
73308,598 EAGLE AVENUE,10/25/2022,9/7/2023,1007123.0,598,EAGLE AVENUE,Bronx,10455.0,2026230021.0,2129315.0,BX-01,17.0,73.0,BX0102,40.81533,-73.911286,40.815195,-73.911041,2023-09-07,New Construction,No,Non Prevailing Wage,,,,,4.0,,3.0,,1.0,,,,,,4.0,,4.0,13,2023.0
73237,124 WITHERS STREET,10/24/2022,4/4/2024,397565.0,124,WITHERS STREET,Brooklyn,11211.0,3027430020.0,3068278.0,BK-01,34.0,501.0,BK0104,40.717139,-73.947101,40.716928,-73.947058,2024-04-04,New Construction,No,Non Prevailing Wage,,,,,5.0,,,5.0,,,,,,,5.0,,5.0,14,2024.0
73762,140 STEBBINS AVENUE APARTMENTS,10/24/2022,2/7/2023,111356.0,1420,STEBBINS AVENUE,Bronx,10459.0,2029650042.0,2126638.0,BX-03,17.0,153.0,BX0303,40.833842,-73.894281,40.834031,-73.89406,2023-02-07,New Construction,No,Non Prevailing Wage,,,,,73.0,,,13.0,37.0,22.0,1.0,,,,73.0,,73.0,73,2023.0
73243,3168 VILLA AVENUE,10/19/2022,12/22/2023,117815.0,3168,VILLA AVENUE,Bronx,10468.0,2033110032.0,2129109.0,BX-07,11.0,411.0,BX0702,40.876331,-73.886974,40.876164,-73.886765,2023-12-22,New Construction,No,Non Prevailing Wage,,,,,14.0,,8.0,5.0,1.0,,,,,,14.0,,14.0,44,2023.0
74139,728 ST LAWRENCE AVENUE APARTMENTS,10/13/2022,1/9/2024,110901.0,728,ST LAWRENCE AVENUE,Bronx,10473.0,2035970025.0,2022128.0,BX-09,18.0,38.0,BX0902,40.82006,-73.86455,40.820397,-73.864351,2024-01-09,New Construction,No,Non Prevailing Wage,,,,,3.0,,,3.0,,,,,,,3.0,,3.0,8,2024.0
69287,TRINITY HOUSE,10/12/2022,11/30/2024,9801.0,100,WEST 92 STREET,Manhattan,10025.0,1012220029.0,1032499.0,MN-07,6.0,177.0,MN0702,40.790446,-73.969766,40.79015,-73.97003,2024-11-30,Preservation,No,Non Prevailing Wage,30.0,121.0,,9.0,,1.0,33.0,58.0,47.0,23.0,,,,,161.0,,161.0,200,2024.0
74140,393 WEIRFILED STREET APARTMENT,10/12/2022,11/22/2024,389703.0,389,WEIRFIELD STREET,Brooklyn,11237.0,3034000068.0,3000000.0,BK-04,37.0,439.0,BK0402,40.695699,-73.90661,40.69608,-73.906649,2024-11-22,New Construction,No,Non Prevailing Wage,,,,,20.0,,3.0,10.0,7.0,,,,,,20.0,,20.0,66,2024.0
73275,319 LENOX ROAD APARTMENTS,10/7/2022,9/26/2023,1006084.0,319,LENOX ROAD,Brooklyn,11226.0,3048370084.0,3107783.0,BK-17,40.0,818.0,BK1701,40.654235,-73.948741,40.654576,-73.948874,2023-09-26,New Construction,No,Non Prevailing Wage,,,,,9.0,,4.0,5.0,,,,,,,9.0,,9.0,28,2023.0
70648,3300 PALMER AVE.HPO.FY23,9/29/2022,9/29/2022,832306.0,3300,PALMER AVENUE,Bronx,10475.0,2052280041.0,2102474.0,BX-12,12.0,46209.0,BX1202,40.878305,-73.834946,40.878613,-73.834789,2022-09-29,Preservation,No,Non Prevailing Wage,,,46.0,74.0,14.0,1.0,,7.0,83.0,45.0,,,,,135.0,,135.0,135,2022.0
73281,1661 SUMMERFIELD AVENUE,9/28/2022,1/31/2023,1004947.0,16-61,SUMMERFIELD STREET,Queens,11385.0,4035540061.0,4623327.0,QN-05,34.0,559.0,QN0502,40.695884,-73.901359,40.696304,-73.901272,2023-01-31,New Construction,No,Non Prevailing Wage,,,,,9.0,,,7.0,2.0,,,,,,9.0,,9.0,28,2023.0
74141,53 EAST 51 STREET,9/28/2022,3/10/2023,1005584.0,53,EAST 51 STREET,Brooklyn,11203.0,3045920029.0,3429171.0,BK-17,41.0,88002.0,BK1703,40.661003,-73.930342,40.66089,-73.930065,2023-03-10,New Construction,No,Non Prevailing Wage,,,,,5.0,,,4.0,1.0,,,,,,5.0,,5.0,6,2023.0
74142,841A MORRIS PARK AVENUE APARTMENTS,9/28/2022,8/31/2023,1009222.0,841A,MORRIS PARK AVENUE,Bronx,10462.0,2040550015.0,2127338.0,BX-11,13.0,232.0,BX1101,40.846252,-73.861204,40.846493,-73.861312,2023-08-31,New Construction,No,Non Prevailing Wage,,,,,3.0,,,3.0,,,,,,,3.0,,3.0,8,2023.0
73763,426 MANHATTAN AVENUE APARTMENTS,9/23/2022,3/20/2023,1005140.0,426,MANHATTAN AVENUE,Brooklyn,11222.0,3027240001.0,3429439.0,BK-01,33.0,499.0,BK0101,40.719132,-73.946862,40.719132,-73.946642,2023-03-20,New Construction,No,Non Prevailing Wage,,,,,10.0,,1.0,6.0,1.0,2.0,,,,,10.0,,10.0,33,2023.0
74143,1882 BROADWAY APARTMENTS,9/23/2022,3/22/2024,1005138.0,1882,BROADWAY,Brooklyn,11207.0,3015357503.0,3428937.0,BK-16,37.0,369.0,BK1601,40.680622,-73.90649,40.680372,-73.906613,2024-03-22,New Construction,No,Non Prevailing Wage,,,,,20.0,,,17.0,3.0,,,,,,20.0,,20.0,66,2024.0
73295,370 EAST 158 STREET,9/22/2022,5/8/2023,1005822.0,370,EAST 158 STREET,Bronx,10451.0,2024040012.0,2129142.0,BX-01,17.0,69.0,BX0102,40.822607,-73.915869,40.822425,-73.915952,2023-05-08,New Construction,No,Non Prevailing Wage,,,,,11.0,,,11.0,,,,,,,11.0,,11.0,12,2023.0
73306,571 OCEAN PARKWAY APARTMENTS,9/22/2022,7/19/2023,348602.0,571,OCEAN PARKWAY,Brooklyn,11218.0,3054000072.0,3428970.0,BK-12,40.0,484.0,BK1203,40.634605,-73.972434,40.634459,-73.971782,2023-07-19,New Construction,No,Non Prevailing Wage,,,,,9.0,,,9.0,,,,,,,9.0,,9.0,29,2023.0
73195,1147-1167 VYSE AVENUE APARTMENTS,9/21/2022,2/24/2023,1005485.0,1167,VYSE AVENUE,Bronx,10459.0,2027520036.0,2129627.0,BX-03,17.0,12101.0,BX0303,40.827879,-73.889965,40.828184,-73.890229,2023-02-24,New Construction,No,Non Prevailing Wage,,,,,3.0,,1.0,2.0,,,,,,,3.0,,3.0,10,2023.0
73195,1147-1167 VYSE AVENUE APARTMENTS,9/21/2022,2/24/2023,1005644.0,1147,VYSE AVENUE,Bronx,10459.0,2027520046.0,2129107.0,BX-03,17.0,12101.0,BX0303,40.827539,-73.889973,40.827635,-73.890237,2023-01-27,New Construction,No,Non Prevailing Wage,,,,,3.0,,1.0,,2.0,,,,,,3.0,,3.0,10,2023.0
73292,364 AND 366 EAST 184 STREET,9/21/2022,3/29/2023,999169.0,364,EAST 184 STREET,Bronx,10458.0,2031430283.0,2013339.0,BX-05,15.0,38303.0,BX0503,40.857596,-73.895653,40.85767,-73.895892,2023-03-29,New Construction,No,Non Prevailing Wage,,,,,6.0,,1.0,5.0,,,,,,,6.0,,6.0,10,2023.0
73292,364 AND 366 EAST 184 STREET,9/21/2022,3/29/2023,1006037.0,366,EAST 184 STREET,Bronx,10458.0,2031430284.0,2130586.0,BX-05,15.0,38303.0,BX0503,40.857558,-73.895678,40.857621,-73.895928,2023-01-31,New Construction,No,Non Prevailing Wage,,,,,6.0,,1.0,5.0,,,,,,,6.0,,6.0,10,2023.0
73270,308 LINDEN BOULEVARD,9/20/2022,8/11/2023,1006273.0,308,LINDEN BOULEVARD,Brooklyn,11226.0,3048680039.0,3429121.0,BK-17,40.0,818.0,BK1701,40.652731,-73.947967,40.652407,-73.947837,2023-08-11,New Construction,No,Non Prevailing Wage,,,,,6.0,,4.0,,2.0,,,,,,6.0,,6.0,18,2023.0
64828,RB.598-604 E 40TH STREET.BETHANY HOUSES,9/19/2022,10/11/2024,989272.0,604,EAST 40 STREET,Brooklyn,11203.0,3049730016.0,3000000.0,BK-17,45.0,834.0,BK1702,40.640688,-73.938903,40.64071,-73.939177,2024-10-11,New Construction,No,Prevailing Wage,57.0,,,,,1.0,45.0,12.0,,1.0,,,,,58.0,,58.0,58,2024.0
73764,4607 PARK DEVELOPMENT LLC,9/19/2022,9/19/2022,984408.0,4607,PARK AVENUE,Bronx,10458.0,2030310054.0,2127293.0,BX-06,15.0,38304.0,BX0603,40.857503,-73.893394,40.857553,-73.893936,2022-09-19,New Construction,No,Non Prevailing Wage,,,9.0,,18.0,,,20.0,7.0,,,,,,27.0,,27.0,90,2022.0
73765,1144 EVERGREEN DEVELOPMENT LLC,9/19/2022,9/19/2022,994661.0,1144,EVERGREEN AVENUE,Bronx,10472.0,2037387501.0,2127944.0,BX-09,17.0,5002.0,BX0901,40.827014,-73.880702,40.827044,-73.880438,2022-09-19,New Construction,No,Non Prevailing Wage,,,,,22.0,,4.0,12.0,6.0,,,,,,22.0,,22.0,73,2022.0
71033,BROOKLYN - 2177 60'TH STREET_MIH70942,9/15/2022,12/5/2024,998591.0,2177,60 STREET,Brooklyn,11204.0,3055150043.0,3429049.0,BK-12,44.0,246.0,BK1204,40.617127,-73.979134,40.617064,-73.978536,2024-12-05,New Construction,No,Non Prevailing Wage,,,2.0,3.0,9.0,,3.0,4.0,7.0,,,,,,14.0,,14.0,44,2024.0
73766,ANTHONY BUSH DEVELOPMENT LLC,9/14/2022,2/16/2023,1005930.0,218,BUSH STREET,Bronx,10457.0,2028120023.0,2130512.0,BX-05,15.0,23502.0,BX0502,40.851521,-73.903557,40.851246,-73.903247,2023-02-16,New Construction,No,Non Prevailing Wage,,,,,28.0,,6.0,18.0,4.0,,,,,,28.0,,28.0,91,2023.0
73298,51 EAST 51 STREET,9/12/2022,12/12/2022,1005179.0,51,EAST 51 STREET,Brooklyn,11203.0,3045920129.0,3426581.0,BK-17,41.0,88002.0,BK1703,40.661041,-73.930346,40.660942,-73.930058,2022-12-12,New Construction,No,Non Prevailing Wage,,,,,6.0,,,6.0,,,,,,,6.0,,6.0,7,2022.0
73272,303 POWELL STREET,9/8/2022,5/31/2024,354724.0,303,POWELL STREET,Brooklyn,11212.0,3037630006.0,3084226.0,BK-16,42.0,910.0,BK1602,40.667082,-73.903301,40.667071,-73.90298,2024-05-31,New Construction,No,Non Prevailing Wage,,,,,7.0,,,,7.0,,,,,,7.0,,7.0,22,2024.0
73274,99-45 66TH AVENUE,9/8/2022,8/7/2024,458509.0,99-45,66 AVENUE,Queens,11374.0,4021160057.0,4050958.0,QN-06,29.0,71304.0,QN0602,40.728445,-73.854439,40.728995,-73.853356,2024-08-07,New Construction,No,Non Prevailing Wage,,,,,4.0,,,4.0,,,,,,,4.0,,4.0,12,2024.0
73234,21 MESEROLE STREET,9/7/2022,11/27/2024,939724.0,21,MESEROLE STREET,Brooklyn,11206.0,3030400044.0,3427297.0,BK-01,34.0,511.0,BK0104,40.707493,-73.949518,40.707687,-73.949659,2024-11-27,New Construction,No,Non Prevailing Wage,,,,,8.0,,,7.0,1.0,,,,,,8.0,,8.0,24,2024.0
73289,1503 MORRIS AVENUE,9/7/2022,6/7/2023,97396.0,1503,MORRIS AVENUE,Bronx,10457.0,2028200062.0,2007846.0,BX-04,16.0,225.0,BX0403,40.841096,-73.909499,40.841162,-73.909767,2023-06-07,New Construction,No,Non Prevailing Wage,,,,,19.0,,16.0,3.0,,,,,,,19.0,,19.0,20,2023.0
73265,90 LIBERTY AVENUE,9/6/2022,9/12/2024,1007093.0,90,LIBERTY AVENUE,Brooklyn,11212.0,3036920016.0,3425974.0,BK-16,37.0,908.0,BK1602,40.672781,-73.90737,40.672685,-73.907305,2024-09-12,New Construction,No,Non Prevailing Wage,,,,,3.0,,,1.0,2.0,,,,,,3.0,,3.0,8,2024.0
73269,1200 & 1202 DECATUR STREET,9/6/2022,1/30/2023,1004660.0,1200,DECATUR STREET,Brooklyn,11207.0,3034350013.0,3079741.0,BK-04,37.0,411.0,BK0402,40.688964,-73.90734,40.688799,-73.907164,2023-01-30,New Construction,No,Non Prevailing Wage,,,,,3.0,,,2.0,1.0,,,,,,3.0,,3.0,8,2023.0
73269,1200 & 1202 DECATUR STREET,9/6/2022,1/30/2023,1004684.0,1202,DECATUR STREET,Brooklyn,11207.0,3034350015.0,3326359.0,BK-04,37.0,411.0,BK0402,40.688997,-73.907308,40.688854,-73.90711,2023-01-30,New Construction,No,Non Prevailing Wage,,,,,3.0,,,2.0,1.0,,,,,,3.0,,3.0,8,2023.0
73297,1804 PALISADE PLACE APARTMENTS,9/6/2022,1/13/2023,1004740.0,1804,PALISADE PLACE,Bronx,10453.0,2028770547.0,2130374.0,BX-05,14.0,20502.0,BX0501,40.851933,-73.918268,40.852067,-73.918087,2023-01-13,New Construction,No,Non Prevailing Wage,,,,,7.0,,,7.0,,,,,,,7.0,,7.0,8,2023.0
73307,2117 BATHGATE AVENUE,9/6/2022,5/7/2024,1007119.0,2117,BATHGATE AVENUE,Bronx,10457.0,2030470019.0,2000000.0,BX-06,15.0,395.0,BX0602,40.851395,-73.894618,40.851568,-73.894856,2024-05-07,New Construction,No,Non Prevailing Wage,,,,,4.0,,3.0,1.0,,,,,,,4.0,,4.0,12,2024.0
73232,195 HERZL STREET APARTMENTS,9/1/2022,8/18/2023,311808.0,195,HERZL STREET,Brooklyn,11212.0,3035390005.0,3428689.0,BK-16,41.0,902.0,BK1602,40.665383,-73.914496,40.66537,-73.914207,2023-08-18,New Construction,No,Non Prevailing Wage,,,,,3.0,,,3.0,,,,,,,3.0,,3.0,8,2023.0
73287,2189 ARTHUR AVENUE APARTMENTS,9/1/2022,6/9/2023,1005079.0,2189,ARTHUR AVENUE,Bronx,10457.0,2030630058.0,2130666.0,BX-06,15.0,37504.0,BX0602,40.852066,-73.890005,40.851932,-73.89028,2023-06-09,New Construction,No,Non Prevailing Wage,,,,,24.0,,,13.0,10.0,1.0,,,,,24.0,,24.0,25,2023.0
70891,BRC. 13-12 BEACH CHANNEL DRIVE,8/31/2022,,1000194.0,13-12,BEACH CHANNEL DRIVE,Queens,11691.0,4155280005.0,4000000.0,QN-14,31.0,103201.0,QN1401,40.605609,-73.754996,40.605663,-73.754499,2024-12-17,New Construction,No,Non Prevailing Wage,88.0,,58.0,,,1.0,125.0,9.0,13.0,,,,,,147.0,,147.0,147,2024.0
73228,2069 HONEYWELL AVENUE,8/30/2022,1/30/2023,1005141.0,2069,HONEYWELL AVENUE,Bronx,10460.0,2031230068.0,2013155.0,BX-06,15.0,363.0,BX0601,40.844453,-73.882894,40.844371,-73.883374,2023-01-30,New Construction,No,Non Prevailing Wage,,,,,16.0,,,10.0,5.0,1.0,,,,,16.0,,16.0,51,2023.0
73286,82 MILFORD STREET,8/30/2022,10/24/2022,1004945.0,82,MILFORD STREET,Brooklyn,11208.0,3039760065.0,3088470.0,BK-05,37.0,1192.0,BK0502,40.677916,-73.87794,40.677746,-73.878179,2022-10-24,New Construction,No,Non Prevailing Wage,,,,,3.0,,,1.0,2.0,,,,,,3.0,,3.0,7,2022.0
73290,3923 CARPENTER AVENUE APARTMENTS,8/30/2022,7/11/2023,1006089.0,3923,CARPENTER AVENUE,Bronx,10466.0,2048190013.0,2130529.0,BX-12,12.0,394.0,BX1201,40.88742,-73.864069,40.887404,-73.86438,2023-07-11,New Construction,No,Non Prevailing Wage,,,,,26.0,,9.0,11.0,6.0,,,,,,26.0,,26.0,27,2023.0
74147,739 EAST GUN HILL RD,8/25/2022,11/15/2024,1011373.0,739,EAST GUN HILL ROAD,Bronx,10467.0,2046570001.0,2129693.0,BX-12,12.0,380.0,BX1201,40.876931,-73.864991,40.877301,-73.864849,2024-11-15,New Construction,No,Non Prevailing Wage,,,,,41.0,,9.0,11.0,17.0,4.0,,,,,41.0,,41.0,134,2024.0
73273,2001 NOSTRAND AVENUE,8/24/2022,3/28/2023,1006311.0,2001,NOSTRAND AVENUE,Brooklyn,11210.0,3049947501.0,3426361.0,BK-17,45.0,78802.0,BK1702,40.63691,-73.948073,40.636726,-73.947745,2023-03-28,New Construction,No,Non Prevailing Wage,,,,,16.0,,,11.0,5.0,,,,,,16.0,,16.0,53,2023.0
73279,3421 GLENWOOD ROAD,8/24/2022,8/3/2023,1004904.0,3421,GLENWOOD ROAD,Brooklyn,11210.0,3050090001.0,3114102.0,BK-17,45.0,784.0,BK1702,40.634262,-73.94364,40.634544,-73.943178,2023-08-03,New Construction,No,Non Prevailing Wage,,,,,6.0,,1.0,2.0,3.0,,,,,,6.0,,6.0,19,2023.0
73223,2913 SNYDER AVENUE,8/23/2022,1/27/2023,1005038.0,2913,SNYDER AVENUE,Brooklyn,11226.0,3051080049.0,3428812.0,BK-17,40.0,824.0,BK1701,40.648886,-73.950392,40.64915,-73.949764,2023-01-27,New Construction,No,Non Prevailing Wage,,,,,13.0,,,6.0,7.0,,,,,,13.0,,13.0,41,2023.0
74148,167 MALCOM X BLVD,8/23/2022,7/17/2023,360402.0,167,MALCOLM X BOULEVARD,Brooklyn,11221.0,3016420006.0,3429147.0,BK-03,36.0,385.0,BK0302,40.687531,-73.929961,40.687533,-73.929673,2023-07-17,New Construction,No,Non Prevailing Wage,,,,,3.0,,3.0,,,,,,,,3.0,,3.0,10,2023.0
67200,WEEKSVILLE,8/19/2022,2/21/2025,1004976.0,1559,PROSPECT PLACE,Brooklyn,11233.0,3013630090.0,3000000.0,BK-08,41.0,359.0,BK0802,40.672925,-73.924479,40.673172,-73.924533,2025-02-21,New Construction,No,Non Prevailing Wage,10.0,21.0,13.0,,,1.0,22.0,8.0,15.0,,,,,,45.0,,45.0,45,2025.0
73271,180 THROOP AVENUE APARTMENTS,8/17/2022,10/17/2023,979661.0,180,THROOP AVENUE,Brooklyn,11206.0,3017320019.0,3428572.0,BK-03,36.0,257.0,BK0301,40.698858,-73.944087,40.69871,-73.944379,2023-10-17,New Construction,No,Non Prevailing Wage,,,,,10.0,,,,10.0,,,,,,10.0,,10.0,33,2023.0
73303,2733 EAST 12TH STREET,8/10/2022,9/22/2023,370325.0,3188,SHORE PARKWAY,Brooklyn,11235.0,3087640004.0,3246944.0,BK-15,48.0,608.0,BK1503,40.58476,-73.957229,40.584573,-73.957031,2023-09-22,New Construction,No,Non Prevailing Wage,,,,,14.0,,2.0,9.0,3.0,,,,,,14.0,,14.0,45,2023.0
74152,3606 HOLLAND AVE,8/10/2022,9/6/2023,85984.0,3606,HOLLAND AVENUE,Bronx,10467.0,2046610043.0,2057805.0,BX-12,12.0,380.0,BX1201,40.879002,-73.863776,40.878971,-73.863512,2023-09-06,New Construction,No,Non Prevailing Wage,,,,,4.0,,3.0,1.0,,,,,,,4.0,,4.0,11,2023.0
73213,42-41 JUDGE STREET APARTMENTS,8/9/2022,3/14/2024,1008831.0,42-41,JUDGE STREET,Queens,11373.0,4015160044.0,4037468.0,QN-04,25.0,27101.0,QN0401,40.744144,-73.880096,40.744199,-73.879692,2024-03-14,New Construction,No,Non Prevailing Wage,,,,1.0,2.0,,,1.0,1.0,1.0,,,,,3.0,,3.0,10,2024.0
73291,43-17 & 43-19 108TH STREET APARTMENTS,8/9/2022,6/30/2023,994592.0,108-03,44 AVENUE,Queens,11368.0,4019990066.0,4000000.0,QN-04,21.0,40101.0,QN0402,40.748207,-73.856958,40.74823,-73.857243,2023-06-30,New Construction,No,Non Prevailing Wage,,,,,3.0,,,3.0,,,,,,,3.0,,3.0,7,2023.0
73305,2057 STRAUSS STREET,8/4/2022,2/7/2024,378166.0,2057,STRAUSS STREET,Brooklyn,11212.0,3035550007.0,3429436.0,BK-16,41.0,898.0,BK1602,40.663786,-73.915042,40.663773,-73.914761,2024-02-07,New Construction,No,Non Prevailing Wage,,,,,3.0,,,3.0,,,,,,,3.0,,3.0,9,2024.0
74153,2045 OCEAN APTS,8/4/2022,8/14/2023,1007348.0,2045,OCEAN AVENUE,Brooklyn,11230.0,3067670070.0,3428753.0,BK-14,48.0,546.0,BK1403,40.612149,-73.953815,40.61216,-73.953455,2023-08-14,New Construction,No,Non Prevailing Wage,,,,,15.0,,2.0,10.0,3.0,,,,,,15.0,,15.0,50,2023.0
69760,299 E 161 STREET,7/28/2022,4/29/2025,994662.0,299,EAST 161 STREET,Bronx,10451.0,2024210049.0,2130660.0,BX-04,16.0,173.0,BX0401,40.825306,-73.917575,40.82558,-73.917347,2025-04-29,New Construction,No,Non Prevailing Wage,,,27.0,,20.0,,12.0,25.0,10.0,,,,,,47.0,,47.0,155,2025.0
73233,1376 DEKALB AVENUE APARTMENTS,7/28/2022,7/17/2023,1006418.0,1376,DEKALB AVENUE,Brooklyn,11221.0,3032450027.0,3429016.0,BK-04,37.0,421.0,BK0401,40.699242,-73.924197,40.699118,-73.923977,2023-07-17,New Construction,No,Non Prevailing Wage,,,,,3.0,,,3.0,,,,,,,3.0,,3.0,8,2023.0
74154,PACIFIC PARK APARTMENTS,7/26/2022,11/20/2024,989274.0,595,DEAN STREET,Brooklyn,11238.0,3011290050.0,3428601.0,BK-08,35.0,163.0,BK0801,40.680653,-73.970133,40.681169,-73.969823,2024-11-20,New Construction,No,Non Prevailing Wage,,,,,240.0,,99.0,93.0,48.0,,,,,,240.0,,240.0,798,2024.0
73767,1401 EDWARD L GRANT HIGHWAY,7/25/2022,7/25/2022,973743.0,1355,SHAKESPEARE AVENUE,Bronx,10452.0,2025200045.0,2000000.0,BX-04,16.0,211.0,BX0402,40.840685,-73.922214,40.840998,-73.922326,2022-07-25,New Construction,No,Non Prevailing Wage,,,,,14.0,,3.0,10.0,1.0,,,,,,14.0,,14.0,44,2022.0
73224,101 VARET STREET APARTMENTS,7/18/2022,9/13/2023,386465.0,101,VARET STREET,Brooklyn,11206.0,3031060029.0,3071522.0,BK-01,34.0,491.0,BK0104,40.703174,-73.941371,40.703394,-73.941486,2023-09-13,New Construction,No,Non Prevailing Wage,,,,,3.0,,2.0,1.0,,,,,,,3.0,,3.0,10,2023.0
73293,103 SCHENECTADY AVENUE,7/14/2022,2/1/2023,367293.0,103,SCHENECTADY AVENUE,Brooklyn,11213.0,3013480006.0,3429081.0,BK-08,36.0,309.0,BK0802,40.67567,-73.933244,40.675615,-73.932955,2023-02-01,New Construction,No,Non Prevailing Wage,,,,,3.0,,,3.0,,,,,,,3.0,,3.0,7,2023.0
73194,153 ERASMUS STREET,7/7/2022,6/9/2023,1007001.0,153,ERASMUS STREET,Brooklyn,11226.0,3051050053.0,3428869.0,BK-17,40.0,824.0,BK1701,40.649751,-73.950524,40.650015,-73.950582,2023-06-09,New Construction,No,Non Prevailing Wage,,,,,7.0,,2.0,5.0,,,,,,,7.0,,7.0,22,2023.0
73217,1686 WEEKS AVENUE,7/6/2022,4/27/2023,120802.0,1686,WEEKS AVENUE,Bronx,10457.0,2027920030.0,2007362.0,BX-04,15.0,22902.0,BX0403,40.844045,-73.907616,40.844055,-73.907356,2023-04-27,New Construction,No,Non Prevailing Wage,,,,,8.0,,4.0,4.0,,,,,,,8.0,,8.0,25,2023.0
74156,1306 FINDLAY AVENUE APARTMENTS,7/6/2022,12/30/2022,1004455.0,1306,FINDLAY AVENUE,Bronx,10456.0,2027820008.0,2007033.0,BX-04,16.0,17702.0,BX0403,40.835349,-73.910823,40.835201,-73.91061,2022-12-30,New Construction,No,Non Prevailing Wage,,,,,29.0,,6.0,11.0,12.0,,,,,,29.0,,29.0,30,2022.0
66789,JOE UPTOWN LLC - PHASE 1.YR15.FY22,6/30/2022,5/7/2024,4187.0,2851,FREDERICK DOUGLASS BOULEVARD,Manhattan,10039.0,1020460056.0,1060874.0,MN-10,9.0,23502.0,MN1002,40.82735,-73.938634,40.827498,-73.938916,2024-05-07,Preservation,No,Non Prevailing Wage,6.0,12.0,2.0,,,,,7.0,11.0,2.0,,,,,20.0,,20.0,20,2024.0
66789,JOE UPTOWN LLC - PHASE 1.YR15.FY22,6/30/2022,5/7/2024,7465.0,184,BRADHURST AVENUE,Manhattan,10039.0,1020460022.0,1060857.0,MN-10,9.0,23502.0,MN1002,40.82684,-73.940272,40.826684,-73.940073,2024-05-07,Preservation,No,Non Prevailing Wage,4.0,11.0,1.0,,,1.0,2.0,6.0,2.0,6.0,1.0,,,,17.0,,17.0,17,2024.0
66789,JOE UPTOWN LLC - PHASE 1.YR15.FY22,6/30/2022,5/7/2024,7477.0,226,BRADHURST AVENUE,Manhattan,10039.0,1020470003.0,1060881.0,MN-10,9.0,23502.0,MN1002,40.828467,-73.939165,40.828415,-73.938883,2024-05-07,Preservation,No,Non Prevailing Wage,1.0,10.0,,,,,1.0,1.0,5.0,4.0,,,,,11.0,,11.0,11,2024.0
66789,JOE UPTOWN LLC - PHASE 1.YR15.FY22,6/30/2022,5/7/2024,7478.0,230,BRADHURST AVENUE,Manhattan,10039.0,1020470004.0,1060882.0,MN-10,9.0,23502.0,MN1002,40.828605,-73.939107,40.828497,-73.938839,2024-05-07,Preservation,No,Non Prevailing Wage,2.0,7.0,1.0,,,,,4.0,4.0,2.0,,,,,10.0,,10.0,10,2024.0
66789,JOE UPTOWN LLC - PHASE 1.YR15.FY22,6/30/2022,5/7/2024,25515.0,107,MORNINGSIDE AVENUE,Manhattan,10027.0,1019500064.0,1059285.0,MN-09,9.0,20901.0,MN0901,40.810423,-73.954693,40.810282,-73.954426,2024-05-07,Preservation,No,Non Prevailing Wage,4.0,3.0,3.0,,,,1.0,,9.0,,,,,,10.0,,10.0,10,2024.0
66789,JOE UPTOWN LLC - PHASE 1.YR15.FY22,6/30/2022,5/7/2024,25516.0,109,MORNINGSIDE AVENUE,Manhattan,10027.0,1019500063.0,1059284.0,MN-09,9.0,20901.0,MN0901,40.810461,-73.954664,40.810343,-73.954382,2024-05-07,Preservation,No,Non Prevailing Wage,5.0,3.0,2.0,,,,1.0,,9.0,,,,,,10.0,,10.0,10,2024.0
66789,JOE UPTOWN LLC - PHASE 1.YR15.FY22,6/30/2022,5/7/2024,25517.0,111,MORNINGSIDE AVENUE,Manhattan,10027.0,1019500062.0,1059283.0,MN-09,9.0,20901.0,MN0901,40.810499,-73.954635,40.8104,-73.954342,2024-05-07,Preservation,No,Non Prevailing Wage,4.0,3.0,3.0,,,,1.0,,9.0,,,,,,10.0,,10.0,10,2024.0
66789,JOE UPTOWN LLC - PHASE 1.YR15.FY22,6/30/2022,5/7/2024,42491.0,308,WEST 151 STREET,Manhattan,10039.0,1020460020.0,1060856.0,MN-10,9.0,23502.0,MN1002,40.826705,-73.939361,40.826805,-73.939983,2024-05-07,Preservation,No,Non Prevailing Wage,8.0,9.0,1.0,,,,,2.0,10.0,6.0,,,,,18.0,,18.0,18,2024.0
66789,JOE UPTOWN LLC - PHASE 1.YR15.FY22,6/30/2022,5/7/2024,42526.0,302,WEST 152 STREET,Manhattan,10039.0,1020460039.0,1060867.0,MN-10,9.0,23502.0,MN1002,40.827328,-73.938905,40.827243,-73.939281,2024-05-07,Preservation,No,Non Prevailing Wage,1.0,8.0,1.0,,,,1.0,9.0,,,,,,,10.0,,10.0,10,2024.0
67899,BLUE SEA. 223 LINDEN STREET. LINDEN GROVE,6/30/2022,12/30/2024,1004426.0,223,LINDEN STREET,Brooklyn,11221.0,,,BK-04,37.0,433.0,BK0402,40.696176,-73.916696,,,2025-12-30,New Construction,No,Prevailing Wage,152.0,,,,,1.0,109.0,43.0,1.0,,,,,,153.0,,153.0,153,2025.0
68815,PROSPECT TRIANGLE.YR15.FY22,6/30/2022,8/7/2024,896309.0,890,PROSPECT AVENUE,Bronx,10459.0,2026907502.0,2113129.0,BX-02,17.0,12901.0,BX0202,40.820819,-73.901137,40.820673,-73.900823,2024-08-07,Preservation,No,Non Prevailing Wage,,46.0,77.0,1.0,,,5.0,40.0,79.0,,,,,,124.0,,124.0,124,2024.0
70170,CRISCUOLO HOMES LP.YR15.FY22,6/30/2022,6/20/2024,52037.0,854,BRONX PARK SOUTH,Bronx,10460.0,2031190064.0,2013108.0,BX-06,15.0,363.0,BX0601,40.847359,-73.882194,40.847217,-73.882372,2024-06-20,Preservation,No,Non Prevailing Wage,,5.0,5.0,,,,,,10.0,,,,,,10.0,,10.0,10,2024.0
70170,CRISCUOLO HOMES LP.YR15.FY22,6/30/2022,6/20/2024,73848.0,1100,EAST TREMONT AVENUE,Bronx,10460.0,2039060055.0,2028357.0,BX-06,15.0,60.0,BX0601,40.839982,-73.877123,40.839746,-73.877228,2024-06-20,Preservation,No,Non Prevailing Wage,1.0,18.0,10.0,,,1.0,,1.0,21.0,8.0,,,,,30.0,,30.0,30,2024.0
70170,CRISCUOLO HOMES LP.YR15.FY22,6/30/2022,6/20/2024,118554.0,2117,VYSE AVENUE,Bronx,10460.0,2031280027.0,2013232.0,BX-06,15.0,363.0,BX0601,40.844338,-73.880085,40.844431,-73.880432,2024-06-20,Preservation,No,Non Prevailing Wage,5.0,12.0,2.0,,,1.0,,1.0,15.0,4.0,,,,,20.0,,20.0,20,2024.0
70170,CRISCUOLO HOMES LP.YR15.FY22,6/30/2022,6/20/2024,833238.0,1945,VYSE AVENUE,Bronx,10460.0,2029920052.0,2113077.0,BX-06,15.0,359.0,BX0601,40.840814,-73.883092,40.841168,-73.883185,2024-06-20,Preservation,No,Non Prevailing Wage,12.0,16.0,17.0,,,1.0,,10.0,26.0,10.0,,,,,46.0,,46.0,46,2024.0
70725,BROADWAY TRIANGLE SITE C,6/30/2022,,1014040.0,88,THROOP AVENUE,Brooklyn,11206.0,3022690025.0,3000000.0,BK-01,33.0,507.0,BK0103,40.702032,-73.946078,40.701741,-73.946241,2025-03-21,New Construction,No,Non Prevailing Wage,28.0,28.0,83.0,,,1.0,27.0,61.0,15.0,19.0,18.0,,,,140.0,,140.0,140,2025.0
71469,WESTCHESTER TRIANGLE.YR15.FY22,6/30/2022,8/7/2024,877119.0,871,WESTCHESTER AVENUE,Bronx,10459.0,2026907501.0,2115281.0,BX-02,17.0,12901.0,BX0202,40.820428,-73.900141,40.820511,-73.900596,2024-08-07,Preservation,No,Non Prevailing Wage,1.0,24.0,44.0,,,1.0,19.0,31.0,20.0,,,,,,70.0,,70.0,70,2024.0
72581,3333 BROADWAY,6/30/2022,6/30/2022,929104.0,3333A,BROADWAY,Manhattan,10031.0,1020019005.0,1085412.0,MN-09,7.0,22302.0,MN0902,40.818858,-73.955991,,,2022-06-30,Preservation,No,Non Prevailing Wage,,,226.0,339.0,,,113.0,170.0,192.0,85.0,5.0,,,,565.0,,565.0,565,2022.0
73209,ASTORIA WEST PHASE TWO,6/30/2022,2/3/2023,1004762.0,2025-11-28T00:00:00.000,30 DRIVE,Queens,11102.0,4005040121.0,4619107.0,QN-01,22.0,81.0,QN0102,40.770156,-73.933867,40.769598,-73.93342,2023-02-03,New Construction,No,Non Prevailing Wage,,,,,46.0,,3.0,31.0,12.0,,,,,,46.0,,46.0,151,2023.0
73285,1988 ANTHONY AVENUE,6/30/2022,3/31/2023,1003768.0,1988,ANTHONY AVENUE,Bronx,10457.0,2028140055.0,2130386.0,BX-05,15.0,381.0,BX0502,40.850968,-73.902831,40.850729,-73.902438,2023-03-31,New Construction,No,Non Prevailing Wage,,,,,67.0,,19.0,34.0,14.0,,,,,,67.0,,67.0,68,2023.0
74157,ASTORIA WEST  PHASE TWO,6/30/2022,1/20/2023,1004758.0,2025-11-12T00:00:00.000,30 DRIVE,Queens,11102.0,4005040122.0,4623158.0,QN-01,22.0,81.0,QN0102,40.770235,-73.934066,40.769892,-73.934243,2023-01-20,New Construction,No,Non Prevailing Wage,,,,,80.0,,8.0,61.0,11.0,,,,,,80.0,,80.0,266,2023.0
60031,BELMONT COVE,6/29/2022,,976441.0,656,EAST 176 STREET,Bronx,10457.0,2029450034.0,2000000.0,BX-06,15.0,36901.0,BX0602,40.844227,-73.893184,40.843884,-73.893076,2025-06-17,New Construction,No,Non Prevailing Wage,39.0,38.0,75.0,,,1.0,12.0,81.0,45.0,15.0,,,,,153.0,,153.0,153,2025.0
63776,EBENEZER PLAZA PHASE II,6/29/2022,,991993.0,589,CHRISTOPHER AVENUE,Brooklyn,11212.0,3038610001.0,3428616.0,BK-16,42.0,920.0,BK1602,40.657206,-73.902652,40.657384,-73.902205,2025-06-13,New Construction,No,Non Prevailing Wage,53.0,51.0,103.0,,,1.0,16.0,116.0,60.0,16.0,,,,,208.0,,208.0,208,2025.0
68134,HCCI 144 STREET HDFC.HUDMF.FY22,6/29/2022,4/17/2024,41770.0,104,WEST 144 STREET,Manhattan,10030.0,1020120039.0,1060144.0,MN-10,9.0,232.0,MN1002,40.819897,-73.937044,40.819865,-73.937557,2024-04-17,Preservation,Yes,Non Prevailing Wage,12.0,2.0,,,,1.0,,,15.0,,,,,,15.0,,15.0,15,2024.0
68134,HCCI 144 STREET HDFC.HUDMF.FY22,6/29/2022,4/17/2024,41771.0,106,WEST 144 STREET,Manhattan,10030.0,1020120041.0,1060145.0,MN-10,9.0,232.0,MN1002,40.819936,-73.937138,40.819914,-73.937677,2022-06-29,Preservation,Yes,Non Prevailing Wage,13.0,2.0,,,,,,,15.0,,,,,,15.0,,15.0,15,2022.0
68134,HCCI 144 STREET HDFC.HUDMF.FY22,6/29/2022,4/17/2024,41772.0,108,WEST 144 STREET,Manhattan,10030.0,1020120042.0,1060146.0,MN-10,9.0,232.0,MN1002,40.819982,-73.937247,40.819964,-73.937792,2022-06-29,Preservation,Yes,Non Prevailing Wage,13.0,1.0,,1.0,,,,,15.0,,,,,,15.0,,15.0,15,2022.0
68134,HCCI 144 STREET HDFC.HUDMF.FY22,6/29/2022,4/17/2024,41774.0,110,WEST 144 STREET,Manhattan,10030.0,1020120044.0,1060147.0,MN-10,9.0,232.0,MN1002,40.820015,-73.937326,40.820013,-73.937911,2022-06-29,Preservation,Yes,Non Prevailing Wage,13.0,1.0,1.0,,,,,,15.0,,,,,,15.0,,15.0,15,2022.0
73220,664-667 NEW YORK AVENUE,6/29/2022,11/22/2022,970788.0,664,NEW YORK AVENUE,Brooklyn,11203.0,3048197501.0,3107423.0,BK-09,40.0,804.0,BK0902,40.657918,-73.947433,40.657644,-73.947606,2022-11-22,New Construction,No,Non Prevailing Wage,,,,,12.0,,,6.0,6.0,,,,,,12.0,,12.0,37,2022.0
67981,GRAND STREET GUILD,6/28/2022,9/13/2024,1003757.0,165,BROOME STREET,Manhattan,10002.0,1003410060.0,1000000.0,MN-03,1.0,1402.0,MN0302,40.71672,-73.985646,40.716495,-73.98587,2024-09-13,New Construction,No,Non Prevailing Wage,70.0,46.0,115.0,,,1.0,26.0,103.0,77.0,26.0,,,,,232.0,,232.0,232,2024.0
71106,25-88 49TH STREET APARTMENTS,6/28/2022,6/28/2022,982686.0,25-88,49 STREET,Queens,11103.0,4007440080.0,4014000.0,QN-01,22.0,145.0,QN0104,40.762465,-73.906238,40.762575,-73.906476,2022-06-28,New Construction,No,Non Prevailing Wage,,,,,2.0,,,,2.0,,,,,,2.0,,2.0,6,2022.0
76634,3031 & 3033 CRUGER AVENUE,6/27/2022,1/20/2023,1003294.0,3031,CRUGER AVENUE,Bronx,10467.0,2045680040.0,2130403.0,BX-12,12.0,33802.0,BX1201,40.870136,-73.866202,40.870573,-73.866465,2023-01-20,New Construction,No,Non Prevailing Wage,,,,,3.0,,,3.0,,,,,,,3.0,,3.0,8,2023.0
68458,LANTERN. 437 EUCLID AVE,6/24/2022,11/15/2024,994674.0,437,EUCLID AVENUE,Brooklyn,11208.0,,,BK-05,42.0,1196.0,BK0505,40.676444,-73.87216,,,2022-06-24,New Construction,No,Non Prevailing Wage,88.0,33.0,13.0,,,1.0,81.0,14.0,32.0,8.0,,,,,135.0,,135.0,135,2022.0
71903,404 CARROLL STREET_MIH71789,6/24/2022,3/24/2025,1000973.0,424,CARROLL STREET,Brooklyn,11215.0,3004530001.0,3000000.0,BK-06,39.0,11901.0,BK0601,40.677884,-73.988402,40.677527,-73.988568,2025-03-24,New Construction,No,Non Prevailing Wage,,36.0,36.0,17.0,1.0,,12.0,50.0,21.0,7.0,,,,,90.0,,90.0,360,2025.0
63886,MWBE SITE C - 1510-1524 BROADWAY,6/21/2022,,998370.0,1510,BROADWAY,Brooklyn,11221.0,3014890011.0,3039905.0,BK-16,41.0,373.0,BK1601,40.686811,-73.917364,40.686611,-73.917479,2024-09-03,New Construction,No,Non Prevailing Wage,10.0,44.0,53.0,,,1.0,9.0,45.0,41.0,13.0,,,,,108.0,,108.0,108,2024.0
73768,THE BARONIAL,6/21/2022,4/30/2025,66538.0,665,EAST 183 STREET,Bronx,10458.0,2030880054.0,2012504.0,BX-06,15.0,391.0,BX0603,40.852395,-73.886885,40.852606,-73.886845,2025-04-30,New Construction,No,Non Prevailing Wage,,,,,4.0,,,3.0,1.0,,,,,,4.0,,4.0,11,2025.0
73226,353 MILLER AVENUE,6/20/2022,2/24/2023,1005567.0,353,MILLER AVENUE,Brooklyn,11207.0,3040090015.0,3425941.0,BK-05,42.0,1152.0,BK0502,40.672163,-73.891095,40.672181,-73.890813,2023-02-24,New Construction,No,Non Prevailing Wage,,,,,5.0,,,2.0,3.0,,,,,,5.0,,5.0,15,2023.0
73227,110 WEST 123RD STREET APARTMENTS,6/20/2022,7/18/2023,1004683.0,110,WEST 123 STREET,Manhattan,10027.0,1019070040.0,1057739.0,MN-10,9.0,222.0,MN1001,40.806744,-73.947102,40.806604,-73.947352,2023-07-18,New Construction,No,Non Prevailing Wage,,,,,2.0,,,,2.0,,,,,,2.0,,2.0,6,2023.0
73769,813 ELSMERE PLACE,6/20/2022,7/6/2023,1008329.0,813,ELSMERE PLACE,Bronx,10460.0,2029560039.0,2010077.0,BX-06,15.0,36502.0,BX0602,40.843169,-73.88831,40.843113,-73.887721,2023-07-06,New Construction,No,Non Prevailing Wage,,,,,3.0,,1.0,2.0,,,,,,,3.0,,3.0,10,2023.0
73770,1462 SOUTHERN BOULEVARD,6/20/2022,11/21/2023,997806.0,1462,SOUTHERN BOULEVARD,Bronx,10460.0,2029810002.0,2010569.0,BX-03,17.0,157.0,BX0303,40.832689,-73.890535,40.832477,-73.890323,2023-11-21,New Construction,No,Non Prevailing Wage,,,,,3.0,,,3.0,,,,,,,3.0,,3.0,10,2023.0
73771,1286 NEW YORK AVE APARTMENTS,6/20/2022,10/11/2022,1003597.0,1286,NEW YORK AVENUE,Brooklyn,11203.0,3049490035.0,3428830.0,BK-17,45.0,830.0,BK1702,40.641764,-73.945705,40.641616,-73.945997,2022-10-11,New Construction,No,Non Prevailing Wage,,,,,5.0,,,4.0,1.0,,,,,,5.0,,5.0,14,2022.0
69259,SUS. 1600 GRAND AVE. STARHILL PHASE I,6/16/2022,,1004336.0,1600,GRAND AVENUE,Bronx,10453.0,2028650160.0,2000000.0,BX-05,14.0,217.0,BX0501,40.84647,-73.916753,40.846168,-73.916454,2025-04-25,New Construction,No,Non Prevailing Wage,213.0,28.0,84.0,,,1.0,161.0,74.0,91.0,,,,,,326.0,,326.0,326,2025.0
73277,221 EAST 117TH STREET APARTMENTS,6/16/2022,8/1/2024,19849.0,221,EAST 117 STREET,Manhattan,10035.0,1016670011.0,1091581.0,MN-11,8.0,188.0,MN1102,40.798358,-73.93886,40.798396,-73.938401,2024-08-01,New Construction,No,Non Prevailing Wage,,,,,4.0,,,4.0,,,,,,,4.0,,4.0,12,2024.0
73225,25-79 31ST STREET APARTMENTS,6/14/2022,4/7/2023,1005543.0,25-79,31 STREET,Queens,11102.0,4006200004.0,4623168.0,QN-01,22.0,6501.0,QN0103,40.769624,-73.918568,40.768527,-73.919324,2023-04-07,New Construction,No,Non Prevailing Wage,,,,,7.0,,,7.0,,,,,,,7.0,,7.0,23,2023.0
70532,21-59 44TH DRIVE,6/13/2022,3/31/2023,991583.0,21-59,44 DRIVE,Queens,11101.0,4004387503.0,4005176.0,QN-02,26.0,1903.0,QN0201,40.748034,-73.946922,40.747965,-73.945179,2023-03-31,New Construction,No,Non Prevailing Wage,,,,,6.0,,,3.0,3.0,,,,,,6.0,,6.0,20,2023.0
69689,BEULAH CLUSTER HDFC.Y15.FY22,6/10/2022,1/28/2025,50398.0,1272,BOSTON ROAD,Bronx,10456.0,2026630029.0,2004752.0,BX-03,17.0,151.0,BX0301,40.830884,-73.900692,40.830839,-73.900205,2025-01-28,Preservation,No,Non Prevailing Wage,2.0,6.0,4.0,,,1.0,,8.0,5.0,,,,,,13.0,,13.0,13,2025.0
69689,BEULAH CLUSTER HDFC.Y15.FY22,6/10/2022,1/28/2025,57038.0,1418,CLINTON AVENUE,Bronx,10456.0,2029360044.0,2009811.0,BX-03,15.0,151.0,BX0301,40.834354,-73.898682,40.834474,-73.898432,2025-01-28,Preservation,No,Non Prevailing Wage,3.0,6.0,1.0,,,,,1.0,5.0,4.0,,,,,10.0,,10.0,10,2025.0
69689,BEULAH CLUSTER HDFC.Y15.FY22,6/10/2022,1/28/2025,64529.0,426,EAST 162 STREET,Bronx,10451.0,2023830016.0,2001507.0,BX-03,17.0,141.0,BX0301,40.824509,-73.912647,40.824295,-73.912629,2025-01-28,Preservation,No,Non Prevailing Wage,2.0,5.0,,,,,,3.0,4.0,,,,,,7.0,,7.0,7,2025.0
69689,BEULAH CLUSTER HDFC.Y15.FY22,6/10/2022,1/28/2025,64890.0,493,EAST 166 STREET,Bronx,10456.0,2023710064.0,2001309.0,BX-03,16.0,18501.0,BX0301,40.828016,-73.907927,40.828255,-73.907916,2025-01-28,Preservation,No,Non Prevailing Wage,,8.0,2.0,,,,,,6.0,4.0,,,,,10.0,,10.0,10,2025.0
69689,BEULAH CLUSTER HDFC.Y15.FY22,6/10/2022,1/28/2025,79393.0,918,FREEMAN STREET,Bronx,10459.0,2029750022.0,2010476.0,BX-03,17.0,125.0,BX0303,40.830132,-73.892115,40.82991,-73.892144,2025-01-28,Preservation,No,Non Prevailing Wage,,8.0,2.0,,,,2.0,,,4.0,4.0,,,,10.0,,10.0,10,2025.0
69689,BEULAH CLUSTER HDFC.Y15.FY22,6/10/2022,1/28/2025,85516.0,1300,HOE AVENUE,Bronx,10459.0,2029870015.0,2010641.0,BX-03,17.0,123.0,BX0303,40.831231,-73.890292,40.831113,-73.890068,2025-01-28,Preservation,No,Non Prevailing Wage,4.0,13.0,3.0,,,1.0,,12.0,9.0,,,,,,21.0,,21.0,21,2025.0
69689,BEULAH CLUSTER HDFC.Y15.FY22,6/10/2022,1/28/2025,85539.0,1507,HOE AVENUE,Bronx,10460.0,2029810025.0,2010574.0,BX-03,17.0,157.0,BX0303,40.833253,-73.889107,40.833725,-73.889124,2025-01-28,Preservation,No,Non Prevailing Wage,,2.0,8.0,,,,,5.0,4.0,1.0,,,,,10.0,,10.0,10,2025.0
69689,BEULAH CLUSTER HDFC.Y15.FY22,6/10/2022,1/28/2025,101210.0,4031,PARK AVENUE,Bronx,10457.0,2028980029.0,2009424.0,BX-03,15.0,165.0,BX0302,40.843521,-73.901675,40.843598,-73.902098,2025-01-28,Preservation,No,Non Prevailing Wage,1.0,7.0,2.0,,,,,,5.0,5.0,,,,,10.0,,10.0,10,2025.0
69689,BEULAH CLUSTER HDFC.Y15.FY22,6/10/2022,1/28/2025,104293.0,1336,PROSPECT AVENUE,Bronx,10459.0,2029700010.0,2010347.0,BX-03,17.0,151.0,BX0301,40.829563,-73.8975,40.829415,-73.897182,2025-01-28,Preservation,No,Non Prevailing Wage,6.0,1.0,3.0,,,,,,3.0,7.0,,,,,10.0,,10.0,10,2025.0
69689,BEULAH CLUSTER HDFC.Y15.FY22,6/10/2022,1/28/2025,104326.0,1386,PROSPECT AVENUE,Bronx,10459.0,2029710016.0,2010389.0,BX-03,17.0,153.0,BX0303,40.831391,-73.896811,40.831371,-73.896457,2025-01-28,Preservation,No,Non Prevailing Wage,2.0,6.0,2.0,,,1.0,,,,11.0,,,,,11.0,,11.0,11,2025.0
69689,BEULAH CLUSTER HDFC.Y15.FY22,6/10/2022,1/28/2025,104354.0,1439,PROSPECT AVENUE,Bronx,10456.0,2029370058.0,2009828.0,BX-03,15.0,151.0,BX0301,40.834034,-73.896724,40.833921,-73.897016,2025-01-28,Preservation,No,Non Prevailing Wage,7.0,12.0,1.0,,,,,12.0,8.0,,,,,,20.0,,20.0,20,2025.0
69689,BEULAH CLUSTER HDFC.Y15.FY22,6/10/2022,1/28/2025,806625.0,768,EAST 168 STREET,Bronx,10456.0,2026620016.0,2097877.0,BX-03,17.0,135.0,BX0301,40.829251,-73.900836,40.829026,-73.900977,2025-01-28,Preservation,No,Non Prevailing Wage,8.0,5.0,2.0,,,,,6.0,4.0,5.0,,,,,15.0,,15.0,15,2025.0
69689,BEULAH CLUSTER HDFC.Y15.FY22,6/10/2022,1/28/2025,871098.0,1212,UNIVERSITY AVENUE,Bronx,10452.0,2025280011.0,2116375.0,BX-04,16.0,199.0,BX0402,40.838281,-73.927269,40.838067,-73.927147,2025-01-28,Preservation,No,Non Prevailing Wage,,29.0,24.0,,,1.0,10.0,15.0,28.0,1.0,,,,,54.0,,54.0,54,2025.0
71927,QUEENS - 43-15 52 STREET_MIH71732,6/10/2022,10/29/2024,1004233.0,43-15,52 STREET,Queens,11377.0,4013210016.0,4000000.0,QN-02,26.0,25302.0,QN0202,40.743792,-73.912547,40.743495,-73.912349,2024-10-29,New Construction,No,Non Prevailing Wage,,9.0,9.0,3.0,2.0,,,13.0,10.0,,,,,,23.0,,23.0,87,2024.0
73206,2750 & 2754 FREDERICK DOUGLAS BOULEVARD APARTMENTS,6/10/2022,5/5/2023,1006360.0,2750,FREDERICK DOUGLASS BLVD,Manhattan,10039.0,1020320001.0,1060495.0,MN-10,9.0,234.0,MN1002,40.823599,-73.941348,40.823473,-73.941052,2023-03-27,New Construction,No,Non Prevailing Wage,,,,,5.0,,,3.0,2.0,,,,,,5.0,,5.0,14,2023.0
73206,2750 & 2754 FREDERICK DOUGLAS BOULEVARD APARTMENTS,6/10/2022,5/5/2023,1006805.0,2754,FREDERICK DOUGLASS BLVD,Manhattan,10039.0,1020320003.0,1091005.0,MN-10,9.0,234.0,MN1002,40.823706,-73.941268,40.823599,-73.940957,2023-05-05,New Construction,No,Non Prevailing Wage,,,,,4.0,,,4.0,,,,,,,4.0,,4.0,13,2023.0
72615,101 PATCHEN AVENUE,6/9/2022,11/15/2022,1002891.0,101,PATCHEN AVENUE,Brooklyn,11221.0,3016380005.0,3044710.0,BK-03,41.0,385.0,BK0302,40.688473,-73.927162,40.688511,-73.926899,2022-11-15,New Construction,No,Non Prevailing Wage,,,,,3.0,,,1.0,2.0,,,,,,3.0,,3.0,10,2022.0
73202,855 EAST 167TH STREET,6/9/2022,9/20/2023,1007043.0,855,EAST 167 STREET,Bronx,10459.0,2026920079.0,2005292.0,BX-02,17.0,131.0,BX0202,40.826212,-73.897823,40.826445,-73.897613,2023-09-20,New Construction,No,Non Prevailing Wage,,,,,9.0,,,4.0,5.0,,,,,,9.0,,9.0,30,2023.0
73214,1010 BEDFORD AVENUE & 263 SKILLMAN STREET,6/9/2022,6/26/2024,975465.0,1010,BEDFORD AVENUE,Brooklyn,11205.0,3019420012.0,3055424.0,BK-03,36.0,233.0,BK0301,40.690439,-73.95533,40.69036,-73.955827,2024-06-26,New Construction,No,Non Prevailing Wage,,,,,16.0,,,4.0,,12.0,,,,,16.0,,16.0,52,2024.0
73215,3836 - 3838 CARPENTER AVENUE APARTMENTS,6/9/2022,9/28/2023,991506.0,3836,CARPENTER AVENUE,Bronx,10467.0,2046550006.0,2057608.0,BX-12,12.0,394.0,BX1201,40.885541,-73.865075,40.885461,-73.864826,2023-09-28,New Construction,No,Non Prevailing Wage,,,,,3.0,,1.0,2.0,,,,,,,3.0,,3.0,10,2023.0
73215,3836 - 3838 CARPENTER AVENUE APARTMENTS,6/9/2022,9/28/2023,1007044.0,3838,CARPENTER AVENUE,Bronx,10467.0,2046550008.0,2129464.0,BX-12,12.0,394.0,BX1201,40.885582,-73.865053,40.885524,-73.864793,2023-09-28,New Construction,No,Non Prevailing Wage,,,,,3.0,,,1.0,2.0,,,,,,3.0,,3.0,10,2023.0
73208,"99, 101 & 103 GROVE STREET",6/7/2022,9/21/2023,997265.0,103,GROVE STREET,Brooklyn,11221.0,3033140075.0,3425722.0,BK-04,37.0,419.0,BK0402,40.693459,-73.920525,40.693484,-73.920846,2023-09-21,New Construction,No,Non Prevailing Wage,,,,,3.0,,,3.0,,,,,,,3.0,,3.0,8,2023.0
73208,"99, 101 & 103 GROVE STREET",6/7/2022,9/21/2023,1007037.0,99,GROVE STREET,Brooklyn,11221.0,3033140080.0,3428720.0,BK-04,37.0,419.0,BK0402,40.693385,-73.920594,40.693379,-73.920947,2023-09-21,New Construction,No,Non Prevailing Wage,,,,,3.0,,,3.0,,,,,,,3.0,,3.0,8,2023.0
73208,"99, 101 & 103 GROVE STREET",6/7/2022,9/21/2023,1007038.0,101,GROVE STREET,Brooklyn,11221.0,3033140078.0,3428721.0,BK-04,37.0,419.0,BK0402,40.693423,-73.920558,40.693431,-73.920897,2023-09-21,New Construction,No,Non Prevailing Wage,,,,,3.0,,,3.0,,,,,,,3.0,,3.0,8,2023.0
73221,THE MARATHON BUILDING - 31-07 38TH AVENUE,6/7/2022,8/21/2024,1007045.0,31-07,38 AVENUE,Queens,11101.0,4003730002.0,4436763.0,QN-01,26.0,51.0,QN0105,40.753713,-73.931866,40.753752,-73.931422,2024-08-21,New Construction,No,Non Prevailing Wage,,,,,4.0,,,2.0,1.0,1.0,,,,,4.0,,4.0,12,2024.0
73773,851 EAST 167TH STREET,6/7/2022,6/5/2024,1010149.0,851,EAST 167 STREET,Bronx,10459.0,2026920082.0,2091997.0,BX-02,17.0,131.0,BX0202,40.82624,-73.897946,40.82644,-73.897798,2024-06-05,New Construction,No,Non Prevailing Wage,,,,,6.0,,1.0,2.0,3.0,,,,,,6.0,,6.0,18,2024.0
73774,360 FORDHAM HEIGHTS,6/7/2022,7/3/2024,66592.0,360,EAST 184 STREET,Bronx,10458.0,2031430281.0,2129657.0,BX-05,15.0,38303.0,BX0503,40.857673,-73.895602,40.857728,-73.895823,2024-07-03,New Construction,No,Non Prevailing Wage,,,,,4.0,,1.0,2.0,1.0,,,,,,4.0,,4.0,12,2024.0
73775,2339 STUART STREET APARTMENTS,6/7/2022,6/27/2023,378706.0,2339,STUART STREET,Brooklyn,11229.0,3088240056.0,3427407.0,BK-15,46.0,632.0,BK1503,40.599885,-73.931631,40.599907,-73.931306,2023-06-27,New Construction,No,Non Prevailing Wage,,,,,3.0,,,,3.0,,,,,,3.0,,3.0,9,2023.0
73210,63 LEWIS AVENUE,6/3/2022,8/2/2023,1007024.0,63,LEWIS AVENUE,Brooklyn,11206.0,3015890006.0,3429578.0,BK-03,36.0,287.0,BK0302,40.69553,-73.937537,40.695687,-73.937151,2023-08-02,New Construction,No,Non Prevailing Wage,,,,,5.0,,,5.0,,,,,,,5.0,,5.0,16,2023.0
73211,9-24 MAIN AVENUE,6/3/2022,8/10/2023,1009127.0,2025-09-24T00:00:00.000,MAIN AVENUE,Queens,11102.0,4005070025.0,4619618.0,QN-01,22.0,81.0,QN0102,40.771997,-73.933136,40.771862,-73.932909,2023-08-10,New Construction,No,Non Prevailing Wage,,,,,10.0,,,5.0,5.0,,,,,,10.0,,10.0,31,2023.0
73278,1446 BRYANT AVENUE,6/3/2022,8/2/2023,53649.0,1446,BRYANT AVENUE,Bronx,10459.0,2029990022.0,2000000.0,BX-03,17.0,123.0,BX0303,40.831141,-73.888283,40.831149,-73.88798,2023-08-02,New Construction,No,Non Prevailing Wage,,,,,3.0,,1.0,2.0,,,,,,,3.0,,3.0,9,2023.0
73777,1472 SHAKESPEARE AVENUE,6/3/2022,6/6/2024,991719.0,1472,SHAKESPEARE AVENUE,Bronx,10452.0,2028720120.0,2008677.0,BX-04,16.0,21302.0,BX0403,40.843749,-73.919973,40.843708,-73.919695,2024-06-06,New Construction,No,Non Prevailing Wage,,,,,11.0,,2.0,3.0,6.0,,,,,,11.0,,11.0,34,2024.0
70805,597 MARCY AVENUE,6/2/2022,3/25/2025,1002855.0,597,MARCY AVENUE,Brooklyn,11206.0,3017597501.0,3426256.0,BK-03,36.0,25901.0,BK0301,40.694529,-73.949027,40.694512,-73.948731,2025-03-25,New Construction,No,Non Prevailing Wage,,,4.0,,,,1.0,1.0,2.0,,,,,,4.0,,4.0,20,2025.0
73244,1477 GREENE AVENUE APARTMENT,5/24/2022,6/13/2023,1006350.0,1477,GREENE AVENUE,Brooklyn,11237.0,3032910038.0,3421819.0,BK-04,37.0,443.0,BK0401,40.702787,-73.914859,40.702971,-73.915017,2023-06-13,New Construction,No,Non Prevailing Wage,,,,,3.0,,,1.0,2.0,,,,,,3.0,,3.0,10,2023.0
72614,829 TILDEN STREET,5/23/2022,3/24/2023,115054.0,829,TILDEN STREET,Bronx,10467.0,2046710007.0,2058216.0,BX-12,12.0,380.0,BX1201,40.876865,-73.860681,40.877219,-73.860478,2023-03-24,New Construction,No,Non Prevailing Wage,,,,,28.0,,,14.0,14.0,,,,,,28.0,,28.0,92,2023.0
52728,SCATTERED SITES LP.YR15.FY22,5/20/2022,5/23/2023,42808.0,508,WEST 159 STREET,Manhattan,10032.0,1021170031.0,1062762.0,MN-12,10.0,245.0,MN1201,40.834304,-73.941595,40.8342,-73.941913,2023-05-23,Preservation,No,Non Prevailing Wage,,,2.0,,,,1.0,,1.0,,,,,,2.0,,2.0,2,2023.0
52728,SCATTERED SITES LP.YR15.FY22,5/20/2022,5/23/2023,42830.0,542,WEST 159 STREET,Manhattan,10032.0,1021170014.0,1062750.0,MN-12,10.0,245.0,MN1201,40.834614,-73.942332,40.834727,-73.943177,2023-05-23,Preservation,No,Non Prevailing Wage,5.0,7.0,2.0,,,1.0,,2.0,13.0,,,,,,15.0,,15.0,15,2023.0
52728,SCATTERED SITES LP.YR15.FY22,5/20/2022,5/23/2023,43021.0,434,WEST 164 STREET,Manhattan,10032.0,1021100078.0,1062627.0,MN-12,10.0,24301.0,MN1201,40.83678,-73.937791,40.836489,-73.937726,2023-05-23,Preservation,No,Non Prevailing Wage,9.0,6.0,4.0,,,1.0,,2.0,5.0,13.0,,,,,20.0,,20.0,20,2023.0
52728,SCATTERED SITES LP.YR15.FY22,5/20/2022,5/23/2023,43027.0,453,WEST 164 STREET,Manhattan,10032.0,1021110036.0,1062637.0,MN-12,10.0,24301.0,MN1201,40.836893,-73.938011,40.837008,-73.937596,2023-05-23,Preservation,No,Non Prevailing Wage,2.0,7.0,5.0,,,,,9.0,4.0,1.0,,,,,14.0,,14.0,14,2023.0
52728,SCATTERED SITES LP.YR15.FY22,5/20/2022,5/23/2023,43099.0,508,WEST 168 STREET,Manhattan,10032.0,1021230090.0,1062979.0,MN-12,10.0,251.0,MN1201,40.840049,-73.937361,40.839942,-73.937719,2023-05-23,Preservation,No,Non Prevailing Wage,,4.0,,,,,,3.0,1.0,,,,,,4.0,,4.0,4,2023.0
72151,BK-1640 FLATBUSH AVENUE_MIH72038,5/20/2022,3/19/2025,996166.0,1640,FLATBUSH AVENUE,Brooklyn,11210.0,3075770060.0,3000000.0,BK-14,45.0,774.0,BK1401,40.630456,-73.945167,40.630313,-73.945473,2025-03-19,New Construction,No,Non Prevailing Wage,,17.0,25.0,,3.0,,9.0,19.0,17.0,,,,,,45.0,,45.0,171,2025.0
73200,737 FENIMORE STREET APARTMENTS,5/20/2022,1/31/2023,1006065.0,737,FENIMORE STREET,Brooklyn,11203.0,3048130054.0,3428948.0,BK-09,40.0,87401.0,BK0902,40.659484,-73.937888,40.659681,-73.938025,2023-01-31,New Construction,No,Non Prevailing Wage,,,,,2.0,,,2.0,,,,,,,2.0,,2.0,6,2023.0
72458,2735 EAST 13TH STREET APARTMENTS,5/19/2022,10/24/2022,982158.0,2735,EAST 13 STREET,Brooklyn,11235.0,3087667501.0,3426528.0,BK-15,48.0,608.0,BK1503,40.584592,-73.955591,40.584726,-73.955429,2022-10-24,New Construction,No,Non Prevailing Wage,,,,,6.0,,,6.0,,,,,,,6.0,,6.0,19,2022.0
73205,305 KINGSLAND AVENUE APARTMENTS,5/17/2022,2/1/2023,1005743.0,305,KINGSLAND AVENUE,Brooklyn,11222.0,3026570017.0,3426118.0,BK-01,33.0,58901.0,BK0101,40.726966,-73.941873,40.727002,-73.94218,2023-02-01,New Construction,No,Non Prevailing Wage,,,,,3.0,,1.0,2.0,,,,,,,3.0,,3.0,9,2023.0
72506,THE DEERMAR,5/16/2022,2/16/2023,1001857.0,262,9 STREET,Brooklyn,11215.0,3010100010.0,3330874.0,BK-06,38.0,139.0,BK0602,40.670062,-73.988133,40.66996,-73.988569,2023-02-16,New Construction,No,Non Prevailing Wage,,,,,22.0,,5.0,10.0,7.0,,,,,,22.0,,22.0,72,2023.0
72613,56-15 VAN CLEEF STREET APARTMENTS,5/16/2022,1/18/2023,701504.0,56-15,VAN CLEEF STREET,Queens,11368.0,4019680073.0,4000000.0,QN-04,21.0,43701.0,QN0402,40.740532,-73.852056,40.740713,-73.851966,2023-01-18,New Construction,No,Non Prevailing Wage,,,,,3.0,,,3.0,,,,,,,3.0,,3.0,7,2023.0
73779,315 BUSHWICK AVE APARTMENTS,5/13/2022,8/11/2023,215994.0,315,BUSHWICK AVENUE,Brooklyn,11206.0,3030820002.0,3071365.0,BK-01,34.0,485.0,BK0104,40.705558,-73.939475,40.705503,-73.939176,2023-08-11,New Construction,No,Non Prevailing Wage,,,,,4.0,,,2.0,1.0,1.0,,,,,4.0,,4.0,12,2023.0
69912,250 WEST HDFC.HPO.FY22 (CASSIOPEIA APTS - W 116 ST),5/11/2022,5/11/2022,881106.0,246,WEST 116 STREET,Manhattan,10026.0,1018310056.0,1087744.0,MN-10,9.0,218.0,MN1001,40.803983,-73.954354,40.803865,-73.954795,2022-05-11,Preservation,No,Non Prevailing Wage,1.0,4.0,21.0,6.0,,,,6.0,26.0,,,,,,32.0,,32.0,32,2022.0
72509,"1537, 1539, 1541 DEAN STREET",5/9/2022,12/21/2023,230942.0,1539,DEAN STREET,Brooklyn,11213.0,3013407506.0,3035659.0,BK-08,36.0,311.0,BK0802,40.676182,-73.936971,40.67641,-73.936927,2023-12-21,New Construction,No,Non Prevailing Wage,,,,,3.0,,,1.0,2.0,,,,,,3.0,,3.0,7,2023.0
72509,"1537, 1539, 1541 DEAN STREET",5/9/2022,12/21/2023,230944.0,1541,DEAN STREET,Brooklyn,11213.0,3013407505.0,3427320.0,BK-08,36.0,311.0,BK0802,40.676179,-73.93692,40.676404,-73.936855,2023-11-09,New Construction,No,Non Prevailing Wage,,,,,3.0,,,1.0,2.0,,,,,,3.0,,3.0,7,2023.0
72612,2321 BELMONT AVENUE APARTMENTS,5/6/2022,6/23/2023,49478.0,2321,BELMONT AVENUE,Bronx,10458.0,2030870022.0,2012457.0,BX-06,15.0,391.0,BX0603,40.85329,-73.88684,40.853528,-73.886962,2023-06-23,New Construction,No,Non Prevailing Wage,,,,,13.0,,,6.0,7.0,,,,,,13.0,,13.0,42,2023.0
70738,1457 FLATBUSH AVENUE,5/2/2022,12/5/2023,1002193.0,1457,FLATBUSH AVENUE,Brooklyn,11210.0,3052517501.0,3427317.0,BK-14,45.0,78601.0,BK1401,40.634773,-73.949721,40.634855,-73.949393,2023-12-05,New Construction,No,Non Prevailing Wage,,,16.0,,,,4.0,12.0,,,,,,,16.0,,16.0,71,2023.0
72498,1169 HOE AVENUE APARTMENT,4/27/2022,8/26/2022,1003649.0,1169,HOE AVENUE,Bronx,10459.0,2027450033.0,2130565.0,BX-03,17.0,125.0,BX0303,40.827784,-73.890901,40.827963,-73.891172,2022-08-26,New Construction,No,Non Prevailing Wage,,,,,12.0,,3.0,,9.0,,,,,,12.0,,12.0,38,2022.0
72503,22 CHAPEL STREET APARTMENTS,4/25/2022,11/16/2023,218890.0,22,CHAPEL STREET,Brooklyn,11201.0,3001197501.0,3000208.0,BK-02,33.0,13.0,BK0202,40.697243,-73.986217,40.697042,-73.985694,2023-11-16,New Construction,No,Non Prevailing Wage,,,,,55.0,,23.0,16.0,14.0,2.0,,,,,55.0,,55.0,180,2023.0
73198,709 EMPIRE BOULEVARD,4/25/2022,10/18/2023,289638.0,709,EMPIRE BOULEVARD,Brooklyn,11213.0,3014220061.0,3038367.0,BK-09,35.0,331.0,BK0901,40.663832,-73.938442,40.664123,-73.938691,2023-10-18,New Construction,No,Non Prevailing Wage,,,,,4.0,,,4.0,,,,,,,4.0,,4.0,12,2023.0
72491,1808 MOHEGAN AVENUE,4/21/2022,11/7/2022,1002479.0,1808,MOHEGAN AVENUE,Bronx,10460.0,2029580068.0,2129028.0,BX-06,15.0,367.0,BX0602,40.840353,-73.888513,40.840224,-73.888467,2022-11-07,New Construction,No,Non Prevailing Wage,,,,,4.0,,,2.0,2.0,,,,,,4.0,,4.0,13,2022.0
73197,THE GREEN HOUSE APARTMENT,4/20/2022,3/21/2023,667065.0,2025-10-30T00:00:00.000,JACKSON AVENUE,Queens,11101.0,4000400015.0,4000219.0,QN-02,26.0,701.0,QN0201,40.742064,-73.953538,40.741985,-73.953245,2023-03-21,New Construction,No,Non Prevailing Wage,,,,,14.0,,3.0,4.0,7.0,,,,,,14.0,,14.0,50,2023.0
72611,903 EAGLE AVENUE,4/19/2022,12/16/2022,62335.0,903,EAGLE AVENUE,Bronx,10456.0,2026200045.0,2130438.0,BX-03,17.0,141.0,BX0301,40.822667,-73.908231,40.822675,-73.90857,2022-12-16,New Construction,No,Non Prevailing Wage,,,,,3.0,,1.0,2.0,,,,,,,3.0,,3.0,10,2022.0
73780,1082 WOODYCREST AVENUE APARTMENTS,4/19/2022,2/1/2023,1004157.0,1082,WOODYCREST AVENUE,Bronx,10452.0,2025090010.0,2128675.0,BX-04,16.0,193.0,BX0402,40.834446,-73.92659,40.834479,-73.926146,2023-02-01,New Construction,No,Non Prevailing Wage,,,,,15.0,,4.0,10.0,1.0,,,,,,15.0,,15.0,48,2023.0
76635,845 SOTHERN BOULEVARD APARTMENTS,4/19/2022,3/29/2023,1005874.0,845,SOUTHERN BOULEVARD,Bronx,10459.0,2027220121.0,2130520.0,BX-02,17.0,89.0,BX0201,40.817671,-73.894838,40.817844,-73.895087,2023-03-29,New Construction,No,Non Prevailing Wage,,,,,6.0,,1.0,2.0,3.0,,,,,,6.0,,6.0,17,2023.0
73782,9048 REALTY LLC,4/13/2022,10/4/2024,987955.0,34-21,109 STREET,Queens,11368.0,4017530115.0,4043689.0,QN-03,21.0,381.0,QN0303,40.756129,-73.859569,40.755747,-73.859104,2024-10-04,New Construction,No,Non Prevailing Wage,,,,,2.0,,,1.0,1.0,,,,,,2.0,,2.0,6,2024.0
73785,1000 WOODYCREST AVENUE,4/13/2022,6/16/2023,1003281.0,1000,WOODYCREST AVENUE,Bronx,10452.0,2025080001.0,2130588.0,BX-04,16.0,189.0,BX0402,40.83271,-73.927926,40.832509,-73.92776,2023-06-16,New Construction,No,Non Prevailing Wage,,,,,25.0,,,2.0,23.0,,,,,,25.0,,25.0,25,2023.0
72501,378 WEIRFIELD STREET APARTMENTS,4/12/2022,4/3/2023,389694.0,378,WEIRFIELD STREET,Brooklyn,11237.0,3034070026.0,3429032.0,BK-04,37.0,439.0,BK0402,40.695866,-73.906415,40.695732,-73.906217,2023-04-03,New Construction,No,Non Prevailing Wage,,,,,12.0,,3.0,3.0,6.0,,,,,,12.0,,12.0,39,2023.0
72610,68 GOLD STREET,4/12/2022,7/10/2023,301639.0,68,GOLD STREET,Brooklyn,11201.0,3000420024.0,3428900.0,BK-02,33.0,21.0,BK0202,40.702864,-73.982764,40.702639,-73.983074,2023-07-10,New Construction,No,Non Prevailing Wage,,,,,18.0,,3.0,6.0,9.0,,,,,,18.0,,18.0,58,2023.0
72470,88 LINDEN BOULEVARD,4/11/2022,1/13/2023,973338.0,92,LINDEN BOULEVARD,Brooklyn,11226.0,3050870014.0,3000000.0,BK-17,40.0,822.0,BK1701,40.652352,-73.955117,40.651996,-73.955388,2023-01-13,New Construction,No,Non Prevailing Wage,,,,,20.0,,2.0,13.0,4.0,1.0,,,,,20.0,,20.0,66,2023.0
72504,328 21ST STREET APARTMENTS,4/11/2022,1/13/2023,987994.0,328,21 STREET,Brooklyn,11215.0,3008980023.0,3017564.0,BK-07,39.0,147.0,BK0702,40.659418,-73.99024,40.659278,-73.990449,2023-01-13,New Construction,No,Non Prevailing Wage,,,,,2.0,,,2.0,,,,,,,2.0,,2.0,6,2023.0
73199,2311 ANDREWS AVENUE,4/11/2022,9/7/2023,45496.0,2311,ANDREWS AVENUE NORTH,Bronx,10468.0,2032250131.0,2130538.0,BX-07,14.0,255.0,BX0701,40.861608,-73.907223,40.861693,-73.907519,2023-09-07,New Construction,No,Non Prevailing Wage,,,,,4.0,,1.0,2.0,1.0,,,,,,4.0,,4.0,12,2023.0
73201,91-09 ROOSEVELT AVENUE APARTMENTS,4/11/2022,8/9/2023,1008597.0,91-09,ROOSEVELT AVENUE,Queens,11372.0,4014797501.0,4036413.0,QN-09,21.0,275.0,QN0301,40.748555,-73.875267,40.748805,-73.875151,2023-08-09,New Construction,No,Non Prevailing Wage,,,,,27.0,,6.0,15.0,6.0,,,,,,27.0,,27.0,88,2023.0
61765,1761 WALTON AVENUE,4/6/2022,7/18/2024,975339.0,1761,WALTON AVENUE,Bronx,10453.0,2028500063.0,2120490.0,BX-05,14.0,22701.0,BX0502,40.847297,-73.910434,40.847574,-73.91055,2024-07-18,New Construction,No,Non Prevailing Wage,26.0,25.0,51.0,,,1.0,,61.0,25.0,17.0,,,,,103.0,,103.0,103,2024.0
72508,2333 BEAUMONT AVENUE,4/6/2022,5/29/2024,49154.0,2333,BEAUMONT AVENUE,Bronx,10458.0,2030890049.0,2012525.0,BX-06,15.0,391.0,BX0603,40.853101,-73.885,40.853214,-73.885217,2024-05-29,New Construction,No,Non Prevailing Wage,,,,,4.0,,4.0,,,,,,,,4.0,,4.0,12,2024.0
72496,1463 NEW YORK AVENUE APARTMENTS,4/5/2022,12/22/2023,343532.0,1463,NEW YORK AVENUE,Brooklyn,11210.0,3049970017.0,3428816.0,BK-17,45.0,782.0,BK1702,40.637282,-73.945201,40.637232,-73.944884,2023-12-22,New Construction,No,Non Prevailing Wage,,,,,6.0,,,3.0,3.0,,,,,,6.0,,6.0,17,2023.0
72457,57-41 GRANGER STREET,4/4/2022,11/15/2022,991672.0,57-41,GRANGER STREET,Queens,11368.0,4019510010.0,4048009.0,QN-04,21.0,43702.0,QN0402,40.73902,-73.856621,40.739121,-73.856278,2022-11-15,New Construction,No,Non Prevailing Wage,,,,,6.0,,,2.0,4.0,,,,,,6.0,,6.0,20,2022.0
73203,1399 MYRTLE AVENUE,4/4/2022,8/11/2023,1006028.0,1399,MYRTLE AVENUE,Brooklyn,11237.0,3032787502.0,3418366.0,BK-04,37.0,431.0,BK0401,40.698575,-73.920653,40.698816,-73.920544,2023-08-11,New Construction,No,Non Prevailing Wage,,,,,15.0,,2.0,10.0,3.0,,,,,,15.0,,15.0,49,2023.0
72468,781 FOUNTAIN,4/1/2022,11/7/2022,295509.0,781,FOUNTAIN AVENUE,Brooklyn,11208.0,3045650074.0,3390867.0,BK-05,42.0,1220.0,BK0505,40.661208,-73.867753,40.661307,-73.867334,2022-11-07,New Construction,No,Non Prevailing Wage,,,,,3.0,,1.0,2.0,,,,,,,3.0,,3.0,7,2022.0
72489,2439 BARKER AVENUE,4/1/2022,9/9/2022,1003316.0,2439,BARKER AVENUE,Bronx,10467.0,2044240040.0,2130568.0,BX-11,15.0,33202.0,BX1104,40.862167,-73.869421,40.862763,-73.869676,2022-09-09,New Construction,No,Non Prevailing Wage,,,,,4.0,,3.0,,1.0,,,,,,4.0,,4.0,12,2022.0
65554,BRIDGE ROCKAWAY,3/31/2022,6/3/2025,1003153.0,805,ROCKAWAY AVENUE,Brooklyn,11212.0,3036030010.0,3429686.0,BK-16,41.0,916.0,BK1602,40.66012,-73.908285,40.660029,-73.907763,2025-06-03,New Construction,No,Non Prevailing Wage,122.0,38.0,13.0,,,,85.0,17.0,46.0,25.0,,,,,173.0,,173.0,174,2025.0
69567,ASLAND CAPITAL. 1940 TURNBULL AVE. PL SARA,3/31/2022,11/6/2024,1003176.0,1940,TURNBULL AVENUE,Bronx,10473.0,2036720030.0,2000000.0,BX-09,18.0,16.0,BX0902,40.822884,-73.857564,40.82264,-73.857619,2024-11-06,New Construction,No,Prevailing Wage,153.0,,,,,1.0,122.0,31.0,1.0,,,,,,154.0,,154.0,154,2024.0
72505,31-05 21ST STREET,3/29/2022,7/21/2023,991354.0,31-05,21 STREET,Queens,11106.0,4005520015.0,4006365.0,QN-01,22.0,77.0,QN0102,40.76715,-73.929982,40.766934,-73.929831,2023-07-21,New Construction,No,Non Prevailing Wage,,,,,7.0,,,6.0,1.0,,,,,,7.0,,7.0,23,2023.0
72466,61-63 PITT STREET APARTMENTS,3/28/2022,1/20/2023,26903.0,61,PITT STREET,Manhattan,10002.0,1003430062.0,1004083.0,MN-03,2.0,12.0,MN0302,40.717877,-73.982724,40.717878,-73.98307,2023-01-20,New Construction,No,Non Prevailing Wage,,,6.0,,12.0,,3.0,12.0,3.0,,,,,,18.0,,18.0,59,2023.0
72464,115 PARK AVENUE APARTMENTS,3/24/2022,1/27/2023,351153.0,115,PARK AVENUE,Brooklyn,11205.0,3020290056.0,3057966.0,BK-02,35.0,211.0,BK0203,40.6963,-73.975084,40.696503,-73.975153,2023-01-27,New Construction,No,Non Prevailing Wage,,,,,3.0,,1.0,1.0,1.0,,,,,,3.0,,3.0,9,2023.0
67442,505 WEST 134 STREET CLUSTER,3/22/2022,3/17/2025,40677.0,505,WEST 134 STREET,Manhattan,10031.0,1019880027.0,1059763.0,MN-09,7.0,22301.0,MN0902,40.81842,-73.953141,40.818648,-73.953119,2024-06-17,Preservation,No,Non Prevailing Wage,,10.0,,9.0,,,,,18.0,1.0,,,,,,19.0,19.0,19,2024.0
67442,505 WEST 134 STREET CLUSTER,3/22/2022,3/17/2025,40693.0,523,WEST 134 STREET,Manhattan,10031.0,1019880012.0,1059754.0,MN-09,7.0,22301.0,MN0902,40.818868,-73.954214,40.819148,-73.954308,2024-06-17,Preservation,No,Non Prevailing Wage,,17.0,,8.0,,,,1.0,16.0,8.0,,,,,,25.0,25.0,25,2024.0
67442,505 WEST 134 STREET CLUSTER,3/22/2022,3/17/2025,40696.0,527,WEST 134 STREET,Manhattan,10031.0,1019880008.0,1059752.0,MN-09,7.0,22301.0,MN0902,40.818895,-73.954272,40.819274,-73.954611,2025-03-17,Preservation,No,Non Prevailing Wage,,16.0,,9.0,,,,3.0,16.0,6.0,,,,,,25.0,25.0,25,2025.0
72465,3827 CARPENTER AVENUE,3/16/2022,4/18/2023,55109.0,3827,CARPENTER AVENUE,Bronx,10467.0,2046530087.0,2130642.0,BX-12,12.0,394.0,BX1201,40.885377,-73.865191,40.885421,-73.865459,2023-04-18,New Construction,No,Non Prevailing Wage,,,,,5.0,,2.0,3.0,,,,,,,5.0,,5.0,15,2023.0
73786,1115 DECATUR STREET APARTMENTS,3/16/2022,7/15/2022,1002482.0,1115,DECATUR STREET,Brooklyn,11207.0,3034280065.0,3427279.0,BK-04,37.0,411.0,BK0402,40.687335,-73.908969,40.687379,-73.909286,2022-07-15,New Construction,No,Non Prevailing Wage,,,,,3.0,,,2.0,1.0,,,,,,3.0,,3.0,8,2022.0
73787,1111 DECATUR STREET APARTMENTS,3/16/2022,8/25/2022,1002483.0,1111,DECATUR STREET,Brooklyn,11207.0,3034280066.0,3427278.0,BK-04,37.0,411.0,BK0402,40.687274,-73.909027,40.687327,-73.909319,2022-08-25,New Construction,No,Non Prevailing Wage,,,,,3.0,,,3.0,,,,,,,3.0,,3.0,8,2022.0
73788,948 NEW YORK AVE,3/14/2022,12/12/2022,1004919.0,948,NEW YORK AVENUE,Brooklyn,11203.0,3048860018.0,3109337.0,BK-17,40.0,824.0,BK1701,40.650172,-73.946603,40.650178,-73.946917,2022-12-12,New Construction,No,Non Prevailing Wage,,,,,5.0,,,5.0,,,,,,,5.0,,5.0,16,2022.0
71700,641 EAST 28TH STREET,3/10/2022,9/14/2023,1002723.0,641,EAST 28 STREET,Brooklyn,11210.0,3052510014.0,3121675.0,BK-14,45.0,78601.0,BK1401,40.635571,-73.94985,40.635102,-73.949523,2023-09-14,New Construction,No,Non Prevailing Wage,,,6.0,,5.0,,1.0,7.0,3.0,,,,,,11.0,,11.0,36,2023.0
72502,396 SHEPHERD AVENUE APARTMENTS,3/8/2022,6/8/2023,1007118.0,396,SHEPHERD AVENUE,Brooklyn,11208.0,3040040022.0,3428642.0,BK-05,42.0,1166.0,BK0502,40.674829,-73.880989,40.674911,-73.881291,2023-06-08,New Construction,No,Non Prevailing Wage,,,,,3.0,,,3.0,,,,,,,3.0,,3.0,7,2023.0
72461,720 LIBERTY AVENUE,3/7/2022,5/10/2024,325689.0,720,LIBERTY AVENUE,Brooklyn,11208.0,3039870010.0,3088675.0,BK-05,37.0,1166.0,BK0502,40.676382,-73.883088,40.676173,-73.883041,2024-05-10,New Construction,No,Non Prevailing Wage,,,,,3.0,,,,3.0,,,,,,3.0,,3.0,10,2024.0
73196,1998 SECOND AVENUE APARTMENTS,3/7/2022,4/1/2024,1140.0,1998,2 AVENUE,Manhattan,10029.0,1016740049.0,1052673.0,MN-11,8.0,164.0,MN1101,40.788616,-73.943899,40.788298,-73.943744,2024-04-01,New Construction,No,Non Prevailing Wage,,,,,51.0,,13.0,25.0,10.0,3.0,,,,,51.0,,51.0,164,2024.0
73789,175 PALMETTO STREET  APARTMENTS,3/7/2022,8/19/2022,1003097.0,175,PALMETTO STREET,Brooklyn,11221.0,3033420056.0,3428619.0,BK-04,37.0,417.0,BK0402,40.693947,-73.916533,40.694016,-73.916814,2022-08-19,New Construction,No,Non Prevailing Wage,,,,,3.0,,,1.0,2.0,,,,,,3.0,,3.0,8,2022.0
72189,1223 PUTNAM AVENUE APARTMENTS,3/4/2022,7/8/2022,357764.0,1223,PUTNAM AVENUE,Brooklyn,11221.0,3033680055.0,3077043.0,BK-04,37.0,415.0,BK0402,40.691331,-73.915584,40.691405,-73.915858,2022-07-08,New Construction,No,Non Prevailing Wage,,,,,6.0,,,3.0,3.0,,,,,,6.0,,6.0,18,2022.0
70138,10 MARCY AVE,3/1/2022,6/30/2023,983547.0,402,METROPOLITAN AVENUE,Brooklyn,11211.0,3023690019.0,3429448.0,BK-01,34.0,519.0,BK0102,40.714068,-73.954942,40.713769,-73.954856,2023-06-30,New Construction,No,Non Prevailing Wage,,,24.0,,,,6.0,13.0,5.0,,,,,,24.0,,24.0,123,2023.0
72500,31-07 ASTORIA APARTMENTS,2/28/2022,9/28/2023,987953.0,31-07,31 AVENUE,Queens,11106.0,4006157502.0,4623225.0,QN-01,22.0,63.0,QN0103,40.764283,-73.9233,40.764382,-73.922957,2023-09-28,New Construction,No,Non Prevailing Wage,,,,,3.0,,,1.0,2.0,,,,,,3.0,,3.0,10,2023.0
73218,1182 OGDEN STREET,2/28/2022,8/21/2024,1007040.0,1182,OGDEN AVENUE,Bronx,10452.0,2025160007.0,2130639.0,BX-04,16.0,199.0,BX0402,40.837427,-73.926818,40.837317,-73.926587,2024-08-21,New Construction,No,Non Prevailing Wage,,,,,7.0,,,7.0,,,,,,,7.0,,7.0,21,2024.0
72459,29 EVELYN PLACE APARTMENTS,2/25/2022,3/28/2023,77184.0,29,EVELYN PLACE,Bronx,10468.0,2031980045.0,2088424.0,BX-07,14.0,253.0,BX0701,40.859451,-73.90476,40.85961,-73.904576,2023-03-28,New Construction,No,Non Prevailing Wage,,,,,4.0,,2.0,1.0,1.0,,,,,,4.0,,4.0,11,2023.0
72493,2116 COLONIAL AVENUE,2/25/2022,5/24/2023,989545.0,2116,COLONIAL AVENUE,Bronx,10461.0,2042520007.0,2047827.0,BX-10,13.0,300.0,BX1003,40.85475,-73.82905,40.854994,-73.828887,2023-05-24,New Construction,No,Non Prevailing Wage,,,,,5.0,,1.0,1.0,3.0,,,,,,5.0,,5.0,16,2023.0
72460,1985 HONEYWELL AVENUE APARTMENTS,2/24/2022,1/31/2023,87065.0,1985,HONEYWELL AVENUE,Bronx,10460.0,2031210021.0,2129637.0,BX-06,15.0,363.0,BX0601,40.842761,-73.884339,40.842986,-73.884479,2023-01-31,New Construction,No,Non Prevailing Wage,,,,,10.0,,2.0,6.0,2.0,,,,,,10.0,,10.0,33,2023.0
73204,909 EAST 229TH STREET APARTMENTS,2/24/2022,11/25/2024,71269.0,909,EAST 229 STREET,Bronx,10466.0,2048650044.0,2064641.0,BX-12,12.0,424.0,BX1203,40.888619,-73.852551,40.888899,-73.852685,2024-11-25,New Construction,No,Non Prevailing Wage,,,,,6.0,,,3.0,3.0,,,,,,6.0,,6.0,17,2024.0
67201,HABITAT NET ZERO,2/23/2022,,543067.0,114-11,130 STREET,Queens,11420.0,4116560067.0,4251748.0,QN-10,28.0,174.0,QN1001,40.680889,-73.811415,40.680933,-73.811097,2023-11-28,Preservation,No,Non Prevailing Wage,,,,1.0,,,,,,,1.0,,,,,1.0,1.0,1,2023.0
67201,HABITAT NET ZERO,2/23/2022,,547824.0,133-24,135 PLACE,Queens,11420.0,4117950068.0,4256344.0,QN-10,28.0,814.0,QN1001,40.66879,-73.802653,40.66826,-73.802925,2023-11-28,Preservation,No,Non Prevailing Wage,,,1.0,,,,,,,1.0,,,,,,1.0,1.0,1,2023.0
67201,HABITAT NET ZERO,2/23/2022,,654963.0,142-06,FOCH BOULEVARD,Queens,11436.0,4120140003.0,4260618.0,QN-12,28.0,182.0,QN1203,40.67875,-73.799426,40.678514,-73.799358,2023-12-06,Preservation,No,Non Prevailing Wage,,,1.0,,,,,,,1.0,,,,,,1.0,1.0,1,2023.0
72192,320 WEST 135TH STREET APARTMENTS,2/22/2022,7/15/2022,1002206.0,320,WEST 135 STREET,Manhattan,10030.0,1019590054.0,1089809.0,MN-10,9.0,22102.0,MN1002,40.816771,-73.94721,40.816829,-73.947766,2022-07-15,New Construction,No,Non Prevailing Wage,,,,,6.0,,,3.0,3.0,,,,,,6.0,,6.0,17,2022.0
72193,48 BLEECKER STREET APARTMENTS,2/22/2022,10/18/2022,210816.0,48,BLEECKER STREET,Brooklyn,11221.0,3033050012.0,3428946.0,BK-04,37.0,419.0,BK0402,40.694072,-73.922245,40.693811,-73.922158,2022-10-18,New Construction,No,Non Prevailing Wage,,,,,3.0,,,1.0,2.0,,,,,,3.0,,3.0,8,2022.0
72463,802 HOWARD AVENUE APARTMENTS,2/16/2022,10/3/2022,865013.0,802,HOWARD AVENUE,Brooklyn,11212.0,3035650042.0,3081797.0,BK-16,41.0,892.0,BK1704,40.662203,-73.918584,40.662208,-73.918912,2022-10-03,New Construction,No,Non Prevailing Wage,,,,,3.0,,,3.0,,,,,,,3.0,,3.0,10,2022.0
72194,729 LIBERTY AVENUE,2/15/2022,11/22/2022,1002510.0,729,LIBERTY AVENUE,Brooklyn,11208.0,3039710051.0,3088392.0,BK-05,37.0,1168.0,BK0501,40.676439,-73.882806,40.676642,-73.882882,2022-11-22,New Construction,No,Non Prevailing Wage,,,,,6.0,,4.0,2.0,,,,,,,6.0,,6.0,10,2022.0
72195,762 EAST 213RD STREET,2/15/2022,5/20/2022,1002298.0,762,EAST 213 STREET,Bronx,10467.0,2046600053.0,2057765.0,BX-12,12.0,380.0,BX1201,40.878479,-73.862565,40.878196,-73.862569,2022-05-20,New Construction,No,Non Prevailing Wage,,,,,3.0,,1.0,2.0,,,,,,,3.0,,3.0,10,2022.0
73792,241-243 EAST 202 STREET,2/15/2022,8/24/2023,1007048.0,3020,VALENTINE AVENUE,Bronx,10458.0,2033080104.0,2130817.0,BX-07,11.0,413.0,BX0702,40.873036,-73.88528,40.873091,-73.88507,2023-08-24,New Construction,No,Non Prevailing Wage,,,,,41.0,,,25.0,16.0,,,,,,41.0,,41.0,42,2023.0
72196,114 SEIGEL STREET,2/14/2022,2/14/2022,940249.0,114,SEIGEL STREET,Brooklyn,11206.0,3030970014.0,3071458.0,BK-01,34.0,491.0,BK0104,40.704536,-73.942001,40.704346,-73.941795,2022-02-14,New Construction,No,Non Prevailing Wage,,,2.0,,,,,2.0,,,,,,,2.0,,2.0,8,2022.0
72197,1259 BEDFORD AVENUE APARTMENTS,2/8/2022,7/10/2023,1008495.0,1259,BEDFORD AVENUE,Brooklyn,11216.0,3018607502.0,3429001.0,BK-03,36.0,247.0,BK0301,40.680016,-73.953235,40.680008,-73.95291,2023-07-10,New Construction,No,Non Prevailing Wage,,,,,14.0,,6.0,6.0,2.0,,,,,,14.0,,14.0,46,2023.0
72497,503 EVERGREEN AVENUE,2/4/2022,7/15/2022,1003279.0,503,EVERGREEN AVENUE,Brooklyn,11221.0,3033687505.0,3077003.0,BK-04,37.0,415.0,BK0402,40.690763,-73.916309,40.69095,-73.916143,2022-07-15,New Construction,No,Non Prevailing Wage,,,,,3.0,,,2.0,1.0,,,,,,3.0,,3.0,9,2022.0
68747,88 EAST 127TH STREET,2/3/2022,2/22/2024,991167.0,88,EAST 126 STREET,Manhattan,10035.0,,,MN-11,9.0,198.0,MN1102,40.805955,-73.939106,,,2024-02-22,New Construction,No,Non Prevailing Wage,,32.0,,,8.0,,15.0,9.0,16.0,,,,,,40.0,,40.0,160,2024.0
72198,125 KINGS HIGHWAY APARTMENTS,1/31/2022,1/27/2023,319857.0,125,KINGS HIGHWAY,Brooklyn,11223.0,3066180027.0,3429013.0,BK-11,43.0,428.0,BK1103,40.606017,-73.986866,40.60624,-73.986704,2023-01-27,New Construction,No,Non Prevailing Wage,,,,,19.0,,,2.0,17.0,,,,,,19.0,,19.0,61,2023.0
73790,960 KELLY STREET APARTMENTS,1/31/2022,7/15/2022,1001913.0,960,KELLY STREET,Bronx,10459.0,2027130008.0,2129610.0,BX-02,17.0,159.0,BX0202,40.821437,-73.895865,40.82172,-73.895586,2022-07-15,New Construction,No,Non Prevailing Wage,,,,,17.0,,5.0,12.0,,,,,,,17.0,,17.0,18,2022.0
72199,912 BROADWAY APARTMENTS,1/28/2022,8/21/2023,976859.0,912,BROADWAY,Brooklyn,11206.0,3015847501.0,3398091.0,BK-03,36.0,287.0,BK0302,40.697561,-73.936305,40.697336,-73.93676,2023-08-21,New Construction,No,Non Prevailing Wage,,,,,25.0,,,12.0,13.0,,,,,,25.0,,25.0,81,2023.0
72492,846 MONROE STREET,1/27/2022,12/19/2022,1002515.0,846,MONROE STREET,Brooklyn,11221.0,3014810026.0,3426918.0,BK-03,41.0,375.0,BK0302,40.688706,-73.922345,40.688497,-73.922201,2022-12-19,New Construction,No,Non Prevailing Wage,,,,,3.0,,,1.0,2.0,,,,,,3.0,,3.0,8,2022.0
72202,765 EAST 214TH STREET,1/26/2022,6/17/2022,1001798.0,765,EAST 214 STREET,Bronx,10467.0,2046620075.0,2057887.0,BX-12,12.0,380.0,BX1201,40.879228,-73.862607,40.879428,-73.862462,2022-06-17,New Construction,No,Non Prevailing Wage,,,,,26.0,,,17.0,9.0,,,,,,26.0,,26.0,30,2022.0
70454,BROOKLYN - 985 PACIFIC STREET_MIH70451,1/21/2022,4/4/2024,996698.0,985,PACIFIC STREET,Brooklyn,11238.0,3011250001.0,3000000.0,BK-08,35.0,305.0,BK0802,40.679566,-73.960979,40.679855,-73.961314,2024-04-04,New Construction,No,Non Prevailing Wage,,7.0,7.0,,4.0,,3.0,9.0,6.0,,,,,,18.0,,18.0,69,2024.0
72203,972 WOODYCREST,1/18/2022,10/18/2022,1002928.0,972,WOODYCREST AVENUE,Bronx,10452.0,2025070007.0,2130546.0,BX-04,16.0,189.0,BX0402,40.831986,-73.928483,40.831804,-73.928303,2022-10-18,New Construction,No,Non Prevailing Wage,,,,,31.0,,,6.0,15.0,10.0,,,,,31.0,,31.0,101,2022.0
72204,1224 39TH STREET APARTMENTS,1/17/2022,11/7/2022,147951.0,1224,39 STREET,Brooklyn,11218.0,3052930013.0,3123064.0,BK-12,39.0,230.0,BK1202,40.641521,-73.987792,40.641277,-73.987864,2022-11-07,New Construction,No,Non Prevailing Wage,,,,,4.0,,,2.0,2.0,,,,,,4.0,,4.0,6,2022.0
68962,ELMCOR. 104-10 & 12 NORTHERN BLVD,1/13/2022,12/18/2023,1001734.0,104-10,NORTHERN BOULEVARD,Queens,11368.0,4017190004.0,4620871.0,QN-03,21.0,379.0,QN0303,40.757694,-73.864417,40.757425,-73.864187,2023-12-18,New Construction,No,Non Prevailing Wage,29.0,1.0,,,,,30.0,,,,,,,,30.0,,30.0,30,2023.0
72301,2524 ALBEMARLE ROAD,1/12/2022,11/7/2022,989509.0,2524,ALBEMARLE ROAD,Brooklyn,11226.0,3051280006.0,3426579.0,BK-17,40.0,794.0,BK1701,40.64796,-73.953416,40.647749,-73.953441,2022-11-07,New Construction,No,Non Prevailing Wage,,,,,2.0,,,2.0,,,,,,,2.0,,2.0,6,2022.0
72530,KEITH PLAZA,1/12/2022,5/20/2024,110144.0,2459,SOUTHERN BOULEVARD,Bronx,10458.0,2031150021.0,2086808.0,BX-06,15.0,393.0,BX0603,40.854923,-73.881234,40.855812,-73.881666,2024-05-20,Preservation,No,Non Prevailing Wage,,,,,310.0,1.0,28.0,80.0,149.0,54.0,,,,,311.0,,311.0,311,2024.0
72580,KELLY TOWERS (HDC),1/12/2022,5/20/2024,110127.0,2405,SOUTHERN BOULEVARD,Bronx,10458.0,2031150005.0,2013061.0,BX-06,15.0,393.0,BX0603,40.853773,-73.881558,40.85385,-73.882046,2024-05-20,Preservation,No,Non Prevailing Wage,,,302.0,,,,155.0,116.0,31.0,,,,,,302.0,,302.0,302,2024.0
72299,100 LENOX ROAD APARTMENTS,1/6/2022,2/3/2023,324006.0,100,LENOX ROAD,Brooklyn,11226.0,3050830050.0,3253056.0,BK-14,40.0,79602.0,BK1401,40.653739,-73.956659,40.653495,-73.956443,2023-02-03,New Construction,No,Non Prevailing Wage,,,,,29.0,,5.0,15.0,9.0,,,,,,29.0,,29.0,95,2023.0
72499,485 EAST 28TH STREET APARTMENTS,1/6/2022,12/14/2023,255066.0,485,EAST 28 STREET,Brooklyn,11226.0,3052150070.0,3428814.0,BK-17,45.0,828.0,BK1701,40.638906,-73.950204,40.638805,-73.949916,2023-12-14,New Construction,No,Non Prevailing Wage,,,,,6.0,,,3.0,3.0,,,,,,6.0,,6.0,17,2023.0
73791,810 EAST 165TH STREET,1/6/2022,2/26/2024,1007883.0,810,EAST 165 STREET,Bronx,10459.0,2026780027.0,2129621.0,BX-03,17.0,12901.0,BX0202,40.824321,-73.900923,40.82417,-73.901114,2024-02-26,New Construction,No,Non Prevailing Wage,,,,,2.0,,,2.0,,,,,,,2.0,,2.0,6,2024.0
65390,81 - 95 LENOX AVENUE AKA CANAAN IV TOWERS,12/30/2021,6/21/2023,842019.0,95,LENOX AVENUE,Manhattan,10026.0,1018240016.0,1055038.0,MN-10,9.0,218.0,MN1001,40.801226,-73.950278,40.801303,-73.951044,2023-06-21,Preservation,No,Non Prevailing Wage,127.0,11.0,12.0,,10.0,1.0,,63.0,89.0,9.0,,,,,161.0,,161.0,161,2023.0
69246,CARROLL-BURKE HDFC.PLP.FY22,12/30/2021,,60025.0,755,CROTONA PARK NORTH,Bronx,10457.0,2029480047.0,2009936.0,BX-06,15.0,36902.0,BX0602,40.841204,-73.892412,40.841311,-73.892155,2024-12-18,Preservation,No,Non Prevailing Wage,,26.0,3.0,,,1.0,,22.0,6.0,1.0,1.0,,,,30.0,,30.0,30,2024.0
69246,CARROLL-BURKE HDFC.PLP.FY22,12/30/2021,,60031.0,801,CROTONA PARK NORTH,Bronx,10460.0,2029520009.0,2010002.0,BX-06,15.0,367.0,BX0602,40.840459,-73.891148,40.840487,-73.890758,2024-12-18,Preservation,No,Non Prevailing Wage,,10.0,11.0,,,1.0,,,9.0,9.0,4.0,,,,22.0,,22.0,22,2024.0
69246,CARROLL-BURKE HDFC.PLP.FY22,12/30/2021,,60039.0,857,CROTONA PARK NORTH,Bronx,10460.0,2029570011.0,2010093.0,BX-06,15.0,367.0,BX0602,40.839618,-73.889729,40.839703,-73.889443,2024-12-18,Preservation,No,Non Prevailing Wage,3.0,9.0,7.0,,,1.0,,7.0,13.0,,,,,,20.0,,20.0,20,2024.0
69246,CARROLL-BURKE HDFC.PLP.FY22,12/30/2021,,60040.0,861,CROTONA PARK NORTH,Bronx,10460.0,2029570009.0,2010092.0,BX-06,15.0,367.0,BX0602,40.839569,-73.889646,40.839612,-73.889303,2024-12-18,Preservation,No,Non Prevailing Wage,,12.0,4.0,,,,,4.0,1.0,10.0,1.0,,,,16.0,,16.0,16,2024.0
69246,CARROLL-BURKE HDFC.PLP.FY22,12/30/2021,,60043.0,887,CROTONA PARK NORTH,Bronx,10460.0,2029570001.0,2010091.0,BX-06,15.0,367.0,BX0602,40.839269,-73.888616,40.83942,-73.888764,2024-12-18,Preservation,No,Non Prevailing Wage,5.0,15.0,9.0,,,1.0,,5.0,20.0,5.0,,,,,30.0,,30.0,30,2024.0
69246,CARROLL-BURKE HDFC.PLP.FY22,12/30/2021,,65778.0,870,EAST 175 STREET,Bronx,10460.0,2029570034.0,2010103.0,BX-06,15.0,367.0,BX0602,40.840023,-73.888597,40.839831,-73.888514,2024-12-18,Preservation,No,Non Prevailing Wage,3.0,13.0,3.0,,,,,4.0,8.0,6.0,1.0,,,,19.0,,19.0,19,2024.0
69246,CARROLL-BURKE HDFC.PLP.FY22,12/30/2021,,77588.0,815,FAIRMOUNT PLACE,Bronx,10460.0,2029550036.0,2010048.0,BX-06,15.0,36502.0,BX0602,40.842579,-73.88877,40.842444,-73.888022,2024-12-18,Preservation,No,Non Prevailing Wage,5.0,32.0,6.0,,,1.0,,10.0,26.0,5.0,3.0,,,,44.0,,44.0,44,2024.0
69218,MHANY. MHANY CLUSTER. JOE NYC,12/29/2021,2/14/2024,183293.0,135,ALBANY AVENUE,Brooklyn,11213.0,3013460008.0,3035758.0,BK-08,36.0,311.0,BK0802,40.675991,-73.938784,40.676073,-73.938503,2024-02-14,Preservation,No,Non Prevailing Wage,1.0,1.0,9.0,,,1.0,,8.0,4.0,,,,,,12.0,,12.0,12,2024.0
69218,MHANY. MHANY CLUSTER. JOE NYC,12/29/2021,2/14/2024,287684.0,1629,EASTERN PARKWAY EXTENSION,Brooklyn,11233.0,3014640045.0,3039333.0,BK-16,41.0,363.0,BK1601,40.67176,-73.914441,40.672059,-73.914462,2023-03-27,Preservation,No,Non Prevailing Wage,6.0,,10.0,,,,,5.0,11.0,,,,,,16.0,,16.0,16,2023.0
69218,MHANY. MHANY CLUSTER. JOE NYC,12/29/2021,2/14/2024,355164.0,1180,PRESIDENT STREET,Brooklyn,11225.0,3012820034.0,3033530.0,BK-09,35.0,321.0,BK0901,40.668111,-73.951538,40.667842,-73.951452,2024-01-31,Preservation,No,Non Prevailing Wage,2.0,7.0,10.0,,,1.0,,5.0,12.0,3.0,,,,,20.0,,20.0,20,2024.0
70082,ROCKAWAY VILLAGE PHASE 4,12/29/2021,,1000221.0,1605,VILLAGE LANE,Queens,11691.0,4155377501.0,4000000.0,QN-14,31.0,103202.0,QN1401,40.606351,-73.751795,40.606358,-73.752199,2024-02-22,New Construction,No,Non Prevailing Wage,31.0,33.0,65.0,,,,9.0,44.0,63.0,13.0,,,,,129.0,,129.0,129,2024.0
70082,ROCKAWAY VILLAGE PHASE 4,12/29/2021,,1000222.0,1607,VILLAGE LANE,Queens,11691.0,4155377501.0,4000000.0,QN-14,31.0,103202.0,QN1401,40.606348,-73.751799,40.606358,-73.752199,2024-02-26,New Construction,No,Non Prevailing Wage,15.0,13.0,26.0,,,1.0,5.0,20.0,25.0,5.0,,,,,55.0,,55.0,55,2024.0
70392,153-10 88TH AVE,12/29/2021,6/26/2024,996448.0,153-10,88 AVENUE,Queens,11432.0,4097620010.0,4623445.0,QN-12,27.0,236.0,QN1201,40.706356,-73.803642,40.706169,-73.803369,2024-06-26,New Construction,No,Non Prevailing Wage,,,44.0,,23.0,,18.0,35.0,14.0,,,,,,67.0,,67.0,223,2024.0
71900,EVERGREEN GARDENS (600621),12/29/2021,11/15/2024,77294.0,950,EVERGREEN AVENUE,Bronx,10473.0,2036500001.0,2022564.0,BX-09,18.0,28.0,BX0901,40.822347,-73.879612,40.822201,-73.879139,2024-11-15,Preservation,No,Non Prevailing Wage,4.0,179.0,30.0,,,,4.0,58.0,134.0,17.0,,,,,213.0,,213.0,213,2024.0
71900,EVERGREEN GARDENS (600621),12/29/2021,11/15/2024,77295.0,955,EVERGREEN AVENUE,Bronx,10473.0,2036490001.0,2022560.0,BX-09,18.0,28.0,BX0901,40.822382,-73.879641,40.822007,-73.88001,2024-11-15,Preservation,No,Non Prevailing Wage,2.0,75.0,67.0,,,,33.0,16.0,41.0,54.0,,,,,144.0,,144.0,144,2024.0
76633,6915 15 AVE,12/28/2021,7/6/2023,1006204.0,6915,15 AVENUE,Brooklyn,11228.0,3061580001.0,3156583.0,BK-11,38.0,190.0,BK1101,40.620826,-73.999701,40.620505,-73.999651,2023-07-06,New Construction,No,Non Prevailing Wage,,,,,6.0,,,4.0,,2.0,,,,,6.0,,6.0,18,2023.0
71891,808 ELSMERE AVENUE,12/27/2021,6/10/2022,999509.0,808,ELSMERE PLACE,Bronx,10460.0,2029550025.0,2130664.0,BX-06,15.0,36502.0,BX0602,40.843191,-73.888393,40.842831,-73.88813,2022-06-10,New Construction,No,Non Prevailing Wage,,,,,8.0,,2.0,2.0,4.0,,,,,,8.0,,8.0,25,2022.0
71892,1318 SOUTHERN BLVD,12/27/2021,6/10/2022,998343.0,1318,SOUTHERN BOULEVARD,Bronx,10459.0,2029800017.0,2130513.0,BX-03,17.0,123.0,BX0303,40.831084,-73.89147,40.831347,-73.890957,2022-06-10,New Construction,No,Non Prevailing Wage,,,,,18.0,,3.0,10.0,5.0,,,,,,18.0,,18.0,59,2022.0
71893,430 BELMONT AVENUE APARTMENTS,12/27/2021,5/20/2022,386680.0,360,VERMONT STREET,Brooklyn,11207.0,3037560123.0,3000000.0,BK-05,42.0,1158.0,BK0502,40.670644,-73.893574,40.670752,-73.893829,2022-05-20,New Construction,No,Non Prevailing Wage,,,,,3.0,,,,,3.0,,,,,3.0,,3.0,8,2022.0
70731,100 FLATBUSH AVENUE (PHASE 1),12/23/2021,1/16/2025,994953.0,90,FLATBUSH AVENUE,Brooklyn,11217.0,3001747502.0,3000000.0,BK-02,33.0,39.0,BK0202,40.685689,-73.978654,40.685673,-73.978997,2025-01-16,New Construction,No,Non Prevailing Wage,,18.0,18.0,9.0,,,5.0,32.0,6.0,2.0,,,,,45.0,,45.0,441,2025.0
71021,1018 EAST 163RD ST,12/23/2021,2/3/2023,64557.0,1018,EAST 163 STREET,Bronx,10459.0,2027237501.0,2005764.0,BX-02,17.0,89.0,BX0201,40.82097,-73.892412,40.820636,-73.892409,2023-02-03,Preservation,No,Non Prevailing Wage,61.0,17.0,18.0,,,1.0,,30.0,27.0,30.0,10.0,,,,97.0,,97.0,97,2023.0
62229,LAMBERT REDEVELOPMENT-BUILDING 5AB,12/22/2021,,996076.0,2082,BOSTON ROAD,Bronx,10460.0,2031407501.0,2130768.0,BX-06,15.0,361.0,BX0601,40.842107,-73.878478,40.842,-73.877784,2024-03-21,New Construction,No,Non Prevailing Wage,278.0,,,,,1.0,4.0,53.0,74.0,137.0,11.0,,,,279.0,,279.0,279,2024.0
63764,CONEY ISLAND PHASE 2,12/22/2021,,1000227.0,1607,SURF AVENUE,Brooklyn,11224.0,,,BK-13,47.0,326.0,BK1302,40.575401,-73.983636,,,2024-04-05,New Construction,No,Non Prevailing Wage,94.0,94.0,148.0,39.0,,1.0,94.0,105.0,151.0,26.0,,,,,376.0,,376.0,376,2024.0
64689,NME III,12/22/2021,4/29/2025,994120.0,207,WEST 140 STREET,Manhattan,10030.0,1020260024.0,1000000.0,MN-10,9.0,230.0,MN1002,40.818736,-73.941995,40.819008,-73.942071,2024-05-17,New Construction,No,Non Prevailing Wage,,,,21.0,,,,10.0,11.0,,,,,,,21.0,21.0,21,2024.0
64689,NME III,12/22/2021,4/29/2025,994121.0,304,WEST 150 STREET,Manhattan,10039.0,1020450098.0,1000000.0,MN-10,9.0,259.0,MN1002,40.826069,-73.939785,40.826047,-73.940298,2025-04-29,New Construction,No,Non Prevailing Wage,,,,31.0,,,1.0,11.0,8.0,11.0,,,,,,31.0,31.0,31,2025.0
69542,HELP. 273 SNEDIKER AVENUE. 515 BLAKE AVENUE BUILDING A,12/22/2021,10/10/2023,1001405.0,273,SNEDIKER AVENUE,Brooklyn,11207.0,3037667501.0,3429179.0,BK-05,42.0,1134.0,BK0502,40.668282,-73.900704,40.668325,-73.900253,2023-10-10,New Construction,No,Non Prevailing Wage,111.0,18.0,54.0,,,1.0,39.0,29.0,114.0,2.0,,,,,184.0,,184.0,184,2023.0
71866,825 DEKALB AVENUE APARTMENTS,12/22/2021,6/17/2022,1002402.0,825,DEKALB AVENUE,Brooklyn,11221.0,3017767504.0,3424850.0,BK-03,36.0,261.0,BK0301,40.692286,-73.943493,40.692533,-73.943291,2022-06-17,New Construction,No,Non Prevailing Wage,,,,,12.0,,,12.0,,,,,,,12.0,,12.0,39,2022.0
71867,781 ELSMERE PLACE APARTMENTS,12/22/2021,7/15/2022,1003916.0,781,ELSMERE PLACE,Bronx,10460.0,2029560052.0,2130571.0,BX-06,15.0,36502.0,BX0602,40.843444,-73.88887,40.843581,-73.888667,2022-07-15,New Construction,No,Non Prevailing Wage,,,,,8.0,,1.0,7.0,,,,,,,8.0,,8.0,25,2022.0
71868,27-14 39TH AVENUE APARTMENTS,12/22/2021,7/15/2022,991695.0,27-14,39 AVENUE,Queens,11101.0,4003970017.0,4004807.0,QN-01,26.0,31.0,QN0105,40.754232,-73.935821,40.753938,-73.935753,2022-07-15,New Construction,No,Non Prevailing Wage,,,,,2.0,,,2.0,,,,,,,2.0,,2.0,6,2022.0
71869,41-30 66TH STREET APARTMENTS,12/22/2021,6/17/2022,984647.0,41-30,66 STREET,Queens,11377.0,4012980075.0,4030239.0,QN-02,26.0,263.0,QN0203,40.74409,-73.897985,40.744115,-73.898382,2022-06-17,New Construction,No,Non Prevailing Wage,,,,,5.0,,,5.0,,,,,,,5.0,,5.0,14,2022.0
72206,LYRA AT 555 WEST 38TH STREET,12/21/2021,5/29/2024,1003181.0,555,WEST 38 STREET,Manhattan,10018.0,1007100001.0,1091000.0,MN-04,3.0,117.0,MN0401,40.758062,-73.999527,40.758474,-73.999643,2024-05-29,New Construction,No,Non Prevailing Wage,,,59.0,,118.0,,80.0,78.0,19.0,,,,,,177.0,,177.0,590,2024.0
72208,193 LENOX ROAD,12/21/2021,7/1/2022,324092.0,193,LENOX ROAD,Brooklyn,11226.0,3050650074.0,3116246.0,BK-17,40.0,822.0,BK1701,40.653946,-73.953473,40.654213,-73.95321,2022-07-01,New Construction,No,Non Prevailing Wage,,,,,5.0,,5.0,,,,,,,,5.0,,5.0,15,2022.0
72209,2109 TIEBOUT AVENUE,12/21/2021,5/22/2024,114404.0,2109,TIEBOUT AVENUE,Bronx,10457.0,2031440032.0,2013364.0,BX-05,15.0,379.0,BX0502,40.853095,-73.89874,40.853251,-73.898957,2024-05-22,New Construction,No,Non Prevailing Wage,,,,,5.0,,2.0,1.0,2.0,,,,,,5.0,,5.0,14,2024.0
71874,595 NEW YORK AVENUE APARTMENTS,12/20/2021,2/1/2023,343998.0,595,NEW YORK AVENUE,Brooklyn,11203.0,3048020001.0,3106949.0,BK-09,40.0,810.0,BK0902,40.659966,-73.94763,40.660106,-73.947442,2023-02-01,New Construction,No,Non Prevailing Wage,,,,,5.0,,,3.0,2.0,,,,,,5.0,,5.0,16,2023.0
72210,2073 & 2075 ANTHONY AVENUE APARTMENTS,12/20/2021,7/1/2022,1001410.0,2075,ANTHONY AVENUE,Bronx,10457.0,2031560020.0,2130544.0,BX-05,15.0,23502.0,BX0502,40.852845,-73.901947,40.852985,-73.902127,2022-07-01,New Construction,No,Non Prevailing Wage,,,,,43.0,,,43.0,,,,,,,43.0,,43.0,44,2022.0
72212,1365 NOSTRAND AVENUE,12/20/2021,12/20/2021,1001671.0,1365,NOSTRAND AVENUE,Brooklyn,11226.0,3048530011.0,3428865.0,BK-17,40.0,818.0,BK1701,40.653377,-73.949837,40.653327,-73.949426,2021-12-20,New Construction,No,Non Prevailing Wage,,,,,7.0,,7.0,,,,,,,,7.0,,7.0,22,2021.0
72213,55-44 97 PLACE APARTMENTS,12/20/2021,6/8/2023,1008559.0,55-44,97 PLACE,Queens,11368.0,4019050047.0,4047191.0,QN-04,21.0,44302.0,QN0402,40.738592,-73.863658,40.737588,-73.863545,2023-06-08,New Construction,No,Non Prevailing Wage,,,,,3.0,,,,3.0,,,,,,3.0,,3.0,10,2023.0
71865,1559 WHITE PLAINS ROAD APARTMENTS,12/17/2021,5/13/2022,1001166.0,1559,WHITE PLAINS ROAD,Bronx,10462.0,2039230015.0,2129061.0,BX-09,18.0,21601.0,BX0901,40.839453,-73.863846,40.839542,-73.864156,2022-05-13,New Construction,No,Non Prevailing Wage,,,,,3.0,,,1.0,2.0,,,,,,3.0,,3.0,8,2022.0
71890,1503 NOSTRAND AVENUE,12/17/2021,1/28/2022,346162.0,1503,NOSTRAND AVENUE,Brooklyn,11226.0,3048840048.0,3259607.0,BK-17,40.0,824.0,BK1701,40.649504,-73.949425,40.649514,-73.949115,2022-01-28,New Construction,No,Non Prevailing Wage,,,,,3.0,,1.0,2.0,,,,,,,3.0,,3.0,8,2022.0
65303,PENINSULA A1,12/16/2021,,1001190.0,5123,BEACH CHANNEL DRIVE,Queens,11691.0,4158437501.0,4000000.0,QN-14,31.0,97204.0,QN1402,40.595196,-73.782775,40.59465,-73.783072,2024-08-28,New Construction,No,Non Prevailing Wage,97.0,,96.0,,,1.0,45.0,87.0,55.0,7.0,,,,,194.0,,194.0,194,2024.0
66601,266 WEST 96TH STREET,12/16/2021,5/31/2024,1001362.0,270,WEST 96 STREET,Manhattan,10025.0,1012437503.0,1091038.0,MN-07,7.0,183.0,MN0702,40.794981,-73.972584,40.794756,-73.972761,2024-05-31,New Construction,No,Non Prevailing Wage,11.0,,21.0,35.0,,1.0,35.0,14.0,17.0,2.0,,,,,68.0,,68.0,171,2024.0
71264,SEAVIEW ESTATES PRESERVATION HDFC.HPO.FY22,12/16/2021,12/16/2022,784121.0,90,ST MARKS PLACE,Staten Island,10301.0,5000220070.0,5112219.0,SI-01,49.0,7.0,SI0101,40.646479,-74.083271,40.645946,-74.084085,2022-12-16,Preservation,No,Non Prevailing Wage,1.0,1.0,47.0,30.0,,,9.0,58.0,12.0,,,,,,79.0,,79.0,79,2022.0
71264,SEAVIEW ESTATES PRESERVATION HDFC.HPO.FY22,12/16/2021,12/16/2022,812466.0,201,HAMILTON AVENUE,Staten Island,10301.0,5000220070.0,5112216.0,SI-01,49.0,7.0,SI0101,40.645161,-74.083968,40.645946,-74.084085,2022-12-16,Preservation,No,Non Prevailing Wage,,,52.0,25.0,,1.0,20.0,42.0,16.0,,,,,,78.0,,78.0,78,2022.0
71264,SEAVIEW ESTATES PRESERVATION HDFC.HPO.FY22,12/16/2021,12/16/2022,812467.0,217,HAMILTON AVENUE,Staten Island,10301.0,5000220070.0,5112217.0,SI-01,49.0,7.0,SI0101,40.645345,-74.08447,40.645946,-74.084085,2022-12-16,Preservation,No,Non Prevailing Wage,,1.0,55.0,24.0,,,5.0,67.0,8.0,,,,,,80.0,,80.0,80,2022.0
71264,SEAVIEW ESTATES PRESERVATION HDFC.HPO.FY22,12/16/2021,12/16/2022,812578.0,80,ST MARKS PLACE,Staten Island,10301.0,5000220070.0,5112218.0,SI-01,49.0,7.0,SI0101,40.646539,-74.083509,40.645946,-74.084085,2022-12-16,Preservation,No,Non Prevailing Wage,,,55.0,24.0,,,9.0,58.0,12.0,,,,,,79.0,,79.0,79,2022.0
71887,285 RUTLAND ROAD,12/16/2021,2/28/2022,999250.0,285,RUTLAND ROAD,Brooklyn,11225.0,3050360053.0,3428923.0,BK-09,40.0,800.0,BK0902,40.659356,-73.951447,40.659572,-73.951292,2022-02-28,New Construction,No,Non Prevailing Wage,,,,,3.0,,,,3.0,,,,,,3.0,,3.0,9,2022.0
71888,931-935 E 179TH STREET,12/16/2021,12/27/2023,66162.0,931,EAST 179 STREET,Bronx,10460.0,2031270039.0,2000000.0,BX-06,15.0,363.0,BX0601,40.843242,-73.882155,40.843374,-73.881938,2023-12-27,New Construction,No,Non Prevailing Wage,,,,,12.0,,2.0,4.0,6.0,,,,,,12.0,,12.0,37,2023.0
71889,8218 AVENUE J,12/16/2021,9/20/2023,992856.0,8218,AVENUE J,Brooklyn,11236.0,3080340042.0,3426048.0,BK-18,46.0,996.0,BK1803,40.635094,-73.909508,40.634932,-73.909282,2023-09-20,New Construction,No,Non Prevailing Wage,,,,,2.0,,,,2.0,,,,,,2.0,,2.0,6,2023.0
72214,322 MENAHAN STREET,12/16/2021,12/16/2021,998405.0,322,MENAHAN STREET,Brooklyn,11237.0,3033190025.0,3426132.0,BK-04,37.0,441.0,BK0401,40.700687,-73.914577,40.700629,-73.914292,2021-12-16,New Construction,No,Non Prevailing Wage,,,,,4.0,,,4.0,,,,,,,4.0,,4.0,13,2021.0
72215,388 CHRISTOPHER AVENUE,12/16/2021,2/18/2022,998379.0,388,CHRISTOPHER AVENUE,Brooklyn,11212.0,3038110128.0,3428922.0,BK-16,41.0,918.0,BK1602,40.662809,-73.904107,40.662801,-73.904392,2022-02-18,New Construction,No,Non Prevailing Wage,,,,,3.0,,,1.0,2.0,,,,,,3.0,,3.0,10,2022.0
71885,680 EAST 21ST STREET APARTMENTS,12/15/2021,7/11/2023,1001367.0,680,EAST 21 STREET,Brooklyn,11226.0,3052200057.0,3120590.0,BK-15,45.0,51601.0,BK1401,40.637306,-73.957541,40.637194,-73.957801,2023-07-11,New Construction,No,Non Prevailing Wage,,,,,6.0,,2.0,2.0,2.0,,,,,,6.0,,6.0,17,2023.0
72216,2026 WALTON AVENUE,12/15/2021,8/19/2022,994916.0,2026,WALTON AVENUE,Bronx,10453.0,2028290040.0,2007945.0,BX-05,14.0,241.0,BX0502,40.85283,-73.907025,40.852775,-73.906733,2022-08-19,New Construction,No,Non Prevailing Wage,,,,,13.0,,4.0,7.0,2.0,,,,,,13.0,,13.0,43,2022.0
72217,1690-1692 PACIFIC STREET,12/15/2021,2/18/2022,991494.0,1690,PACIFIC STREET,Brooklyn,11213.0,3013420012.0,3427185.0,BK-08,36.0,309.0,BK0802,40.676698,-73.932395,40.676482,-73.932731,2022-02-18,New Construction,No,Non Prevailing Wage,,,,,3.0,,3.0,,,,,,,,3.0,,3.0,10,2022.0
71863,363 EAST 197TH STREET APARTMENTS,12/14/2021,6/10/2022,67109.0,363,EAST 197 STREET,Bronx,10458.0,2032830104.0,2016537.0,BX-07,15.0,40502.0,BX0702,40.866004,-73.887993,40.866169,-73.887758,2022-06-10,New Construction,No,Non Prevailing Wage,,,,,6.0,,4.0,2.0,,,,,,,6.0,,6.0,20,2022.0
71864,140 WEST FORDHAM ROAD,12/14/2021,9/16/2022,122109.0,140,WEST FORDHAM ROAD,Bronx,10468.0,2032250108.0,2130515.0,BX-07,14.0,255.0,BX0701,40.862793,-73.907062,40.862494,-73.907417,2022-09-16,New Construction,No,Non Prevailing Wage,,,,18.0,,,2.0,14.0,2.0,,,,,,18.0,,18.0,54,2022.0
72218,476 MAPLE STREET APARTMENTS,12/14/2021,8/26/2022,1002892.0,476,MAPLE STREET,Brooklyn,11225.0,3047980011.0,3428536.0,BK-09,40.0,806.0,BK0902,40.661186,-73.944731,40.660964,-73.944911,2022-08-26,New Construction,No,Non Prevailing Wage,,,,,3.0,,,3.0,,,,,,,3.0,,3.0,9,2022.0
72625,1111 FOSTER AVENUE APARTMENTS,12/14/2021,11/22/2022,224414.0,1035,CONEY ISLAND AVENUE,Brooklyn,11230.0,3052327501.0,3382135.0,BK-14,45.0,526.0,BK1402,40.632514,-73.966829,40.63278,-73.966559,2022-11-22,New Construction,No,Non Prevailing Wage,,,,,18.0,,4.0,8.0,4.0,2.0,,,,,18.0,,18.0,60,2022.0
71861,1405 HERKIMER STREET APARTMENTS,12/13/2021,7/15/2022,311334.0,1405,HERKIMER STREET,Brooklyn,11233.0,3015530037.0,3042292.0,BK-16,37.0,367.0,BK1601,40.677309,-73.906823,40.67754,-73.906902,2022-07-15,New Construction,No,Non Prevailing Wage,,,,,3.0,,,,1.0,2.0,,,,,3.0,,3.0,9,2022.0
71862,2110 HUGHES AVENUE APARTMENTS,12/13/2021,7/1/2022,927554.0,2110,HUGHES AVENUE,Bronx,10457.0,2030810006.0,2127264.0,BX-06,15.0,373.0,BX0602,40.849398,-73.890168,40.849283,-73.88998,2022-07-01,New Construction,No,Non Prevailing Wage,,,,,3.0,,,3.0,,,,,,,3.0,,3.0,8,2022.0
72220,2381 & 2383 LORILLARD PLACE APARTMENTS,12/10/2021,12/22/2022,985901.0,2381,LORILLARD PLACE,Bronx,10458.0,2030550021.0,2130467.0,BX-06,15.0,387.0,BX0603,40.855867,-73.889716,40.856062,-73.889832,2022-12-22,New Construction,No,Non Prevailing Wage,,,,,3.0,,,3.0,,,,,,,3.0,,3.0,7,2022.0
72220,2381 & 2383 LORILLARD PLACE APARTMENTS,12/10/2021,12/22/2022,992072.0,2383,LORILLARD PLACE,Bronx,10458.0,2030550020.0,2128558.0,BX-06,15.0,387.0,BX0603,40.8559,-73.889684,40.856122,-73.889778,2022-12-12,New Construction,No,Non Prevailing Wage,,,,,3.0,,,3.0,,,,,,,3.0,,3.0,7,2022.0
69501,CHICA HDFC.YR15.FY21,12/9/2021,6/30/2025,848175.0,1022,REV JAMES A POLITE AVENUE,Bronx,10459.0,2026910122.0,2114108.0,BX-02,17.0,131.0,BX0202,40.824116,-73.898856,40.82408,-73.898672,2025-06-30,Preservation,Yes,Non Prevailing Wage,20.0,6.0,40.0,1.0,,1.0,68.0,,,,,,,,68.0,,68.0,68,2025.0
72221,ASTORIA WEST - 11-37 31ST AVENUE,12/9/2021,3/31/2023,417008.0,1937-11-01T00:00:00.000,31 AVENUE,Queens,11106.0,4005040003.0,4619106.0,QN-01,22.0,81.0,QN0102,40.769245,-73.934496,40.769327,-73.933868,2023-03-31,New Construction,No,Non Prevailing Wage,,,,,36.0,,,28.0,8.0,,,,,,36.0,,36.0,117,2023.0
66928,HELP. 282 HINSDALE STREET. 515 BLAKE AVENUE BUILDING B,12/8/2021,,1001184.0,282,HINSDALE STREET,Brooklyn,11207.0,3037660024.0,3427356.0,BK-05,42.0,1134.0,BK0502,40.668155,-73.899742,40.667993,-73.89998,2023-07-19,New Construction,No,Non Prevailing Wage,43.0,,27.0,,,1.0,56.0,8.0,7.0,,,,,,71.0,,71.0,71,2023.0
71860,2779 & 2781 UNIVERSITY AVENUE APARTMENTS,12/8/2021,10/7/2022,1000959.0,2781,UNIVERSITY AVENUE,Bronx,10468.0,2032490104.0,2129474.0,BX-08,14.0,26702.0,BX0801,40.870966,-73.899403,40.871106,-73.899674,2022-09-09,New Construction,No,Non Prevailing Wage,,,,,3.0,,,3.0,,,,,,,3.0,,3.0,9,2022.0
71860,2779 & 2781 UNIVERSITY AVENUE APARTMENTS,12/8/2021,10/7/2022,1000962.0,2779,UNIVERSITY AVENUE,Bronx,10468.0,2032490105.0,2130576.0,BX-08,14.0,26702.0,BX0801,40.870917,-73.899421,40.871038,-73.899696,2022-10-07,New Construction,No,Non Prevailing Wage,,,,,3.0,,,3.0,,,,,,,3.0,,3.0,9,2022.0
72222,THE ARIEL 44-46 PURVES STREET,12/7/2021,11/8/2024,970255.0,44-46,PURVES STREET,Queens,11101.0,4002680031.0,4607819.0,QN-02,26.0,1902.0,QN0201,40.746717,-73.941018,40.746168,-73.9409,2024-11-08,New Construction,No,Non Prevailing Wage,,,,,15.0,,3.0,11.0,1.0,,,,,,15.0,,15.0,49,2024.0
72223,872 HOME STREET,12/7/2021,5/14/2025,86473.0,872,HOME STREET,Bronx,10459.0,2026920035.0,2005279.0,BX-02,17.0,131.0,BX0202,40.828105,-73.896527,40.827872,-73.896495,2025-05-14,New Construction,No,Non Prevailing Wage,,,,,10.0,,5.0,4.0,1.0,,,,,,10.0,,10.0,11,2025.0
71859,2484 BEDFORD AVENUE,12/6/2021,5/20/2022,205955.0,2484,BEDFORD AVENUE,Brooklyn,11226.0,3051670045.0,3428925.0,BK-14,40.0,79201.0,BK1401,40.643121,-73.954561,40.643072,-73.954864,2022-05-20,New Construction,No,Non Prevailing Wage,,,,,8.0,,,,8.0,,,,,,8.0,,8.0,25,2022.0
71199,REVIVE 103 HDFC,12/2/2021,12/2/2021,18930.0,160,EAST 103 STREET,Manhattan,10029.0,1016300041.0,1083441.0,MN-11,8.0,166.0,MN1101,40.790081,-73.947145,40.789831,-73.94713,2021-12-02,Preservation,Yes,Non Prevailing Wage,48.0,7.0,3.0,1.0,,1.0,10.0,30.0,10.0,10.0,,,,,60.0,,60.0,60,2021.0
72224,THIRD AT BANKSIDE,12/2/2021,6/7/2024,1002080.0,2385,3 AVENUE,Bronx,10451.0,2023190002.0,2129132.0,BX-01,8.0,51.0,BX0101,40.80819,-73.931243,40.808674,-73.931915,2024-06-07,New Construction,No,Non Prevailing Wage,,,,,138.0,,47.0,49.0,38.0,4.0,,,,,138.0,,138.0,458,2024.0
72225,THE HENRY - 2395 PALISADE AVENUE,12/2/2021,2/3/2023,1004857.0,2395,PALISADE AVENUE,Bronx,10463.0,2057160264.0,2130523.0,BX-08,11.0,29301.0,BX0803,40.87934,-73.92061,40.879258,-73.921044,2023-02-03,New Construction,No,Non Prevailing Wage,,,,,17.0,,3.0,8.0,6.0,,,,,,17.0,,17.0,55,2023.0
72226,280 20 STREET APARTMENTS,12/2/2021,1/31/2023,1003183.0,276,20 STREET,Brooklyn,11215.0,3008910026.0,3324563.0,BK-07,39.0,145.0,BK0702,40.661306,-73.991854,40.660993,-73.9918,2023-01-31,New Construction,No,Non Prevailing Wage,,,,,8.0,,,4.0,4.0,,,,,,8.0,,8.0,24,2023.0
72227,SILVER POINT 43-20 52ND STREET APARTMENTS,12/2/2021,2/6/2024,441530.0,43-20,52 STREET,Queens,11377.0,4013207503.0,4030858.0,QN-02,26.0,25302.0,QN0202,40.743731,-73.912584,40.743397,-73.912844,2024-02-06,New Construction,No,Non Prevailing Wage,,,,,5.0,,,,5.0,,,,,,5.0,,5.0,14,2024.0
72228,27-10 37TH AVENUE,12/2/2021,3/16/2023,424470.0,27-10,37 AVENUE,Queens,11101.0,4003697501.0,4623406.0,QN-01,26.0,51.0,QN0105,40.756492,-73.933827,40.75619,-73.933791,2023-03-16,New Construction,No,Non Prevailing Wage,,,,,3.0,,,3.0,,,,,,,3.0,,3.0,10,2023.0
71857,1111 FULTON STREET APARTMENTS,11/29/2021,8/25/2022,990870.0,1111,FULTON STREET,Brooklyn,11238.0,3019970060.0,3399785.0,BK-03,36.0,227.0,BK0301,40.681429,-73.957037,40.681703,-73.957091,2022-08-25,New Construction,No,Non Prevailing Wage,,,,,6.0,,2.0,2.0,2.0,,,,,,6.0,,6.0,18,2022.0
71858,110 EAST 53RD STREET APARTMENTS,11/29/2021,6/20/2025,268906.0,110,EAST 53 STREET,Brooklyn,11203.0,3046220022.0,3428571.0,BK-17,41.0,878.0,BK1703,40.657584,-73.928086,40.657557,-73.928396,2025-06-20,New Construction,No,Non Prevailing Wage,,,,,3.0,,1.0,2.0,,,,,,,3.0,,3.0,8,2025.0
72230,1153 BROADWAY APARTMENTS,11/29/2021,2/13/2023,213707.0,1153,BROADWAY,Brooklyn,11221.0,3032527502.0,3074002.0,BK-04,34.0,393.0,BK0401,40.693134,-73.92843,40.693269,-73.928232,2023-02-13,New Construction,No,Non Prevailing Wage,,,,,5.0,,,2.0,3.0,,,,,,5.0,,5.0,14,2023.0
71855,668 BUSHWICK AVENUE APARTMENTS,11/26/2021,7/13/2023,982177.0,666,BUSHWICK AVENUE,Brooklyn,11221.0,3031940024.0,3000000.0,BK-04,34.0,393.0,BK0401,40.697246,-73.932162,40.697056,-73.932555,2023-07-13,New Construction,No,Non Prevailing Wage,,,,,15.0,,,11.0,4.0,,,,,,15.0,,15.0,50,2023.0
71856,37 HERKIMER STREET,11/26/2021,9/30/2022,311475.0,37,HERKIMER STREET,Brooklyn,11216.0,3018600085.0,3425800.0,BK-03,36.0,247.0,BK0301,40.679766,-73.951832,40.679988,-73.951847,2022-09-30,New Construction,No,Non Prevailing Wage,,,,,2.0,,,2.0,,,,,,,2.0,,2.0,6,2022.0
72231,2809 CLARENDON ROAD APARTMENTS,11/26/2021,10/3/2022,220827.0,2809,CLARENDON ROAD,Brooklyn,11226.0,3051720037.0,3428841.0,BK-17,40.0,826.0,BK1701,40.643147,-73.950472,40.643416,-73.950291,2022-10-03,New Construction,No,Non Prevailing Wage,,,,,5.0,,,3.0,2.0,,,,,,5.0,,5.0,16,2022.0
72300,14 DUFFIELD STREET APARTMENTS,11/23/2021,8/25/2022,234710.0,14,DUFFIELD STREET,Brooklyn,11201.0,3001080019.0,3000191.0,BK-02,33.0,1501.0,BK0202,40.69797,-73.984031,40.697978,-73.984262,2022-08-25,New Construction,No,Non Prevailing Wage,,,,,4.0,,,3.0,1.0,,,,,,4.0,,4.0,12,2022.0
71873,288 WILLOUGHBY AVENUE APARTMENTS,11/22/2021,6/3/2022,396247.0,288,WILLOUGHBY AVENUE,Brooklyn,11205.0,3019250029.0,3426205.0,BK-03,33.0,235.0,BK0301,40.692557,-73.959544,40.692359,-73.959483,2022-06-03,New Construction,No,Non Prevailing Wage,,,,,4.0,,,4.0,,,,,,,4.0,,4.0,12,2022.0
72232,1669 EAST 19TH ST,11/22/2021,7/27/2023,988780.0,1669,EAST 19 STREET,Brooklyn,11229.0,3067820059.0,3426569.0,BK-15,48.0,550.0,BK1502,40.609366,-73.954512,40.60936,-73.954213,2023-07-27,New Construction,No,Non Prevailing Wage,,,,,9.0,,3.0,3.0,3.0,,,,,,9.0,,9.0,29,2023.0
72233,990 WOODYCREST AVENUE APARTMENTS,11/22/2021,10/18/2022,125706.0,990,WOODYCREST AVENUE,Bronx,10452.0,2025070018.0,2130514.0,BX-04,16.0,189.0,BX0402,40.832279,-73.928259,40.832276,-73.927941,2022-10-18,New Construction,No,Non Prevailing Wage,,,,,8.0,,2.0,2.0,4.0,,,,,,8.0,,8.0,25,2022.0
72622,160 CLARKSON AVE APARTMENTS,11/22/2021,9/22/2023,1004402.0,160,CLARKSON AVENUE,Brooklyn,11226.0,3050650039.0,3116233.0,BK-17,40.0,822.0,BK1701,40.655146,-73.954535,40.654773,-73.954579,2023-09-22,New Construction,No,Non Prevailing Wage,,,,,36.0,,10.0,18.0,8.0,,,,,,36.0,,36.0,116,2023.0
74160,2588-2590 HEATH AVENUE,11/22/2021,8/7/2024,991334.0,2590,HEATH AVENUE,Bronx,10463.0,2032370062.0,2015133.0,BX-07,14.0,269.0,BX0701,40.869015,-73.907003,40.868837,-73.906847,2024-08-07,New Construction,No,Non Prevailing Wage,,,,,3.0,,,,3.0,,,,,,3.0,,3.0,7,2024.0
68891,LITTLE ITALY RESTORATION APARTMENTS (L.I.R.A.),11/19/2021,11/19/2021,27685.0,13,SPRING STREET,Manhattan,10012.0,1004930041.0,1007484.0,MN-02,1.0,43.0,MN0201,40.721365,-73.994812,40.721779,-73.994957,2021-11-19,Preservation,Yes,Non Prevailing Wage,128.0,11.0,8.0,2.0,,3.0,,34.0,118.0,,,,,,152.0,,152.0,152,2021.0
71206,MADISON AVE,11/19/2021,11/19/2021,20862.0,47,EAST 130 STREET,Manhattan,10037.0,1017550020.0,1054277.0,MN-11,9.0,206.0,MN1102,40.808773,-73.938001,40.809015,-73.938026,2021-11-19,Preservation,No,Non Prevailing Wage,12.0,2.0,1.0,,,,,,5.0,10.0,,,,,15.0,,15.0,15,2021.0
71206,MADISON AVE,11/19/2021,11/19/2021,24822.0,2071,MADISON AVENUE,Manhattan,10037.0,1017550050.0,1054293.0,MN-11,9.0,206.0,MN1102,40.809333,-73.938012,40.809234,-73.93777,2021-11-19,Preservation,No,Non Prevailing Wage,22.0,16.0,,,,1.0,10.0,20.0,9.0,,,,,,39.0,,39.0,39,2021.0
71207,GRACE TOWERS,11/19/2021,11/19/2021,354100.0,2060,PITKIN AVENUE,Brooklyn,11207.0,3037370001.0,3328020.0,BK-05,37.0,1144.0,BK0502,40.671791,-73.896506,40.671165,-73.896219,2021-11-19,Preservation,No,Non Prevailing Wage,52.0,19.0,13.0,,,,,18.0,42.0,18.0,6.0,,,,84.0,,84.0,84,2021.0
71207,GRACE TOWERS,11/19/2021,11/19/2021,807762.0,373,BELMONT AVENUE,Brooklyn,11207.0,3037370001.0,3328019.0,BK-05,37.0,1144.0,BK0502,40.670567,-73.896003,40.671165,-73.896219,2021-11-19,Preservation,No,Non Prevailing Wage,54.0,21.0,8.0,,,1.0,,18.0,42.0,18.0,6.0,,,,84.0,,84.0,84,2021.0
71208,TARGET V,11/19/2021,11/19/2021,81438.0,1971,GRAND AVENUE,Bronx,10453.0,2028690163.0,2008620.0,BX-05,14.0,243.0,BX0501,40.852161,-73.910789,40.85221,-73.911042,2021-11-19,Preservation,No,Non Prevailing Wage,33.0,4.0,2.0,,,,,14.0,10.0,15.0,,,,,39.0,,39.0,39,2021.0
71208,TARGET V,11/19/2021,11/19/2021,81440.0,1975,GRAND AVENUE,Bronx,10453.0,2028690159.0,2008619.0,BX-05,14.0,243.0,BX0501,40.852257,-73.910775,40.85252,-73.910959,2021-11-19,Preservation,No,Non Prevailing Wage,30.0,7.0,6.0,,,1.0,2.0,12.0,30.0,,,,,,44.0,,44.0,44,2021.0
72486,164-11 HIGHLAND AVENUE,11/19/2021,10/17/2023,663003.0,164-11,HIGHLAND AVENUE,Queens,11432.0,4098460010.0,4210624.0,QN-08,24.0,448.0,QN0805,40.710351,-73.799605,40.710691,-73.799514,2023-10-17,New Construction,No,Non Prevailing Wage,,,,,4.0,,,1.0,3.0,,,,,,4.0,,4.0,12,2023.0
74161,30-75 32ND STREET APARTMENTS,11/19/2021,3/27/2023,984660.0,30-75,32 STREET,Queens,11102.0,4006160008.0,4008530.0,QN-01,22.0,63.0,QN0103,40.764785,-73.921989,40.764604,-73.921816,2023-03-27,New Construction,No,Non Prevailing Wage,,,,,3.0,,,3.0,,,,,,,3.0,,3.0,7,2023.0
69479,SCHEUER HOUSE OF MANHATTAN BEACH,11/18/2021,11/18/2021,225950.0,161,CORBIN PLACE,Brooklyn,11235.0,3087190073.0,3245719.0,BK-15,48.0,61004.0,BK1303,40.578026,-73.954127,40.57777,-73.953832,2021-11-18,Preservation,No,Non Prevailing Wage,63.0,,1.0,,,,30.0,34.0,,,,,,,64.0,,64.0,64,2021.0
69479,SCHEUER HOUSE OF MANHATTAN BEACH,11/18/2021,11/18/2021,395156.0,156,WEST END AVENUE,Brooklyn,11235.0,3087190027.0,3245695.0,BK-15,48.0,61004.0,BK1303,40.577836,-73.953079,40.577647,-73.9534,2021-11-18,Preservation,No,Non Prevailing Wage,81.0,2.0,1.0,1.0,,1.0,21.0,64.0,1.0,,,,,,86.0,,86.0,86,2021.0
71884,37-28 104TH STREET APARTMENTS,11/18/2021,1/13/2023,515769.0,37-28,104 STREET,Queens,11368.0,4017690018.0,4623413.0,QN-03,21.0,40502.0,QN0303,40.752681,-73.863157,40.752667,-73.863449,2023-01-13,New Construction,No,Non Prevailing Wage,,,,,3.0,,,3.0,,,,,,,3.0,,3.0,7,2023.0
72234,142 RICHARDS STREET APARTMENTS,11/18/2021,6/20/2023,1003184.0,142,RICHARDS STREET,Brooklyn,11231.0,3005560024.0,3426417.0,BK-06,38.0,5301.0,BK0601,40.677267,-74.0103,40.677382,-74.010726,2023-06-20,New Construction,No,Non Prevailing Wage,,,,,6.0,,,3.0,3.0,,,,,,6.0,,6.0,17,2023.0
72472,304 EAST 134TH STREET APARTMENTS,11/18/2021,10/24/2022,62474.0,304,EAST 134 STREET,Bronx,10454.0,2023090020.0,2130461.0,BX-01,8.0,1901.0,BX0101,40.807812,-73.927743,40.807593,-73.927776,2022-10-24,New Construction,No,Non Prevailing Wage,,,,,7.0,,,7.0,,,,,,,7.0,,7.0,22,2022.0
76632,314 WOODWARD AVE APARTMENTS,11/18/2021,10/28/2022,1002516.0,314,WOODWARD AVENUE,Queens,11385.0,4033990035.0,4622958.0,QN-05,34.0,53901.0,QN0502,40.709934,-73.914269,40.709662,-73.914273,2022-10-28,New Construction,No,Non Prevailing Wage,,,,,6.0,,,3.0,3.0,,,,,,6.0,,6.0,18,2022.0
71872,417 MANHATTAN AVENUE,11/17/2021,6/3/2022,982514.0,417,MANHATTAN AVENUE,Brooklyn,11222.0,3027230029.0,3067908.0,BK-01,33.0,499.0,BK0101,40.719176,-73.946898,40.719044,-73.947122,2022-06-03,New Construction,No,Non Prevailing Wage,,,,,3.0,,,2.0,1.0,,,,,,3.0,,3.0,10,2022.0
72235,40-53 JUNCTION BOULEVARD APARTMENTS,11/17/2021,3/20/2023,669812.0,40-53,JUNCTION BOULEVARD,Queens,11368.0,4016050049.0,4040211.0,QN-04,21.0,37501.0,QN0402,40.747826,-73.868634,40.747834,-73.868274,2023-03-20,New Construction,No,Non Prevailing Wage,,,,,3.0,,,3.0,,,,,,,3.0,,3.0,10,2023.0
72237,320 EAST MOSHOLU PARKWAY SOUTH APARTMENTS,11/16/2021,10/17/2023,102882.0,3008,PERRY AVENUE,Bronx,10458.0,2032810015.0,2016455.0,BX-07,11.0,415.0,BX0702,40.870893,-73.882749,40.870939,-73.882305,2023-10-17,New Construction,No,Non Prevailing Wage,,,,,11.0,,2.0,4.0,5.0,,,,,,11.0,,11.0,34,2023.0
72239,881 LEXINGTON AVENUE APARTMENTS,11/16/2021,9/12/2022,325379.0,881,LEXINGTON AVENUE,Brooklyn,11221.0,3016230057.0,3337964.0,BK-03,41.0,387.0,BK0302,40.690591,-73.925707,40.690819,-73.925613,2022-09-12,New Construction,No,Non Prevailing Wage,,,,,8.0,,1.0,7.0,,,,,,,8.0,,8.0,24,2022.0
72240,1329 MORRIS AVENUE APARTMENTS,11/16/2021,5/12/2023,97374.0,1329,MORRIS AVENUE,Bronx,10456.0,2028160058.0,2130582.0,BX-04,16.0,17902.0,BX0403,40.83636,-73.912288,40.83649,-73.912548,2023-05-12,New Construction,No,Non Prevailing Wage,,,,,7.0,,3.0,3.0,1.0,,,,,,7.0,,7.0,21,2023.0
72241,1540 PARK PLACE APARTMENTS,11/16/2021,8/26/2022,988010.0,1540,PARK PLACE,Brooklyn,11213.0,3013740032.0,3036608.0,BK-08,36.0,347.0,BK0802,40.672116,-73.926387,40.671853,-73.926337,2022-08-26,New Construction,No,Non Prevailing Wage,,,,,3.0,,,3.0,,,,,,,3.0,,3.0,10,2022.0
72242,99-21 CORONA AVENUE APARTMENTS,11/16/2021,4/7/2023,646924.0,99-21,CORONA AVENUE,Queens,11368.0,4016290103.0,4040752.0,QN-04,21.0,413.0,QN0402,40.744338,-73.862337,40.744555,-73.86225,2023-04-07,New Construction,No,Non Prevailing Wage,,,,,3.0,,,2.0,1.0,,,,,,3.0,,3.0,7,2023.0
72623,1353 PURDY STREET APARTMENTS,11/16/2021,9/12/2023,104791.0,1353,PURDY STREET,Bronx,10462.0,2039340055.0,2029002.0,BX-09,18.0,222.0,BX0904,40.83498,-73.852995,40.835647,-73.853413,2023-09-12,New Construction,No,Non Prevailing Wage,,,,,8.0,,,6.0,1.0,1.0,,,,,8.0,,8.0,26,2023.0
70801,550 TENTH AVENUE,11/15/2021,5/14/2025,1000496.0,550,10 AVENUE,Manhattan,10018.0,1010500061.0,1076207.0,MN-04,3.0,115.0,MN0402,40.758743,-73.996105,40.758507,-73.995914,2025-05-14,New Construction,No,Non Prevailing Wage,,,47.0,,90.0,,42.0,59.0,36.0,,,,,,137.0,,137.0,453,2025.0
71854,PLANK ROAD APARTMENTS,11/15/2021,2/3/2023,131884.0,25,6 AVENUE,Brooklyn,11217.0,3011287505.0,3000000.0,BK-02,35.0,161.0,BK0801,40.682101,-73.974008,40.681815,-73.973806,2023-02-03,New Construction,No,Non Prevailing Wage,,,,,94.0,,24.0,48.0,22.0,,,,,,94.0,,94.0,312,2023.0
72243,113-115 FATHER ZEISER PLACE APARTMENTS,11/15/2021,10/31/2024,121275.0,113,FATHER ZEISER PLACE,Bronx,10468.0,2032190213.0,2129070.0,BX-07,14.0,263.0,BX0701,40.864219,-73.904594,40.864413,-73.904688,2024-10-31,New Construction,No,Non Prevailing Wage,,,,,3.0,,,3.0,,,,,,,3.0,,3.0,8,2024.0
72243,113-115 FATHER ZEISER PLACE APARTMENTS,11/15/2021,10/31/2024,1003186.0,115,FATHER ZEISER PLACE,Bronx,10468.0,2032190214.0,2014823.0,BX-07,14.0,263.0,BX0701,40.864199,-73.904667,40.864386,-73.904768,2024-10-31,New Construction,No,Non Prevailing Wage,,,,,3.0,,1.0,,2.0,,,,,,3.0,,3.0,8,2024.0
69521,1102 MYRTLE AVENUE,11/10/2021,6/26/2025,996695.0,1100,MYRTLE AVENUE,Brooklyn,11206.0,3015867501.0,3427349.0,BK-03,36.0,287.0,BK0302,40.696809,-73.936674,40.696543,-73.936223,2025-06-26,New Construction,No,Non Prevailing Wage,,,38.0,,32.0,,8.0,53.0,9.0,,,,,,70.0,,70.0,233,2025.0
71853,319 SOUTH 4TH STREET,11/10/2021,12/30/2021,1000539.0,319,SOUTH 4 STREET,Brooklyn,11211.0,3024360022.0,3428785.0,BK-01,34.0,527.0,BK0102,40.70904,-73.955076,40.709202,-73.954967,2021-12-30,New Construction,No,Non Prevailing Wage,,,,,3.0,,,1.0,2.0,,,,,,3.0,,3.0,10,2021.0
72244,1232 50 STREET,11/10/2021,9/9/2022,1004887.0,1232,50 STREET,Brooklyn,11219.0,3056480020.0,3138035.0,BK-12,44.0,220.0,BK1202,40.635264,-73.994041,40.635113,-73.994235,2022-09-09,New Construction,No,Non Prevailing Wage,,,,,3.0,,,,3.0,,,,,,3.0,,3.0,8,2022.0
68421,46-09 69TH ST.,11/9/2021,5/21/2024,990968.0,46-09,69 STREET,Queens,11377.0,4024320009.0,4623448.0,QN-02,26.0,489.0,QN0203,40.739858,-73.895856,40.739699,-73.89534,2024-05-21,New Construction,No,Non Prevailing Wage,,,89.0,,,,23.0,48.0,18.0,,,,,,89.0,,89.0,295,2024.0
68422,46-10 70TH ST,11/9/2021,5/21/2024,991092.0,46-10,70 STREET,Queens,11377.0,4024327502.0,4623447.0,QN-02,26.0,489.0,QN0203,40.739613,-73.894214,40.739319,-73.894835,2024-05-21,New Construction,No,Non Prevailing Wage,,,55.0,,,,16.0,28.0,11.0,,,,,,55.0,,55.0,183,2024.0
72245,1362 ARNOW AVENUE,11/8/2021,9/16/2022,999753.0,1362,ARNOW AVENUE,Bronx,10469.0,2045300036.0,2130451.0,BX-11,13.0,360.0,BX1103,40.867516,-73.846593,40.867274,-73.846521,2022-09-16,New Construction,No,Non Prevailing Wage,,,,,4.0,,,2.0,2.0,,,,,,4.0,,4.0,11,2022.0
68238,606 WEST 30TH STREET,11/5/2021,2/28/2025,991166.0,606,WEST 30 STREET,Manhattan,10001.0,1006750039.0,1012275.0,MN-04,3.0,9902.0,MN0401,40.753484,-74.004371,40.753382,-74.004717,2025-02-28,New Construction,No,Non Prevailing Wage,,31.0,25.0,14.0,,,24.0,31.0,15.0,,,,,,70.0,,70.0,277,2025.0
71851,2015 VYSE AVENUE APARTMENTS,11/5/2021,12/17/2021,999436.0,2015,VYSE AVENUE,Bronx,10460.0,2031270023.0,2128795.0,BX-06,15.0,363.0,BX0601,40.842358,-73.881867,40.842731,-73.881957,2021-12-17,New Construction,No,Non Prevailing Wage,,,,,9.0,,,4.0,5.0,,,,,,9.0,,9.0,27,2021.0
69620,1184 RIVER PHASE 2,11/4/2021,,989393.0,1160,RIVER AVENUE,Bronx,10452.0,,,BX-04,16.0,197.0,BX0401,40.834619,-73.921932,,,2024-12-05,New Construction,No,Non Prevailing Wage,63.0,63.0,123.0,,,1.0,57.0,112.0,51.0,30.0,,,,,250.0,,250.0,250,2024.0
71850,2955 BRIGHTON 5TH STREET APARTMENTS,11/3/2021,7/1/2022,998652.0,2955,BRIGHTON 5 STREET,Brooklyn,11235.0,3086650525.0,3244441.0,BK-13,48.0,364.0,BK1303,40.57975,-73.96323,40.579937,-73.963032,2022-07-01,New Construction,No,Non Prevailing Wage,,,,,6.0,,,2.0,4.0,,,,,,6.0,,6.0,18,2022.0
71882,853 LEXINGTON AVENUE,11/3/2021,5/24/2023,325374.0,853,LEXINGTON AVENUE,Brooklyn,11221.0,3016230070.0,3428884.0,BK-03,41.0,387.0,BK0302,40.690504,-73.926457,40.69071,-73.926529,2023-05-24,New Construction,No,Non Prevailing Wage,,,,,9.0,,1.0,1.0,7.0,,,,,,9.0,,9.0,29,2023.0
72246,26 SHERMAN RESIDENCE,11/2/2021,4/11/2023,27608.0,26,SHERMAN AVENUE,Manhattan,10040.0,1021750098.0,1064238.0,MN-12,10.0,287.0,MN1202,40.862729,-73.92832,40.862965,-73.928443,2023-04-11,New Construction,No,Non Prevailing Wage,,,,,18.0,,,18.0,,,,,,,18.0,,18.0,59,2023.0
72247,639 EAST 224TH STREET APARTMENTS,11/2/2021,10/3/2022,1002896.0,639,EAST 224 STREET,Bronx,10466.0,2048260037.0,2062991.0,BX-12,12.0,394.0,BX1201,40.887726,-73.862792,40.887992,-73.862889,2022-10-03,New Construction,No,Non Prevailing Wage,,,,,3.0,,1.0,2.0,,,,,,,3.0,,3.0,10,2022.0
74162,1899 CROTONA AVENUE APARTMENTS,11/1/2021,5/22/2024,988625.0,1899,CROTONA AVENUE,Bronx,10457.0,2029460035.0,2129375.0,BX-06,15.0,36901.0,BX0602,40.84427,-73.892114,40.844649,-73.892168,2024-05-22,New Construction,No,Non Prevailing Wage,,,,,20.0,,3.0,14.0,2.0,1.0,,,,,20.0,,20.0,64,2024.0
59843,JERICHO. 1840-1846 ANTHONY AVENUE,10/29/2021,2/14/2025,45626.0,1840,ANTHONY AVENUE,Bronx,10457.0,2028030002.0,2007580.0,BX-05,15.0,23302.0,BX0502,40.847574,-73.903653,40.847716,-73.903357,2025-02-14,Preservation,No,Prevailing Wage,85.0,,,,,,85.0,,,,,,,,85.0,,85.0,85,2025.0
69402,FOO.20-50 NAMEOKE AVENUE,10/28/2021,7/31/2024,1000134.0,20-50,NAMEOKE AVENUE,Queens,11691.0,4155290010.0,4624027.0,QN-14,31.0,103202.0,QN1401,40.607683,-73.75205,40.607952,-73.751933,2023-09-26,New Construction,No,Non Prevailing Wage,71.0,,45.0,,,1.0,76.0,30.0,11.0,,,,,,117.0,,117.0,117,2023.0
71878,22 EAST 212TH STREET,10/28/2021,10/28/2022,1001480.0,22,EAST 212 STREET,Bronx,10467.0,2033280035.0,2130547.0,BX-07,11.0,43101.0,BX0703,40.884066,-73.879225,40.884028,-73.879414,2022-10-28,New Construction,No,Non Prevailing Wage,,,,,4.0,,,,,4.0,,,,,4.0,,4.0,12,2022.0
71881,977-979 EAST 34TH STREET,10/28/2021,10/3/2022,259012.0,977,EAST 34 STREET,Brooklyn,11210.0,3075620012.0,3429091.0,BK-17,45.0,784.0,BK1702,40.632621,-73.943728,40.632398,-73.943432,2022-10-03,New Construction,No,Non Prevailing Wage,,,,,3.0,,,3.0,,,,,,,3.0,,3.0,7,2022.0
71881,977-979 EAST 34TH STREET,10/28/2021,10/3/2022,1001469.0,979,EAST 34 STREET,Brooklyn,11210.0,3075620011.0,3428818.0,BK-17,45.0,784.0,BK1702,40.632585,-73.943724,40.632343,-73.943425,2022-10-03,New Construction,No,Non Prevailing Wage,,,,,2.0,,,2.0,,,,,,,2.0,,2.0,6,2022.0
72249,1245 BEDFORD AVENUE APARTMENTS,10/27/2021,8/14/2023,1008697.0,1190,FULTON STREET,Brooklyn,11216.0,3018607501.0,3053705.0,BK-03,36.0,247.0,BK0301,40.680606,-73.953022,40.680351,-73.953025,2023-08-14,New Construction,No,Non Prevailing Wage,,,,,9.0,,,4.0,5.0,,,,,,9.0,,9.0,30,2023.0
71849,2269 1ST AVENUE APARTMENTS,10/26/2021,1/27/2023,482.0,340,EAST 117 STREET,Manhattan,10035.0,1016880030.0,1052963.0,MN-11,8.0,188.0,MN1102,40.797151,-73.936051,40.796654,-73.935441,2023-01-27,New Construction,No,Non Prevailing Wage,,,,,27.0,,7.0,16.0,4.0,,,,,,27.0,,27.0,90,2023.0
72250,1120 ST. JOHNS PLACE APARTMENTS,10/26/2021,7/6/2023,373575.0,1120,ST JOHNS PLACE,Brooklyn,11213.0,3012580016.0,3428850.0,BK-08,35.0,339.0,BK0802,40.671134,-73.941251,40.670802,-73.941082,2023-07-06,New Construction,No,Non Prevailing Wage,,,,,23.0,,6.0,11.0,6.0,,,,,,23.0,,23.0,75,2023.0
71876,458 CYRUS PLACE,10/25/2021,12/30/2022,60319.0,458,CYRUS PLACE,Bronx,10458.0,2030410014.0,2129631.0,BX-06,15.0,385.0,BX0603,40.858476,-73.891361,40.85838,-73.89169,2022-12-30,New Construction,No,Non Prevailing Wage,,,,,6.0,,,3.0,3.0,,,,,,6.0,,6.0,19,2022.0
71877,799 EAST 34TH STREET APARTMENTS,10/25/2021,11/15/2022,291213.0,3401,FARRAGUT ROAD,Brooklyn,11210.0,3049980009.0,3000000.0,BK-17,45.0,782.0,BK1702,40.636524,-73.944013,40.636757,-73.944012,2022-11-15,New Construction,No,Non Prevailing Wage,,,,,3.0,,,1.0,2.0,,,,,,3.0,,3.0,10,2022.0
72251,3508 TRYON AVENUE APARTMENTS,10/25/2021,1/31/2023,991339.0,3508,TRYON AVENUE,Bronx,10467.0,2033440084.0,2018281.0,BX-07,11.0,43102.0,BX0703,40.880583,-73.876661,40.88063,-73.876364,2023-01-31,New Construction,No,Non Prevailing Wage,,,,,8.0,,,4.0,4.0,,,,,,8.0,,8.0,24,2023.0
71883,937 ROGERS AVENUE,10/20/2021,3/18/2022,993205.0,937,ROGERS AVENUE,Brooklyn,11226.0,3051290040.0,3117823.0,BK-17,40.0,824.0,BK1701,40.6474,-73.952112,40.647421,-73.951773,2022-03-18,New Construction,No,Non Prevailing Wage,,,,,10.0,,2.0,2.0,6.0,,,,,,10.0,,10.0,32,2022.0
69253,58 VANDERBILT AVENUE,10/19/2021,9/5/2024,992915.0,205,PARK AVENUE,Brooklyn,11205.0,3020330050.0,3000000.0,BK-02,35.0,211.0,BK0203,40.696148,-73.970901,40.696288,-73.97093,2024-09-05,New Construction,No,Non Prevailing Wage,,9.0,9.0,5.0,,,9.0,10.0,4.0,,,,,,23.0,,23.0,90,2024.0
71848,1016 EAST 13TH STREET,10/19/2021,1/20/2023,950377.0,1016,EAST 13 STREET,Brooklyn,11230.0,3067147501.0,3179875.0,BK-14,44.0,534.0,BK1403,40.624345,-73.963141,40.624507,-73.963447,2023-01-20,New Construction,No,Non Prevailing Wage,,,,,3.0,,,1.0,,2.0,,,,,3.0,,3.0,8,2023.0
72252,332 EAST 28 STREET APARTMENTS,10/19/2021,10/7/2022,991563.0,332,EAST 28 STREET,Brooklyn,11226.0,3051930020.0,3119917.0,BK-17,45.0,828.0,BK1701,40.642258,-73.950584,40.642233,-73.950858,2022-10-07,New Construction,No,Non Prevailing Wage,,,,,2.0,,,1.0,1.0,,,,,,2.0,,2.0,6,2022.0
71847,531 TINTON AVENUE,10/18/2021,5/27/2022,991717.0,531,TINTON AVENUE,Bronx,10455.0,2025810030.0,2130535.0,BX-01,8.0,35.0,BX0101,40.812265,-73.906486,40.812192,-73.906804,2022-05-27,New Construction,No,Non Prevailing Wage,,,,,11.0,,3.0,5.0,3.0,,,,,,11.0,,11.0,34,2022.0
71846,30 EAST 29TH STREET APARTMENTS,10/15/2021,9/2/2022,1000284.0,30,EAST 29 STREET,Brooklyn,11226.0,3051300015.0,3117830.0,BK-17,40.0,824.0,BK1701,40.647657,-73.950223,40.647407,-73.950468,2022-09-02,New Construction,No,Non Prevailing Wage,,,,,3.0,,,3.0,,,,,,,3.0,,3.0,7,2022.0
72253,1730 OCEAN AVENUE APARTMENTS,10/14/2021,9/2/2022,347279.0,1730,OCEAN AVENUE,Brooklyn,11230.0,3067390057.0,3428965.0,BK-14,44.0,538.0,BK1403,40.619805,-73.955283,40.619766,-73.955723,2022-09-02,New Construction,No,Non Prevailing Wage,,,,,11.0,,3.0,8.0,,,,,,,11.0,,11.0,34,2022.0
72254,23-29 30TH DRIVE APARTMENTS,10/14/2021,3/10/2023,416480.0,23-29,30 DRIVE,Queens,11102.0,4005710010.0,4006730.0,QN-01,22.0,73.0,QN0103,40.767476,-73.927502,40.767406,-73.92665,2023-03-10,New Construction,No,Non Prevailing Wage,,,,,3.0,,1.0,2.0,,,,,,,3.0,,3.0,8,2023.0
71845,385 HARMAN STREET APARTMENTS,10/12/2021,7/15/2022,1002277.0,385,HARMAN STREET,Brooklyn,11237.0,3032800049.0,3074867.0,BK-04,37.0,443.0,BK0401,40.701729,-73.917093,40.701869,-73.917298,2022-07-15,New Construction,No,Non Prevailing Wage,,,,,3.0,,,3.0,,,,,,,3.0,,3.0,8,2022.0
71534,ATLANTIC PORTFOLIO- UNIVERSITY AVE.YR15.FY22,10/8/2021,10/8/2021,942286.0,1001,UNIVERSITY AVENUE,Bronx,10452.0,2025270001.0,2113108.0,BX-04,16.0,189.0,BX0402,40.833444,-73.930971,40.833807,-73.930989,2021-10-08,Preservation,Yes,Non Prevailing Wage,,42.0,46.0,,,1.0,7.0,14.0,56.0,12.0,,,,,89.0,,89.0,89,2021.0
71537,ATLANTIC PORTFOLIO- 1240 WASHINGTON AVE.YR15.FY22,10/8/2021,10/8/2021,842232.0,1240,WASHINGTON AVENUE,Bronx,10456.0,2023730006.0,2113605.0,BX-03,16.0,145.0,BX0302,40.831759,-73.906621,40.831843,-73.906242,2021-10-08,Preservation,Yes,Non Prevailing Wage,,55.0,41.0,3.0,,1.0,4.0,16.0,65.0,15.0,,,,,100.0,,100.0,100,2021.0
71538,ATLANTIC PORTFOLIO- CONCORD AVE.YR15.FY22,10/8/2021,10/8/2021,847877.0,600,CONCORD AVENUE,Bronx,10455.0,2026420070.0,2113113.0,BX-01,8.0,73.0,BX0102,40.814402,-73.907657,40.814119,-73.907466,2021-10-08,Preservation,Yes,Non Prevailing Wage,,31.0,38.0,13.0,,1.0,18.0,12.0,45.0,8.0,,,,,83.0,,83.0,83,2021.0
71539,ATLANTIC PORTFOLIO- ALDUS STREET ASSOCIATES.YR15.FY22,10/8/2021,10/8/2021,871553.0,951,HOE AVENUE,Bronx,10459.0,2027427501.0,2113353.0,BX-02,17.0,119.0,BX0202,40.822088,-73.89034,40.822251,-73.890697,2021-10-08,Preservation,Yes,Non Prevailing Wage,,85.0,75.0,3.0,,1.0,8.0,23.0,123.0,10.0,,,,,164.0,,164.0,164,2021.0
71540,ATLANTIC PORTFOLIO- HOE AVE.YR15.FY22,10/8/2021,10/8/2021,871732.0,941,HOE AVENUE,Bronx,10459.0,2027427501.0,2113354.0,BX-02,17.0,119.0,BX0202,40.821937,-73.890326,40.822251,-73.890697,2021-10-08,Preservation,Yes,Non Prevailing Wage,,57.0,73.0,4.0,1.0,1.0,9.0,24.0,94.0,9.0,,,,,136.0,,136.0,136,2021.0
71844,65 BUCHANAN PLACE APARTMENTS,10/8/2021,1/30/2023,990046.0,65,BUCHANAN PLACE,Bronx,10453.0,2032080053.0,2128732.0,BX-05,14.0,251.0,BX0501,40.858508,-73.906547,40.858777,-73.906663,2023-01-30,New Construction,No,Non Prevailing Wage,,,,,7.0,,,7.0,,,,,,,7.0,,7.0,23,2023.0
71843,3315 & 3317 PARKSIDE PLACE,10/6/2021,2/17/2023,991424.0,3317,PARKSIDE PLACE,Bronx,10467.0,2033550150.0,2018619.0,BX-07,11.0,42902.0,BX0703,40.876637,-73.872481,40.876588,-73.872795,2023-02-17,New Construction,No,Non Prevailing Wage,,,,,3.0,,,3.0,,,,,,,3.0,,3.0,8,2023.0
71843,3315 & 3317 PARKSIDE PLACE,10/6/2021,2/17/2023,1001470.0,3315,PARKSIDE PLACE,Bronx,10467.0,2033550250.0,2128978.0,BX-07,11.0,42902.0,BX0703,40.87658,-73.87252,40.876531,-73.872839,2023-02-17,New Construction,No,Non Prevailing Wage,,,,,3.0,,,1.0,2.0,,,,,,3.0,,3.0,8,2023.0
71842,567 OCEAN PARKWAY APARTMENTS,10/5/2021,4/10/2023,982303.0,567,OCEAN PARKWAY,Brooklyn,11218.0,3054000074.0,3425052.0,BK-12,40.0,484.0,BK1203,40.63467,-73.972448,40.63458,-73.971804,2023-04-10,New Construction,No,Non Prevailing Wage,,,,,11.0,,2.0,8.0,1.0,,,,,,11.0,,11.0,35,2023.0
71871,30-79 31ST STREET APARTMENTS,10/4/2021,7/1/2022,418038.0,30-79,31 STREET,Queens,11102.0,4006150005.0,4008467.0,QN-01,22.0,63.0,QN0103,40.764917,-73.922985,40.764832,-73.922682,2022-07-01,New Construction,No,Non Prevailing Wage,,,,,3.0,,,3.0,,,,,,,3.0,,3.0,8,2022.0
71841,1510 GATES AVENUE APARTMENTS,10/1/2021,1/31/2023,315857.0,333,IRVING AVENUE,Brooklyn,11237.0,3033457502.0,3429086.0,BK-04,37.0,439.0,BK0402,40.69832,-73.913134,40.698383,-73.912751,2023-01-31,New Construction,No,Non Prevailing Wage,,,,,21.0,,5.0,5.0,11.0,,,,,,21.0,,21.0,70,2023.0
71675,"115, 119, 123 CLIFTON PLACE",9/30/2021,9/30/2021,995131.0,119,CLIFTON PLACE,Brooklyn,11238.0,3019490068.0,3428685.0,BK-03,36.0,233.0,BK0301,40.68825,-73.959049,40.688428,-73.959233,2021-09-30,New Construction,No,Non Prevailing Wage,,,,,3.0,,,,3.0,,,,,,3.0,,3.0,8,2021.0
71675,"115, 119, 123 CLIFTON PLACE",9/30/2021,9/30/2021,995571.0,115,CLIFTON PLACE,Brooklyn,11238.0,3019490070.0,3428684.0,BK-03,36.0,233.0,BK0301,40.688236,-73.959164,40.688407,-73.959373,2021-09-30,New Construction,No,Non Prevailing Wage,,,,,3.0,,,,3.0,,,,,,3.0,,3.0,9,2021.0
71675,"115, 119, 123 CLIFTON PLACE",9/30/2021,9/30/2021,995572.0,123,CLIFTON PLACE,Brooklyn,11238.0,3019490067.0,3055658.0,BK-03,36.0,233.0,BK0301,40.688264,-73.958933,40.688442,-73.959124,2021-09-30,New Construction,No,Non Prevailing Wage,,,,,3.0,,,,3.0,,,,,,3.0,,3.0,8,2021.0
71680,1574 PITKIN AVENUE APARTMENTS,9/30/2021,3/4/2022,353937.0,1574,PITKIN AVENUE,Brooklyn,11212.0,3035170031.0,3080981.0,BK-16,41.0,902.0,BK1602,40.669002,-73.915288,40.668746,-73.915216,2022-03-04,New Construction,No,Non Prevailing Wage,,,,,4.0,,1.0,,,3.0,,,,,4.0,,4.0,12,2022.0
71681,2510 BEDFORD AVENUE,9/30/2021,3/24/2022,998937.0,2510,BEDFORD AVENUE,Brooklyn,11226.0,3051890015.0,3428534.0,BK-14,45.0,79001.0,BK1401,40.642141,-73.954458,40.64224,-73.954775,2022-03-24,New Construction,No,Non Prevailing Wage,,,,,8.0,,,3.0,5.0,,,,,,8.0,,8.0,26,2022.0
71682,2829 SNYDER AVENUE,9/30/2021,5/20/2022,999299.0,2829,SNYDER AVENUE,Brooklyn,11226.0,3051080055.0,3428704.0,BK-17,40.0,824.0,BK1701,40.648862,-73.950965,40.649131,-73.950301,2022-05-20,New Construction,No,Non Prevailing Wage,,,,,3.0,,,3.0,,,,,,,3.0,,3.0,10,2022.0
71683,2901 SNYDER AVENUE,9/30/2021,12/17/2021,999300.0,2901,SNYDER AVENUE,Brooklyn,11226.0,3051080054.0,3428705.0,BK-17,40.0,824.0,BK1701,40.648884,-73.950474,40.649133,-73.950215,2021-12-17,New Construction,No,Non Prevailing Wage,,,,,3.0,,,3.0,,,,,,,3.0,,3.0,10,2021.0
71684,2909-2911 ALBEMARLE RD,9/30/2021,1/21/2022,999193.0,2911,ALBEMARLE ROAD,Brooklyn,11226.0,3051110046.0,3428822.0,BK-17,40.0,824.0,BK1701,40.648131,-73.949805,40.648354,-73.949866,2022-01-21,New Construction,No,Non Prevailing Wage,,,,,3.0,,,3.0,,,,,,,3.0,,3.0,9,2022.0
71684,2909-2911 ALBEMARLE RD,9/30/2021,1/21/2022,999369.0,2909,ALBEMARLE ROAD,Brooklyn,11226.0,3051110047.0,3428699.0,BK-17,40.0,824.0,BK1701,40.648129,-73.949866,40.648346,-73.949956,2022-01-21,New Construction,No,Non Prevailing Wage,,,,,3.0,,,3.0,,,,,,,3.0,,3.0,8,2022.0
71685,3013 BARKER AVE APARTMENTS,9/30/2021,7/22/2022,994509.0,3013,BARKER AVENUE,Bronx,10467.0,2045430043.0,2054731.0,BX-12,12.0,33602.0,BX1201,40.869984,-73.869304,40.870116,-73.869564,2022-07-22,New Construction,No,Non Prevailing Wage,,,,,10.0,,1.0,6.0,3.0,,,,,,10.0,,10.0,31,2022.0
71687,379 DEWITT AVENUE,9/30/2021,3/18/2022,977424.0,379,DEWITT AVENUE,Brooklyn,11207.0,3038750050.0,3421440.0,BK-05,42.0,1098.0,BK0503,40.656225,-73.896029,40.65644,-73.896025,2022-03-18,New Construction,No,Non Prevailing Wage,,,,,8.0,,,,8.0,,,,,,8.0,,8.0,26,2022.0
71688,385 CLASSON AVENUE,9/30/2021,8/26/2022,998767.0,385,CLASSON AVENUE,Brooklyn,11238.0,3019530007.0,3427219.0,BK-03,36.0,233.0,BK0301,40.687847,-73.959788,40.687899,-73.959514,2022-08-26,New Construction,No,Non Prevailing Wage,,,,,3.0,,,1.0,2.0,,,,,,3.0,,3.0,8,2022.0
71689,402 EAST 118 STREET APARTMENT,9/30/2021,1/31/2023,20031.0,402,EAST 118 STREET,Manhattan,10035.0,1017110044.0,1090218.0,MN-11,8.0,178.0,MN1102,40.797145,-73.93409,40.796906,-73.934072,2023-01-31,New Construction,No,Non Prevailing Wage,,,,,11.0,,,5.0,6.0,,,,,,11.0,,11.0,35,2023.0
71690,428 EAST 148TH STREET,9/30/2021,3/18/2022,972150.0,428,EAST 148 STREET,Bronx,10455.0,2022927502.0,2129121.0,BX-01,8.0,43.0,BX0101,40.81484,-73.917017,40.814634,-73.917089,2022-03-18,New Construction,No,Non Prevailing Wage,,,,,23.0,,8.0,11.0,4.0,,,,,,23.0,,23.0,24,2022.0
71692,75 LOTT AVENUE,9/30/2021,11/22/2022,329147.0,75,LOTT AVENUE,Brooklyn,11212.0,3036110005.0,3082509.0,BK-16,41.0,896.0,BK1602,40.657457,-73.91106,40.657676,-73.911121,2022-11-22,New Construction,No,Non Prevailing Wage,,,,,8.0,,,1.0,6.0,,1.0,,,,8.0,,8.0,8,2022.0
63026,LOS SURES. 11-23 MONTIETH ST. RHEINGOLD,9/29/2021,2/29/2024,974198.0,2025-11-23T00:00:00.000,MONTIETH STREET,Brooklyn,11206.0,3031390030.0,3000000.0,BK-04,34.0,391.0,BK0401,40.701439,-73.936255,40.701692,-73.936056,2024-02-29,New Construction,No,Prevailing Wage,93.0,,,,,1.0,54.0,39.0,1.0,,,,,,94.0,,94.0,94,2024.0
71500,186 EAST 205TH STREET APARTMENTS,9/29/2021,9/16/2022,67386.0,186,EAST 205 STREET,Bronx,10458.0,2033110114.0,2129445.0,BX-07,11.0,413.0,BX0702,40.875017,-73.884601,40.874833,-73.884782,2022-09-16,New Construction,No,Non Prevailing Wage,,,,,19.0,,5.0,9.0,5.0,,,,,,19.0,,19.0,62,2022.0
65261,BETANCES (VI) FAMILY APARTMENTS,9/24/2021,4/24/2025,989929.0,472,WILLIS AVENUE,Bronx,10455.0,2022910101.0,2130670.0,BX-01,8.0,43.0,BX0101,40.814364,-73.91903,40.814202,-73.918755,2023-12-28,New Construction,No,Non Prevailing Wage,37.0,23.0,32.0,8.0,,1.0,19.0,44.0,24.0,14.0,,,,,101.0,,101.0,101,2023.0
64608,142-150 SOUTH PORTLAND,9/23/2021,6/26/2025,976722.0,142-150,SOUTH PORTLAND AVENUE,Brooklyn,11217.0,3020030037.0,3427387.0,BK-02,35.0,35.0,BK0203,40.684941,-73.974173,40.684895,-73.974465,2025-06-26,New Construction,No,Non Prevailing Wage,16.0,25.0,19.0,43.0,,1.0,16.0,56.0,21.0,11.0,,,,,104.0,,104.0,104,2025.0
71486,29-28 NEWTOWN AVENUE APARTMENTS,9/21/2021,7/8/2022,683892.0,29-28,NEWTOWN AVENUE,Queens,11102.0,4005940050.0,4617228.0,QN-01,22.0,71.0,QN0103,40.768924,-73.921876,40.768421,-73.921623,2022-07-08,New Construction,No,Non Prevailing Wage,,,,,3.0,,,3.0,,,,,,,3.0,,3.0,9,2022.0
72257,2065-2067 RYER AVENUE,9/21/2021,9/2/2022,988938.0,2067,RYER AVENUE,Bronx,10457.0,2031560062.0,2130449.0,BX-05,15.0,381.0,BX0502,40.852232,-73.901102,40.852493,-73.901351,2022-07-22,New Construction,No,Non Prevailing Wage,,,,,20.0,,7.0,7.0,6.0,,,,,,20.0,,20.0,66,2022.0
72257,2065-2067 RYER AVENUE,9/21/2021,9/2/2022,988939.0,2065,RYER AVENUE,Bronx,10457.0,2031560063.0,2130448.0,BX-05,15.0,381.0,BX0502,40.852175,-73.901116,40.852331,-73.901409,2022-09-02,New Construction,No,Non Prevailing Wage,,,,,20.0,,6.0,14.0,,,,,,,20.0,,20.0,66,2022.0
67690,982 FULTON STREET,9/17/2021,6/25/2024,999794.0,445,GRAND AVENUE,Brooklyn,11238.0,3020150010.0,3000000.0,BK-02,35.0,227.0,BK0301,40.682179,-73.961558,40.682026,-73.961122,2024-06-25,New Construction,No,Non Prevailing Wage,,,20.0,,14.0,,1.0,25.0,8.0,,,,,,34.0,,34.0,113,2024.0
71458,1492 BRYANT AVENUE APARTMENTS,9/16/2021,4/8/2022,53686.0,1492,BRYANT AVENUE,Bronx,10460.0,2030000017.0,2117998.0,BX-03,17.0,157.0,BX0303,40.832559,-73.887435,40.832518,-73.887157,2022-04-08,New Construction,No,Non Prevailing Wage,,,,,4.0,,2.0,2.0,,,,,,,4.0,,4.0,11,2022.0
71487,7 DEY STREET,9/3/2021,4/21/2023,1001800.0,185,BROADWAY,Manhattan,10007.0,1000637501.0,1090952.0,MN-01,1.0,13.0,MN0101,40.710602,-74.0101,40.710402,-74.01002,2023-04-21,New Construction,No,Non Prevailing Wage,,,21.0,,42.0,,25.0,30.0,8.0,,,,,,63.0,,63.0,209,2023.0
71488,2369 & 2377 HOFFMAN STREET,9/3/2021,2/1/2023,991379.0,2377,HOFFMAN STREET,Bronx,10458.0,2030540031.0,2011669.0,BX-06,15.0,387.0,BX0603,40.855449,-73.888965,40.855564,-73.889186,2023-02-01,New Construction,No,Non Prevailing Wage,,,,,3.0,,,1.0,2.0,,,,,,3.0,,3.0,8,2023.0
71488,2369 & 2377 HOFFMAN STREET,9/3/2021,2/1/2023,999825.0,2369,HOFFMAN STREET,Bronx,10458.0,2030540033.0,2128438.0,BX-06,15.0,387.0,BX0603,40.855337,-73.889063,40.855488,-73.889251,2023-01-30,New Construction,No,Non Prevailing Wage,,,,,3.0,,,1.0,2.0,,,,,,3.0,,3.0,8,2023.0
72260,1073 SUMMIT AVENUE,9/2/2021,12/12/2022,112041.0,1073,SUMMIT AVENUE,Bronx,10452.0,2025260076.0,2003492.0,BX-04,16.0,193.0,BX0402,40.835129,-73.92913,40.83528,-73.929473,2022-12-12,New Construction,No,Non Prevailing Wage,,,,32.0,,,6.0,9.0,17.0,,,,,,32.0,,32.0,105,2022.0
71459,148-37 88TH AVENUE APARTMENTS,8/27/2021,3/20/2023,491545.0,148-37,86 AVENUE,Queens,11435.0,4097260042.0,4208174.0,QN-08,24.0,232.0,QN0805,40.708194,-73.809577,40.708679,-73.808725,2023-03-20,New Construction,No,Non Prevailing Wage,,,,,33.0,,1.0,19.0,12.0,1.0,,,,,33.0,,33.0,109,2023.0
71460,1407 FLATBUSH AVENUE APARTMENTS,8/27/2021,1/28/2022,999663.0,1409,FLATBUSH AVENUE,Brooklyn,11210.0,3052287501.0,3428820.0,BK-14,45.0,78801.0,BK1401,40.636373,-73.951395,40.636489,-73.951186,2022-01-28,New Construction,No,Non Prevailing Wage,,,,,7.0,,,3.0,4.0,,,,,,7.0,,7.0,22,2022.0
68297,310 GRAND CONCOURSE,8/26/2021,9/13/2023,991160.0,310,GRAND CONCOURSE,Bronx,10451.0,2023410028.0,2130531.0,BX-01,8.0,51.0,BX0101,40.814206,-73.929098,40.814354,-73.928621,2023-09-13,New Construction,No,Non Prevailing Wage,,,24.0,,21.0,,4.0,18.0,23.0,,,,,,45.0,,45.0,150,2023.0
68892,WEST END. 15 W 118TH ST,8/25/2021,8/14/2023,805885.0,17,WEST 118 STREET,Manhattan,10026.0,1017170022.0,1083960.0,MN-10,9.0,190.0,MN1001,40.802468,-73.946658,40.802657,-73.946553,2023-08-14,New Construction,No,Non Prevailing Wage,50.0,,,,,1.0,50.0,1.0,,,,,,,51.0,,51.0,51,2023.0
71461,761 EAST 233RD STREET APARTMENTS,8/24/2021,3/18/2022,999699.0,773,EAST 233 STREET,Bronx,10466.0,2049970001.0,2130380.0,BX-12,11.0,434.0,BX1203,40.892668,-73.855067,40.892937,-73.854871,2022-03-18,New Construction,No,Non Prevailing Wage,,,,35.0,,,4.0,28.0,3.0,,,,,,35.0,,35.0,116,2022.0
71462,59-24 41ST AVENUE,8/23/2021,1/13/2023,988167.0,59-24,41 AVENUE,Queens,11377.0,4013320088.0,4031270.0,QN-02,26.0,249.0,QN0203,40.744159,-73.904716,40.744016,-73.904936,2023-01-13,New Construction,No,Non Prevailing Wage,,,,,3.0,,,1.0,2.0,,,,,,3.0,,3.0,7,2023.0
71463,263 EAST 9TH STREET APARTMENTS,8/23/2021,7/1/2022,999826.0,263,EAST 9 STREET,Brooklyn,11218.0,3053610055.0,3125656.0,BK-12,39.0,492.0,BK1203,40.642259,-73.970438,40.642155,-73.970175,2022-07-01,New Construction,No,Non Prevailing Wage,,,,,2.0,,,,2.0,,,,,,2.0,,2.0,6,2022.0
72261,173 JOHNSON AVENUE APARTMENTS,8/23/2021,7/15/2022,301968.0,139,GRAHAM AVENUE,Brooklyn,11206.0,3030610025.0,3000000.0,BK-01,34.0,505.0,BK0104,40.706707,-73.943113,40.706729,-73.943539,2022-07-15,New Construction,No,Non Prevailing Wage,,,,,16.0,,4.0,4.0,8.0,,,,,,16.0,,16.0,52,2022.0
71464,79 TRUXTON STREET APARTMENT,8/19/2021,11/12/2021,997954.0,79,TRUXTON STREET,Brooklyn,11233.0,3015430060.0,3423889.0,BK-16,37.0,367.0,BK1601,40.678563,-73.906403,40.678755,-73.906478,2021-11-12,New Construction,No,Non Prevailing Wage,,,,,3.0,,,3.0,,,,,,,3.0,,3.0,8,2021.0
72262,2873 WEST 17TH STREET,8/18/2021,4/29/2022,1001296.0,2873,WEST 17 STREET,Brooklyn,11224.0,3070217501.0,3336538.0,BK-13,47.0,326.0,BK1302,40.577403,-73.98491,40.577202,-73.984564,2022-04-29,New Construction,No,Non Prevailing Wage,,,,,5.0,,,4.0,1.0,,,,,,5.0,,5.0,15,2022.0
72263,407 EAST 117TH STREET,8/18/2021,12/19/2022,19881.0,407,EAST 117 STREET,Manhattan,10035.0,1017110006.0,1090547.0,MN-11,8.0,178.0,MN1102,40.796505,-73.934473,40.796634,-73.934217,2022-12-19,New Construction,No,Non Prevailing Wage,,,,,4.0,,1.0,,3.0,,,,,,4.0,,4.0,11,2022.0
72265,44 WEST 128TH STREET,8/18/2021,10/11/2022,1002039.0,44,WEST 128 STREET,Manhattan,10027.0,1017250057.0,1090347.0,MN-10,9.0,208.0,MN1002,40.808929,-73.942296,40.808908,-73.94282,2022-10-11,New Construction,No,Non Prevailing Wage,,,,,3.0,,2.0,1.0,,,,,,,3.0,,3.0,8,2022.0
72266,56-12 VAN CLEEF STREET APARTMENTS,8/18/2021,8/25/2022,1000663.0,56-12,VAN CLEEF STREET,Queens,11368.0,4019670006.0,4618851.0,QN-04,21.0,43701.0,QN0402,40.740527,-73.8521,40.740373,-73.852298,2022-08-25,New Construction,No,Non Prevailing Wage,,,,,3.0,,,3.0,,,,,,,3.0,,3.0,7,2022.0
72483,2434 BRONX PARK EAST,8/18/2021,9/2/2022,1002904.0,2434,BRONX PARK EAST,Bronx,10467.0,2044240020.0,2051219.0,BX-11,15.0,33202.0,BX1104,40.862138,-73.870516,40.862362,-73.870111,2022-09-02,New Construction,No,Non Prevailing Wage,,,,,18.0,,4.0,11.0,3.0,,,,,,18.0,,18.0,57,2022.0
71465,ROOSEVELT APARTMENTS PHASE I,8/16/2021,11/20/2024,998986.0,108-59,ROOSEVELT AVENUE,Queens,11368.0,4017807501.0,4044831.0,QN-03,21.0,40102.0,QN0303,40.750871,-73.858274,40.75158,-73.856832,2023-05-17,New Construction,No,Non Prevailing Wage,,,,,2.0,,,2.0,,,,,,,2.0,,2.0,6,2023.0
71465,ROOSEVELT APARTMENTS PHASE I,8/16/2021,11/20/2024,998987.0,108-55,ROOSEVELT AVENUE,Queens,11368.0,4017807505.0,4619680.0,QN-03,21.0,40102.0,QN0303,40.750871,-73.858277,40.751534,-73.856991,2023-02-02,New Construction,No,Non Prevailing Wage,,,,,2.0,,,2.0,,,,,,,2.0,,2.0,6,2023.0
71465,ROOSEVELT APARTMENTS PHASE I,8/16/2021,11/20/2024,998988.0,108-57,ROOSEVELT AVENUE,Queens,11368.0,4017807509.0,4619681.0,QN-03,21.0,40102.0,QN0303,40.750871,-73.858274,40.751559,-73.856911,2024-05-10,New Construction,No,Non Prevailing Wage,,,,,2.0,,,2.0,,,,,,,2.0,,2.0,6,2024.0
71465,ROOSEVELT APARTMENTS PHASE I,8/16/2021,11/20/2024,998989.0,108-61,ROOSEVELT AVENUE,Queens,11368.0,4017807503.0,4619682.0,QN-03,21.0,40102.0,QN0303,40.750871,-73.85827,40.751605,-73.856756,2023-11-09,New Construction,No,Non Prevailing Wage,,,,,2.0,,,2.0,,,,,,,2.0,,2.0,6,2023.0
71465,ROOSEVELT APARTMENTS PHASE I,8/16/2021,11/20/2024,998990.0,108-63,ROOSEVELT AVENUE,Queens,11368.0,4017807507.0,4619685.0,QN-03,21.0,40102.0,QN0303,40.750871,-73.85827,40.751627,-73.856677,2023-05-19,New Construction,No,Non Prevailing Wage,,,,,2.0,,,2.0,,,,,,,2.0,,2.0,6,2023.0
71465,ROOSEVELT APARTMENTS PHASE I,8/16/2021,11/20/2024,998991.0,108-65,ROOSEVELT AVENUE,Queens,11368.0,4017807502.0,4619684.0,QN-03,21.0,40102.0,QN0303,40.750874,-73.858266,40.751652,-73.856597,2024-02-28,New Construction,No,Non Prevailing Wage,,,,,2.0,,,2.0,,,,,,,2.0,,2.0,6,2024.0
71465,ROOSEVELT APARTMENTS PHASE I,8/16/2021,11/20/2024,998992.0,108-67,ROOSEVELT AVENUE,Queens,11368.0,4017807506.0,4619683.0,QN-03,21.0,40102.0,QN0303,40.750874,-73.858266,40.751673,-73.856518,2023-07-03,New Construction,No,Non Prevailing Wage,,,,,2.0,,,2.0,,,,,,,2.0,,2.0,6,2023.0
71465,ROOSEVELT APARTMENTS PHASE I,8/16/2021,11/20/2024,998993.0,108-69,ROOSEVELT AVENUE,Queens,11368.0,4017807508.0,4431610.0,QN-03,21.0,40102.0,QN0303,40.750874,-73.858263,40.751698,-73.856442,2024-11-20,New Construction,No,Non Prevailing Wage,,,,,2.0,,,2.0,,,,,,,2.0,,2.0,6,2024.0
71465,ROOSEVELT APARTMENTS PHASE I,8/16/2021,11/20/2024,1001479.0,108-53,ROOSEVELT AVENUE,Queens,11368.0,4017807504.0,4044832.0,QN-03,21.0,40102.0,QN0303,40.750869,-73.858277,40.751504,-73.857092,2023-10-27,New Construction,No,Non Prevailing Wage,,,,,2.0,,,2.0,,,,,,,2.0,,2.0,6,2023.0
72477,20 PRESCOTT PLACE,8/11/2021,8/12/2022,1004114.0,20,PRESCOTT PLACE,Brooklyn,11233.0,3015560025.0,3428823.0,BK-03,41.0,301.0,BK1601,40.677446,-73.920908,40.677323,-73.921139,2022-08-12,New Construction,No,Non Prevailing Wage,,,,,15.0,,3.0,,12.0,,,,,,15.0,,15.0,49,2022.0
70089,1010 PACIFIC OWNER LLC_MIH69636,8/10/2021,8/12/2024,994429.0,1010,PACIFIC STREET,Brooklyn,11238.0,3011330032.0,3428849.0,BK-08,35.0,305.0,BK0802,40.679289,-73.959743,40.679072,-73.959894,2024-08-12,New Construction,No,Non Prevailing Wage,,,52.0,,1.0,,5.0,39.0,9.0,,,,,,53.0,,53.0,175,2024.0
71466,25-28 BROADWAY APARTMENTS,8/9/2021,4/12/2023,1001927.0,25-28,BROADWAY,Queens,11106.0,4005800028.0,4618176.0,QN-01,22.0,53.0,QN0103,40.763301,-73.928207,40.762782,-73.927713,2023-04-12,New Construction,No,Non Prevailing Wage,,,,,6.0,,,4.0,2.0,,,,,,6.0,,6.0,20,2023.0
72267,67-47 ALDERTON STREET,8/4/2021,2/13/2023,627634.0,67-45,ALDERTON STREET,Queens,11374.0,4031500022.0,4074432.0,QN-06,30.0,703.0,QN0601,40.71662,-73.858758,40.716754,-73.858462,2023-02-13,New Construction,No,Non Prevailing Wage,,,,,6.0,,,6.0,,,,,,,6.0,,6.0,18,2023.0
71467,150 LENOX ROAD APARTMENTS,8/3/2021,3/4/2022,324075.0,150,LENOX ROAD,Brooklyn,11226.0,3050840036.0,3116648.0,BK-17,40.0,822.0,BK1701,40.653867,-73.954518,40.653543,-73.95454,2022-03-04,New Construction,No,Non Prevailing Wage,,,,,13.0,,,,13.0,,,,,,13.0,,13.0,42,2022.0
71468,THE POSH AT 1941 CONEY ISLAND AVENUE,7/28/2021,9/2/2022,224762.0,1941,CONEY ISLAND AVENUE,Brooklyn,11223.0,3067740001.0,3182286.0,BK-15,48.0,554.0,BK1501,40.609893,-73.962353,40.609772,-73.961975,2022-09-02,New Construction,No,Non Prevailing Wage,,,,,13.0,,3.0,8.0,2.0,,,,,,13.0,,13.0,43,2022.0
71473,38 STRATFORD ROAD APARTMENTS,7/27/2021,1/10/2022,242265.0,38,STRATFORD ROAD,Brooklyn,11218.0,3050710022.0,3428920.0,BK-14,40.0,506.0,BK1402,40.647943,-73.969499,40.647883,-73.969841,2022-01-10,New Construction,No,Non Prevailing Wage,,,,,5.0,,,3.0,2.0,,,,,,5.0,,5.0,14,2022.0
71474,26 QUINCY STREET APARTMENTS,7/21/2021,4/28/2022,999828.0,26,QUINCY STREET,Brooklyn,11238.0,3019720010.0,3429057.0,BK-02,35.0,231.0,BK0204,40.685843,-73.960269,40.685604,-73.960309,2022-04-28,New Construction,No,Non Prevailing Wage,,,,,13.0,,3.0,7.0,3.0,,,,,,13.0,,13.0,43,2022.0
71476,2692 CRESTON AVENUE,7/20/2021,11/7/2022,958554.0,2692,CRESTON AVENUE,Bronx,10468.0,2033140023.0,2128768.0,BX-07,14.0,40304.0,BX0702,40.867537,-73.894755,40.867503,-73.894517,2022-11-07,New Construction,No,Non Prevailing Wage,,,,,4.0,,,2.0,2.0,,,,,,4.0,,4.0,12,2022.0
71477,550 PROSPECT PLACE APARTMENT,7/20/2021,4/20/2022,999827.0,550,PROSPECT PLACE,Brooklyn,11238.0,3011630023.0,3428528.0,BK-08,35.0,305.0,BK0802,40.67547,-73.958437,40.675207,-73.958509,2022-04-20,New Construction,No,Non Prevailing Wage,,,,,13.0,,1.0,10.0,2.0,,,,,,13.0,,13.0,41,2022.0
72268,3531 BRUCKNER AVENUE,7/16/2021,11/22/2022,53113.0,3531,BRUCKNER BOULEVARD,Bronx,10461.0,2041780018.0,2046334.0,BX-10,13.0,26602.0,BX1003,40.847488,-73.827273,40.847675,-73.827709,2022-11-22,New Construction,No,Non Prevailing Wage,,,,,9.0,,2.0,4.0,3.0,,,,,,9.0,,9.0,26,2022.0
74163,637 EAST 176 STREET APARTMENTS,7/16/2021,12/12/2022,1005779.0,637,EAST 176 STREET,Bronx,10457.0,2029470052.0,2129322.0,BX-06,15.0,36901.0,BX0602,40.844576,-73.893747,40.84468,-73.893451,2022-12-12,New Construction,No,Non Prevailing Wage,,,,,14.0,,2.0,8.0,4.0,,,,,,14.0,,14.0,46,2022.0
71479,922 DEKALB AVENUE APARTMENTS,7/12/2021,10/3/2022,999829.0,922,DEKALB AVENUE,Brooklyn,11221.0,3016010014.0,3043211.0,BK-03,36.0,281.0,BK0302,40.692806,-73.938841,40.692586,-73.938776,2022-10-03,New Construction,No,Non Prevailing Wage,,,,,3.0,,,3.0,,,,,,,3.0,,3.0,10,2022.0
71480,420 GATES AVENUE APARTMENTS,7/12/2021,5/20/2022,999830.0,420,GATES AVENUE,Brooklyn,11216.0,3018130018.0,3429028.0,BK-03,36.0,251.0,BK0301,40.686339,-73.949477,40.686105,-73.949517,2022-05-20,New Construction,No,Non Prevailing Wage,,,,,14.0,,9.0,4.0,1.0,,,,,,14.0,,14.0,44,2022.0
68832,HELP USA.HELP CLUSTER.NR REHAB,7/8/2021,,112736.0,1058,TELLER AVENUE,Bronx,10456.0,2024280006.0,2002119.0,BX-04,16.0,175.0,BX0401,40.828904,-73.913603,40.828852,-73.913296,2022-09-03,Preservation,No,Non Prevailing Wage,13.0,,12.0,,,1.0,,1.0,,,,,,25.0,26.0,,26.0,26,2022.0
68832,HELP USA.HELP CLUSTER.NR REHAB,7/8/2021,,122960.0,1233,WHITE PLAINS ROAD,Bronx,10472.0,2037670074.0,2024876.0,BX-09,18.0,72.0,BX0903,40.831489,-73.862073,40.831621,-73.862608,2024-03-12,Preservation,No,Non Prevailing Wage,16.0,,14.0,,,1.0,,,,1.0,,,,30.0,31.0,,31.0,31,2024.0
71482,933 ROGERS AVENUE APARTMENTS,7/7/2021,4/1/2022,993206.0,933,ROGERS AVENUE,Brooklyn,11226.0,3051290041.0,3117824.0,BK-17,40.0,824.0,BK1701,40.647479,-73.952119,40.647572,-73.951784,2022-04-01,New Construction,No,Non Prevailing Wage,,,,,10.0,,2.0,2.0,6.0,,,,,,10.0,,10.0,32,2022.0
68783,123 WEST 183 HDFC,7/1/2021,5/31/2022,121223.0,123,WEST 183 STREET,Bronx,10453.0,2032250048.0,2094690.0,BX-07,14.0,255.0,BX0701,40.8601,-73.910052,40.860649,-73.910062,2022-05-31,Preservation,Yes,Non Prevailing Wage,100.0,4.0,,,,1.0,75.0,30.0,,,,,,,105.0,,105.0,105,2022.0
44223,ROCHESTER SUYDAM PHASE 1,6/30/2021,9/24/2024,927737.0,335,RALPH AVENUE,Brooklyn,11233.0,3015560003.0,3000000.0,BK-03,41.0,301.0,BK1601,40.677644,-73.921745,40.677474,-73.921492,2024-09-24,New Construction,No,Non Prevailing Wage,,,,13.0,,,,2.0,11.0,,,,,,,13.0,13.0,13,2024.0
44223,ROCHESTER SUYDAM PHASE 1,6/30/2021,9/24/2024,969695.0,35,ROCHESTER AVENUE,Brooklyn,11233.0,3017090009.0,3000000.0,BK-03,41.0,299.0,BK0302,40.677925,-73.927466,40.677886,-73.927181,2024-06-11,New Construction,No,Non Prevailing Wage,,,,2.0,6.0,,,2.0,6.0,,,,,,,8.0,8.0,8,2024.0
44223,ROCHESTER SUYDAM PHASE 1,6/30/2021,9/24/2024,975702.0,18-22,SUYDAM PLACE,Brooklyn,11233.0,3017090028.0,3000000.0,BK-03,41.0,299.0,BK0302,40.677823,-73.926554,40.677782,-73.926828,2024-03-05,New Construction,No,Non Prevailing Wage,,,,14.0,1.0,,,14.0,1.0,,,,,,,15.0,15.0,15,2024.0
44223,ROCHESTER SUYDAM PHASE 1,6/30/2021,9/24/2024,977564.0,329,RALPH AVENUE,Brooklyn,11233.0,3015560007.0,3000000.0,BK-03,41.0,301.0,BK1601,40.677798,-73.92173,40.677663,-73.921474,2024-07-24,New Construction,No,Non Prevailing Wage,,,,10.0,,,,3.0,7.0,,,,,,,10.0,10.0,10,2024.0
64543,LOWER EAST SIDE CLUSTER,6/30/2021,12/22/2023,6567.0,195,AVENUE C,Manhattan,10009.0,1003940037.0,1004911.0,MN-03,2.0,28.0,MN0303,40.727,-73.976715,40.727115,-73.976945,2023-12-22,Preservation,No,Non Prevailing Wage,,,,9.0,,,1.0,,8.0,,,,,,,9.0,9.0,9,2023.0
64543,LOWER EAST SIDE CLUSTER,6/30/2021,12/22/2023,11581.0,406,EAST 10 STREET,Manhattan,10009.0,1003790012.0,1004543.0,MN-03,2.0,28.0,MN0303,40.725658,-73.977032,40.725433,-73.977076,2023-11-15,Preservation,No,Non Prevailing Wage,,,,21.0,,,,1.0,9.0,10.0,1.0,,,,,21.0,21.0,21,2023.0
64543,LOWER EAST SIDE CLUSTER,6/30/2021,12/22/2023,11701.0,533,EAST 11 STREET,Manhattan,10009.0,1004050046.0,1005188.0,MN-03,2.0,34.0,MN0303,40.728085,-73.980907,40.728041,-73.980239,2023-12-18,Preservation,No,Non Prevailing Wage,,,,14.0,,,4.0,,6.0,4.0,,,,,,14.0,14.0,14,2023.0
65315,BED STUY CENTRAL AND NORTH PHASE I,6/30/2021,,926974.0,687A,HANCOCK STREET,Brooklyn,11233.0,3016570059.0,3341825.0,BK-03,36.0,383.0,BK0302,40.685114,-73.927692,40.685366,-73.92745,2025-03-26,New Construction,No,Non Prevailing Wage,,,,,3.0,,1.0,,2.0,,,,,,2.0,1.0,3.0,3,2025.0
65315,BED STUY CENTRAL AND NORTH PHASE I,6/30/2021,,927550.0,821,WILLOUGHBY AVENUE,Brooklyn,11206.0,3015890058.0,3000000.0,BK-03,36.0,287.0,BK0302,40.695428,-73.935723,40.695667,-73.935579,2025-03-12,New Construction,No,Non Prevailing Wage,,,,,3.0,,,,1.0,2.0,,,,,2.0,1.0,3.0,3,2025.0
65315,BED STUY CENTRAL AND NORTH PHASE I,6/30/2021,,927551.0,278,BAINBRIDGE STREET,Brooklyn,11233.0,3016870047.0,3000000.0,BK-03,36.0,381.0,BK0302,40.681506,-73.926279,40.681322,-73.925915,2025-05-02,New Construction,No,Non Prevailing Wage,,,,3.0,,,,,1.0,2.0,,,,,2.0,1.0,3.0,3,2025.0
65315,BED STUY CENTRAL AND NORTH PHASE I,6/30/2021,,927552.0,1662,BERGEN STREET,Brooklyn,11213.0,3013560006.0,3000000.0,BK-08,41.0,307.0,BK0802,40.674876,-73.927685,40.674681,-73.927614,2025-03-07,New Construction,No,Non Prevailing Wage,,,,3.0,,,,,1.0,2.0,,,,,2.0,1.0,3.0,3,2025.0
65315,BED STUY CENTRAL AND NORTH PHASE I,6/30/2021,,927561.0,697A,JEFFERSON AVENUE,Brooklyn,11221.0,,,BK-03,36.0,295.0,BK0302,40.685544,-73.930457,,,2025-02-25,New Construction,No,Non Prevailing Wage,,,,3.0,,,,,1.0,2.0,,,,,2.0,1.0,3.0,3,2025.0
65315,BED STUY CENTRAL AND NORTH PHASE I,6/30/2021,,978709.0,191,CHAUNCEY STREET,Brooklyn,11233.0,3016870073.0,3000000.0,BK-03,36.0,381.0,BK0302,40.680648,-73.927369,40.680906,-73.927376,2025-03-10,New Construction,No,Non Prevailing Wage,,,,,2.0,,,1.0,,1.0,,,,,1.0,1.0,2.0,2,2025.0
65315,BED STUY CENTRAL AND NORTH PHASE I,6/30/2021,,978711.0,179,CHAUNCEY STREET,Brooklyn,11233.0,3016870080.0,3000000.0,BK-03,36.0,381.0,BK0302,40.680593,-73.927827,40.68081,-73.927921,2025-05-01,New Construction,No,Non Prevailing Wage,,,,3.0,,,,,1.0,2.0,,,,,2.0,1.0,3.0,3,2025.0
65315,BED STUY CENTRAL AND NORTH PHASE I,6/30/2021,,996113.0,50,BUFFALO AVENUE,Brooklyn,11233.0,3017100049.0,3000000.0,BK-03,41.0,299.0,BK0302,40.677432,-73.924759,40.677402,-73.924954,2025-03-18,New Construction,No,Non Prevailing Wage,,,,,2.0,,1.0,,1.0,,,,,,1.0,1.0,2.0,2,2025.0
65315,BED STUY CENTRAL AND NORTH PHASE I,6/30/2021,,996114.0,1835,ATLANTIC AVENUE,Brooklyn,11233.0,3017100051.0,3000000.0,BK-03,41.0,299.0,BK0302,40.677125,-73.925087,40.677539,-73.924989,2025-03-25,New Construction,No,Non Prevailing Wage,,,,,3.0,,,,3.0,,,,,,2.0,1.0,3.0,3,2025.0
65358,WEST 135TH ST. CLUSTER.YR15.FY21,6/30/2021,6/30/2021,5563.0,1453,AMSTERDAM AVENUE,Manhattan,10027.0,1019700073.0,1059643.0,MN-09,7.0,21303.0,MN0902,40.816754,-73.953789,40.81665,-73.953475,2021-06-30,Preservation,Yes,Non Prevailing Wage,,6.0,3.0,,,,,,9.0,,,,,,9.0,,9.0,9,2021.0
65358,WEST 135TH ST. CLUSTER.YR15.FY21,6/30/2021,6/30/2021,5635.0,1732,AMSTERDAM AVENUE,Manhattan,10031.0,1020770035.0,1061945.0,MN-09,7.0,229.0,MN0903,40.825691,-73.947282,40.825856,-73.947506,2021-06-30,Preservation,Yes,Non Prevailing Wage,,6.0,2.0,,,,4.0,,4.0,,,,,,8.0,,8.0,8,2021.0
65358,WEST 135TH ST. CLUSTER.YR15.FY21,6/30/2021,6/30/2021,5642.0,1747,AMSTERDAM AVENUE,Manhattan,10031.0,1020610064.0,1061418.0,MN-09,7.0,231.0,MN0903,40.826188,-73.946895,40.826116,-73.946559,2021-06-30,Preservation,Yes,Non Prevailing Wage,,7.0,1.0,,,1.0,1.0,4.0,,4.0,,,,,9.0,,9.0,9,2021.0
65358,WEST 135TH ST. CLUSTER.YR15.FY21,6/30/2021,6/30/2021,40762.0,507,WEST 135 STREET,Manhattan,10031.0,1019880099.0,1059793.0,MN-09,7.0,22301.0,MN0902,40.819169,-73.952729,40.819416,-73.952725,2021-06-30,Preservation,Yes,Non Prevailing Wage,1.0,10.0,3.0,1.0,,,1.0,5.0,8.0,1.0,,,,,15.0,,15.0,15,2021.0
65358,WEST 135TH ST. CLUSTER.YR15.FY21,6/30/2021,6/30/2021,40764.0,509,WEST 135 STREET,Manhattan,10031.0,1019880098.0,1059792.0,MN-09,7.0,22301.0,MN0902,40.819186,-73.952768,40.819468,-73.952851,2021-06-30,Preservation,Yes,Non Prevailing Wage,1.0,13.0,1.0,,,,1.0,5.0,8.0,1.0,,,,,15.0,,15.0,15,2021.0
65358,WEST 135TH ST. CLUSTER.YR15.FY21,6/30/2021,6/30/2021,40780.0,529,WEST 135 STREET,Manhattan,10031.0,1019880081.0,1059782.0,MN-09,7.0,22301.0,MN0902,40.819342,-73.953162,40.819999,-73.954112,2021-06-30,Preservation,Yes,Non Prevailing Wage,2.0,9.0,4.0,,,1.0,1.0,6.0,9.0,,,,,,16.0,,16.0,16,2021.0
65358,WEST 135TH ST. CLUSTER.YR15.FY21,6/30/2021,6/30/2021,40792.0,625,WEST 135 STREET,Manhattan,10031.0,1020020014.0,1059951.0,MN-09,7.0,22301.0,MN0902,40.820474,-73.955936,40.820971,-73.956424,2021-06-30,Preservation,Yes,Non Prevailing Wage,7.0,7.0,5.0,1.0,,,1.0,,14.0,5.0,,,,,20.0,,20.0,20,2021.0
65358,WEST 135TH ST. CLUSTER.YR15.FY21,6/30/2021,6/30/2021,40934.0,510,WEST 136 STREET,Manhattan,10031.0,1019880115.0,1059802.0,MN-09,7.0,22301.0,MN0902,40.820004,-73.952786,40.819757,-73.952768,2021-06-30,Preservation,Yes,Non Prevailing Wage,,14.0,2.0,2.0,,,2.0,10.0,,6.0,,,,,18.0,,18.0,18,2021.0
66909,111 WILLOW AVENUE,6/30/2021,10/31/2024,997246.0,750,EAST 134 STREET,Bronx,10454.0,2025627501.0,2000000.0,BX-01,8.0,1902.0,BX0101,40.801943,-73.913905,40.801435,-73.913718,2023-11-21,New Construction,No,Non Prevailing Wage,33.0,40.0,59.0,,,1.0,23.0,70.0,26.0,14.0,,,,,133.0,,133.0,133,2023.0
69280,1898 HARRISON AVENUE.GHPP.FY21,6/30/2021,11/15/2023,83696.0,1898,HARRISON AVENUE,Bronx,10453.0,2028690087.0,2008604.0,BX-05,14.0,243.0,BX0501,40.852603,-73.911461,40.852468,-73.911288,2023-11-15,Preservation,No,Non Prevailing Wage,1.0,38.0,14.0,,,1.0,,34.0,14.0,6.0,,,,,54.0,,54.0,54,2023.0
69763,ELECTCHESTER HOUSING CO 1.HRP.FY21,6/30/2021,4/23/2025,669304.0,158-40,JEWEL AVENUE,Queens,11365.0,4067890015.0,4451555.0,QN-08,24.0,122704.0,QN0802,40.732214,-73.80952,40.73116,-73.808108,2025-04-23,Preservation,No,Non Prevailing Wage,2.0,64.0,18.0,,,,,16.0,55.0,13.0,,,,,,84.0,84.0,84,2025.0
69763,ELECTCHESTER HOUSING CO 1.HRP.FY21,6/30/2021,4/23/2025,810604.0,159-21,71 AVENUE,Queens,11365.0,4067890015.0,4451567.0,QN-08,24.0,122704.0,QN0802,40.730363,-73.809283,40.73116,-73.808108,2025-04-23,Preservation,No,Non Prevailing Wage,,32.0,7.0,,,,,7.0,26.0,6.0,,,,,,39.0,39.0,39,2025.0
69763,ELECTCHESTER HOUSING CO 1.HRP.FY21,6/30/2021,4/23/2025,810605.0,162-01,71 AVENUE,Queens,11365.0,4067890015.0,4451549.0,QN-08,24.0,122704.0,QN0802,40.730433,-73.806981,40.73116,-73.808108,2025-04-23,Preservation,No,Non Prevailing Wage,,29.0,7.0,,,,,7.0,23.0,6.0,,,,,,36.0,36.0,36,2025.0
69763,ELECTCHESTER HOUSING CO 1.HRP.FY21,6/30/2021,4/23/2025,811576.0,161-02,JEWEL AVENUE,Queens,11365.0,4067890015.0,4451557.0,QN-08,24.0,122704.0,QN0802,40.731845,-73.807399,40.73116,-73.808108,2025-04-23,Preservation,No,Non Prevailing Wage,,20.0,16.0,,,,2.0,10.0,19.0,5.0,,,,,,36.0,36.0,36,2025.0
69763,ELECTCHESTER HOUSING CO 1.HRP.FY21,6/30/2021,4/23/2025,811577.0,161-06,JEWEL AVENUE,Queens,11365.0,4067890015.0,4451559.0,QN-08,24.0,122704.0,QN0802,40.731837,-73.807312,40.73116,-73.808108,2025-04-23,Preservation,No,Non Prevailing Wage,,51.0,21.0,,,1.0,,14.0,51.0,8.0,,,,,,73.0,73.0,73,2025.0
69763,ELECTCHESTER HOUSING CO 1.HRP.FY21,6/30/2021,4/23/2025,811578.0,161-10,JEWEL AVENUE,Queens,11365.0,4067890015.0,4451561.0,QN-08,24.0,122704.0,QN0802,40.731825,-73.80723,40.73116,-73.808108,2025-04-23,Preservation,No,Non Prevailing Wage,,26.0,10.0,,,,,9.0,21.0,6.0,,,,,,36.0,36.0,36,2025.0
69763,ELECTCHESTER HOUSING CO 1.HRP.FY21,6/30/2021,4/23/2025,811579.0,161-32,JEWEL AVENUE,Queens,11365.0,4067890015.0,4451564.0,QN-08,24.0,122704.0,QN0802,40.731775,-73.806761,40.73116,-73.808108,2025-04-23,Preservation,No,Non Prevailing Wage,,77.0,,,,,2.0,13.0,52.0,10.0,,,,,,77.0,77.0,77,2025.0
69765,ELECTCHESTER HOUSING CO 2.HRP.FY21,6/30/2021,4/23/2025,669305.0,161-25,JEWEL AVENUE,Queens,11365.0,4067920600.0,4455454.0,QN-08,24.0,122703.0,QN0802,40.731809,-73.806926,40.733715,-73.806232,2025-04-23,Preservation,No,Non Prevailing Wage,,72.0,,,,,,14.0,46.0,12.0,,,,,,72.0,72.0,72,2025.0
69765,ELECTCHESTER HOUSING CO 2.HRP.FY21,6/30/2021,4/23/2025,810974.0,67-11,161 STREET,Queens,11365.0,4067920600.0,4455452.0,QN-08,24.0,122703.0,QN0802,40.733421,-73.807856,40.733715,-73.806232,2025-04-23,Preservation,No,Non Prevailing Wage,,18.0,,,,,,4.0,11.0,3.0,,,,,,18.0,18.0,18,2025.0
69765,ELECTCHESTER HOUSING CO 2.HRP.FY21,6/30/2021,4/23/2025,810976.0,67-25,161 STREET,Queens,11365.0,4067920600.0,4455453.0,QN-08,24.0,122703.0,QN0802,40.733237,-73.807868,40.733715,-73.806232,2025-04-23,Preservation,No,Non Prevailing Wage,,72.0,,,,,,14.0,46.0,12.0,,,,,,72.0,72.0,72,2025.0
69765,ELECTCHESTER HOUSING CO 2.HRP.FY21,6/30/2021,4/23/2025,810978.0,67-47,161 STREET,Queens,11365.0,4067920600.0,4455460.0,QN-08,24.0,122703.0,QN0802,40.732946,-73.807883,40.733715,-73.806232,2025-04-23,Preservation,No,Non Prevailing Wage,,18.0,,,,,,4.0,11.0,3.0,,,,,,18.0,18.0,18,2025.0
69765,ELECTCHESTER HOUSING CO 2.HRP.FY21,6/30/2021,4/23/2025,810980.0,65-69,162 STREET,Queens,11365.0,4067920600.0,4455464.0,QN-08,24.0,122703.0,QN0802,40.73519,-73.806603,40.733715,-73.806232,2025-04-23,Preservation,No,Non Prevailing Wage,,72.0,,,,,,14.0,46.0,12.0,,,,,,72.0,72.0,72,2025.0
69765,ELECTCHESTER HOUSING CO 2.HRP.FY21,6/30/2021,4/23/2025,810982.0,65-85,162 STREET,Queens,11365.0,4067920600.0,4455466.0,QN-08,24.0,122703.0,QN0802,40.73421,-73.80692,40.733715,-73.806232,2025-04-23,Preservation,No,Non Prevailing Wage,,71.0,,,,,,14.0,45.0,12.0,,,,,,71.0,71.0,71,2025.0
69765,ELECTCHESTER HOUSING CO 2.HRP.FY21,6/30/2021,4/23/2025,811021.0,67-02,164 STREET,Queens,11365.0,4067920600.0,4455444.0,QN-08,24.0,122703.0,QN0802,40.734808,-73.804879,40.733715,-73.806232,2025-04-23,Preservation,No,Non Prevailing Wage,,72.0,,,,,,14.0,46.0,12.0,,,,,,72.0,72.0,72,2025.0
69765,ELECTCHESTER HOUSING CO 2.HRP.FY21,6/30/2021,4/23/2025,811022.0,67-30,164 STREET,Queens,11365.0,4067920600.0,4455440.0,QN-08,24.0,122703.0,QN0802,40.734103,-73.804924,40.733715,-73.806232,2025-04-23,Preservation,No,Non Prevailing Wage,,36.0,,,,,,7.0,23.0,6.0,,,,,,36.0,36.0,36,2025.0
69765,ELECTCHESTER HOUSING CO 2.HRP.FY21,6/30/2021,4/23/2025,811023.0,67-40,164 STREET,Queens,11365.0,4067920600.0,4455441.0,QN-08,24.0,122703.0,QN0802,40.733982,-73.804932,40.733715,-73.806232,2025-04-23,Preservation,No,Non Prevailing Wage,,72.0,,,,,,14.0,46.0,12.0,,,,,,72.0,72.0,72,2025.0
69765,ELECTCHESTER HOUSING CO 2.HRP.FY21,6/30/2021,4/23/2025,811024.0,67-50,164 STREET,Queens,11365.0,4067920600.0,4455445.0,QN-08,24.0,122703.0,QN0802,40.733861,-73.80494,40.733715,-73.806232,2025-04-23,Preservation,No,Non Prevailing Wage,,36.0,,,,,,7.0,23.0,6.0,,,,,,36.0,36.0,36,2025.0
69765,ELECTCHESTER HOUSING CO 2.HRP.FY21,6/30/2021,4/23/2025,811025.0,69-10,164 STREET,Queens,11365.0,4067920600.0,4455447.0,QN-08,24.0,122703.0,QN0802,40.732796,-73.805011,40.733715,-73.806232,2025-04-23,Preservation,No,Non Prevailing Wage,,72.0,,,,,,14.0,46.0,12.0,,,,,,72.0,72.0,72,2025.0
69765,ELECTCHESTER HOUSING CO 2.HRP.FY21,6/30/2021,4/23/2025,811580.0,161-51,JEWEL AVENUE,Queens,11365.0,4067920600.0,4455457.0,QN-08,24.0,122703.0,QN0802,40.731758,-73.806371,40.733715,-73.806232,2025-04-23,Preservation,No,Non Prevailing Wage,,72.0,,,,,,14.0,46.0,12.0,,,,,,72.0,72.0,72,2025.0
69766,ELECTCHESTER HOUSING CO 3.HRP.FY21,6/30/2021,4/23/2025,566924.0,65-20,160 STREET,Queens,11365.0,4067900001.0,4455379.0,QN-08,24.0,122703.0,QN0802,40.736263,-73.808703,40.734494,-73.809383,2025-04-23,Preservation,No,Non Prevailing Wage,,72.0,,,,,,12.0,50.0,10.0,,,,,,72.0,72.0,72,2025.0
69766,ELECTCHESTER HOUSING CO 3.HRP.FY21,6/30/2021,4/23/2025,810970.0,65-76,160 STREET,Queens,11365.0,4067900001.0,4455383.0,QN-08,24.0,122703.0,QN0802,40.73476,-73.808924,40.734494,-73.809383,2025-04-23,Preservation,No,Non Prevailing Wage,,77.0,,,,,2.0,13.0,52.0,10.0,,,,,,77.0,77.0,77,2025.0
69766,ELECTCHESTER HOUSING CO 3.HRP.FY21,6/30/2021,4/23/2025,810972.0,65-90,160 STREET,Queens,11365.0,4067900001.0,4455386.0,QN-08,24.0,122703.0,QN0802,40.734169,-73.808576,40.734494,-73.809383,2025-04-23,Preservation,No,Non Prevailing Wage,,77.0,,,,,2.0,13.0,52.0,10.0,,,,,,77.0,77.0,77,2025.0
69766,ELECTCHESTER HOUSING CO 3.HRP.FY21,6/30/2021,4/23/2025,810973.0,67-10,161 STREET,Queens,11365.0,4067900001.0,4455389.0,QN-08,24.0,122703.0,QN0802,40.733424,-73.807878,40.734494,-73.809383,2025-04-23,Preservation,No,Non Prevailing Wage,1.0,17.0,,,,,,3.0,12.0,3.0,,,,,,18.0,18.0,18,2025.0
69766,ELECTCHESTER HOUSING CO 3.HRP.FY21,6/30/2021,4/23/2025,810975.0,67-24,161 STREET,Queens,11365.0,4067900001.0,4455390.0,QN-08,24.0,122703.0,QN0802,40.733237,-73.807889,40.734494,-73.809383,2025-04-23,Preservation,No,Non Prevailing Wage,,72.0,,,,,,12.0,50.0,10.0,,,,,,72.0,72.0,72,2025.0
69766,ELECTCHESTER HOUSING CO 3.HRP.FY21,6/30/2021,4/23/2025,810977.0,67-46,161 STREET,Queens,11365.0,4067900001.0,4455393.0,QN-08,24.0,122703.0,QN0802,40.732946,-73.807905,40.734494,-73.809383,2025-04-23,Preservation,No,Non Prevailing Wage,,18.0,,,,,,3.0,12.0,3.0,,,,,,18.0,18.0,18,2025.0
69766,ELECTCHESTER HOUSING CO 3.HRP.FY21,6/30/2021,4/23/2025,811575.0,158-39,JEWEL AVENUE,Queens,11365.0,4067900001.0,4455394.0,QN-08,24.0,122703.0,QN0802,40.732233,-73.809556,40.734494,-73.809383,2025-04-23,Preservation,No,Non Prevailing Wage,2.0,80.0,2.0,,,,,17.0,56.0,11.0,,,,,,84.0,84.0,84,2025.0
69766,ELECTCHESTER HOUSING CO 3.HRP.FY21,6/30/2021,4/23/2025,811739.0,65-17,PARSONS BOULEVARD,Queens,11365.0,4067900001.0,4455397.0,QN-08,24.0,122703.0,QN0802,40.736319,-73.810515,40.734494,-73.809383,2025-04-23,Preservation,No,Non Prevailing Wage,,72.0,,,,,,11.0,51.0,10.0,,,,,,72.0,72.0,72,2025.0
69766,ELECTCHESTER HOUSING CO 3.HRP.FY21,6/30/2021,4/23/2025,811744.0,65-43,PARSONS BOULEVARD,Queens,11365.0,4067900001.0,4455400.0,QN-08,24.0,122703.0,QN0802,40.735224,-73.810579,40.734494,-73.809383,2025-04-23,Preservation,No,Non Prevailing Wage,,72.0,,,,,,12.0,50.0,10.0,,,,,,72.0,72.0,72,2025.0
69766,ELECTCHESTER HOUSING CO 3.HRP.FY21,6/30/2021,4/23/2025,811746.0,65-61,PARSONS BOULEVARD,Queens,11365.0,4067900001.0,4455403.0,QN-08,24.0,122703.0,QN0802,40.734809,-73.810606,40.734494,-73.809383,2025-04-23,Preservation,No,Non Prevailing Wage,,72.0,,,,,,12.0,50.0,10.0,,,,,,72.0,72.0,72,2025.0
69766,ELECTCHESTER HOUSING CO 3.HRP.FY21,6/30/2021,4/23/2025,811747.0,65-77,PARSONS BOULEVARD,Queens,11365.0,4067900001.0,4455407.0,QN-08,24.0,122703.0,QN0802,40.734447,-73.810628,40.734494,-73.809383,2025-04-23,Preservation,No,Non Prevailing Wage,,77.0,,,,,2.0,13.0,52.0,10.0,,,,,,77.0,77.0,77,2025.0
69766,ELECTCHESTER HOUSING CO 3.HRP.FY21,6/30/2021,4/23/2025,811750.0,67-11,PARSONS BOULEVARD,Queens,11365.0,4067900001.0,4455410.0,QN-08,24.0,122703.0,QN0802,40.73423,-73.810643,40.734494,-73.809383,2025-04-23,Preservation,No,Non Prevailing Wage,1.0,75.0,,,,,2.0,14.0,52.0,8.0,,,,,,76.0,76.0,76,2025.0
69767,ELECTCHESTER HOUSING CO 4.HRP.FY21,6/30/2021,4/23/2025,566925.0,65-47,160 STREET,Queens,11365.0,4067910001.0,4451583.0,QN-08,24.0,122703.0,QN0802,40.735866,-73.808755,40.735049,-73.80774,2025-04-23,Preservation,No,Non Prevailing Wage,,72.0,,,,,,14.0,45.0,13.0,,,,,,72.0,72.0,72,2025.0
69767,ELECTCHESTER HOUSING CO 4.HRP.FY21,6/30/2021,4/23/2025,810971.0,65-77,160 STREET,Queens,11365.0,4067910001.0,4451569.0,QN-08,24.0,122703.0,QN0802,40.735369,-73.808847,40.735049,-73.80774,2025-04-23,Preservation,No,Non Prevailing Wage,,72.0,,,,,,14.0,46.0,12.0,,,,,,72.0,72.0,72,2025.0
69767,ELECTCHESTER HOUSING CO 4.HRP.FY21,6/30/2021,4/23/2025,810979.0,65-44,162 STREET,Queens,11365.0,4067910001.0,4451574.0,QN-08,24.0,122703.0,QN0802,40.735763,-73.806652,40.735049,-73.80774,2025-04-23,Preservation,No,Non Prevailing Wage,,72.0,,,,,,14.0,46.0,12.0,,,,,,72.0,72.0,72,2025.0
69767,ELECTCHESTER HOUSING CO 4.HRP.FY21,6/30/2021,4/23/2025,810981.0,65-70,162 STREET,Queens,11365.0,4067910001.0,4451576.0,QN-08,24.0,122703.0,QN0802,40.735297,-73.806631,40.735049,-73.80774,2025-04-23,Preservation,No,Non Prevailing Wage,,72.0,,,,,,14.0,46.0,12.0,,,,,,72.0,72.0,72,2025.0
69767,ELECTCHESTER HOUSING CO 4.HRP.FY21,6/30/2021,4/23/2025,810983.0,65-88,162 STREET,Queens,11365.0,4067910001.0,4451578.0,QN-08,24.0,122703.0,QN0802,40.734221,-73.806938,40.735049,-73.80774,2025-04-23,Preservation,No,Non Prevailing Wage,,72.0,,,,,,14.0,46.0,12.0,,,,,,72.0,72.0,72,2025.0
69862,FOXY. 1323 BOSTON ROAD,6/30/2021,10/13/2023,999031.0,1323,BOSTON ROAD,Bronx,10456.0,2029340015.0,2129702.0,BX-03,17.0,151.0,BX0301,40.831657,-73.89951,40.832099,-73.899625,2023-10-13,New Construction,No,Prevailing Wage,149.0,,,,,1.0,109.0,40.0,1.0,,,,,,150.0,,150.0,150,2023.0
70628,101 - 103 - 105 LIBERTY,6/30/2021,12/4/2023,997184.0,101,LIBERTY AVENUE,Brooklyn,11212.0,3036750025.0,3083408.0,BK-16,37.0,908.0,BK1602,40.672857,-73.906963,40.673069,-73.906969,2023-01-30,New Construction,No,Non Prevailing Wage,,6.0,6.0,3.0,,,,9.0,6.0,,,,,,15.0,,15.0,58,2023.0
70724,1042 PRESIDENT STREET,6/30/2021,8/25/2023,998854.0,1042,PRESIDENT STREET,Brooklyn,11225.0,3012800029.0,3428914.0,BK-09,35.0,325.0,BK0901,40.668572,-73.95701,40.668245,-73.957028,2023-08-25,New Construction,No,Non Prevailing Wage,,,18.0,,,,5.0,6.0,7.0,,,,,,18.0,,18.0,55,2023.0
70913,ROCHESTER SUYDAM PHASE I,6/30/2021,10/23/2024,1017489.0,20,SUYDAM PLACE,Brooklyn,11233.0,3017090028.0,3048184.0,BK-03,41.0,299.0,BK0302,40.677776,-73.926561,40.677782,-73.926828,2024-03-05,New Construction,No,Non Prevailing Wage,,,,14.0,1.0,,,14.0,1.0,,,,,,,15.0,15.0,15,2024.0
70913,ROCHESTER SUYDAM PHASE I,6/30/2021,10/23/2024,1017490.0,37,ROCHESTER AVENUE,Brooklyn,11233.0,3017090009.0,3429148.0,BK-03,41.0,299.0,BK0302,40.677876,-73.927473,40.677886,-73.927181,2024-06-11,New Construction,No,Non Prevailing Wage,,,,2.0,6.0,,,2.0,6.0,,,,,,,8.0,8.0,8,2024.0
70913,ROCHESTER SUYDAM PHASE I,6/30/2021,10/23/2024,1017491.0,335,RALPH AVENUE,Brooklyn,11233.0,3015560003.0,3000000.0,BK-03,41.0,301.0,BK1601,40.677644,-73.921745,40.677474,-73.921492,2024-09-24,New Construction,No,Non Prevailing Wage,,,,13.0,,,,2.0,11.0,,,,,,,13.0,13.0,13,2024.0
70913,ROCHESTER SUYDAM PHASE I,6/30/2021,10/23/2024,1017549.0,331,RALPH AVENUE,Brooklyn,11233.0,3015560007.0,3000000.0,BK-03,41.0,301.0,BK1601,40.677746,-73.921734,40.677663,-73.921474,2024-10-23,New Construction,No,Non Prevailing Wage,,,,10.0,,,,3.0,7.0,,,,,,,10.0,10.0,10,2024.0
71109,1409 BRYANT AVENUE,6/30/2021,6/30/2021,995859.0,1409,BRYANT AVENUE,Bronx,10459.0,2029940045.0,2129300.0,BX-03,17.0,123.0,BX0303,40.83037,-73.888769,40.830253,-73.889134,2021-06-30,New Construction,No,Non Prevailing Wage,,,,,3.0,,1.0,2.0,,,,,,,3.0,,3.0,10,2021.0
71112,494 JACKSON AVENUE,6/30/2021,7/23/2021,996950.0,494,JACKSON AVENUE,Bronx,10455.0,2025790001.0,2003911.0,BX-01,8.0,35.0,BX0101,40.811856,-73.909557,40.81184,-73.909308,2021-07-23,New Construction,No,Non Prevailing Wage,,,,,5.0,,,2.0,3.0,,,,,,5.0,,5.0,16,2021.0
71116,2311 MORRIS AVENUE,6/30/2021,6/30/2021,995199.0,2311,MORRIS AVENUE,Bronx,10468.0,2031830071.0,2128532.0,BX-05,14.0,239.0,BX0503,40.858567,-73.901642,40.858658,-73.901898,2021-06-30,New Construction,No,Non Prevailing Wage,,,,,5.0,,3.0,2.0,,,,,,,5.0,,5.0,16,2021.0
71118,2320 VALENTINE AVENUE,6/30/2021,12/10/2021,117058.0,2320,VALENTINE AVENUE,Bronx,10458.0,2031460013.0,2013431.0,BX-05,15.0,38301.0,BX0503,40.857384,-73.89792,40.857359,-73.897577,2021-12-10,New Construction,No,Non Prevailing Wage,,,,,6.0,,6.0,,,,,,,,6.0,,6.0,19,2021.0
71121,169 LOTT STREET,6/30/2021,12/17/2021,329180.0,169,LOTT STREET,Brooklyn,11226.0,3051360062.0,3117945.0,BK-17,40.0,79202.0,BK1701,40.645753,-73.954052,40.645751,-73.95367,2021-12-17,New Construction,No,Non Prevailing Wage,,,,,5.0,,4.0,,1.0,,,,,,5.0,,5.0,14,2021.0
71124,246 ECHO PLACE,6/30/2021,6/30/2021,996257.0,246,ECHO PLACE,Bronx,10457.0,2028090026.0,2129180.0,BX-05,15.0,23502.0,BX0502,40.849647,-73.904283,40.849325,-73.903712,2021-06-30,New Construction,No,Non Prevailing Wage,,,,,27.0,,9.0,18.0,,,,,,,27.0,,27.0,90,2021.0
71126,2302 WEBSTER AVENUE,6/30/2021,3/4/2022,996722.0,2302,WEBSTER AVENUE,Bronx,10458.0,2030317501.0,2129104.0,BX-06,15.0,38304.0,BX0603,40.856435,-73.895449,40.856396,-73.895134,2022-03-04,New Construction,No,Non Prevailing Wage,,,,,22.0,,,11.0,11.0,,,,,,22.0,,22.0,71,2022.0
71128,TWO BLUE SLIP,6/30/2021,9/23/2022,997424.0,2,BLUE SLIP,Brooklyn,11222.0,3024720050.0,3428938.0,BK-01,33.0,56302.0,BK0101,40.736157,-73.95903,40.736426,-73.959568,2022-09-23,New Construction,No,Non Prevailing Wage,,,,,127.0,,35.0,65.0,25.0,2.0,,,,,127.0,,127.0,421,2022.0
71129,744 EAST 21ST STREET,6/30/2021,6/30/2021,996047.0,2021,FARRAGUT ROAD,Brooklyn,11210.0,3052200001.0,3426611.0,BK-15,45.0,770.0,BK1401,40.63533,-73.957899,40.635552,-73.957489,2021-06-30,New Construction,No,Non Prevailing Wage,,,,,9.0,,,5.0,4.0,,,,,,9.0,,9.0,29,2021.0
71131,4761 WHITE PLAINS ROAD,6/30/2021,7/16/2021,123619.0,4761,WHITE PLAINS ROAD,Bronx,10470.0,2051070008.0,2071761.0,BX-12,11.0,414.0,BX1203,40.905135,-73.849559,40.905218,-73.849957,2021-07-16,New Construction,No,Non Prevailing Wage,,,,,11.0,,7.0,3.0,1.0,,,,,,11.0,,11.0,36,2021.0
71132,276 GRAND CONCOURSE APARTMENTS,6/30/2021,12/30/2022,81853.0,260,GRAND CONCOURSE,Bronx,10451.0,2023410010.0,2000999.0,BX-01,8.0,51.0,BX0101,40.813775,-73.929384,40.813791,-73.928976,2022-12-30,New Construction,No,Non Prevailing Wage,,,,,65.0,,10.0,36.0,15.0,4.0,,,,,65.0,,65.0,215,2022.0
71133,58 PALMETTO STREET APARTMENTS,6/30/2021,8/26/2022,1001955.0,58,PALMETTO STREET,Brooklyn,11221.0,3033490011.0,3427253.0,BK-04,37.0,399.0,BK0402,40.69079,-73.919605,40.690746,-73.919306,2022-08-26,New Construction,No,Non Prevailing Wage,,,,,9.0,,,6.0,3.0,,,,,,9.0,,9.0,27,2022.0
71135,1181 SHERMAN AVENUE,6/30/2021,6/30/2021,995341.0,1181,SHERMAN AVENUE,Bronx,10456.0,2024560240.0,2098340.0,BX-04,16.0,18102.0,BX0401,40.833078,-73.916318,40.833243,-73.916524,2021-06-30,New Construction,No,Non Prevailing Wage,,,,,13.0,,2.0,7.0,4.0,,,,,,13.0,,13.0,43,2021.0
71136,1994 BERGEN STREET,6/30/2021,6/30/2021,996398.0,1994,BERGEN STREET,Brooklyn,11233.0,3014530032.0,3425513.0,BK-16,41.0,303.0,BK1601,40.67417,-73.914809,40.673903,-73.914719,2021-06-30,New Construction,No,Non Prevailing Wage,,,,,6.0,,,6.0,,,,,,,6.0,,6.0,17,2021.0
71137,3365 CRUGER AVENUE,6/30/2021,6/30/2021,996582.0,3365,CRUGER AVENUE,Bronx,10467.0,2046290020.0,2129617.0,BX-12,12.0,374.0,BX1201,40.874511,-73.866052,40.874849,-73.866315,2021-06-30,New Construction,No,Non Prevailing Wage,,,,,15.0,,1.0,11.0,3.0,,,,,,15.0,,15.0,50,2021.0
71138,109 BRUCKNER BOULEVARD,6/30/2021,3/18/2022,996696.0,109,BRUCKNER BOULEVARD,Bronx,10454.0,2022780059.0,2128915.0,BX-01,8.0,1902.0,BX0101,40.804892,-73.922834,40.805072,-73.922559,2022-03-18,New Construction,No,Non Prevailing Wage,,,,,6.0,,,6.0,,,,,,,6.0,,6.0,20,2022.0
71139,730 EAST 32ND STREET,6/30/2021,6/30/2021,996951.0,730,EAST 32 STREET,Brooklyn,11210.0,3075590057.0,3205944.0,BK-14,45.0,78601.0,BK1401,40.633264,-73.945784,40.633198,-73.946058,2021-06-30,New Construction,No,Non Prevailing Wage,,,,,5.0,,,3.0,2.0,,,,,,5.0,,5.0,16,2021.0
71140,13 GARDEN STREET,6/30/2021,6/30/2021,996286.0,13,GARDEN STREET,Brooklyn,11206.0,3031380020.0,3071814.0,BK-04,34.0,389.0,BK0401,40.701253,-73.937831,40.701435,-73.937903,2021-06-30,New Construction,No,Non Prevailing Wage,,,,,6.0,,,,6.0,,,,,,6.0,,6.0,19,2021.0
71141,19 EAST 31ST STREET,6/30/2021,7/23/2021,970692.0,19,EAST 31 STREET,Brooklyn,11226.0,3048850061.0,3109319.0,BK-17,40.0,824.0,BK1701,40.65025,-73.94852,40.650313,-73.948254,2021-07-23,New Construction,No,Non Prevailing Wage,,,,,3.0,,,3.0,,,,,,,3.0,,3.0,10,2021.0
71142,3525 EASTCHESTER ROAD,6/30/2021,12/30/2022,997720.0,3525,EASTCHESTER ROAD,Bronx,10469.0,2047220006.0,2060213.0,BX-12,12.0,386.0,BX1202,40.879072,-73.847485,40.878932,-73.847763,2022-12-30,New Construction,No,Non Prevailing Wage,,,,,3.0,,,1.0,2.0,,,,,,3.0,,3.0,10,2022.0
71143,417 EAST 135TH STREET,6/30/2021,1/10/2022,996744.0,417,EAST 135 STREET,Bronx,10454.0,2022800072.0,2127446.0,BX-01,8.0,25.0,BX0101,40.806918,-73.923641,40.807077,-73.923449,2022-01-10,New Construction,No,Non Prevailing Wage,,,,,7.0,,,1.0,6.0,,,,,,7.0,,7.0,22,2022.0
71144,2438 BARKER AVENUE,6/30/2021,10/8/2021,996829.0,2438,BARKER AVENUE,Bronx,10467.0,2044250022.0,2051243.0,BX-11,15.0,33202.0,BX1104,40.862167,-73.869399,40.862477,-73.869113,2021-10-08,New Construction,No,Non Prevailing Wage,,,,,3.0,,,1.0,2.0,,,,,,3.0,,3.0,9,2021.0
71145,237 WEST 167TH STREET,6/30/2021,9/10/2021,997876.0,237,WEST 167 STREET,Bronx,10452.0,2025300007.0,2128886.0,BX-04,16.0,201.0,BX0402,40.839404,-73.928446,40.839338,-73.928038,2021-09-10,New Construction,No,Non Prevailing Wage,,,,,34.0,,9.0,14.0,11.0,,,,,,34.0,,34.0,35,2021.0
71147,15 JEFFERSON STREET,6/30/2021,8/27/2021,997651.0,15,JEFFERSON STREET,Brooklyn,11206.0,3031600146.0,3428669.0,BK-04,34.0,389.0,BK0401,40.697445,-73.934794,40.697524,-73.935,2021-08-27,New Construction,No,Non Prevailing Wage,,,,,2.0,,,,2.0,,,,,,2.0,,2.0,6,2021.0
71148,1010 ROGERS AVENUE,6/30/2021,7/9/2021,997793.0,1010,ROGERS AVENUE,Brooklyn,11226.0,3051370019.0,3117967.0,BK-17,40.0,79202.0,BK1701,40.645626,-73.951936,40.645497,-73.952279,2021-07-09,New Construction,No,Non Prevailing Wage,,,,,8.0,,1.0,7.0,,,,,,,8.0,,8.0,26,2021.0
71149,13 JEFFERSON STREET,6/30/2021,11/12/2021,998601.0,13,JEFFERSON STREET,Brooklyn,11206.0,3031607502.0,3421605.0,BK-04,34.0,389.0,BK0401,40.697406,-73.93483,40.697445,-73.935083,2021-11-12,New Construction,No,Non Prevailing Wage,,,,,3.0,,,1.0,2.0,,,,,,3.0,,3.0,10,2021.0
71150,378 EAST 165TH STREET,6/30/2021,8/10/2021,64772.0,378,EAST 165 STREET,Bronx,10456.0,2024240017.0,2002045.0,BX-04,16.0,173.0,BX0401,40.828198,-73.913105,40.828119,-73.913351,2021-08-10,New Construction,No,Non Prevailing Wage,,,,,10.0,,,8.0,2.0,,,,,,10.0,,10.0,31,2021.0
71151,4415 3RD AVENUE,6/30/2021,12/29/2021,113903.0,4415,3 AVENUE,Bronx,10457.0,2030480051.0,2011535.0,BX-06,15.0,37504.0,BX0602,40.851789,-73.893085,40.851819,-73.893439,2021-12-29,New Construction,No,Non Prevailing Wage,,,,,6.0,,3.0,1.0,2.0,,,,,,6.0,,6.0,20,2021.0
71152,1557 FULTON STREET,6/30/2021,3/4/2022,995093.0,1557,FULTON STREET,Brooklyn,11216.0,3018580039.0,3329705.0,BK-03,36.0,273.0,BK0302,40.679831,-73.939105,40.680062,-73.939051,2022-03-04,New Construction,No,Non Prevailing Wage,,,,,7.0,,,7.0,,,,,,,7.0,,7.0,23,2022.0
71153,3216 CRUGER AVENUE,6/30/2021,6/30/2021,995942.0,3216,CRUGER AVENUE,Bronx,10467.0,2045970014.0,2128747.0,BX-12,12.0,374.0,BX1201,40.87197,-73.866133,40.872068,-73.865843,2021-06-30,New Construction,No,Non Prevailing Wage,,,,,3.0,,,,3.0,,,,,,3.0,,3.0,8,2021.0
71155,169 HULL STREET,6/30/2021,9/30/2022,997279.0,169,HULL STREET,Brooklyn,11233.0,3015340060.0,3041744.0,BK-16,37.0,369.0,BK1601,40.679642,-73.910065,40.679853,-73.910162,2022-09-30,New Construction,No,Non Prevailing Wage,,,,,3.0,,,1.0,2.0,,,,,,3.0,,3.0,8,2022.0
71157,205 BEACH 29TH STREET,6/30/2021,6/30/2021,972093.0,205,BEACH 29 STREET,Queens,11691.0,4158050020.0,4607294.0,QN-14,31.0,99802.0,QN1401,40.59505,-73.76197,40.595029,-73.762222,2021-06-30,New Construction,No,Non Prevailing Wage,,,,,5.0,,,2.0,3.0,,,,,,5.0,,5.0,15,2021.0
71158,1516 FULTON STREET,6/30/2021,4/23/2025,297498.0,1516,FULTON STREET,Brooklyn,11216.0,3018647502.0,3053844.0,BK-03,36.0,271.0,BK0302,40.679867,-73.940072,40.67964,-73.940241,2025-04-23,New Construction,No,Non Prevailing Wage,,,,,7.0,,,7.0,,,,,,,7.0,,7.0,23,2025.0
71159,117 EAST 95TH STREET,6/30/2021,10/1/2021,283531.0,117,EAST 95 STREET,Brooklyn,11212.0,3046140068.0,3100099.0,BK-17,41.0,884.0,BK1704,40.66272,-73.924772,40.662934,-73.924581,2021-10-01,New Construction,No,Non Prevailing Wage,,,,,4.0,,3.0,,1.0,,,,,,4.0,,4.0,10,2021.0
71160,2302 MORRIS AVENUE,6/30/2021,6/30/2021,995728.0,2302,MORRIS AVENUE,Bronx,10468.0,2031720003.0,2129425.0,BX-01,14.0,23703.0,BX0503,40.858419,-73.901707,40.85826,-73.901508,2021-06-30,New Construction,No,Non Prevailing Wage,,,,,13.0,,4.0,7.0,2.0,,,,,,13.0,,13.0,42,2021.0
71161,329 RUTLAND ROAD,6/30/2021,6/30/2021,989407.0,329,RUTLAND ROAD,Brooklyn,11225.0,3048010177.0,3423939.0,BK-09,40.0,804.0,BK0902,40.65947,-73.949587,40.65967,-73.949767,2021-06-30,New Construction,No,Non Prevailing Wage,,,,,2.0,,,2.0,,,,,,,2.0,,2.0,6,2021.0
71162,327 RUTLAND ROAD,6/30/2021,6/30/2021,996006.0,327,RUTLAND ROAD,Brooklyn,11225.0,3048010077.0,3425925.0,BK-09,40.0,804.0,BK0902,40.659467,-73.949634,40.659665,-73.949839,2021-06-30,New Construction,No,Non Prevailing Wage,,,,,2.0,,,2.0,,,,,,,2.0,,2.0,6,2021.0
71164,903 DEKALB AVENUE,6/30/2021,6/30/2021,995389.0,903,DEKALB AVENUE,Brooklyn,11221.0,3017770044.0,3049578.0,BK-03,36.0,281.0,BK0302,40.692601,-73.940771,40.69285,-73.940543,2021-06-30,New Construction,No,Non Prevailing Wage,,,,,3.0,,,3.0,,,,,,,3.0,,3.0,10,2021.0
71165,1636 DEKALB AVENUE,6/30/2021,6/30/2021,995336.0,1636,DEKALB AVENUE,Brooklyn,11237.0,3032490011.0,3421684.0,BK-04,37.0,445.0,BK0401,40.704653,-73.918867,40.704483,-73.918698,2021-06-30,New Construction,No,Non Prevailing Wage,,,,,3.0,,,3.0,,,,,,,3.0,,3.0,8,2021.0
71167,237 RALPH AVENUE,6/30/2021,8/10/2021,359991.0,237,RALPH AVENUE,Brooklyn,11233.0,3015080003.0,3040758.0,BK-03,41.0,379.0,BK0302,40.681485,-73.922461,40.681484,-73.922126,2021-08-10,New Construction,No,Non Prevailing Wage,,,,,3.0,,,,3.0,,,,,,3.0,,3.0,8,2021.0
71168,3405 FARRAGUT ROAD,6/30/2021,6/30/2021,995382.0,3405,FARRAGUT ROAD,Brooklyn,11210.0,3049980008.0,3113857.0,BK-17,45.0,782.0,BK1702,40.636527,-73.943987,40.636765,-73.943897,2021-06-30,New Construction,No,Non Prevailing Wage,,,,,3.0,,,1.0,2.0,,,,,,3.0,,3.0,10,2021.0
71169,1527 NEW YORK AVENUE,6/30/2021,6/30/2021,992764.0,1527,NEW YORK AVENUE,Brooklyn,11210.0,3050080025.0,3426533.0,BK-17,45.0,784.0,BK1702,40.635457,-73.945004,40.635451,-73.944691,2021-06-30,New Construction,No,Non Prevailing Wage,,,,,3.0,,,2.0,1.0,,,,,,3.0,,3.0,8,2021.0
71170,255 GRAFTON STREET,6/30/2021,12/30/2021,995443.0,255,GRAFTON STREET,Brooklyn,11212.0,3035670016.0,3252427.0,BK-16,41.0,894.0,BK1602,40.661938,-73.91751,40.661971,-73.917239,2021-12-30,New Construction,No,Non Prevailing Wage,,,,,3.0,,,,3.0,,,,,,3.0,,3.0,8,2021.0
71171,133 BROWN PLACE,6/30/2021,6/30/2021,994447.0,133,BROWN PLACE,Bronx,10454.0,2022780053.0,2129126.0,BX-01,8.0,1902.0,BX0101,40.805176,-73.922046,40.805204,-73.922357,2021-06-30,New Construction,No,Non Prevailing Wage,,,,,5.0,,,4.0,1.0,,,,,,5.0,,5.0,16,2021.0
64217,MARION + CRESTON NCP,6/29/2021,1/26/2024,59324.0,2861,CRESTON AVENUE,Bronx,10468.0,2033190060.0,2130690.0,BX-07,14.0,40701.0,BX0702,40.870896,-73.891601,40.871138,-73.891705,2024-01-26,New Construction,No,Non Prevailing Wage,10.0,6.0,9.0,,,,13.0,7.0,5.0,,,,,,25.0,,25.0,25,2024.0
64217,MARION + CRESTON NCP,6/29/2021,1/26/2024,94463.0,2997,MARION AVENUE,Bronx,10458.0,2032810023.0,2129651.0,BX-07,11.0,415.0,BX0702,40.870006,-73.882617,40.870371,-73.88249,2023-10-31,New Construction,No,Non Prevailing Wage,3.0,4.0,11.0,,,,13.0,5.0,,,,,,,18.0,,18.0,18,2023.0
67478,AHC HOMES HDFC.YR15.FY21,6/29/2021,4/6/2023,46128.0,1842,ARTHUR AVENUE,Bronx,10457.0,2029450023.0,2009892.0,BX-06,15.0,36901.0,BX0602,40.84425,-73.894348,40.844269,-73.893993,2023-04-06,Preservation,No,Non Prevailing Wage,4.0,10.0,,,,1.0,1.0,9.0,1.0,4.0,,,,,15.0,,15.0,15,2023.0
67478,AHC HOMES HDFC.YR15.FY21,6/29/2021,4/6/2023,46129.0,1844,ARTHUR AVENUE,Bronx,10457.0,2029450026.0,2009893.0,BX-06,15.0,36901.0,BX0602,40.844269,-73.894329,40.84436,-73.89391,2023-04-06,Preservation,No,Non Prevailing Wage,4.0,12.0,,,,,3.0,9.0,,4.0,,,,,16.0,,16.0,16,2023.0
67478,AHC HOMES HDFC.YR15.FY21,6/29/2021,4/6/2023,46130.0,1846,ARTHUR AVENUE,Bronx,10457.0,2029450027.0,2009894.0,BX-06,15.0,36901.0,BX0602,40.844291,-73.894311,40.844447,-73.893827,2023-04-06,Preservation,No,Non Prevailing Wage,5.0,13.0,1.0,,,,4.0,5.0,9.0,1.0,,,,,19.0,,19.0,19,2023.0
67478,AHC HOMES HDFC.YR15.FY21,6/29/2021,4/6/2023,46132.0,1884,ARTHUR AVENUE,Bronx,10457.0,2029470005.0,2009907.0,BX-06,15.0,36901.0,BX0602,40.845043,-73.893739,40.844889,-73.893378,2023-04-06,Preservation,No,Non Prevailing Wage,4.0,11.0,,,,,,3.0,8.0,4.0,,,,,15.0,,15.0,15,2023.0
67478,AHC HOMES HDFC.YR15.FY21,6/29/2021,4/6/2023,46133.0,1888,ARTHUR AVENUE,Bronx,10457.0,2029470007.0,2009908.0,BX-06,15.0,36901.0,BX0602,40.845098,-73.893703,40.844979,-73.893298,2023-04-06,Preservation,No,Non Prevailing Wage,4.0,13.0,2.0,,,1.0,2.0,10.0,8.0,,,,,,20.0,,20.0,20,2023.0
67478,AHC HOMES HDFC.YR15.FY21,6/29/2021,4/6/2023,60359.0,2068,DALY AVENUE,Bronx,10460.0,2031270046.0,2013212.0,BX-06,15.0,363.0,BX0601,40.843775,-73.882266,40.843615,-73.882096,2023-04-06,Preservation,No,Non Prevailing Wage,2.0,6.0,,,,,,,8.0,,,,,,8.0,,8.0,8,2023.0
67478,AHC HOMES HDFC.YR15.FY21,6/29/2021,4/6/2023,66035.0,910,EAST 178 STREET,Bronx,10460.0,2031210044.0,2013114.0,BX-06,15.0,363.0,BX0601,40.842859,-73.883583,40.842763,-73.883833,2023-04-06,Preservation,No,Non Prevailing Wage,1.0,6.0,1.0,,,,,1.0,1.0,6.0,,,,,8.0,,8.0,8,2023.0
67478,AHC HOMES HDFC.YR15.FY21,6/29/2021,4/6/2023,66154.0,867,EAST 179 STREET,Bronx,10460.0,2031230079.0,2013158.0,BX-06,15.0,363.0,BX0601,40.844271,-73.884184,40.844413,-73.883974,2023-04-06,Preservation,No,Non Prevailing Wage,8.0,12.0,,,,1.0,,11.0,9.0,1.0,,,,,21.0,,21.0,21,2023.0
67478,AHC HOMES HDFC.YR15.FY21,6/29/2021,4/6/2023,66160.0,916,EAST 179 STREET,Bronx,10460.0,2031220016.0,2013125.0,BX-06,15.0,363.0,BX0601,40.843523,-73.882733,40.84346,-73.882863,2023-04-06,Preservation,No,Non Prevailing Wage,8.0,7.0,,,,,,6.0,4.0,5.0,,,,,15.0,,15.0,15,2023.0
67478,AHC HOMES HDFC.YR15.FY21,6/29/2021,4/6/2023,66163.0,934,EAST 179 STREET,Bronx,10460.0,2031270016.0,2013200.0,BX-06,15.0,363.0,BX0601,40.843187,-73.882086,40.843042,-73.882162,2023-04-06,Preservation,No,Non Prevailing Wage,2.0,11.0,,,,,,1.0,12.0,,,,,,13.0,,13.0,13,2023.0
67478,AHC HOMES HDFC.YR15.FY21,6/29/2021,4/6/2023,66353.0,867,EAST 181 STREET,Bronx,10460.0,2031240039.0,2013162.0,BX-06,15.0,363.0,BX0601,40.846155,-73.882533,40.846239,-73.882323,2023-04-06,Preservation,No,Non Prevailing Wage,5.0,6.0,1.0,,,,,12.0,,,,,,,12.0,,12.0,12,2023.0
67478,AHC HOMES HDFC.YR15.FY21,6/29/2021,4/6/2023,74509.0,1961,VYSE AVENUE,Bronx,10460.0,2031260001.0,2013187.0,BX-06,15.0,363.0,BX0601,40.841426,-73.882689,40.841579,-73.88279,2023-04-06,Preservation,No,Non Prevailing Wage,2.0,15.0,1.0,,,,1.0,4.0,8.0,5.0,,,,,18.0,,18.0,18,2023.0
67478,AHC HOMES HDFC.YR15.FY21,6/29/2021,4/6/2023,76629.0,866,ELSMERE PLACE,Bronx,10460.0,2029600028.0,2010152.0,BX-06,15.0,36502.0,BX0602,40.842379,-73.886743,40.842124,-73.886707,2023-04-06,Preservation,No,Non Prevailing Wage,19.0,29.0,30.0,7.0,,1.0,1.0,51.0,28.0,6.0,,,,,86.0,,86.0,86,2023.0
67478,AHC HOMES HDFC.YR15.FY21,6/29/2021,4/6/2023,76634.0,890,ELSMERE PLACE,Bronx,10460.0,2029600039.0,2010153.0,BX-06,15.0,36502.0,BX0602,40.842088,-73.886154,40.841934,-73.886162,2023-04-06,Preservation,No,Non Prevailing Wage,8.0,10.0,,,,,,,5.0,13.0,,,,,18.0,,18.0,18,2023.0
67478,AHC HOMES HDFC.YR15.FY21,6/29/2021,4/6/2023,77601.0,895,FAIRMOUNT PLACE,Bronx,10460.0,2029600001.0,2010150.0,BX-06,15.0,36502.0,BX0602,40.841388,-73.88635,40.8415,-73.886278,2023-04-06,Preservation,No,Non Prevailing Wage,6.0,21.0,3.0,,,1.0,,16.0,12.0,3.0,,,,,31.0,,31.0,31,2023.0
67478,AHC HOMES HDFC.YR15.FY21,6/29/2021,4/6/2023,110095.0,1941,SOUTHERN BOULEVARD,Bronx,10460.0,2029600073.0,2010160.0,BX-06,15.0,36502.0,BX0602,40.842268,-73.88576,40.842444,-73.88606,2023-04-06,Preservation,No,Non Prevailing Wage,9.0,7.0,2.0,,,1.0,,,14.0,5.0,,,,,19.0,,19.0,19,2023.0
67478,AHC HOMES HDFC.YR15.FY21,6/29/2021,4/6/2023,118544.0,2081,VYSE AVENUE,Bronx,10460.0,2031270073.0,2013223.0,BX-06,15.0,363.0,BX0601,40.843403,-73.880929,40.843535,-73.881142,2023-04-06,Preservation,No,Non Prevailing Wage,4.0,4.0,,,,,,,5.0,3.0,,,,,8.0,,8.0,8,2023.0
67583,URBAN BLDRS COLLABORATIVE. SUMNER HOUSES,6/29/2021,3/25/2024,998619.0,57,MARCUS GARVEY BOULEVARD,Brooklyn,11206.0,3015800010.0,3428961.0,BK-03,36.0,28502.0,BK0302,40.697473,-73.940921,40.6975,-73.940503,2024-03-25,New Construction,No,Prevailing Wage,189.0,,,,,1.0,130.0,59.0,1.0,,,,,,190.0,,190.0,190,2024.0
69931,1 SULLIVAN,6/29/2021,11/9/2023,995172.0,1,SULLIVAN PLACE,Brooklyn,11225.0,3011920095.0,3429588.0,BK-09,35.0,213.0,BK0901,40.66408,-73.960992,40.664223,-73.96083,2023-11-09,New Construction,No,Non Prevailing Wage,,,14.0,,,,4.0,4.0,6.0,,,,,,14.0,,14.0,52,2023.0
70668,116-09 GROSVENOR LANE,6/29/2021,11/30/2023,997379.0,82-77,116 STREET,Queens,11418.0,4033210091.0,4079271.0,QN-09,29.0,134.0,QN0901,40.707094,-73.836484,40.706973,-73.836246,2023-11-30,New Construction,No,Non Prevailing Wage,,,12.0,,17.0,,,26.0,3.0,,,,,,29.0,,29.0,55,2023.0
71125,455 ONDERDONK AVENUE APARTMENTS,6/29/2021,8/26/2022,991419.0,455,ONDERDONK AVENUE,Queens,11385.0,4034030009.0,4081279.0,QN-05,34.0,591.0,QN0502,40.707108,-73.91248,40.707267,-73.912285,2022-08-26,New Construction,No,Non Prevailing Wage,,,,,5.0,,,3.0,2.0,,,,,,5.0,,5.0,15,2022.0
71127,1121 36TH STREET APARTMENTS,6/29/2021,5/7/2024,991377.0,1121,36 STREET,Brooklyn,11218.0,3053027501.0,3429344.0,BK-12,39.0,498.0,BK1203,40.644266,-73.987842,40.644274,-73.987388,2024-05-07,New Construction,No,Non Prevailing Wage,,,,,2.0,,,,,2.0,,,,,2.0,,2.0,6,2024.0
72269,772 EAST 182ND STREET,6/29/2021,8/10/2023,1003187.0,772,EAST 182 STREET,Bronx,10460.0,2031100061.0,2092325.0,BX-06,15.0,371.0,BX0602,40.848997,-73.88431,40.848874,-73.884538,2023-08-10,New Construction,No,Non Prevailing Wage,,,,,6.0,,1.0,2.0,3.0,,,,,,6.0,,6.0,18,2023.0
70076,SEAGIRT SENIOR HOUSING HDFC,6/28/2021,4/15/2024,811831.0,19-15,SEAGIRT BOULEVARD,Queens,11691.0,4158100030.0,4453812.0,QN-14,31.0,99802.0,QN1401,40.595128,-73.7534,40.594772,-73.753837,2024-04-15,Preservation,No,Non Prevailing Wage,147.0,2.0,,2.0,,1.0,43.0,109.0,,,,,,,152.0,,152.0,152,2024.0
70470,305 EAST 165TH STREET,6/28/2021,5/10/2023,999024.0,305,EAST 165 STREET,Bronx,10456.0,2024330036.0,2130497.0,BX-04,16.0,175.0,BX0401,40.828867,-73.91512,40.828993,-73.914874,2023-05-10,New Construction,No,Non Prevailing Wage,,,24.0,,13.0,,9.0,25.0,3.0,,,,,,37.0,,37.0,72,2023.0
70658,278 8TH AVENUE,6/28/2021,3/21/2024,997507.0,278,8 AVENUE,Manhattan,10011.0,1007730001.0,1091035.0,MN-04,3.0,91.0,MN0401,40.745848,-73.998069,40.745521,-73.997914,2024-03-21,New Construction,No,Non Prevailing Wage,,19.0,25.0,,,,12.0,22.0,9.0,1.0,,,,,44.0,,44.0,190,2024.0
70815,132-77 METROPOLITAN AVENUE,6/28/2021,5/16/2024,998853.0,132-77,METROPOLITAN AVENUE,Queens,11418.0,4092850090.0,4000000.0,QN-09,29.0,21602.0,QN0901,40.70284,-73.818461,40.702882,-73.817603,2024-05-16,New Construction,No,Non Prevailing Wage,,,13.0,,,,2.0,8.0,3.0,,,,,,13.0,,13.0,40,2024.0
71122,445 VANDERBILT AVENUE APARTMENTS,6/28/2021,6/24/2022,999048.0,445,VANDERBILT AVENUE,Brooklyn,11238.0,3019600011.0,3428934.0,BK-02,35.0,199.0,BK0204,40.685022,-73.968205,40.68505,-73.967917,2022-06-24,New Construction,No,Non Prevailing Wage,,,,,13.0,,3.0,7.0,3.0,,,,,,13.0,,13.0,43,2022.0
71123,428 WYTHE AVENUE APARTMENTS,6/28/2021,3/4/2022,981841.0,428,WYTHE AVENUE,Brooklyn,11249.0,3024697503.0,3063648.0,BK-01,33.0,549.0,BK0102,40.71121,-73.966534,40.711136,-73.966815,2022-03-04,New Construction,No,Non Prevailing Wage,,,,,12.0,,,10.0,1.0,1.0,,,,,12.0,,12.0,37,2022.0
62193,ATLANTIC CHESTNUT - LOT 1,6/25/2021,6/5/2025,975454.0,250,EUCLID AVENUE,Brooklyn,11208.0,3041437501.0,3428606.0,BK-05,37.0,1178.0,BK0501,40.68235,-73.873927,40.68254,-73.874618,2024-02-01,New Construction,No,Non Prevailing Wage,101.0,101.0,200.0,,,1.0,40.0,167.0,135.0,61.0,,,,,403.0,,403.0,403,2024.0
69140,FORDHAM BEDFORD.FB CLUSTER.NR REHAB,6/25/2021,,122133.0,17,WEST MOSHOLU PARKWAY NORTH,Bronx,10467.0,2033240099.0,2017698.0,BX-07,11.0,421.0,BX0703,40.88108,-73.884174,40.881195,-73.883935,2024-09-30,Preservation,No,Non Prevailing Wage,25.0,,24.0,,,1.0,,39.0,7.0,4.0,,,,,50.0,,50.0,50,2024.0
70293,"1281 HOE AVENUE, LLC",6/25/2021,11/21/2022,996451.0,1281,HOE AVENUE,Bronx,10459.0,2029800056.0,2130665.0,BX-03,17.0,123.0,BX0303,40.83057,-73.890709,40.830666,-73.890954,2022-11-21,New Construction,No,Non Prevailing Wage,,,45.0,,,,45.0,,,,,,,,45.0,,45.0,45,2022.0
70444,915 ELSMERE PLACE,6/25/2021,1/24/2023,996660.0,915,ELSMERE PLACE,Bronx,10460.0,2029850064.0,2130498.0,BX-06,15.0,359.0,BX0601,40.84159,-73.8851,40.841669,-73.884796,2023-01-24,New Construction,No,Non Prevailing Wage,,,27.0,,12.0,,10.0,27.0,2.0,,,,,,39.0,,39.0,76,2023.0
71117,26-02 4TH STREET APARTMENTS,6/25/2021,5/13/2022,1000196.0,26-02,4 STREET,Queens,11102.0,4009100023.0,4618329.0,QN-01,22.0,87.0,QN0102,40.775924,-73.932753,40.776045,-73.933013,2022-05-13,New Construction,No,Non Prevailing Wage,,,,,14.0,,1.0,9.0,3.0,1.0,,,,,14.0,,14.0,46,2022.0
63774,ST. FRANCIS,6/24/2021,1/9/2024,997258.0,1544,SHAKESPEARE AVENUE,Bronx,10452.0,2028720148.0,2129668.0,BX-05,14.0,21301.0,BX0501,40.845717,-73.919234,40.845725,-73.918937,2024-01-09,New Construction,No,Non Prevailing Wage,42.0,24.0,49.0,,,1.0,28.0,47.0,35.0,6.0,,,,,116.0,,116.0,116,2024.0
63974,SENDERO VERDE A,6/24/2021,,972163.0,50,EAST 112 STREET,Manhattan,10029.0,1016177502.0,1000000.0,MN-11,8.0,17402.0,MN1101,40.797129,-73.945972,40.796772,-73.946059,2025-02-06,New Construction,No,Non Prevailing Wage,88.0,51.0,69.0,139.0,,1.0,87.0,154.0,78.0,29.0,,,,,348.0,,348.0,348,2025.0
67898,XENOLITH. 1810 WATSON AVENUE.SOTOMAYOR,6/24/2021,11/22/2023,991371.0,1810,WATSON AVENUE,Bronx,10472.0,2037300001.0,2102921.0,BX-09,18.0,44.0,BX0901,40.827858,-73.864953,40.826787,-73.864193,2023-11-22,New Construction,No,Prevailing Wage,204.0,,,,,1.0,158.0,46.0,1.0,,,,,,205.0,,205.0,205,2023.0
69591,GREENPOINT LANDING H1H2,6/24/2021,10/31/2024,995045.0,45,COMMERCIAL STREET,Brooklyn,11222.0,3024727504.0,3000000.0,BK-01,33.0,56302.0,BK0101,40.736593,-73.957951,40.736903,-73.958182,2023-08-04,New Construction,No,Non Prevailing Wage,123.0,68.0,111.0,71.0,,1.0,93.0,93.0,188.0,,,,,,374.0,,374.0,374,2023.0
72270,ONE ARCHER - 160-05 ARCHER AVENUE,6/24/2021,11/30/2023,1003185.0,92-27,160 STREET,Queens,11433.0,4101010150.0,4622954.0,QN-12,27.0,44601.0,QN1201,40.703587,-73.799016,40.703083,-73.798177,2023-11-30,New Construction,No,Non Prevailing Wage,,,,,95.0,,22.0,56.0,17.0,,,,,,95.0,,95.0,315,2023.0
72271,815 FLATBUSH AVENUE,6/24/2021,9/23/2022,1001979.0,815,FLATBUSH AVENUE,Brooklyn,11226.0,3050830003.0,3116601.0,BK-14,40.0,79602.0,BK1401,40.652702,-73.959269,40.6527,-73.958916,2022-09-23,New Construction,No,Non Prevailing Wage,,,,,23.0,,,11.0,12.0,,,,,,23.0,,23.0,76,2022.0
69285,3800 PUTNAM AVENUE GARDENS HDFC.HPO.FY21,6/23/2021,6/23/2021,863998.0,3800,PUTNAM AVENUE WEST,Bronx,10463.0,2032710101.0,2114272.0,BX-08,11.0,283.0,BX0802,40.884936,-73.898561,40.884911,-73.898449,2021-06-23,Preservation,Yes,Non Prevailing Wage,,,44.0,,,,,31.0,13.0,,,,,,44.0,,44.0,44,2021.0
68572,CONCERN FOR INDEPENDENT LIVING. 2337 PITKIN AVENUE,6/22/2021,,992115.0,410,WARWICK STREET,Brooklyn,11207.0,3039980030.0,3392571.0,BK-05,42.0,1150.0,BK0502,40.673722,-73.88594,40.673585,-73.886124,2023-08-17,New Construction,No,Non Prevailing Wage,43.0,5.0,9.0,,,1.0,37.0,15.0,6.0,,,,,,58.0,,58.0,58,2023.0
70633,2528 GRAND AVENUE,6/22/2021,4/9/2025,997194.0,2528,GRAND AVENUE,Bronx,10468.0,2032040015.0,2129684.0,BX-07,14.0,265.0,BX0701,40.865215,-73.901429,40.865215,-73.901129,2025-04-09,New Construction,No,Non Prevailing Wage,,,27.0,,,,,13.0,14.0,,,,,,27.0,,27.0,59,2025.0
70796,661 MANIDA STREET,6/22/2021,12/16/2022,998851.0,661,MANIDA STREET,Bronx,10474.0,2027650206.0,2130561.0,BX-02,17.0,9301.0,BX0201,40.813221,-73.888075,40.813677,-73.888475,2022-12-16,New Construction,No,Non Prevailing Wage,,,32.0,,,,23.0,9.0,,,,,,,32.0,,32.0,56,2022.0
70188,CLAY AVENUE CLUSTER L.P.YR15.FY21,6/17/2021,6/17/2021,56820.0,1175,CLAY AVENUE,Bronx,10456.0,2024300041.0,2002158.0,BX-04,16.0,17701.0,BX0401,40.831754,-73.910975,40.831938,-73.911207,2021-06-17,Preservation,Yes,Non Prevailing Wage,,8.0,4.0,,,,,1.0,5.0,6.0,,,,,12.0,,12.0,12,2021.0
70188,CLAY AVENUE CLUSTER L.P.YR15.FY21,6/17/2021,6/17/2021,56822.0,1179,CLAY AVENUE,Bronx,10456.0,2024300039.0,2002157.0,BX-04,16.0,17701.0,BX0401,40.831842,-73.910928,40.832048,-73.911141,2021-06-17,Preservation,Yes,Non Prevailing Wage,2.0,8.0,2.0,,,,,1.0,5.0,6.0,,,,,12.0,,12.0,12,2021.0
70188,CLAY AVENUE CLUSTER L.P.YR15.FY21,6/17/2021,6/17/2021,56825.0,1186,CLAY AVENUE,Bronx,10456.0,2024260055.0,2002078.0,BX-04,16.0,17701.0,BX0401,40.831836,-73.910907,40.831663,-73.910723,2021-06-17,Preservation,Yes,Non Prevailing Wage,,9.0,2.0,,,1.0,2.0,,9.0,1.0,,,,,12.0,,12.0,12,2021.0
70188,CLAY AVENUE CLUSTER L.P.YR15.FY21,6/17/2021,6/17/2021,56828.0,1191,CLAY AVENUE,Bronx,10456.0,2024300033.0,2002154.0,BX-04,16.0,17701.0,BX0401,40.832099,-73.910784,40.832382,-73.910949,2021-06-17,Preservation,Yes,Non Prevailing Wage,2.0,9.0,5.0,1.0,,,,16.0,,1.0,,,,,17.0,,17.0,17,2021.0
70188,CLAY AVENUE CLUSTER L.P.YR15.FY21,6/17/2021,6/17/2021,56831.0,1198,CLAY AVENUE,Bronx,10456.0,2024260058.0,2002081.0,BX-04,16.0,17701.0,BX0401,40.832094,-73.910765,40.831959,-73.910556,2021-06-17,Preservation,Yes,Non Prevailing Wage,,7.0,4.0,,,,,,11.0,,,,,,11.0,,11.0,11,2021.0
70188,CLAY AVENUE CLUSTER L.P.YR15.FY21,6/17/2021,6/17/2021,56940.0,1394,CLAY AVENUE,Bronx,10456.0,2028870082.0,2009294.0,BX-04,16.0,17702.0,BX0403,40.837051,-73.907965,40.836854,-73.907781,2021-06-17,Preservation,Yes,Non Prevailing Wage,2.0,11.0,8.0,,,1.0,5.0,8.0,6.0,3.0,,,,,22.0,,22.0,22,2021.0
70607,71-82 PARSONS BLVD,6/17/2021,7/14/2023,997445.0,71-82,PARSONS BOULEVARD,Queens,11365.0,4067930231.0,4000000.0,QN-08,24.0,122702.0,QN0802,40.72825,-73.811173,40.727998,-73.811592,2023-07-14,New Construction,No,Non Prevailing Wage,,,24.0,,,,1.0,19.0,4.0,,,,,,24.0,,24.0,94,2023.0
71115,735 FENIMORE STREET APARTMENTS,6/17/2021,6/10/2022,999046.0,735,FENIMORE STREET,Brooklyn,11203.0,3048130055.0,3426232.0,BK-09,40.0,87401.0,BK0902,40.659481,-73.93792,40.659676,-73.938097,2022-06-10,New Construction,No,Non Prevailing Wage,,,,,2.0,,,1.0,1.0,,,,,,2.0,,2.0,6,2022.0
67592,SOUTHEASTERN QUEENS VACANT HOMES - CLUSTER III,6/15/2021,,55105.0,3817,CARPENTER AVENUE,Bronx,10467.0,2046530021.0,2057542.0,BX-12,12.0,394.0,BX1201,40.884992,-73.865398,40.885144,-73.865607,2024-01-30,Preservation,No,Non Prevailing Wage,,,,2.0,,,,,,,,,2.0,,,2.0,2.0,2,2024.0
67592,SOUTHEASTERN QUEENS VACANT HOMES - CLUSTER III,6/15/2021,,185434.0,305,ATKINS AVENUE,Brooklyn,11208.0,3040550012.0,3089899.0,BK-05,42.0,1194.0,BK0502,40.671236,-73.878165,40.671301,-73.877902,2023-05-23,Preservation,No,Non Prevailing Wage,,,,3.0,,,,,,,,,3.0,,,3.0,3.0,3,2023.0
67592,SOUTHEASTERN QUEENS VACANT HOMES - CLUSTER III,6/15/2021,,209449.0,349,BERRIMAN STREET,Brooklyn,11208.0,3040700021.0,3090235.0,BK-05,42.0,1118.0,BK0503,40.669779,-73.878756,40.669891,-73.878543,2023-01-26,Preservation,No,Non Prevailing Wage,,,2.0,,,,,,,,,2.0,,,,2.0,2.0,2,2023.0
67592,SOUTHEASTERN QUEENS VACANT HOMES - CLUSTER III,6/15/2021,,322293.0,580,LAFAYETTE AVENUE,Brooklyn,11205.0,3017880053.0,3049894.0,BK-03,36.0,243.0,BK0301,40.689773,-73.952189,40.689598,-73.951757,2024-03-04,Preservation,No,Non Prevailing Wage,,,,3.0,,,,,,,,3.0,,,,3.0,3.0,3,2024.0
67592,SOUTHEASTERN QUEENS VACANT HOMES - CLUSTER III,6/15/2021,,389130.0,110,WAVERLY AVENUE,Brooklyn,11205.0,3018880177.0,3054341.0,BK-02,35.0,191.0,BK0204,40.694462,-73.9681,40.694475,-73.968349,2024-02-15,Preservation,No,Non Prevailing Wage,,,,3.0,,,,,,,,,3.0,,,3.0,3.0,3,2024.0
67592,SOUTHEASTERN QUEENS VACANT HOMES - CLUSTER III,6/15/2021,,389258.0,99,WAVERLY AVENUE,Brooklyn,11205.0,3018890022.0,3054355.0,BK-02,35.0,191.0,BK0204,40.694698,-73.968125,40.694813,-73.967869,2023-01-20,Preservation,No,Non Prevailing Wage,,,,2.0,,,,,,,2.0,,,,,2.0,2.0,2,2023.0
67592,SOUTHEASTERN QUEENS VACANT HOMES - CLUSTER III,6/15/2021,,516144.0,143-03,105 AVENUE,Queens,11435.0,4100410120.0,4214750.0,QN-12,28.0,202.0,QN1202,40.69154,-73.808568,40.691675,-73.808687,2023-01-12,Preservation,No,Non Prevailing Wage,,,,1.0,,,,,,1.0,,,,,,1.0,1.0,1,2023.0
67592,SOUTHEASTERN QUEENS VACANT HOMES - CLUSTER III,6/15/2021,,516172.0,144-29,105 AVENUE,Queens,11435.0,4100430019.0,4214792.0,QN-12,28.0,204.0,QN1201,40.692244,-73.807741,40.692757,-73.807472,2024-04-19,Preservation,No,Non Prevailing Wage,,,,2.0,,,,,,,,,2.0,,,2.0,2.0,2,2024.0
67592,SOUTHEASTERN QUEENS VACANT HOMES - CLUSTER III,6/15/2021,,516281.0,171-40,105 AVENUE,Queens,11433.0,4102410027.0,4218258.0,QN-12,27.0,440.0,QN1202,40.702116,-73.785373,40.702063,-73.78489,2023-06-21,Preservation,No,Non Prevailing Wage,,,1.0,,,,,,,1.0,,,,,,1.0,1.0,1,2023.0
67592,SOUTHEASTERN QUEENS VACANT HOMES - CLUSTER III,6/15/2021,,551178.0,185-10,141 AVENUE,Queens,11413.0,4130570050.0,4280842.0,QN-12,31.0,330.0,QN1204,40.670979,-73.758779,40.670808,-73.758488,2024-03-13,Preservation,No,Non Prevailing Wage,,,1.0,,,,,,,1.0,,,,,,1.0,1.0,1,2024.0
67592,SOUTHEASTERN QUEENS VACANT HOMES - CLUSTER III,6/15/2021,,561907.0,118-35,153 STREET,Queens,11434.0,4122080005.0,4265039.0,QN-12,28.0,28801.0,QN1203,40.680341,-73.789369,40.680011,-73.788977,2023-07-11,Preservation,No,Non Prevailing Wage,,,1.0,,,,,,1.0,,,,,,,1.0,1.0,1,2023.0
67592,SOUTHEASTERN QUEENS VACANT HOMES - CLUSTER III,6/15/2021,,571099.0,114-22,166 STREET,Queens,11434.0,4123290038.0,4267054.0,QN-12,28.0,276.0,QN1203,40.689502,-73.782994,40.689294,-73.783175,2023-02-10,Preservation,No,Non Prevailing Wage,,,1.0,,,,,,,1.0,,,,,,1.0,1.0,1,2023.0
67592,SOUTHEASTERN QUEENS VACANT HOMES - CLUSTER III,6/15/2021,,571220.0,144-23,166 STREET,Queens,11434.0,4132720054.0,4284945.0,QN-13,31.0,306.0,QN1306,40.665609,-73.777395,40.665641,-73.777095,2023-05-31,Preservation,No,Non Prevailing Wage,,,1.0,,,,,,1.0,,,,,,,1.0,1.0,1,2023.0
67592,SOUTHEASTERN QUEENS VACANT HOMES - CLUSTER III,6/15/2021,,606962.0,119-12,219 STREET,Queens,11411.0,4127780128.0,4275406.0,QN-13,27.0,610.0,QN1304,40.691835,-73.74288,40.6918,-73.743201,2024-01-26,Preservation,No,Non Prevailing Wage,,,1.0,,,,,,,1.0,,,,,,1.0,1.0,1,2024.0
67592,SOUTHEASTERN QUEENS VACANT HOMES - CLUSTER III,6/15/2021,,654423.0,231,FERNSIDE PLACE,Queens,11691.0,4157820054.0,4301314.0,QN-14,31.0,99801.0,QN1401,40.596062,-73.757523,40.596181,-73.7578,2024-05-22,Preservation,No,Non Prevailing Wage,,,1.0,,,,,,,1.0,,,,,,1.0,1.0,1,2024.0
67592,SOUTHEASTERN QUEENS VACANT HOMES - CLUSTER III,6/15/2021,,695841.0,113-44,SPRINGFIELD BOULEVARD,Queens,11429.0,4111340046.0,4240073.0,QN-13,27.0,53401.0,QN1304,40.702787,-73.740746,40.702758,-73.741179,2023-04-17,Preservation,No,Non Prevailing Wage,,,1.0,,,,,,,,1.0,,,,,1.0,1.0,1,2023.0
70150,202 EAST 23RD STREET,6/15/2021,9/10/2024,998897.0,202,EAST 23 STREET,Manhattan,10010.0,1009030057.0,1091675.0,MN-06,2.0,64.0,MN0602,40.738669,-73.982784,40.738526,-73.98296,2024-09-10,New Construction,No,Non Prevailing Wage,,11.0,11.0,,6.0,,16.0,5.0,7.0,,,,,,28.0,,28.0,108,2024.0
72272,196 WILLOUGHBY STREET,6/15/2021,9/3/2021,1002406.0,196,WILLOUGHBY STREET,Brooklyn,11201.0,3020857502.0,3426373.0,BK-02,35.0,3101.0,BK0203,40.69195,-73.979965,40.691478,-73.979954,2021-09-03,New Construction,No,Non Prevailing Wage,,,,,143.0,,45.0,71.0,27.0,,,,,,143.0,,143.0,476,2021.0
69221,963 ATLANTIC AVENUE,6/14/2021,1/16/2024,992730.0,963,ATLANTIC AVENUE,Brooklyn,11238.0,3020190080.0,3429692.0,BK-02,35.0,227.0,BK0301,40.680263,-73.960337,40.680639,-73.960532,2024-01-16,New Construction,No,Non Prevailing Wage,,,23.0,,15.0,,8.0,23.0,7.0,,,,,,38.0,,38.0,124,2024.0
71111,1728 TOWNSEND AVENUE APARTMENTS,6/11/2021,12/30/2021,991477.0,1728,TOWNSEND AVENUE,Bronx,10453.0,2028490063.0,2008196.0,BX-05,14.0,22701.0,BX0502,40.846922,-73.911743,40.846924,-73.911429,2021-12-30,New Construction,No,Non Prevailing Wage,,,,,7.0,,3.0,4.0,,,,,,,7.0,,7.0,22,2021.0
71113,516-518 EAST 147TH STREET APARTMENTS,6/11/2021,3/4/2022,984450.0,516,EAST 147 STREET,Bronx,10455.0,2022720109.0,2129125.0,BX-01,8.0,43.0,BX0101,40.813364,-73.914985,40.813247,-73.915328,2022-03-04,New Construction,No,Non Prevailing Wage,,,,,3.0,,,3.0,,,,,,,3.0,,3.0,7,2022.0
71113,516-518 EAST 147TH STREET APARTMENTS,6/11/2021,3/4/2022,992041.0,518,EAST 147 STREET,Bronx,10455.0,2022720110.0,2129008.0,BX-01,8.0,43.0,BX0101,40.813345,-73.914931,40.813216,-73.915241,2022-03-04,New Construction,No,Non Prevailing Wage,,,,,3.0,,,3.0,,,,,,,3.0,,3.0,7,2022.0
72273,170-22 CEDARCROFT ROAD,6/10/2021,5/6/2022,991691.0,170-22,CEDARCROFT ROAD,Queens,11432.0,4098440017.0,4210575.0,QN-08,24.0,458.0,QN0804,40.711826,-73.792235,40.711672,-73.792048,2022-05-06,New Construction,No,Non Prevailing Wage,,,,,3.0,,,1.0,2.0,,,,,,3.0,,3.0,9,2022.0
69119,322 GRAND CONCOURSE,6/9/2021,9/13/2023,998848.0,322,GRAND CONCOURSE,Bronx,10451.0,2023410031.0,2130530.0,BX-01,8.0,51.0,BX0101,40.814571,-73.928878,40.814658,-73.928509,2023-09-13,New Construction,No,Non Prevailing Wage,,,25.0,,,,5.0,7.0,13.0,,,,,,25.0,,25.0,151,2023.0
71110,27 EAST 198TH STREET APARTMENTS,6/9/2021,2/4/2022,991455.0,27,EAST 198 STREET,Bronx,10468.0,2033190021.0,2017580.0,BX-07,14.0,40701.0,BX0702,40.871127,-73.892591,40.870992,-73.891893,2022-02-04,New Construction,No,Non Prevailing Wage,,,,,14.0,,3.0,10.0,1.0,,,,,,14.0,,14.0,46,2022.0
72274,SVEN,6/1/2021,11/28/2023,1000444.0,29-59,NORTHERN BOULEVARD,Queens,11101.0,4004030003.0,4622937.0,QN-01,26.0,3301.0,QN0105,40.75018,-73.93562,40.750288,-73.936208,2023-11-28,New Construction,No,Non Prevailing Wage,,,,,288.0,,50.0,188.0,41.0,9.0,,,,,288.0,,288.0,958,2023.0
71108,25-49 38TH STREET APARTMENT,5/26/2021,9/2/2022,426282.0,25-49,38 STREET,Queens,11103.0,,,QN-01,22.0,143.0,QN0104,40.767787,-73.91292,,,2022-09-02,New Construction,No,Non Prevailing Wage,,,,,7.0,,,5.0,2.0,,,,,,7.0,,7.0,21,2022.0
69851,493 MYRTLE AVENUE,5/20/2021,3/20/2025,995900.0,493,MYRTLE AVENUE,Brooklyn,11205.0,3018917502.0,3000000.0,BK-02,35.0,191.0,BK0204,40.693495,-73.965327,40.693725,-73.965407,2025-03-20,New Construction,No,Non Prevailing Wage,,,4.0,,3.0,,3.0,4.0,,,,,,,7.0,,7.0,21,2025.0
72481,170 EAST 206TH STREET,5/20/2021,4/29/2022,999692.0,170,EAST 206 STREET,Bronx,10458.0,2033120008.0,2017370.0,BX-07,11.0,413.0,BX0702,40.875904,-73.88491,40.875704,-73.885048,2022-04-29,New Construction,No,Non Prevailing Wage,,,,,24.0,,7.0,14.0,3.0,,,,,,24.0,,24.0,79,2022.0
72275,1351 BROOKLYN AVENUE,5/19/2021,9/3/2021,997138.0,1351,BROOKLYN AVENUE,Brooklyn,11203.0,3049700067.0,3428640.0,BK-17,45.0,832.0,BK1702,40.640102,-73.942615,40.640316,-73.942327,2021-09-03,New Construction,No,Non Prevailing Wage,,,,,14.0,,,6.0,8.0,,,,,,14.0,,14.0,44,2021.0
72276,3216 FARRAGUT ROAD,5/18/2021,5/6/2022,291195.0,3216,FARRAGUT ROAD,Brooklyn,11210.0,3050070043.0,3114044.0,BK-17,45.0,78602.0,BK1702,40.636396,-73.945847,40.636179,-73.945544,2022-05-06,New Construction,No,Non Prevailing Wage,,,,,3.0,,,,2.0,1.0,,,,,3.0,,3.0,10,2022.0
71107,36-23 172ND STREET APARTMENTS,5/17/2021,2/28/2022,999045.0,36-23,172 STREET,Queens,11358.0,4053037501.0,4619908.0,QN-07,19.0,1175.0,QN0704,40.762772,-73.794213,40.762346,-73.793991,2022-02-28,New Construction,No,Non Prevailing Wage,,,,,6.0,,,3.0,3.0,,,,,,6.0,,6.0,18,2022.0
68831,BANANA KELLY. BK CLUSTER. JOE NYC,5/13/2021,,115286.0,976,TINTON AVENUE,Bronx,10456.0,2026690009.0,2004826.0,BX-03,17.0,133.0,BX0301,40.823716,-73.902712,40.823477,-73.902423,2024-10-09,Preservation,No,Non Prevailing Wage,18.0,,16.0,,,1.0,,,15.0,16.0,4.0,,,,35.0,,35.0,35,2024.0
71104,1 BOERUM PLACE APARTMENTS,5/13/2021,10/18/2022,298297.0,346,FULTON STREET,Brooklyn,11201.0,3001530003.0,3000417.0,BK-02,33.0,37.0,BK0202,40.69197,-73.988659,40.691572,-73.988775,2022-10-18,New Construction,No,Non Prevailing Wage,,,,,42.0,,10.0,11.0,21.0,,,,,,42.0,,42.0,138,2022.0
69116,539 VANDERBILT AVENUE,5/12/2021,1/12/2023,995212.0,545,VANDERBILT AVENUE,Brooklyn,11238.0,3020100001.0,3057522.0,BK-02,35.0,199.0,BK0204,40.682132,-73.967605,40.682104,-73.967356,2023-01-12,New Construction,No,Non Prevailing Wage,,,54.0,,,,17.0,16.0,18.0,3.0,,,,,54.0,,54.0,264,2023.0
67125,IMPACCT. 811-817 LEXINGTON AVENUE,5/11/2021,3/19/2024,985619.0,811,LEXINGTON AVENUE,Brooklyn,11221.0,3016227502.0,3044163.0,BK-03,36.0,387.0,BK0302,40.690269,-73.928498,40.690483,-73.928401,2024-03-19,New Construction,No,Prevailing Wage,63.0,,,,,1.0,63.0,,1.0,,,,,,64.0,,64.0,64,2024.0
69473,MANHATTAN AVE HDFC,5/10/2021,5/10/2021,25196.0,152,MANHATTAN AVENUE,Manhattan,10025.0,1018430020.0,1055687.0,MN-07,7.0,193.0,MN0703,40.799419,-73.960905,40.799476,-73.960526,2021-05-10,Preservation,Yes,Non Prevailing Wage,18.0,,5.0,,,1.0,1.0,17.0,6.0,,,,,,24.0,,24.0,24,2021.0
69473,MANHATTAN AVE HDFC,5/10/2021,5/10/2021,805081.0,156,MANHATTAN AVENUE,Manhattan,10025.0,1018430020.0,1085312.0,MN-07,7.0,193.0,MN0703,40.799476,-73.960866,40.799476,-73.960526,2021-05-10,Preservation,Yes,Non Prevailing Wage,18.0,1.0,,,,,2.0,7.0,5.0,5.0,,,,,19.0,,19.0,19,2021.0
69473,MANHATTAN AVE HDFC,5/10/2021,5/10/2021,805082.0,160,MANHATTAN AVENUE,Manhattan,10025.0,1018430020.0,1085313.0,MN-07,7.0,193.0,MN0703,40.799536,-73.960822,40.799476,-73.960526,2021-05-10,Preservation,Yes,Non Prevailing Wage,15.0,2.0,2.0,,,,2.0,7.0,5.0,5.0,,,,,19.0,,19.0,19,2021.0
69473,MANHATTAN AVE HDFC,5/10/2021,5/10/2021,805083.0,164,MANHATTAN AVENUE,Manhattan,10025.0,1018430020.0,1085314.0,MN-07,7.0,193.0,MN0703,40.799594,-73.960779,40.799476,-73.960526,2021-05-10,Preservation,Yes,Non Prevailing Wage,14.0,2.0,3.0,,,,2.0,7.0,5.0,5.0,,,,,19.0,,19.0,19,2021.0
69491,200 MONTAGUE STREET,5/10/2021,5/2/2024,994100.0,200,MONTAGUE STREET,Brooklyn,11201.0,3002500039.0,3002107.0,BK-02,33.0,9.0,BK0201,40.693903,-73.991129,40.693716,-73.991252,2024-05-02,New Construction,No,Non Prevailing Wage,,,1.0,,37.0,,8.0,18.0,8.0,4.0,,,,,38.0,,38.0,121,2024.0
71091,334 EVERGREEN AVENUE APARTMENT,5/7/2021,4/1/2022,998965.0,334,EVERGREEN AVENUE,Brooklyn,11221.0,3032640030.0,3074364.0,BK-04,34.0,395.0,BK0402,40.694952,-73.925183,40.694796,-73.925356,2022-04-01,New Construction,No,Non Prevailing Wage,,,,,3.0,,,1.0,2.0,,,,,,3.0,,3.0,8,2022.0
71100,383 12TH STREET APARTMENTS,5/7/2021,10/11/2022,138028.0,383,12 STREET,Brooklyn,11215.0,3010240063.0,3023038.0,BK-06,39.0,151.0,BK0602,40.665573,-73.984057,40.665744,-73.983913,2022-10-11,New Construction,No,Non Prevailing Wage,,,,,3.0,,,3.0,,,,,,,3.0,,3.0,8,2022.0
71101,2337 BEDFORD AVENUE,5/7/2021,9/16/2022,205926.0,2337,BEDFORD AVENUE,Brooklyn,11226.0,3051270066.0,3117745.0,BK-17,40.0,794.0,BK1701,40.646816,-73.955654,40.646822,-73.955413,2022-09-16,New Construction,No,Non Prevailing Wage,,,,,9.0,,,6.0,3.0,,,,,,9.0,,9.0,27,2022.0
74165,1522 -1524 NEW YORK AVENUE,5/7/2021,11/22/2022,1000818.0,1522,NEW YORK AVENUE,Brooklyn,11210.0,3050070054.0,3428963.0,BK-17,45.0,78602.0,BK1702,40.635564,-73.94504,40.635632,-73.945357,2022-11-07,New Construction,No,Non Prevailing Wage,,,,,3.0,,1.0,2.0,,,,,,,3.0,,3.0,9,2022.0
74165,1522 -1524 NEW YORK AVENUE,5/7/2021,11/22/2022,1001468.0,1524,NEW YORK AVENUE,Brooklyn,11210.0,3050070055.0,3428622.0,BK-17,45.0,78602.0,BK1702,40.635528,-73.945033,40.63558,-73.945354,2022-11-22,New Construction,No,Non Prevailing Wage,,,,,3.0,,1.0,2.0,,,,,,,3.0,,3.0,9,2022.0
65433,2274 ADAM CLAYTON POWELL JR. BLVD. CLUSTER,5/5/2021,3/29/2024,3518.0,2274,ADAM C POWELL BOULEVARD,Manhattan,10030.0,1019390034.0,1058815.0,MN-10,9.0,226.0,MN1002,40.814447,-73.94434,40.814587,-73.944687,2024-03-19,Preservation,No,Non Prevailing Wage,,,,7.0,,,,6.0,,,1.0,,,,,7.0,7.0,7,2024.0
65433,2274 ADAM CLAYTON POWELL JR. BLVD. CLUSTER,5/5/2021,3/29/2024,40472.0,24,WEST 132 STREET,Manhattan,10037.0,1017290045.0,1053857.0,MN-10,9.0,208.0,MN1002,40.811258,-73.940004,40.811003,-73.940037,2024-03-19,Preservation,No,Non Prevailing Wage,,,,10.0,,,,,10.0,,,,,,,10.0,10.0,10,2024.0
65433,2274 ADAM CLAYTON POWELL JR. BLVD. CLUSTER,5/5/2021,3/29/2024,40587.0,202,WEST 133 STREET,Manhattan,10030.0,1019380038.0,1058786.0,MN-10,9.0,226.0,MN1002,40.814198,-73.945117,40.814077,-73.945395,2024-03-29,Preservation,No,Non Prevailing Wage,,,,19.0,,,,11.0,7.0,,1.0,,,,,19.0,19.0,19,2024.0
71089,545 ST. MARKS AVENUE APARTMENTS,5/3/2021,6/10/2022,1000664.0,545,ST MARKS AVENUE,Brooklyn,11216.0,3012170083.0,3030630.0,BK-08,35.0,221.0,BK0802,40.675831,-73.955549,40.676109,-73.955545,2022-06-10,New Construction,No,Non Prevailing Wage,,,,,3.0,,,3.0,,,,,,,3.0,,3.0,8,2022.0
68196,JOE INTERVALE.YR15.FY21,4/30/2021,10/5/2022,82951.0,1035,HALL PLACE,Bronx,10459.0,2026910109.0,2005270.0,BX-02,17.0,131.0,BX0202,40.824442,-73.897895,40.824503,-73.898151,2022-10-05,Preservation,No,Non Prevailing Wage,7.0,13.0,1.0,,,1.0,,10.0,11.0,1.0,,,,,22.0,,22.0,22,2022.0
68196,JOE INTERVALE.YR15.FY21,4/30/2021,10/5/2022,88153.0,1036,INTERVALE AVENUE,Bronx,10459.0,2027050007.0,2005480.0,BX-02,17.0,131.0,BX0202,40.824477,-73.896843,40.8244,-73.896504,2022-10-05,Preservation,No,Non Prevailing Wage,6.0,12.0,2.0,,,1.0,,12.0,9.0,,,,,,21.0,,21.0,21,2022.0
68196,JOE INTERVALE.YR15.FY21,4/30/2021,10/5/2022,88154.0,1039,INTERVALE AVENUE,Bronx,10459.0,2027000062.0,2005411.0,BX-02,17.0,131.0,BX0202,40.824515,-73.896861,40.824466,-73.897186,2022-10-05,Preservation,No,Non Prevailing Wage,8.0,9.0,3.0,,,,,5.0,15.0,,,,,,20.0,,20.0,20,2022.0
68196,JOE INTERVALE.YR15.FY21,4/30/2021,10/5/2022,88184.0,1158,INTERVALE AVENUE,Bronx,10459.0,2027060050.0,2005501.0,BX-02,17.0,131.0,BX0202,40.827643,-73.895754,40.82753,-73.895422,2022-10-05,Preservation,No,Non Prevailing Wage,4.0,12.0,2.0,,,,1.0,4.0,9.0,4.0,,,,,18.0,,18.0,18,2022.0
68196,JOE INTERVALE.YR15.FY21,4/30/2021,10/5/2022,109978.0,1118,SOUTHERN BOULEVARD,Bronx,10459.0,2027440021.0,2006030.0,BX-02,17.0,12701.0,BX0202,40.826525,-73.891904,40.826558,-73.891691,2022-10-05,Preservation,No,Non Prevailing Wage,4.0,2.0,,,,,,,3.0,3.0,,,,,6.0,,6.0,6,2022.0
68196,JOE INTERVALE.YR15.FY21,4/30/2021,10/5/2022,114967.0,1141,TIFFANY STREET,Bronx,10459.0,2027060060.0,2005503.0,BX-02,17.0,131.0,BX0202,40.82683,-73.894964,40.827206,-73.895376,2022-10-05,Preservation,No,Non Prevailing Wage,4.0,20.0,1.0,,,,7.0,13.0,5.0,,,,,,25.0,,25.0,25,2022.0
66903,INWOOD LIBRARY,4/29/2021,,983225.0,4790,BROADWAY,Manhattan,10034.0,1022337501.0,1091724.0,MN-12,10.0,291.0,MN1203,40.865947,-73.926075,40.865711,-73.925703,2024-05-23,New Construction,No,Non Prevailing Wage,44.0,35.0,94.0,,,1.0,44.0,76.0,46.0,8.0,,,,,174.0,,174.0,174,2024.0
67991,TQN1003 ROCKAWAY III A,4/29/2021,11/7/2022,680710.0,14-15,MOTT AVENUE,Queens,11691.0,4155740048.0,4298509.0,QN-14,31.0,101003.0,QN1401,40.601295,-73.747943,40.601189,-73.748357,2022-11-07,Preservation,No,Non Prevailing Wage,1.0,31.0,3.0,6.0,,1.0,1.0,24.0,11.0,5.0,1.0,,,,42.0,,42.0,42,2022.0
69042,DUNN. 401 CHESTER STREET. MARCUS GARVEY SENIORS,4/29/2021,8/17/2023,992290.0,401,CHESTER STREET,Brooklyn,11212.0,3035890021.0,3000000.0,BK-16,41.0,916.0,BK1602,40.66174,-73.909671,40.662067,-73.909472,2023-08-17,New Construction,No,Prevailing Wage,156.0,,,,,1.0,100.0,56.0,1.0,,,,,,157.0,,157.0,157,2023.0
69561,212 EAST 125TH STREET,4/29/2021,6/18/2024,998544.0,212,EAST 125 STREET,Manhattan,10035.0,1017890045.0,1091703.0,MN-11,8.0,242.0,MN1102,40.803469,-73.935294,40.803038,-73.935373,2024-06-18,New Construction,No,Non Prevailing Wage,,,28.0,,6.0,,8.0,9.0,17.0,,,,,,34.0,,34.0,113,2024.0
71088,650 WEST 42ND STREET APARTMENTS,4/29/2021,6/8/2023,873392.0,1,RIVER PLACE,Manhattan,10036.0,1010890001.0,1085803.0,MN-04,3.0,117.0,MN0401,40.761614,-74.00022,40.761271,-74.000466,2023-06-08,Preservation,No,Non Prevailing Wage,,,,,47.0,,13.0,28.0,6.0,,,,,,47.0,,47.0,921,2023.0
71087,200 CLIFTON PLACE APARTMENTS,4/28/2021,10/8/2021,997560.0,200,CLIFTON PLACE,Brooklyn,11216.0,3019540009.0,3425979.0,BK-03,36.0,233.0,BK0301,40.688551,-73.956312,40.688315,-73.956463,2021-10-08,New Construction,No,Non Prevailing Wage,,,,,3.0,,,,3.0,,,,,,3.0,,3.0,8,2021.0
71086,30-82 CRESCENT STREET APARTMENTS,4/27/2021,9/2/2022,992174.0,30-82,CRESCENT STREET,Queens,11102.0,4005700049.0,4006713.0,QN-01,22.0,73.0,QN0103,40.766443,-73.926117,40.766542,-73.926506,2022-09-02,New Construction,No,Non Prevailing Wage,,,,,7.0,,1.0,5.0,1.0,,,,,,7.0,,7.0,21,2022.0
71084,249 NORTH 5 STREET AKA 70 HAVEMEYER STREET,4/26/2021,2/13/2023,309172.0,70,HAVEMEYER STREET,Brooklyn,11211.0,3023380027.0,3062268.0,BK-01,34.0,519.0,BK0102,40.714414,-73.954978,40.714664,-73.955212,2023-02-13,New Construction,No,Non Prevailing Wage,,,,,15.0,,3.0,4.0,8.0,,,,,,15.0,,15.0,48,2023.0
71085,1528 BERGEN STREET APARTMENTS,4/26/2021,1/28/2022,982491.0,1528,BERGEN STREET,Brooklyn,11213.0,3013540016.0,3035839.0,BK-08,36.0,309.0,BK0802,40.675139,-73.93253,40.674893,-73.932707,2022-01-28,New Construction,No,Non Prevailing Wage,,,,,3.0,,,2.0,1.0,,,,,,3.0,,3.0,8,2022.0
66740,60 NORFOLK,4/23/2021,12/20/2022,993982.0,64,NORFOLK STREET,Manhattan,10002.0,1003467504.0,1091637.0,MN-03,1.0,1402.0,MN0302,40.717296,-73.987922,40.717066,-73.987814,2022-12-20,New Construction,No,Non Prevailing Wage,18.0,48.0,48.0,,,1.0,80.0,35.0,,,,,,,115.0,,115.0,117,2022.0
71083,38-35 CRESCENT STREET APARTMENT,4/23/2021,7/9/2021,411779.0,38-35,CRESCENT STREET,Queens,11101.0,4003870002.0,4004694.0,QN-01,26.0,31.0,QN0105,40.755379,-73.936174,40.754764,-73.93642,2021-07-09,New Construction,No,Non Prevailing Wage,,,,,6.0,,,3.0,3.0,,,,,,6.0,,6.0,17,2021.0
71079,45-07 48TH AVENUE APARTMENTS,4/16/2021,3/10/2023,988857.0,45-07,48 AVENUE,Queens,11377.0,4001707501.0,4623240.0,QN-02,26.0,18502.0,QN0202,40.739406,-73.920214,40.739611,-73.919929,2023-03-10,New Construction,No,Non Prevailing Wage,,,,,4.0,,,2.0,2.0,,,,,,4.0,,4.0,12,2023.0
71081,2494 AMSTERDAM AVENUE APARTMENT,4/16/2021,5/22/2024,953604.0,2494,AMSTERDAM AVENUE,Manhattan,10033.0,1021550089.0,1090762.0,MN-12,10.0,269.0,MN1202,40.849712,-73.929773,40.849753,-73.930105,2024-05-22,New Construction,No,Non Prevailing Wage,,,3.0,,,,1.0,2.0,,,,,,,3.0,,3.0,15,2024.0
71082,1545 BERGEN STREET APARTMENTS,4/16/2021,6/17/2022,982149.0,1545,BERGEN STREET,Brooklyn,11213.0,3013480076.0,3425550.0,BK-08,36.0,309.0,BK0802,40.675142,-73.932296,40.675386,-73.932386,2022-06-17,New Construction,No,Non Prevailing Wage,,,,,3.0,,,2.0,1.0,,,,,,3.0,,3.0,8,2022.0
71078,2724 HEATH AVENUE APARTMENTS,4/15/2021,8/6/2021,998706.0,2724,HEATH AVENUE,Bronx,10463.0,2032400028.0,2120058.0,BX-07,14.0,269.0,BX0701,40.871655,-73.905321,40.87203,-73.904862,2021-08-06,New Construction,No,Non Prevailing Wage,,,,28.0,,,8.0,17.0,3.0,,,,,,28.0,,28.0,64,2021.0
71077,577 3RD AVENUE APARTMENTS,4/9/2021,10/8/2021,998702.0,577,3 AVENUE,Brooklyn,11215.0,3010460007.0,3023839.0,BK-07,38.0,117.0,BK0601,40.667616,-73.994218,40.667378,-73.993991,2021-10-08,New Construction,No,Non Prevailing Wage,,,,,6.0,,2.0,2.0,2.0,,,,,,6.0,,6.0,20,2021.0
71076,25-18 32  STREET ASTORIA APARTMENTS,4/1/2021,11/4/2022,419220.0,25-31,31 STREET,Queens,11102.0,4006200028.0,4008677.0,QN-01,22.0,6501.0,QN0103,40.769649,-73.918543,40.769484,-73.918247,2022-11-04,New Construction,No,Non Prevailing Wage,,,,,3.0,,1.0,1.0,1.0,,,,,,3.0,,3.0,7,2022.0
69441,WFHA BROOKLYN LP.YR15.FY21,3/31/2021,7/27/2023,209164.0,992,BERGEN STREET,Brooklyn,11216.0,3012170034.0,3030589.0,BK-08,35.0,221.0,BK0802,40.676446,-73.954045,40.676177,-73.954088,2023-07-27,Preservation,No,Non Prevailing Wage,,4.0,,,,,,1.0,3.0,,,,,,4.0,,4.0,4,2023.0
69441,WFHA BROOKLYN LP.YR15.FY21,3/31/2021,7/27/2023,295918.0,658,FRANKLIN AVENUE,Brooklyn,11238.0,3011560051.0,3028671.0,BK-08,35.0,305.0,BK0802,40.675755,-73.95614,40.67576,-73.95632,2023-07-27,Preservation,No,Non Prevailing Wage,2.0,6.0,1.0,,,,,3.0,6.0,,,,,,9.0,,9.0,9,2023.0
69441,WFHA BROOKLYN LP.YR15.FY21,3/31/2021,7/27/2023,295950.0,693,FRANKLIN AVENUE,Brooklyn,11238.0,3012310012.0,3031110.0,BK-08,35.0,221.0,BK0802,40.674802,-73.956465,40.674767,-73.956231,2023-07-27,Preservation,No,Non Prevailing Wage,1.0,5.0,2.0,,,,1.0,,6.0,1.0,,,,,8.0,,8.0,8,2023.0
69441,WFHA BROOKLYN LP.YR15.FY21,3/31/2021,7/27/2023,295952.0,695,FRANKLIN AVENUE,Brooklyn,11238.0,3012310010.0,3031109.0,BK-08,35.0,221.0,BK0802,40.674748,-73.956483,40.67469,-73.956234,2023-07-27,Preservation,No,Non Prevailing Wage,3.0,4.0,1.0,,,,1.0,,6.0,1.0,,,,,8.0,,8.0,8,2023.0
69441,WFHA BROOKLYN LP.YR15.FY21,3/31/2021,7/27/2023,295953.0,697,FRANKLIN AVENUE,Brooklyn,11238.0,3012310008.0,3031108.0,BK-08,35.0,221.0,BK0802,40.674693,-73.956505,40.674616,-73.956242,2023-07-27,Preservation,No,Non Prevailing Wage,,7.0,1.0,,,,1.0,,6.0,1.0,,,,,8.0,,8.0,8,2023.0
69441,WFHA BROOKLYN LP.YR15.FY21,3/31/2021,7/27/2023,296014.0,786,FRANKLIN AVENUE,Brooklyn,11238.0,3011780052.0,3029602.0,BK-08,35.0,217.0,BK0802,40.67172,-73.957603,40.671789,-73.957876,2023-07-27,Preservation,No,Non Prevailing Wage,2.0,6.0,,,,,,,5.0,3.0,,,,,8.0,,8.0,8,2023.0
69441,WFHA BROOKLYN LP.YR15.FY21,3/31/2021,7/27/2023,307342.0,721,HANCOCK STREET,Brooklyn,11233.0,3016580092.0,3045992.0,BK-03,41.0,383.0,BK0302,40.685324,-73.925839,40.685508,-73.926181,2023-07-27,Preservation,No,Non Prevailing Wage,,8.0,,,,,,,,8.0,,,,,8.0,,8.0,8,2023.0
69441,WFHA BROOKLYN LP.YR15.FY21,3/31/2021,7/27/2023,307343.0,723,HANCOCK STREET,Brooklyn,11233.0,3016580091.0,3045991.0,BK-03,41.0,383.0,BK0302,40.685329,-73.925792,40.685522,-73.926069,2023-07-27,Preservation,No,Non Prevailing Wage,2.0,4.0,2.0,,,,,,,8.0,,,,,8.0,,8.0,8,2023.0
69441,WFHA BROOKLYN LP.YR15.FY21,3/31/2021,7/27/2023,317444.0,680,JEFFERSON AVENUE,Brooklyn,11221.0,3016560030.0,3045821.0,BK-03,36.0,295.0,BK0302,40.685516,-73.930562,40.685297,-73.930483,2023-07-27,Preservation,No,Non Prevailing Wage,1.0,26.0,8.0,,,1.0,8.0,17.0,,8.0,3.0,,,,36.0,,36.0,36,2023.0
69441,WFHA BROOKLYN LP.YR15.FY21,3/31/2021,7/27/2023,317447.0,684,JEFFERSON AVENUE,Brooklyn,11221.0,3016560035.0,3045823.0,BK-03,36.0,295.0,BK0302,40.685533,-73.930429,40.685332,-73.930169,2023-07-27,Preservation,No,Non Prevailing Wage,,11.0,1.0,,,,12.0,,,,,,,,12.0,,12.0,12,2023.0
69441,WFHA BROOKLYN LP.YR15.FY21,3/31/2021,7/27/2023,317515.0,768,JEFFERSON AVENUE,Brooklyn,11221.0,3016580010.0,3045922.0,BK-03,41.0,383.0,BK0302,40.686032,-73.926076,40.685777,-73.92635,2023-07-27,Preservation,No,Non Prevailing Wage,,6.0,2.0,,,,,,,8.0,,,,,8.0,,8.0,8,2023.0
69441,WFHA BROOKLYN LP.YR15.FY21,3/31/2021,7/27/2023,331146.0,660,MADISON STREET,Brooklyn,11221.0,3016460017.0,3045202.0,BK-03,36.0,293.0,BK0302,40.686884,-73.931693,40.686648,-73.931783,2023-07-27,Preservation,No,Non Prevailing Wage,,8.0,,,,,,,2.0,6.0,,,,,8.0,,8.0,8,2023.0
69441,WFHA BROOKLYN LP.YR15.FY21,3/31/2021,7/27/2023,331152.0,668,MADISON STREET,Brooklyn,11221.0,3016460020.0,3045205.0,BK-03,36.0,293.0,BK0302,40.686914,-73.931444,40.686686,-73.931451,2023-07-27,Preservation,No,Non Prevailing Wage,1.0,5.0,2.0,,,,,,2.0,6.0,,,,,8.0,,8.0,8,2023.0
69441,WFHA BROOKLYN LP.YR15.FY21,3/31/2021,7/27/2023,337955.0,433,MILLER AVENUE,Brooklyn,11207.0,3040250001.0,3089388.0,BK-05,42.0,1160.0,BK0502,40.67029,-73.890604,40.670251,-73.890323,2023-07-27,Preservation,No,Non Prevailing Wage,2.0,6.0,4.0,,,,,5.0,3.0,4.0,,,,,12.0,,12.0,12,2023.0
69441,WFHA BROOKLYN LP.YR15.FY21,3/31/2021,7/27/2023,337958.0,437,MILLER AVENUE,Brooklyn,11207.0,3040410024.0,3089671.0,BK-05,42.0,1160.0,BK0502,40.669832,-73.890489,40.669955,-73.890255,2023-07-27,Preservation,No,Non Prevailing Wage,2.0,5.0,5.0,,,1.0,1.0,2.0,7.0,3.0,,,,,13.0,,13.0,13,2023.0
69441,WFHA BROOKLYN LP.YR15.FY21,3/31/2021,7/27/2023,357206.0,572,PROSPECT PLACE,Brooklyn,11238.0,3011630035.0,3029003.0,BK-08,35.0,305.0,BK0802,40.675368,-73.957946,40.675055,-73.957781,2023-07-27,Preservation,No,Non Prevailing Wage,2.0,13.0,4.0,,,1.0,,10.0,10.0,,,,,,20.0,,20.0,20,2023.0
69441,WFHA BROOKLYN LP.YR15.FY21,3/31/2021,7/27/2023,358498.0,828,PUTNAM AVENUE,Brooklyn,11221.0,3016520019.0,3045546.0,BK-03,36.0,385.0,BK0302,40.686498,-73.928531,40.68627,-73.92856,2023-07-27,Preservation,No,Non Prevailing Wage,1.0,2.0,1.0,,,,,3.0,1.0,,,,,,4.0,,4.0,4,2023.0
69441,WFHA BROOKLYN LP.YR15.FY21,3/31/2021,7/27/2023,360415.0,186,MALCOLM X BOULEVARD,Brooklyn,11221.0,3016460039.0,3045217.0,BK-03,36.0,293.0,BK0302,40.686938,-73.929868,40.686869,-73.93015,2023-07-27,Preservation,No,Non Prevailing Wage,1.0,8.0,,,,,2.0,,7.0,,,,,,9.0,,9.0,9,2023.0
69441,WFHA BROOKLYN LP.YR15.FY21,3/31/2021,7/27/2023,360424.0,201,MALCOLM X BOULEVARD,Brooklyn,11221.0,3016520006.0,3045533.0,BK-03,36.0,385.0,BK0302,40.686144,-73.929692,40.686136,-73.929433,2023-07-27,Preservation,No,Non Prevailing Wage,,6.0,,,,,,6.0,,,,,,,6.0,,6.0,6,2023.0
69441,WFHA BROOKLYN LP.YR15.FY21,3/31/2021,7/27/2023,360426.0,205,MALCOLM X BOULEVARD,Brooklyn,11221.0,3016520005.0,3045532.0,BK-03,36.0,385.0,BK0302,40.686032,-73.929667,40.686065,-73.929418,2023-07-27,Preservation,No,Non Prevailing Wage,,6.0,,,,,,6.0,,,,,,,6.0,,6.0,6,2023.0
69441,WFHA BROOKLYN LP.YR15.FY21,3/31/2021,7/27/2023,360427.0,206,MALCOLM X BOULEVARD,Brooklyn,11221.0,3016510041.0,3045499.0,BK-03,36.0,295.0,BK0302,40.686257,-73.929736,40.686208,-73.930017,2023-07-27,Preservation,No,Non Prevailing Wage,1.0,4.0,,,,,,,1.0,4.0,,,,,5.0,,5.0,5,2023.0
69441,WFHA BROOKLYN LP.YR15.FY21,3/31/2021,7/27/2023,373725.0,1405,ST JOHNS PLACE,Brooklyn,11213.0,3013780063.0,3036830.0,BK-08,35.0,35101.0,BK0802,40.670646,-73.931937,40.670929,-73.93181,2023-07-27,Preservation,No,Non Prevailing Wage,,19.0,,,,1.0,,9.0,8.0,3.0,,,,,20.0,,20.0,20,2023.0
69441,WFHA BROOKLYN LP.YR15.FY21,3/31/2021,7/27/2023,374066.0,611,ST JOHNS PLACE,Brooklyn,11238.0,3011750068.0,3029499.0,BK-08,35.0,217.0,BK0802,40.672544,-73.957916,40.672813,-73.957887,2023-07-27,Preservation,No,Non Prevailing Wage,,7.0,1.0,,,,2.0,6.0,,,,,,,8.0,,8.0,8,2023.0
69441,WFHA BROOKLYN LP.YR15.FY21,3/31/2021,7/27/2023,376783.0,582,STERLING PLACE,Brooklyn,11238.0,3011750026.0,3324401.0,BK-08,35.0,217.0,BK0802,40.673749,-73.95927,40.673475,-73.95922,2023-07-27,Preservation,No,Non Prevailing Wage,1.0,3.0,,,,,,1.0,2.0,1.0,,,,,4.0,,4.0,4,2023.0
70871,101 BRUCKNER BLVD,3/22/2021,3/18/2022,998360.0,101,BRUCKNER BOULEVARD,Bronx,10454.0,2022780070.0,2129129.0,BX-01,8.0,1902.0,BX0101,40.805265,-73.923722,40.805512,-73.923606,2022-03-18,New Construction,No,Non Prevailing Wage,,,,,17.0,,1.0,16.0,,,,,,,17.0,,17.0,55,2022.0
70870,560 19TH STREET,3/19/2021,12/30/2021,144438.0,590,19 STREET,Brooklyn,11218.0,3008900033.0,3017325.0,BK-07,39.0,1502.0,BK0701,40.654816,-73.979583,40.654541,-73.97958,2021-12-30,New Construction,No,Non Prevailing Wage,,,,,3.0,,,1.0,2.0,,,,,,3.0,,3.0,9,2021.0
70869,948 & 954 HERKIMER STREET APARTMENTS,3/18/2021,5/20/2022,982272.0,954,HERKIMER STREET,Brooklyn,11233.0,3017140017.0,3048270.0,BK-03,41.0,299.0,BK0302,40.678125,-73.921986,40.677911,-73.92209,2022-05-20,New Construction,No,Non Prevailing Wage,,,,,2.0,,,2.0,,,,,,,2.0,,2.0,6,2022.0
70869,948 & 954 HERKIMER STREET APARTMENTS,3/18/2021,5/20/2022,998359.0,948,HERKIMER STREET,Brooklyn,11233.0,3017140016.0,3424924.0,BK-03,41.0,299.0,BK0302,40.678133,-73.922173,40.677919,-73.92217,2022-05-20,New Construction,No,Non Prevailing Wage,,,,,2.0,,,2.0,,,,,,,2.0,,2.0,6,2022.0
72277,BROOKLYN CROSSING - SIXTH AVENUE APARTMENTS,3/18/2021,5/8/2023,1003182.0,18,6 AVENUE,Brooklyn,11217.0,3011187502.0,3426300.0,BK-06,35.0,12902.0,BK0602,40.68251,-73.973885,40.682718,-73.97417,2023-05-08,New Construction,No,Non Prevailing Wage,,,,,258.0,,79.0,134.0,45.0,,,,,,258.0,,258.0,858,2023.0
76707,662 PACIFIC STREET,3/18/2021,2/3/2023,1003420.0,662,PACIFIC STREET,Brooklyn,11217.0,3011287505.0,3428828.0,BK-08,35.0,161.0,BK0801,40.682164,-73.973492,40.681815,-73.973806,2023-02-03,New Construction,No,Non Prevailing Wage,,,,,94.0,,24.0,48.0,22.0,,,,,,94.0,,94.0,312,2023.0
68142,1104 BEDFORD AVENUE,3/17/2021,9/7/2023,991164.0,1104,BEDFORD AVENUE,Brooklyn,11216.0,3019710028.0,3425776.0,BK-03,36.0,229.0,BK0301,40.686942,-73.954636,40.686865,-73.954925,2023-09-07,New Construction,No,Non Prevailing Wage,,,6.0,,4.0,,3.0,6.0,1.0,,,,,,10.0,,10.0,32,2023.0
70868,2720 CLAFLIN AVENUE,3/16/2021,10/22/2021,56536.0,2720,CLAFLIN AVENUE,Bronx,10468.0,2032480082.0,2015267.0,BX-08,14.0,26701.0,BX0801,40.869694,-73.901007,40.869611,-73.900765,2021-10-22,New Construction,No,Non Prevailing Wage,,,,,5.0,,1.0,1.0,3.0,,,,,,5.0,,5.0,15,2021.0
70838,1 UNION SQUARE SOUTH APARTMENTS,3/12/2021,1/9/2024,875873.0,1,UNION SQUARE SOUTH,Manhattan,10003.0,1005650021.0,1087083.0,MN-03,2.0,61.0,MN0202,40.733979,-73.989897,40.734149,-73.990351,2024-01-09,Preservation,No,Non Prevailing Wage,,,,,12.0,,3.0,8.0,1.0,,,,,,12.0,,12.0,240,2024.0
70867,2625 GRAND AVENUE APARTMENTS,3/11/2021,3/25/2022,999340.0,2625,GRAND AVENUE,Bronx,10468.0,2032150042.0,2014682.0,BX-07,14.0,265.0,BX0701,40.867209,-73.899944,40.867412,-73.900103,2022-03-25,New Construction,No,Non Prevailing Wage,,,,,6.0,,1.0,2.0,3.0,,,,,,6.0,,6.0,17,2022.0
74166,4623 5TH AVENUE,3/11/2021,8/25/2023,130542.0,4623,5 AVENUE,Brooklyn,11220.0,3007570001.0,3011888.0,BK-07,38.0,96.0,BK0703,40.64717,-74.008159,40.646718,-74.008227,2023-08-25,New Construction,No,Non Prevailing Wage,,,,,2.0,,,,2.0,,,,,,2.0,,2.0,6,2023.0
70864,582 EAST 138 STREET APARTMENTS,3/2/2021,8/25/2022,62839.0,582,EAST 138 STREET,Bronx,10454.0,2025507501.0,2129612.0,BX-01,8.0,2701.0,BX0101,40.806551,-73.916872,40.806304,-73.91697,2022-08-25,New Construction,No,Non Prevailing Wage,,,,,2.0,,,1.0,1.0,,,,,,2.0,,2.0,6,2022.0
70865,86-15 ROCKAWAY BOULEVARD APARTMENTS,3/2/2021,6/24/2022,692150.0,86-15,ROCKAWAY BOULEVARD,Queens,11416.0,4090580018.0,4188326.0,QN-09,32.0,42.0,QN0904,40.683024,-73.853871,40.683155,-73.853492,2022-06-24,New Construction,No,Non Prevailing Wage,,,,,6.0,,1.0,,5.0,,,,,,6.0,,6.0,20,2022.0
69878,"WHGA MANNIE L. WILSON TOWERS, LP.YR15.FY21",2/25/2021,2/24/2023,25346.0,565,MANHATTAN AVENUE,Manhattan,10027.0,1019500014.0,1059273.0,MN-09,9.0,20901.0,MN0901,40.809719,-73.953411,40.809838,-73.953678,2023-02-24,Preservation,Yes,Non Prevailing Wage,88.0,1.0,12.0,,,1.0,46.0,55.0,1.0,,,,,,102.0,,102.0,102,2023.0
70860,177 & 185 VERONICA PLACE,2/25/2021,9/16/2022,387292.0,177,VERONICA PLACE,Brooklyn,11226.0,3051370040.0,3117975.0,BK-17,40.0,79202.0,BK1701,40.645808,-73.952606,40.645871,-73.952347,2022-09-16,New Construction,No,Non Prevailing Wage,,,,,3.0,,,1.0,2.0,,,,,,3.0,,3.0,8,2022.0
70860,177 & 185 VERONICA PLACE,2/25/2021,9/16/2022,387297.0,185,VERONICA PLACE,Brooklyn,11226.0,3051370037.0,3117972.0,BK-17,40.0,79202.0,BK1701,40.645662,-73.952596,40.645668,-73.952336,2022-02-18,New Construction,No,Non Prevailing Wage,,,,,3.0,,,1.0,2.0,,,,,,3.0,,3.0,8,2022.0
67268,875 4 AVE,2/24/2021,3/25/2025,986508.0,875,4 AVENUE,Brooklyn,11232.0,3006810001.0,3010094.0,BK-07,38.0,101.0,BK0702,40.656237,-74.002408,40.65608,-74.002018,2025-03-25,New Construction,No,Non Prevailing Wage,,,27.0,,18.0,,6.0,29.0,10.0,,,,,,45.0,,45.0,150,2025.0
70840,5 POINTZ LIC,2/24/2021,10/4/2023,966785.0,22-44,JACKSON AVENUE,Queens,11101.0,4000867501.0,4596913.0,QN-02,26.0,1901.0,QN0201,40.74564,-73.94609,40.744745,-73.94551,2023-10-04,New Construction,No,Non Prevailing Wage,,,,,337.0,,78.0,180.0,77.0,2.0,,,,,337.0,,337.0,"1,122",2023.0
70857,2115 BURR AVENUE APARTMENTS,2/24/2021,10/29/2021,988545.0,2115,BURR AVENUE,Bronx,10461.0,2042520023.0,2047830.0,BX-10,13.0,300.0,BX1003,40.854968,-73.828171,40.855147,-73.828576,2021-10-29,New Construction,No,Non Prevailing Wage,,,,,7.0,,,3.0,4.0,,,,,,7.0,,7.0,22,2021.0
70859,26 LAWTON STREET,2/24/2021,11/19/2021,997781.0,26,LAWTON STREET,Brooklyn,11221.0,3032290010.0,3073414.0,BK-04,34.0,393.0,BK0401,40.6954,-73.930447,40.695307,-73.930263,2021-11-19,New Construction,No,Non Prevailing Wage,,,,,3.0,,,3.0,,,,,,,3.0,,3.0,7,2021.0
70855,3214 CRUGER AVENUE,2/22/2021,5/28/2021,995941.0,3214,CRUGER AVENUE,Bronx,10467.0,2045970013.0,2128433.0,BX-12,12.0,374.0,BX1201,40.871929,-73.866133,40.872,-73.865844,2021-05-28,New Construction,No,Non Prevailing Wage,,,,,3.0,,,3.0,,,,,,,3.0,,3.0,8,2021.0
70854,1533 EAST 19TH STREET,2/18/2021,7/1/2022,1003760.0,1533,EAST 19 STREET,Brooklyn,11230.0,3067660092.0,3426444.0,BK-14,48.0,546.0,BK1403,40.612556,-73.955115,40.612814,-73.95482,2022-07-01,New Construction,No,Non Prevailing Wage,,,,,17.0,,1.0,14.0,2.0,,,,,,17.0,,17.0,56,2022.0
70850,2266 PACIFIC STREET,2/12/2021,11/12/2021,980695.0,2266,PACIFIC STREET,Brooklyn,11233.0,3014420036.0,3428881.0,BK-16,37.0,36501.0,BK1601,40.675445,-73.909436,40.675197,-73.908971,2021-11-12,New Construction,No,Non Prevailing Wage,,,,,3.0,,1.0,1.0,1.0,,,,,,3.0,,3.0,9,2021.0
70852,2010 WALTON AVENUE,2/12/2021,4/20/2022,119104.0,2010,WALTON AVENUE,Bronx,10453.0,2028290034.0,2007943.0,BX-05,14.0,241.0,BX0502,40.852537,-73.907293,40.85238,-73.907091,2022-04-20,New Construction,No,Non Prevailing Wage,,,,,13.0,,4.0,7.0,2.0,,,,,,13.0,,13.0,43,2022.0
70847,1825 EASTERN PARKWAY,2/11/2021,10/29/2021,997788.0,1825,EASTERN PARKWAY,Brooklyn,11233.0,3014420037.0,3426987.0,BK-16,37.0,36501.0,BK1601,40.674997,-73.908719,40.675184,-73.908888,2021-10-29,New Construction,No,Non Prevailing Wage,,,,,3.0,,1.0,1.0,1.0,,,,,,3.0,,3.0,9,2021.0
70862,522 GRAND STREET APARTMENTS,2/9/2021,10/3/2022,302707.0,522,GRAND STREET,Brooklyn,11211.0,3027857502.0,3338204.0,BK-01,34.0,513.0,BK0102,40.711023,-73.950338,40.71074,-73.950436,2022-10-03,New Construction,No,Non Prevailing Wage,,,,,3.0,,,3.0,,,,,,,3.0,,3.0,10,2022.0
70863,345 EAST 94TH STREET APARTMENTS,2/9/2021,6/7/2023,867489.0,345,EAST 94 STREET,Manhattan,10128.0,1015570025.0,1087329.0,MN-08,5.0,15601.0,MN0803,40.782486,-73.946934,40.782266,-73.945847,2023-06-07,Preservation,No,Non Prevailing Wage,,,,11.0,,,5.0,6.0,,,,,,,11.0,,11.0,208,2023.0
70861,352 RUTLAND ROAD APARTMENTS,2/8/2021,4/9/2021,997201.0,352,RUTLAND ROAD,Brooklyn,11225.0,3048090024.0,3428537.0,BK-09,40.0,804.0,BK0902,40.659486,-73.949068,40.659272,-73.949068,2021-04-09,New Construction,No,Non Prevailing Wage,,,,,2.0,,,2.0,,,,,,,2.0,,2.0,6,2021.0
70858,THE ASTOR LIC,2/5/2021,11/22/2022,697573.0,36-20,STEINWAY STREET,Queens,11101.0,4006657501.0,4619734.0,QN-01,26.0,157.0,QN0104,40.753253,-73.923688,40.75291,-73.924399,2022-11-22,New Construction,No,Non Prevailing Wage,,,,,43.0,,13.0,21.0,9.0,,,,,,43.0,,43.0,143,2022.0
70853,770 & 774 LEXINGTON AVENUE APARTMENTS,2/4/2021,10/18/2022,325333.0,770,LEXINGTON AVENUE,Brooklyn,11221.0,3016270035.0,3044372.0,BK-03,36.0,387.0,BK0302,40.690236,-73.928624,40.690033,-73.928441,2022-10-18,New Construction,No,Non Prevailing Wage,,,,,3.0,,,1.0,2.0,,,,,,3.0,,3.0,10,2022.0
70853,770 & 774 LEXINGTON AVENUE APARTMENTS,2/4/2021,10/18/2022,992725.0,774,LEXINGTON AVENUE,Brooklyn,11221.0,3016270036.0,3426468.0,BK-03,36.0,387.0,BK0302,40.690252,-73.928495,40.690047,-73.928318,2022-10-18,New Construction,No,Non Prevailing Wage,,,,,3.0,,,1.0,2.0,,,,,,3.0,,3.0,10,2022.0
70856,142 LENOX ROAD,2/4/2021,4/20/2022,324070.0,142,LENOX ROAD,Brooklyn,11226.0,3050840034.0,3116646.0,BK-17,40.0,822.0,BK1701,40.653856,-73.954709,40.65353,-73.95476,2022-04-20,New Construction,No,Non Prevailing Wage,,,,,5.0,,1.0,,4.0,,,,,,5.0,,5.0,16,2022.0
70849,1893 CROTONA AVENUE APARTMENTS,2/3/2021,4/1/2022,989694.0,1893,CROTONA AVENUE,Bronx,10457.0,2029460040.0,2009903.0,BX-06,15.0,36901.0,BX0602,40.844171,-73.892197,40.844421,-73.892352,2022-04-01,New Construction,No,Non Prevailing Wage,,,,,9.0,,2.0,5.0,2.0,,,,,,9.0,,9.0,28,2022.0
70851,1634 CHURCH AVENUE APARTMENTS,2/3/2021,6/15/2022,998358.0,1634,CHURCH AVENUE,Brooklyn,11226.0,3050977501.0,3426423.0,BK-14,40.0,512.0,BK1401,40.648856,-73.964536,40.648762,-73.963855,2022-06-15,New Construction,No,Non Prevailing Wage,,,,,15.0,,,7.0,8.0,,,,,,15.0,,15.0,48,2022.0
69813,PFIZER SITE - 34 UNION AVENUE,1/28/2021,1/16/2024,994482.0,34,UNION AVENUE,Brooklyn,11206.0,3022490122.0,3428595.0,BK-01,33.0,507.0,BK0103,40.700831,-73.950274,40.701051,-73.949981,2024-01-16,New Construction,No,Non Prevailing Wage,,40.0,22.0,15.0,,,,27.0,24.0,15.0,11.0,,,,77.0,,77.0,77,2024.0
70488,ENNIS FRANCIS III- MIXED INCOME,1/27/2021,5/30/2023,996855.0,202,WEST 124 STREET,Manhattan,10027.0,,,MN-10,9.0,222.0,MN1001,40.808513,-73.949359,,,2023-05-30,New Construction,No,Non Prevailing Wage,,,,,34.0,,8.0,6.0,10.0,10.0,,,,,34.0,,34.0,34,2023.0
69261,BRIGHTON BEACH HDFC,1/22/2021,5/1/2023,212712.0,3161,BRIGHTON 6 STREET,Brooklyn,11235.0,3086930012.0,3245130.0,BK-13,48.0,36002.0,BK1303,40.575657,-73.961105,40.575451,-73.960687,2023-05-01,Preservation,No,Non Prevailing Wage,151.0,3.0,,,,,1.0,152.0,,1.0,,,,,154.0,,154.0,154,2023.0
70839,605 HART STREET APARTMENTS,1/22/2021,6/9/2023,380326.0,118,SUYDAM STREET,Brooklyn,11221.0,3032177501.0,3421763.0,BK-04,34.0,423.0,BK0401,40.698363,-73.928324,40.698135,-73.927927,2023-06-09,New Construction,No,Non Prevailing Wage,,,,,17.0,,,8.0,9.0,,,,,,17.0,,17.0,56,2023.0
70846,1381 BERGEN STREET APARTMENTS,1/21/2021,11/19/2021,997955.0,1381,BERGEN STREET,Brooklyn,11213.0,3013460001.0,3035752.0,BK-08,36.0,311.0,BK0802,40.675383,-73.936853,40.675598,-73.938547,2021-11-19,New Construction,No,Non Prevailing Wage,,,,,3.0,,,,3.0,,,,,,3.0,,3.0,8,2021.0
70848,329 BROADWAY APARTMENTS,1/21/2021,4/29/2022,214130.0,329,BROADWAY,Brooklyn,11211.0,3024627502.0,3425870.0,BK-01,34.0,527.0,BK0102,40.707973,-73.956588,40.708151,-73.956317,2022-04-29,New Construction,No,Non Prevailing Wage,,,,,19.0,,1.0,14.0,3.0,1.0,,,,,19.0,,19.0,63,2022.0
70843,2848 WEST 15TH STREET APARTMENTS,1/20/2021,1/19/2022,995371.0,2848,WEST 15 STREET,Brooklyn,11224.0,3070220028.0,3256856.0,BK-13,47.0,348.0,BK1302,40.578025,-73.982883,40.577883,-73.983163,2022-01-19,New Construction,No,Non Prevailing Wage,,,,,6.0,,,3.0,3.0,,,,,,6.0,,6.0,20,2022.0
70844,465 WEST 163 STREET,1/20/2021,8/25/2022,43002.0,465,WEST 163 STREET,Manhattan,10032.0,1021100104.0,1090982.0,MN-12,10.0,24301.0,MN1201,40.836213,-73.938633,40.836504,-73.938601,2022-08-25,New Construction,No,Non Prevailing Wage,,,,,5.0,,2.0,3.0,,,,,,,5.0,,5.0,16,2022.0
70845,2655 EAST 23RD STREET APARTMENTS,1/20/2021,1/10/2022,988311.0,2655,EAST 23 STREET,Brooklyn,11235.0,3074680076.0,3205174.0,BK-15,48.0,600.0,BK1503,40.587495,-73.946534,40.587585,-73.94616,2022-01-10,New Construction,No,Non Prevailing Wage,,,,,4.0,,1.0,3.0,,,,,,,4.0,,4.0,11,2022.0
70842,898 BUSHWICK AVENUE APARTMENTS,1/19/2021,8/10/2021,989718.0,898,BUSHWICK AVENUE,Brooklyn,11221.0,3032730038.0,3074662.0,BK-04,34.0,395.0,BK0402,40.693396,-73.925116,40.69322,-73.925386,2021-08-10,New Construction,No,Non Prevailing Wage,,,,,3.0,,,1.0,2.0,,,,,,3.0,,3.0,8,2021.0
70841,2741 FULTON STREET APARTMENTS,1/15/2021,4/1/2022,297897.0,2741,FULTON STREET,Brooklyn,11207.0,3036640052.0,3083220.0,BK-05,37.0,1146.0,BK0501,40.678008,-73.893425,40.677997,-73.893392,2022-04-01,New Construction,No,Non Prevailing Wage,,,,,3.0,,,1.0,2.0,,,,,,3.0,,3.0,10,2022.0
72279,106-25 50 AVENUE,1/14/2021,6/17/2022,439386.0,106-25,50 AVENUE,Queens,11368.0,4019930076.0,4049159.0,QN-04,21.0,427.0,QN0402,40.744274,-73.85675,40.744578,-73.856479,2022-06-17,New Construction,No,Non Prevailing Wage,,,,,3.0,,,2.0,,1.0,,,,,3.0,,3.0,7,2022.0
72482,25-27 EAST 198TH STREET APARTMENTS,1/14/2021,2/4/2022,1000010.0,27,EAST 198 STREET,Bronx,10468.0,2033190021.0,2017580.0,BX-07,14.0,40701.0,BX0702,40.871127,-73.892591,40.870992,-73.891893,2022-02-04,New Construction,No,Non Prevailing Wage,,,,,14.0,,3.0,10.0,1.0,,,,,,14.0,,14.0,46,2022.0
70837,648 MIDWOOD STREET APARTMENTS,1/11/2021,3/25/2022,999667.0,648,MIDWOOD STREET,Brooklyn,11203.0,3048050014.0,3107093.0,BK-09,40.0,87401.0,BK0902,40.660824,-73.939072,40.660626,-73.939036,2022-03-25,New Construction,No,Non Prevailing Wage,,,,,3.0,,,1.0,2.0,,,,,,3.0,,3.0,10,2022.0
70836,3554 CARLISLE PLACE,1/4/2021,10/22/2021,55095.0,3554,CARLISLE PLACE,Bronx,10467.0,2046600044.0,2057758.0,BX-12,12.0,380.0,BX1201,40.877928,-73.863282,40.87804,-73.862967,2021-10-22,New Construction,No,Non Prevailing Wage,,,,,4.0,,1.0,2.0,1.0,,,,,,4.0,,4.0,11,2021.0
68797,445 GERARD AVENUE,12/31/2020,2/28/2024,991233.0,445,GERARD AVENUE,Bronx,10451.0,2023510012.0,2129137.0,BX-01,8.0,6301.0,BX0401,40.817398,-73.929872,40.817544,-73.930096,2024-02-28,New Construction,No,Non Prevailing Wage,,,71.0,,,,2.0,49.0,20.0,,,,,,71.0,,71.0,338,2024.0
68866,MAXWELL DEVELOPMENT LP.YR15.FY21,12/31/2020,12/31/2020,41403.0,143,WEST 140 STREET,Manhattan,10030.0,1020090018.0,1060064.0,MN-10,9.0,230.0,MN1002,40.817879,-73.939944,40.817947,-73.939572,2020-12-31,Preservation,Yes,Non Prevailing Wage,27.0,22.0,5.0,,,1.0,,14.0,27.0,7.0,7.0,,,,55.0,,55.0,55,2020.0
68866,MAXWELL DEVELOPMENT LP.YR15.FY21,12/31/2020,12/31/2020,41405.0,151,WEST 140 STREET,Manhattan,10030.0,1020090012.0,1060063.0,MN-10,9.0,230.0,MN1002,40.817947,-73.940113,40.818115,-73.939969,2020-12-31,Preservation,Yes,Non Prevailing Wage,4.0,48.0,2.0,,,1.0,,21.0,20.0,7.0,7.0,,,,55.0,,55.0,55,2020.0
68866,MAXWELL DEVELOPMENT LP.YR15.FY21,12/31/2020,12/31/2020,41431.0,227,WEST 140 STREET,Manhattan,10030.0,1020260014.0,1060404.0,MN-10,9.0,230.0,MN1002,40.818904,-73.942389,40.819379,-73.942952,2020-12-31,Preservation,Yes,Non Prevailing Wage,3.0,16.0,,,,1.0,,3.0,13.0,4.0,,,,,20.0,,20.0,20,2020.0
68866,MAXWELL DEVELOPMENT LP.YR15.FY21,12/31/2020,12/31/2020,41436.0,233,WEST 140 STREET,Manhattan,10030.0,1020260009.0,1060401.0,MN-10,9.0,230.0,MN1002,40.818953,-73.942508,40.819472,-73.943172,2020-12-31,Preservation,Yes,Non Prevailing Wage,12.0,16.0,2.0,,,1.0,,6.0,17.0,8.0,,,,,31.0,,31.0,31,2020.0
68866,MAXWELL DEVELOPMENT LP.YR15.FY21,12/31/2020,12/31/2020,41511.0,226,WEST 141 STREET,Manhattan,10030.0,1020260053.0,1060421.0,MN-10,9.0,230.0,MN1002,40.819513,-73.94194,40.819648,-73.942833,2020-12-31,Preservation,Yes,Non Prevailing Wage,2.0,6.0,4.0,1.0,,,,3.0,10.0,,,,,,13.0,,13.0,13,2020.0
68866,MAXWELL DEVELOPMENT LP.YR15.FY21,12/31/2020,12/31/2020,41512.0,228,WEST 141 STREET,Manhattan,10030.0,1020260054.0,1060422.0,MN-10,9.0,230.0,MN1002,40.819529,-73.94198,40.819697,-73.942952,2020-12-31,Preservation,Yes,Non Prevailing Wage,3.0,7.0,2.0,,,1.0,,5.0,8.0,,,,,,13.0,,13.0,13,2020.0
68866,MAXWELL DEVELOPMENT LP.YR15.FY21,12/31/2020,12/31/2020,41513.0,230,WEST 141 STREET,Manhattan,10030.0,1020260056.0,1060423.0,MN-10,9.0,230.0,MN1002,40.819549,-73.94202,40.819747,-73.943067,2020-12-31,Preservation,Yes,Non Prevailing Wage,1.0,10.0,2.0,,,,,1.0,10.0,2.0,,,,,13.0,,13.0,13,2020.0
69330,414 GERARD AVENUE,12/31/2020,2/28/2024,993841.0,414,GERARD AVENUE,Bronx,10451.0,2023500001.0,2001084.0,BX-01,17.0,6301.0,BX0401,40.817116,-73.929962,40.817261,-73.929568,2024-02-28,New Construction,No,Non Prevailing Wage,,,43.0,,19.0,,,38.0,24.0,,,,,,62.0,,62.0,206,2024.0
70165,BROOK AND BROWN HDFC,12/31/2020,12/31/2020,52669.0,199,BROOK AVENUE,Bronx,10454.0,2022640014.0,2000029.0,BX-01,8.0,25.0,BX0101,40.806528,-73.919989,40.8066,-73.920296,2020-12-31,Preservation,No,Non Prevailing Wage,14.0,1.0,1.0,,,,,5.0,10.0,1.0,,,,,16.0,,16.0,16,2020.0
70165,BROOK AND BROWN HDFC,12/31/2020,12/31/2020,52670.0,205,BROOK AVENUE,Bronx,10454.0,2022640012.0,2000028.0,BX-01,8.0,25.0,BX0101,40.806685,-73.919873,40.806789,-73.920155,2020-12-31,Preservation,No,Non Prevailing Wage,36.0,3.0,1.0,,,,,23.0,16.0,1.0,,,,,40.0,,40.0,40,2020.0
70165,BROOK AND BROWN HDFC,12/31/2020,12/31/2020,52794.0,198,BROWN PLACE,Bronx,10454.0,2022640005.0,2000025.0,BX-01,8.0,25.0,BX0101,40.806935,-73.920744,40.80688,-73.920484,2020-12-31,Preservation,No,Non Prevailing Wage,13.0,5.0,1.0,,,,4.0,2.0,12.0,1.0,,,,,19.0,,19.0,19,2020.0
70165,BROOK AND BROWN HDFC,12/31/2020,12/31/2020,52795.0,202,BROWN PLACE,Bronx,10454.0,2022640007.0,2000026.0,BX-01,8.0,25.0,BX0101,40.807003,-73.920693,40.807001,-73.920393,2020-12-31,Preservation,No,Non Prevailing Wage,17.0,1.0,1.0,,,1.0,,1.0,19.0,,,,,,20.0,,20.0,20,2020.0
64886,ROCKAWAY VILLAGE PHASE 3,12/30/2020,5/28/2025,996947.0,1721,REDFERN AVENUE,Queens,11691.0,4155377501.0,4620755.0,QN-14,31.0,103202.0,QN1401,40.606694,-73.753145,40.606419,-73.752861,2023-08-21,New Construction,No,Non Prevailing Wage,89.0,88.0,176.0,,,1.0,42.0,102.0,163.0,47.0,,,,,354.0,,354.0,354,2023.0
69020,RECLAIM HDFC.YR15.FY21,12/30/2020,4/23/2024,60070.0,2100,CROTONA PARKWAY,Bronx,10460.0,2031190029.0,2013101.0,BX-06,15.0,363.0,BX0601,40.845931,-73.884026,40.845933,-73.883708,2022-02-01,Preservation,Yes,Non Prevailing Wage,,34.0,7.0,,,1.0,1.0,21.0,15.0,5.0,,,,,42.0,,42.0,42,2022.0
69020,RECLAIM HDFC.YR15.FY21,12/30/2020,4/23/2024,66235.0,503,EAST 180 STREET,Bronx,10457.0,2030470067.0,2011510.0,BX-06,15.0,37504.0,BX0602,40.851016,-73.89464,40.851156,-73.894413,2022-02-15,Preservation,Yes,Non Prevailing Wage,,14.0,5.0,,,1.0,2.0,9.0,9.0,,,,,,20.0,,20.0,20,2022.0
69020,RECLAIM HDFC.YR15.FY21,12/30/2020,4/23/2024,66477.0,308,EAST 183 STREET,Bronx,10458.0,2031450021.0,2013406.0,BX-05,15.0,38301.0,BX0503,40.856665,-73.897777,40.856492,-73.897874,2021-11-19,Preservation,Yes,Non Prevailing Wage,,8.0,,,,,,3.0,5.0,,,,,,8.0,,8.0,8,2021.0
69020,RECLAIM HDFC.YR15.FY21,12/30/2020,4/23/2024,66480.0,314,EAST 183 STREET,Bronx,10458.0,2031450024.0,2013408.0,BX-05,15.0,38301.0,BX0503,40.856596,-73.897578,40.85642,-73.897661,2021-11-19,Preservation,Yes,Non Prevailing Wage,,7.0,1.0,,,,,3.0,5.0,,,,,,8.0,,8.0,8,2021.0
69020,RECLAIM HDFC.YR15.FY21,12/30/2020,4/23/2024,81461.0,2042,GRAND AVENUE,Bronx,10453.0,2031930001.0,2014154.0,BX-05,14.0,251.0,BX0501,40.854174,-73.909225,40.854135,-73.90895,2022-06-14,Preservation,Yes,Non Prevailing Wage,,42.0,7.0,,,1.0,1.0,7.0,26.0,16.0,,,,,50.0,,50.0,50,2022.0
69020,RECLAIM HDFC.YR15.FY21,12/30/2020,4/23/2024,110103.0,2125,SOUTHERN BOULEVARD,Bronx,10460.0,2031110010.0,2012996.0,BX-06,15.0,36501.0,BX0602,40.846666,-73.883902,40.846705,-73.884209,2022-09-30,Preservation,Yes,Non Prevailing Wage,1.0,25.0,5.0,,,1.0,2.0,16.0,9.0,5.0,,,,,32.0,,32.0,32,2022.0
69020,RECLAIM HDFC.YR15.FY21,12/30/2020,4/23/2024,116849.0,1821,UNIVERSITY AVENUE,Bronx,10453.0,2028790117.0,2009097.0,BX-05,14.0,24501.0,BX0501,40.851288,-73.91464,40.851302,-73.915088,2022-02-15,Preservation,Yes,Non Prevailing Wage,,22.0,9.0,,,1.0,1.0,17.0,5.0,9.0,,,,,32.0,,32.0,32,2022.0
69020,RECLAIM HDFC.YR15.FY21,12/30/2020,4/23/2024,116884.0,1982,UNIVERSITY AVENUE,Bronx,10453.0,2028680129.0,2008555.0,BX-05,14.0,243.0,BX0501,40.854483,-73.911625,40.85454,-73.911093,2021-07-19,Preservation,Yes,Non Prevailing Wage,,17.0,3.0,,,1.0,,1.0,15.0,5.0,,,,,21.0,,21.0,21,2021.0
69020,RECLAIM HDFC.YR15.FY21,12/30/2020,4/23/2024,117050.0,2242,VALENTINE AVENUE,Bronx,10457.0,2031450012.0,2013404.0,BX-05,15.0,38301.0,BX0503,40.856171,-73.898428,40.856097,-73.898179,2021-11-19,Preservation,Yes,Non Prevailing Wage,,7.0,,,,1.0,,3.0,5.0,,,,,,8.0,,8.0,8,2021.0
69020,RECLAIM HDFC.YR15.FY21,12/30/2020,4/23/2024,806990.0,2317,TIEBOUT AVENUE,Bronx,10458.0,2031460063.0,2013443.0,BX-05,15.0,38301.0,BX0503,40.857057,-73.89697,40.857274,-73.897168,2024-04-23,Preservation,Yes,Non Prevailing Wage,2.0,40.0,9.0,,,1.0,,28.0,24.0,,,,,,52.0,,52.0,52,2024.0
63772,BRONX POINT A,12/29/2020,11/21/2024,975365.0,65,EAST 149 STREET,Bronx,10451.0,2023567501.0,2000000.0,BX-04,8.0,6301.0,BX0401,40.819556,-73.931304,40.820256,-73.931462,2023-11-02,New Construction,No,Non Prevailing Wage,163.0,108.0,162.0,108.0,,1.0,135.0,192.0,122.0,93.0,,,,,542.0,,542.0,542,2023.0
65499,29 WEST STREET,12/29/2020,10/10/2023,996955.0,29,WEST STREET,Brooklyn,11222.0,3025700050.0,3425624.0,BK-01,33.0,561.0,BK0101,40.727165,-73.958834,40.727264,-73.959375,2023-10-10,New Construction,No,Non Prevailing Wage,,,215.0,,,,53.0,54.0,108.0,,,,,,215.0,,215.0,216,2023.0
66751,TWIN PARKS TERRACE,12/29/2020,4/13/2023,996389.0,373,EAST 183 STREET,Bronx,10458.0,2031430234.0,2130369.0,BX-05,15.0,38303.0,BX0503,40.856298,-73.895709,40.856627,-73.895759,2023-04-13,New Construction,No,Non Prevailing Wage,46.0,48.0,87.0,,,1.0,41.0,77.0,57.0,7.0,,,,,182.0,,182.0,182,2023.0
70534,2317 CAMBRELEND AVENUE APARTMENTS,12/24/2020,4/15/2022,996890.0,2317,CAMBRELENG AVENUE,Bronx,10458.0,2030880039.0,2129513.0,BX-06,15.0,391.0,BX0603,40.853182,-73.885925,40.853036,-73.886276,2022-04-15,New Construction,No,Non Prevailing Wage,,,,25.0,,,8.0,14.0,3.0,,,,,,25.0,,25.0,50,2022.0
69230,55 SUFFOLK STREET,12/23/2020,3/5/2024,994593.0,55,SUFFOLK STREET,Manhattan,10002.0,1003467505.0,1091600.0,MN-03,1.0,1402.0,MN0302,40.71695,-73.987158,40.716953,-73.987497,2024-03-05,New Construction,No,Non Prevailing Wage,,74.0,,21.0,,,32.0,42.0,20.0,1.0,,,,,95.0,,95.0,378,2024.0
67357,993-995 UNION AVENUE CLUSTER,12/22/2020,7/20/2023,92365.0,1042,LONGFELLOW AVENUE,Bronx,10459.0,2027560071.0,2006263.0,BX-02,17.0,119.0,BX0202,40.824416,-73.887695,40.824495,-73.887424,2023-03-31,Preservation,No,Non Prevailing Wage,,,,4.0,,,,2.0,1.0,1.0,,,,,,4.0,4.0,4,2023.0
67357,993-995 UNION AVENUE CLUSTER,12/22/2020,7/20/2023,116493.0,774,UNION AVENUE,Bronx,10455.0,2026760036.0,2004986.0,BX-01,17.0,79.0,BX0102,40.818266,-73.903519,40.818219,-73.903211,2023-03-31,Preservation,No,Non Prevailing Wage,,,,25.0,,1.0,,1.0,17.0,8.0,,,,,1.0,25.0,26.0,26,2023.0
67357,993-995 UNION AVENUE CLUSTER,12/22/2020,7/20/2023,116557.0,993,UNION AVENUE,Bronx,10459.0,2026690041.0,2004845.0,BX-03,17.0,133.0,BX0301,40.823778,-73.90144,40.823655,-73.901906,2023-07-20,Preservation,No,Non Prevailing Wage,,,,20.0,,1.0,,1.0,2.0,10.0,8.0,,,,1.0,20.0,21.0,21,2023.0
67357,993-995 UNION AVENUE CLUSTER,12/22/2020,7/20/2023,116558.0,995,UNION AVENUE,Bronx,10459.0,2026690040.0,2004844.0,BX-03,17.0,133.0,BX0301,40.823814,-73.901426,40.823778,-73.901856,2023-07-20,Preservation,No,Non Prevailing Wage,,,,20.0,,,,,3.0,10.0,7.0,,,,,20.0,20.0,20,2023.0
70077,THESSALONICA COURT APARTMENTS,12/22/2020,11/17/2021,110467.0,350,ST ANNS AVENUE,Bronx,10454.0,2025560002.0,2003686.0,BX-01,8.0,33.0,BX0101,40.809478,-73.915752,40.809423,-73.915282,2021-11-17,Preservation,Yes,Non Prevailing Wage,158.0,22.0,10.0,,,1.0,,54.0,106.0,31.0,,,,,191.0,,191.0,191,2021.0
70533,53-08 102 STREET,12/22/2020,7/18/2023,988169.0,53-08,102 STREET,Queens,11368.0,4019380016.0,4047633.0,QN-04,21.0,44301.0,QN0402,40.741219,-73.859214,40.741011,-73.859359,2023-07-18,New Construction,No,Non Prevailing Wage,,,,,3.0,,,3.0,,,,,,,3.0,,3.0,7,2023.0
65304,LINDEN TERRACE BUILDING 2,12/17/2020,2/13/2025,989116.0,573,EMERALD STREET,Brooklyn,11208.0,3044960015.0,3425087.0,BK-05,42.0,1220.0,BK0505,40.668754,-73.858798,40.669102,-73.858411,2023-05-25,New Construction,No,Non Prevailing Wage,44.0,36.0,79.0,,,1.0,38.0,69.0,40.0,13.0,,,,,160.0,,160.0,160,2023.0
66879,COMPASS 6,12/17/2020,11/7/2024,989183.0,1923,WEST FARMS ROAD,Bronx,10460.0,2030167503.0,2010971.0,BX-06,15.0,359.0,BX0601,40.83877,-73.880999,40.839113,-73.881107,2023-05-11,New Construction,No,Non Prevailing Wage,71.0,60.0,129.0,,,1.0,65.0,113.0,56.0,27.0,,,,,261.0,,261.0,261,2023.0
68125,CUCS. 711 EAST 211TH ST AND 718 EAST 212TH ST.,12/17/2020,2/2/2023,996758.0,718,EAST 212 STREET,Bronx,10467.0,2046570071.0,2129408.0,BX-12,12.0,380.0,BX1201,40.878308,-73.864804,40.878111,-73.86483,2023-02-02,New Construction,No,Non Prevailing Wage,45.0,15.0,27.0,,,,15.0,23.0,22.0,27.0,,,,,87.0,,87.0,87,2023.0
68125,CUCS. 711 EAST 211TH ST AND 718 EAST 212TH ST.,12/17/2020,2/2/2023,996771.0,713,EAST 211 STREET,Bronx,10467.0,2046570042.0,2129406.0,BX-12,12.0,380.0,BX1201,40.877719,-73.865239,40.87787,-73.865047,2023-01-26,New Construction,No,Non Prevailing Wage,48.0,3.0,31.0,,,1.0,15.0,32.0,36.0,,,,,,83.0,,83.0,83,2023.0
68132,DOUGLASTON. 2856 WEBSTER AVENUE,12/17/2020,5/18/2023,1009036.0,2850,WEBSTER AVENUE,Bronx,10458.0,2032737501.0,2130640.0,BX-07,15.0,397.0,BX0603,40.866692,-73.884597,40.866459,-73.884236,2023-05-18,New Construction,No,Prevailing Wage,187.0,,,,,1.0,151.0,36.0,1.0,,,,,,188.0,,188.0,188,2023.0
68160,O+O. 1611 & 1701 PURDY STREET. PARKCHESTER GARDENS,12/17/2020,8/3/2023,996485.0,1701,PURDY STREET,Bronx,10462.0,2039430199.0,2033976.0,BX-09,18.0,21002.0,BX0904,40.839853,-73.853913,40.839601,-73.854254,2023-08-03,New Construction,No,Prevailing Wage,220.0,,,,,1.0,126.0,94.0,1.0,,,,,,221.0,,221.0,221,2023.0
68741,CAMBA. 261 EAST 202 ST & 270 EAST 203 ST,12/17/2020,8/21/2024,996280.0,270,EAST 203 STREET,Bronx,10458.0,2033080059.0,2113436.0,BX-07,11.0,413.0,BX0702,40.873342,-73.88405,40.873145,-73.884091,2024-07-02,New Construction,No,Non Prevailing Wage,113.0,32.0,14.0,,,1.0,38.0,65.0,41.0,16.0,,,,,160.0,,160.0,160,2024.0
68741,CAMBA. 261 EAST 202 ST & 270 EAST 203 ST,12/17/2020,8/21/2024,996281.0,261,EAST 202 STREET,Bronx,10458.0,2033080092.0,2017263.0,BX-07,11.0,413.0,BX0702,40.872791,-73.884688,40.872881,-73.88421,2024-08-21,New Construction,No,Non Prevailing Wage,113.0,32.0,17.0,,,1.0,42.0,64.0,41.0,16.0,,,,,163.0,,163.0,163,2024.0
70531,2001 ARTHUR AVENUE APARTMENTS,12/17/2020,5/13/2022,46149.0,2001,ARTHUR AVENUE,Bronx,10457.0,2030680033.0,2094641.0,BX-06,15.0,37504.0,BX0602,40.847394,-73.892799,40.847622,-73.892951,2022-05-13,New Construction,No,Non Prevailing Wage,,,,,14.0,,,8.0,6.0,,,,,,14.0,,14.0,45,2022.0
70527,2633 OCEAN AVENUE APARTMENTS,12/16/2020,9/10/2021,984094.0,2633,OCEAN AVENUE,Brooklyn,11229.0,3073817501.0,3398245.0,BK-15,48.0,59403.0,BK1503,40.597167,-73.950977,40.597065,-73.950596,2021-09-10,New Construction,No,Non Prevailing Wage,,,,,18.0,,8.0,4.0,6.0,,,,,,18.0,,18.0,60,2021.0
70529,629 EAST 222ND STREET APARTMENTS,12/16/2020,7/23/2021,996889.0,629,EAST 222 STREET,Bronx,10467.0,2048240041.0,2062900.0,BX-12,12.0,394.0,BX1201,40.886451,-73.863981,40.886712,-73.863991,2021-07-23,New Construction,No,Non Prevailing Wage,,,,,3.0,,,3.0,,,,,,,3.0,,3.0,8,2021.0
68733,OAK HALL.HRP.FY21,12/14/2020,6/24/2025,216940.0,105,CARLTON AVENUE,Brooklyn,11205.0,3020440013.0,3257033.0,BK-02,35.0,18501.0,BK0203,40.694581,-73.973188,40.694614,-73.972813,2025-06-24,Preservation,No,Non Prevailing Wage,34.0,31.0,9.0,,,,74.0,,,,,,,,74.0,,74.0,74,2025.0
70525,1225 42ND STREET,12/14/2020,12/17/2021,989703.0,1225,42 STREET,Brooklyn,11219.0,3055930060.0,3135707.0,BK-12,39.0,224.0,BK1202,40.639855,-73.989529,40.639951,-73.989244,2021-12-17,New Construction,No,Non Prevailing Wage,,,,,2.0,,,,2.0,,,,,,2.0,,2.0,6,2021.0
70526,586 & 596 EAST 32ND STREET APARTMENTS,12/14/2020,7/23/2021,996888.0,586,EAST 32 STREET,Brooklyn,11210.0,3049950001.0,3426559.0,BK-17,45.0,78802.0,BK1702,40.63664,-73.946153,40.636684,-73.946308,2021-07-23,New Construction,No,Non Prevailing Wage,,,,,3.0,,,3.0,,,,,,,3.0,,3.0,7,2021.0
70526,586 & 596 EAST 32ND STREET APARTMENTS,12/14/2020,7/23/2021,1001891.0,596,EAST 32 STREET,Brooklyn,11210.0,3049950002.0,3426560.0,BK-17,45.0,78802.0,BK1702,40.636563,-73.946142,40.636536,-73.94629,2021-07-23,New Construction,No,Non Prevailing Wage,,,,,3.0,,,3.0,,,,,,,3.0,,3.0,8,2021.0
70523,37-56 103RD STREET,12/11/2020,10/7/2022,984002.0,37-56,103 STREET,Queens,11368.0,4017687503.0,4044233.0,QN-03,21.0,40502.0,QN0303,40.752781,-73.864207,40.751784,-73.863974,2022-10-07,New Construction,No,Non Prevailing Wage,,,,,2.0,,,,2.0,,,,,,2.0,,2.0,6,2022.0
70524,61 TROUTMAN STREET,12/11/2020,11/12/2021,381977.0,61,TROUTMAN STREET,Brooklyn,11206.0,3031710053.0,3424255.0,BK-04,34.0,391.0,BK0401,40.698519,-73.931713,40.698686,-73.931843,2021-11-12,New Construction,No,Non Prevailing Wage,,,,,3.0,,,3.0,,,,,,,3.0,,3.0,8,2021.0
68782,PRATT TOWERS INC.PLP.FY21,12/10/2020,12/22/2023,322124.0,333,LAFAYETTE AVENUE,Brooklyn,11238.0,3019330100.0,3055377.0,BK-02,35.0,193.0,BK0204,40.688674,-73.961886,40.689396,-73.962041,2023-12-22,Preservation,No,Non Prevailing Wage,,326.0,,,,1.0,,188.0,126.0,13.0,,,,,,327.0,327.0,327,2023.0
70521,885 ROGERS PLAZA,12/4/2020,1/28/2022,995591.0,885,ROGERS AVENUE,Brooklyn,11226.0,3051117501.0,3117397.0,BK-17,40.0,824.0,BK1701,40.648643,-73.952244,40.648585,-73.951642,2022-01-28,New Construction,No,Non Prevailing Wage,,,,,32.0,,7.0,9.0,16.0,,,,,,32.0,,32.0,105,2022.0
70522,855 DEKALB AVENUE APARTMENTS,12/4/2020,3/5/2021,996440.0,855,DEKALB AVENUE,Brooklyn,11221.0,3017770062.0,3425613.0,BK-03,36.0,281.0,BK0302,40.692459,-73.942004,40.692673,-73.942105,2021-03-05,New Construction,No,Non Prevailing Wage,,,,,6.0,,,,6.0,,,,,,6.0,,6.0,20,2021.0
69877,"CONCOURSE VILLAGE, INC.HRP.FY21",12/1/2020,6/13/2023,97290.0,775,CONCOURSE VILLAGE EAST,Bronx,10451.0,2024430170.0,2093927.0,BX-04,16.0,61.0,BX0401,40.82318,-73.919789,40.823623,-73.920316,2023-06-13,Preservation,No,Non Prevailing Wage,,118.0,194.0,,,,48.0,96.0,120.0,48.0,,,,,,312.0,312.0,312,2023.0
69877,"CONCOURSE VILLAGE, INC.HRP.FY21",12/1/2020,6/13/2023,109464.0,780,CONCOURSE VILLAGE WEST,Bronx,10451.0,2024439080.0,2002455.0,BX-04,16.0,61.0,BX0401,40.823921,-73.922884,,,2023-06-13,Preservation,No,Non Prevailing Wage,,59.0,253.0,,,1.0,48.0,97.0,120.0,48.0,,,,,,313.0,313.0,313,2023.0
69877,"CONCOURSE VILLAGE, INC.HRP.FY21",12/1/2020,6/13/2023,806181.0,790,CONCOURSE VILLAGE WEST,Bronx,10451.0,2024439080.0,2101571.0,BX-04,16.0,61.0,BX0401,40.824343,-73.922634,,,2023-06-13,Preservation,No,Non Prevailing Wage,,59.0,253.0,,,,48.0,96.0,120.0,48.0,,,,,,312.0,312.0,312,2023.0
69877,"CONCOURSE VILLAGE, INC.HRP.FY21",12/1/2020,6/13/2023,806388.0,773,CONCOURSE VILLAGE EAST,Bronx,10451.0,2024430170.0,2093926.0,BX-04,16.0,61.0,BX0401,40.823032,-73.919872,40.823623,-73.920316,2023-06-13,Preservation,No,Non Prevailing Wage,,133.0,179.0,,,,48.0,96.0,120.0,48.0,,,,,,312.0,312.0,312,2023.0
69877,"CONCOURSE VILLAGE, INC.HRP.FY21",12/1/2020,6/13/2023,806389.0,779,CONCOURSE VILLAGE EAST,Bronx,10451.0,2024430170.0,2116939.0,BX-04,16.0,61.0,BX0401,40.823814,-73.919437,40.823623,-73.920316,2023-06-13,Preservation,No,Non Prevailing Wage,,79.0,233.0,,,,48.0,96.0,120.0,48.0,,,,,,312.0,312.0,312,2023.0
69877,"CONCOURSE VILLAGE, INC.HRP.FY21",12/1/2020,6/13/2023,806390.0,800,CONCOURSE VILLAGE WEST,Bronx,10451.0,2024439080.0,2101572.0,BX-04,16.0,61.0,BX0401,40.824785,-73.922374,,,2023-06-13,Preservation,No,Non Prevailing Wage,,58.0,254.0,,,1.0,48.0,97.0,120.0,48.0,,,,,,313.0,313.0,313,2023.0
69484,HP WEST 49TH STREET PORTFOLIO HDFC.HPO.FY21,11/27/2020,8/20/2021,33719.0,308,WEST 49 STREET,Manhattan,10019.0,1010390040.0,1025146.0,MN-04,3.0,127.0,MN0402,40.761923,-73.987203,40.761791,-73.987452,2021-08-20,Preservation,No,Non Prevailing Wage,,6.0,1.0,3.0,5.0,,,8.0,6.0,1.0,,,,,15.0,,15.0,20,2021.0
69484,HP WEST 49TH STREET PORTFOLIO HDFC.HPO.FY21,11/27/2020,8/20/2021,33720.0,310,WEST 49 STREET,Manhattan,10019.0,1010390041.0,1025147.0,MN-04,3.0,127.0,MN0402,40.761951,-73.987275,40.761824,-73.987532,2021-08-20,Preservation,No,Non Prevailing Wage,,7.0,1.0,1.0,5.0,,,3.0,10.0,1.0,,,,,14.0,,14.0,20,2021.0
69484,HP WEST 49TH STREET PORTFOLIO HDFC.HPO.FY21,11/27/2020,8/20/2021,33722.0,318,WEST 49 STREET,Manhattan,10019.0,1010390045.0,1025149.0,MN-04,3.0,127.0,MN0402,40.762069,-73.987553,40.761956,-73.987849,2021-08-20,Preservation,No,Non Prevailing Wage,2.0,2.0,1.0,1.0,10.0,,,7.0,9.0,,,,,,16.0,,16.0,20,2021.0
69484,HP WEST 49TH STREET PORTFOLIO HDFC.HPO.FY21,11/27/2020,8/20/2021,33723.0,320,WEST 49 STREET,Manhattan,10019.0,1010390046.0,1025150.0,MN-04,3.0,127.0,MN0402,40.762099,-73.987626,40.761992,-73.987932,2021-08-20,Preservation,No,Non Prevailing Wage,,1.0,,2.0,9.0,1.0,,4.0,9.0,,,,,,13.0,,13.0,21,2021.0
69484,HP WEST 49TH STREET PORTFOLIO HDFC.HPO.FY21,11/27/2020,8/20/2021,33724.0,322,WEST 49 STREET,Manhattan,10019.0,1010390047.0,1025151.0,MN-04,3.0,127.0,MN0402,40.762129,-73.987694,40.762025,-73.988008,2021-08-20,Preservation,No,Non Prevailing Wage,3.0,1.0,,3.0,8.0,,,6.0,9.0,,,,,,15.0,,15.0,17,2021.0
69484,HP WEST 49TH STREET PORTFOLIO HDFC.HPO.FY21,11/27/2020,8/20/2021,33726.0,324,WEST 49 STREET,Manhattan,10019.0,1010390048.0,1025152.0,MN-04,3.0,127.0,MN0402,40.762159,-73.987763,40.762058,-73.988084,2021-08-20,Preservation,No,Non Prevailing Wage,1.0,3.0,,2.0,10.0,,,9.0,7.0,,,,,,16.0,,16.0,18,2021.0
69484,HP WEST 49TH STREET PORTFOLIO HDFC.HPO.FY21,11/27/2020,8/20/2021,33727.0,326,WEST 49 STREET,Manhattan,10019.0,1010390049.0,1025153.0,MN-04,3.0,127.0,MN0402,40.762187,-73.987835,40.762091,-73.988163,2021-08-20,Preservation,No,Non Prevailing Wage,,2.0,,4.0,9.0,,,3.0,11.0,1.0,,,,,15.0,,15.0,20,2021.0
69484,HP WEST 49TH STREET PORTFOLIO HDFC.HPO.FY21,11/27/2020,8/20/2021,33728.0,328,WEST 49 STREET,Manhattan,10019.0,1010390050.0,1025154.0,MN-04,3.0,127.0,MN0402,40.762217,-73.987903,40.762124,-73.988243,2021-08-20,Preservation,No,Non Prevailing Wage,1.0,3.0,2.0,2.0,4.0,,,3.0,9.0,,,,,,12.0,,12.0,20,2021.0
69484,HP WEST 49TH STREET PORTFOLIO HDFC.HPO.FY21,11/27/2020,8/20/2021,33729.0,330,WEST 49 STREET,Manhattan,10019.0,1010390051.0,1025155.0,MN-04,3.0,127.0,MN0402,40.762247,-73.987972,40.762157,-73.988322,2021-08-20,Preservation,No,Non Prevailing Wage,1.0,3.0,2.0,4.0,5.0,,,7.0,8.0,,,,,,15.0,,15.0,20,2021.0
69484,HP WEST 49TH STREET PORTFOLIO HDFC.HPO.FY21,11/27/2020,8/20/2021,33730.0,332,WEST 49 STREET,Manhattan,10019.0,1010390052.0,1025156.0,MN-04,3.0,127.0,MN0402,40.762277,-73.988044,40.762189,-73.988398,2021-08-20,Preservation,No,Non Prevailing Wage,1.0,2.0,2.0,4.0,7.0,,,7.0,9.0,,,,,,16.0,,16.0,20,2021.0
69484,HP WEST 49TH STREET PORTFOLIO HDFC.HPO.FY21,11/27/2020,8/20/2021,33731.0,334,WEST 49 STREET,Manhattan,10019.0,1010390053.0,1025157.0,MN-04,3.0,127.0,MN0402,40.762305,-73.988113,40.762222,-73.988477,2021-08-20,Preservation,No,Non Prevailing Wage,,2.0,4.0,3.0,2.0,,,7.0,4.0,,,,,,11.0,,11.0,20,2021.0
69484,HP WEST 49TH STREET PORTFOLIO HDFC.HPO.FY21,11/27/2020,8/20/2021,33732.0,336,WEST 49 STREET,Manhattan,10019.0,1010390054.0,1025158.0,MN-04,3.0,127.0,MN0402,40.762335,-73.988181,40.762255,-73.988557,2021-08-20,Preservation,No,Non Prevailing Wage,,2.0,4.0,4.0,7.0,,,11.0,6.0,,,,,,17.0,,17.0,20,2021.0
69484,HP WEST 49TH STREET PORTFOLIO HDFC.HPO.FY21,11/27/2020,8/20/2021,33733.0,338,WEST 49 STREET,Manhattan,10019.0,1010390055.0,1025159.0,MN-04,3.0,127.0,MN0402,40.762365,-73.988254,40.762288,-73.988636,2021-08-20,Preservation,No,Non Prevailing Wage,2.0,1.0,2.0,1.0,10.0,,,7.0,8.0,1.0,,,,,16.0,,16.0,20,2021.0
69484,HP WEST 49TH STREET PORTFOLIO HDFC.HPO.FY21,11/27/2020,8/20/2021,33734.0,340,WEST 49 STREET,Manhattan,10019.0,1010390056.0,1025160.0,MN-04,3.0,127.0,MN0402,40.762393,-73.988322,40.762321,-73.988716,2021-08-20,Preservation,No,Non Prevailing Wage,,1.0,1.0,2.0,4.0,,,2.0,6.0,,,,,,8.0,,8.0,17,2021.0
68409,55-61 SUMMIT,11/25/2020,,991162.0,55,SUMMIT STREET,Brooklyn,11231.0,3003520150.0,3428631.0,BK-06,39.0,51.0,BK0601,40.682617,-74.004766,40.682798,-74.00464,2024-07-30,New Construction,No,Non Prevailing Wage,,,5.0,,,,1.0,,4.0,,,,,,,5.0,5.0,5,2024.0
70520,2265 HUGHES AVENUE APARTMENT,11/20/2020,2/28/2022,984293.0,2265,HUGHES AVENUE,Bronx,10457.0,2030710055.0,2012094.0,BX-06,15.0,391.0,BX0603,40.852454,-73.888229,40.852468,-73.888493,2022-02-28,New Construction,No,Non Prevailing Wage,,,,,5.0,,,,5.0,,,,,,5.0,,5.0,16,2022.0
70519,91 FRANKLIN AVENUE APARTMENTS,11/18/2020,6/17/2021,296047.0,91,FRANKLIN AVENUE,Brooklyn,11205.0,3018990024.0,3425883.0,BK-03,33.0,1237.0,BK0301,40.69605,-73.958319,40.696215,-73.958077,2021-06-17,New Construction,No,Non Prevailing Wage,,,,,3.0,,,1.0,,2.0,,,,,3.0,,3.0,8,2021.0
69284,WHGA ROBINSON PARK HDFC.HPO.FY21 (SCHREIBER),11/17/2020,8/14/2021,7481.0,242,BRADHURST AVENUE,Manhattan,10039.0,1020470021.0,1060892.0,MN-10,9.0,23502.0,MN1002,40.829162,-73.938875,40.829027,-73.938636,2021-08-14,Preservation,No,Non Prevailing Wage,,6.0,25.0,4.0,,,2.0,7.0,21.0,5.0,,,,,35.0,,35.0,35,2021.0
69284,WHGA ROBINSON PARK HDFC.HPO.FY21 (SCHREIBER),11/17/2020,8/14/2021,7482.0,246,BRADHURST AVENUE,Manhattan,10039.0,1020470023.0,1060893.0,MN-10,9.0,23502.0,MN1002,40.829293,-73.938817,40.829156,-73.938564,2021-08-14,Preservation,No,Non Prevailing Wage,1.0,6.0,30.0,10.0,,,17.0,30.0,,,,,,,47.0,,47.0,47,2021.0
69284,WHGA ROBINSON PARK HDFC.HPO.FY21 (SCHREIBER),11/17/2020,8/14/2021,21280.0,363,EDGECOMBE AVENUE,Manhattan,10031.0,1020540012.0,1061164.0,MN-09,9.0,23501.0,MN0903,40.827582,-73.940994,40.827588,-73.941333,2021-08-14,Preservation,No,Non Prevailing Wage,1.0,4.0,2.0,15.0,,1.0,1.0,12.0,8.0,2.0,,,,,23.0,,23.0,23,2021.0
69284,WHGA ROBINSON PARK HDFC.HPO.FY21 (SCHREIBER),11/17/2020,8/14/2021,21282.0,367,EDGECOMBE AVENUE,Manhattan,10031.0,1020540015.0,1061166.0,MN-09,9.0,23501.0,MN0903,40.827689,-73.940918,40.827769,-73.941203,2021-08-14,Preservation,No,Non Prevailing Wage,,2.0,2.0,18.0,,1.0,1.0,10.0,11.0,1.0,,,,,23.0,,23.0,23,2021.0
69284,WHGA ROBINSON PARK HDFC.HPO.FY21 (SCHREIBER),11/17/2020,8/14/2021,42657.0,303,WEST 154 STREET,Manhattan,10039.0,1020470025.0,1060894.0,MN-10,9.0,23502.0,MN1002,40.828607,-73.938023,40.828953,-73.938272,2021-08-14,Preservation,No,Non Prevailing Wage,,11.0,6.0,37.0,,,,51.0,3.0,,,,,,54.0,,54.0,54,2021.0
70518,27-15 ASTORIA BOULEVARD APARTMENTS,11/17/2020,1/15/2021,995418.0,27-15,ASTORIA BOULEVARD,Queens,11102.0,4008390017.0,4619947.0,QN-01,22.0,69.0,QN0103,40.770927,-73.921259,40.771015,-73.920667,2021-01-15,New Construction,No,Non Prevailing Wage,,,,,6.0,,,6.0,,,,,,,6.0,,6.0,20,2021.0
70517,45-57 DAVIS STREET APARTMENTS,11/16/2020,12/3/2021,999682.0,45-57,DAVIS STREET,Queens,11101.0,4000850030.0,4000715.0,QN-02,26.0,1901.0,QN0201,40.744259,-73.944615,40.744415,-73.944442,2021-12-03,New Construction,No,Non Prevailing Wage,,,,,48.0,,12.0,23.0,12.0,1.0,,,,,48.0,,48.0,158,2021.0
70566,23-81 21ST STREET,11/16/2020,10/7/2022,406879.0,23-81,21 STREET,Queens,11105.0,4008767501.0,4019321.0,QN-01,22.0,97.0,QN0101,40.776916,-73.92114,40.776847,-73.920758,2022-10-07,New Construction,No,Non Prevailing Wage,,,,,3.0,,,1.0,2.0,,,,,,3.0,,3.0,10,2022.0
70569,24 WILSON AVENUE,11/16/2020,7/16/2021,396858.0,24,WILSON AVENUE,Brooklyn,11237.0,3031540033.0,3428612.0,BK-04,34.0,425.0,BK0401,40.703214,-73.930158,40.703033,-73.930327,2021-07-16,New Construction,No,Non Prevailing Wage,,,,,5.0,,,5.0,,,,,,,5.0,,5.0,16,2021.0
67672,TBX1004 - FORDHAM BEDFORD - PARK GATES,11/13/2020,7/12/2024,48271.0,2068,BATHGATE AVENUE,Bronx,10457.0,2030450019.0,2092223.0,BX-06,15.0,395.0,BX0602,40.850385,-73.895169,40.850536,-73.894847,2023-05-30,Preservation,No,Non Prevailing Wage,,,15.0,,,,,7.0,8.0,,,,,,15.0,,15.0,15,2023.0
67672,TBX1004 - FORDHAM BEDFORD - PARK GATES,11/13/2020,7/12/2024,96820.0,1854,MONROE AVENUE,Bronx,10457.0,2028020005.0,2007550.0,BX-05,15.0,23302.0,BX0502,40.848062,-73.906146,40.847987,-73.905886,2023-02-17,Preservation,No,Non Prevailing Wage,,,25.0,,,1.0,,5.0,17.0,4.0,,,,,26.0,,26.0,26,2023.0
67672,TBX1004 - FORDHAM BEDFORD - PARK GATES,11/13/2020,7/12/2024,101353.0,4619,PARK AVENUE,Bronx,10458.0,2030310051.0,2011207.0,BX-06,15.0,38304.0,BX0603,40.857833,-73.893147,40.857951,-73.893657,2023-08-02,Preservation,No,Non Prevailing Wage,,,8.0,,,,,,,5.0,3.0,,,,8.0,,8.0,8,2023.0
67672,TBX1004 - FORDHAM BEDFORD - PARK GATES,11/13/2020,7/12/2024,806268.0,2072,BATHGATE AVENUE,Bronx,10457.0,2030450019.0,2092221.0,BX-06,15.0,395.0,BX0602,40.850443,-73.895137,40.850536,-73.894847,2024-07-12,Preservation,No,Non Prevailing Wage,,,15.0,,,,,7.0,8.0,,,,,,15.0,,15.0,15,2024.0
67672,TBX1004 - FORDHAM BEDFORD - PARK GATES,11/13/2020,7/12/2024,806269.0,2078,BATHGATE AVENUE,Bronx,10457.0,2030450019.0,2095196.0,BX-06,15.0,395.0,BX0602,40.850531,-73.895089,40.850536,-73.894847,2024-02-14,Preservation,No,Non Prevailing Wage,,,10.0,,,1.0,,,1.0,10.0,,,,,11.0,,11.0,11,2024.0
70516,312 BROADWAY,11/13/2020,7/23/2021,991945.0,302,BROADWAY,Brooklyn,11211.0,3021427501.0,3000000.0,BK-01,34.0,529.0,BK0103,40.708391,-73.957828,40.708155,-73.957767,2021-07-23,New Construction,No,Non Prevailing Wage,,,,,8.0,,2.0,4.0,2.0,,,,,,8.0,,8.0,24,2021.0
70078,1516 BEDFORD.HPO.FY21,11/12/2020,9/19/2022,205716.0,1516,BEDFORD AVENUE,Brooklyn,11216.0,3012520080.0,3032181.0,BK-08,35.0,219.0,BK0802,40.671437,-73.954805,40.671514,-73.955086,2022-09-19,Preservation,No,Non Prevailing Wage,1.0,3.0,1.0,11.0,,,,8.0,8.0,,,,,,16.0,,16.0,16,2022.0
70515,CENTENNIAL ASTORIA APARTMENTS,11/12/2020,10/22/2021,417083.0,14-53,31 AVENUE,Queens,11106.0,4005340001.0,4595613.0,QN-01,22.0,79.0,QN0102,40.767576,-73.930419,40.767686,-73.929942,2021-10-22,New Construction,No,Non Prevailing Wage,,,,,14.0,,,9.0,5.0,,,,,,14.0,,14.0,45,2021.0
76636,1620 NEW YORK APARTMENTS,11/12/2020,10/3/2022,999933.0,1620,NEW YORK AVENUE,Brooklyn,11210.0,3075600057.0,3205973.0,BK-17,45.0,78602.0,BK1702,40.633151,-73.944779,40.633151,-73.9451,2022-10-03,New Construction,No,Non Prevailing Wage,,,,,17.0,,,8.0,9.0,,,,,,17.0,,17.0,54,2022.0
70512,260 GOLD STREET APARTMENTS,11/10/2020,12/29/2021,996886.0,260,GOLD STREET,Brooklyn,11201.0,3001210003.0,3000220.0,BK-02,33.0,1501.0,BK0202,40.696652,-73.983184,40.696485,-73.983559,2021-12-29,New Construction,No,Non Prevailing Wage,,,,,86.0,,14.0,46.0,22.0,4.0,,,,,86.0,,86.0,286,2021.0
70513,46 MELROSE STREET,11/10/2020,8/10/2023,973490.0,46,MELROSE STREET,Brooklyn,11206.0,3031600023.0,3426313.0,BK-04,34.0,389.0,BK0401,40.698285,-73.935147,40.698219,-73.934862,2023-08-10,New Construction,No,Non Prevailing Wage,,,,,3.0,,,3.0,,,,,,,3.0,,3.0,8,2023.0
70514,722 HINSDALE STREET APARMENTS,11/10/2020,5/21/2021,313203.0,722,HINSDALE STREET,Brooklyn,11207.0,3038740040.0,3429119.0,BK-05,42.0,1098.0,BK0503,40.656816,-73.896836,40.65694,-73.897153,2021-05-21,New Construction,No,Non Prevailing Wage,,,,,3.0,,,1.0,2.0,,,,,,3.0,,3.0,8,2021.0
70511,ROOSEVELT PARC APARTMENTS,11/9/2020,3/4/2022,990386.0,37-46,72 STREET,Queens,11372.0,4012827501.0,4618758.0,QN-03,25.0,26501.0,QN0401,40.747525,-73.893776,40.747232,-73.89435,2022-03-04,New Construction,No,Non Prevailing Wage,,,,,47.0,,15.0,19.0,9.0,4.0,,,,,47.0,,47.0,154,2022.0
70509,834 PACIFIC STREET,11/5/2020,7/15/2022,996885.0,834,PACIFIC STREET,Brooklyn,11238.0,3011300011.0,3332399.0,BK-08,35.0,203.0,BK0801,40.680762,-73.966791,40.680567,-73.967036,2022-07-15,New Construction,No,Non Prevailing Wage,,,,,34.0,,18.0,13.0,2.0,1.0,,,,,34.0,,34.0,113,2022.0
70510,3915 14TH AVENUE,11/5/2020,6/16/2022,138981.0,3915,14 AVENUE,Brooklyn,11218.0,3053467501.0,3124934.0,BK-12,39.0,228.0,BK1202,40.639152,-73.984225,40.638782,-73.984236,2022-06-16,New Construction,No,Non Prevailing Wage,,,,,3.0,,,,,3.0,,,,,3.0,,3.0,8,2022.0
70508,27 BUCHANAN PLACE,11/4/2020,1/8/2021,995569.0,27,BUCHANAN PLACE,Bronx,10453.0,2031960066.0,2128894.0,BX-05,14.0,251.0,BX0501,40.858099,-73.905388,40.858304,-73.905326,2021-01-08,New Construction,No,Non Prevailing Wage,,,,,8.0,,2.0,3.0,3.0,,,,,,8.0,,8.0,25,2021.0
70507,25-22 30TH DRIVE,11/2/2020,12/17/2021,991687.0,25-22,30 DRIVE,Queens,11102.0,4005780027.0,4007088.0,QN-01,22.0,73.0,QN0103,40.766618,-73.925719,40.766149,-73.925399,2021-12-17,New Construction,No,Non Prevailing Wage,,,,,10.0,,2.0,8.0,,,,,,,10.0,,10.0,31,2021.0
70506,2502 & 2506 NEWKIRK AVENUE,10/29/2020,12/3/2021,344338.0,2506,NEWKIRK AVENUE,Brooklyn,11226.0,3052120042.0,3428880.0,BK-17,45.0,79002.0,BK1701,40.639695,-73.953025,40.639489,-73.952762,2021-12-03,New Construction,No,Non Prevailing Wage,,,,,6.0,,,,6.0,,,,,,6.0,,6.0,16,2021.0
70505,1027 REVEREND JAMES POLITE AVENUE APARTMENTS,10/28/2020,4/9/2021,996382.0,1027,REV JAMES A POLITE AVENUE,Bronx,10459.0,2026910042.0,2005247.0,BX-03,17.0,131.0,BX0202,40.82416,-73.898878,40.824125,-73.899124,2021-04-09,New Construction,No,Non Prevailing Wage,,,,,6.0,,1.0,4.0,1.0,,,,,,6.0,,6.0,18,2021.0
70503,36-08 28TH AVENUE APARTMENTS,10/27/2020,4/9/2021,996391.0,36-08,28 AVENUE,Queens,11103.0,4006300019.0,4619948.0,QN-01,22.0,6502.0,QN0103,40.766521,-73.91594,40.766249,-73.915947,2021-04-09,New Construction,No,Non Prevailing Wage,,,,,7.0,,,6.0,1.0,,,,,,7.0,,7.0,22,2021.0
70504,2278 BRONX PARK EAST,10/27/2020,2/11/2022,984966.0,2278,BRONX PARK EAST,Bronx,10467.0,2043400008.0,2130350.0,BX-11,15.0,33201.0,BX1104,40.8595,-73.8708,40.859453,-73.870402,2022-02-11,New Construction,No,Non Prevailing Wage,,,,,10.0,,2.0,5.0,3.0,,,,,,10.0,,10.0,33,2022.0
70502,23-61 31ST STREET APARTMENTS,10/26/2020,11/22/2022,417923.0,23-61,31 STREET,Queens,11105.0,4008350014.0,4017173.0,QN-01,22.0,115.0,QN0101,40.773,-73.914509,40.772879,-73.914228,2022-11-22,New Construction,No,Non Prevailing Wage,,,,,3.0,,,3.0,,,,,,,3.0,,3.0,10,2022.0
66212,BRKG GND. 90 SANDS STREET,10/22/2020,7/29/2022,996261.0,90,SANDS STREET,Brooklyn,11201.0,3000870009.0,3000179.0,BK-02,33.0,13.0,BK0202,40.70007,-73.987219,40.699584,-73.987158,2022-07-29,New Construction,No,Non Prevailing Wage,314.0,9.0,18.0,149.0,,1.0,403.0,87.0,1.0,,,,,,491.0,,491.0,491,2022.0
68497,HELP. 1210 SIMPSON STREET. HOME SIMPSON,10/22/2020,8/30/2023,993152.0,1210,SIMPSON STREET,Bronx,10459.0,2029757501.0,2130453.0,BX-03,17.0,125.0,BX0303,40.828963,-73.892887,40.828768,-73.89262,2023-08-30,New Construction,No,Non Prevailing Wage,44.0,,27.0,,,1.0,45.0,11.0,15.0,1.0,,,,,72.0,,72.0,72,2023.0
70540,VITAL BROOKLYN HERKIMER,10/22/2020,7/26/2023,311547.0,491,HERKIMER STREET,Brooklyn,11213.0,3016997503.0,3429534.0,BK-03,36.0,271.0,BK0302,40.678965,-73.937026,40.67918,-73.937019,2023-07-26,New Construction,No,Non Prevailing Wage,57.0,35.0,28.0,,,1.0,68.0,52.0,1.0,,,,,,121.0,,121.0,121,2023.0
70023,ALBANY KINGSTON HDFC,10/21/2020,10/21/2020,183185.0,1,ALBANY AVENUE,Brooklyn,11216.0,3018590016.0,3053689.0,BK-03,36.0,273.0,BK0302,40.680701,-73.938485,40.680775,-73.93825,2020-10-21,Preservation,Yes,Non Prevailing Wage,,,2.0,,,,,,,2.0,,,,,2.0,,2.0,2,2020.0
70023,ALBANY KINGSTON HDFC,10/21/2020,10/21/2020,183360.0,15,ALBANY AVENUE,Brooklyn,11216.0,3018590006.0,3053686.0,BK-03,36.0,273.0,BK0302,40.680374,-73.93842,40.680295,-73.938139,2020-10-21,Preservation,Yes,Non Prevailing Wage,25.0,6.0,5.0,,,,6.0,14.0,16.0,,,,,,36.0,,36.0,36,2020.0
70023,ALBANY KINGSTON HDFC,10/21/2020,10/21/2020,183582.0,20,ALBANY AVENUE,Brooklyn,11216.0,3018580024.0,3323673.0,BK-03,36.0,273.0,BK0302,40.680251,-73.938427,40.680451,-73.938759,2020-10-21,Preservation,Yes,Non Prevailing Wage,4.0,2.0,2.0,,,,,,,8.0,,,,,8.0,,8.0,8,2020.0
70023,ALBANY KINGSTON HDFC,10/21/2020,10/21/2020,183651.0,3,ALBANY AVENUE,Brooklyn,11216.0,3018590015.0,3053688.0,BK-03,36.0,273.0,BK0302,40.680654,-73.938474,40.680726,-73.938239,2020-10-21,Preservation,Yes,Non Prevailing Wage,1.0,,1.0,,,,,,,2.0,,,,,2.0,,2.0,2,2020.0
70023,ALBANY KINGSTON HDFC,10/21/2020,10/21/2020,183737.0,7,ALBANY AVENUE,Brooklyn,11216.0,3018590010.0,3053687.0,BK-03,36.0,273.0,BK0302,40.680561,-73.938452,40.680536,-73.938207,2020-10-21,Preservation,Yes,Non Prevailing Wage,19.0,2.0,2.0,,,1.0,,2.0,22.0,,,,,,24.0,,24.0,24,2020.0
70023,ALBANY KINGSTON HDFC,10/21/2020,10/21/2020,231918.0,305,DECATUR STREET,Brooklyn,11233.0,3016760001.0,3047131.0,BK-03,36.0,297.0,BK0302,40.681707,-73.93124,40.681891,-73.931539,2020-10-21,Preservation,Yes,Non Prevailing Wage,21.0,6.0,5.0,,,,,11.0,17.0,4.0,,,,,32.0,,32.0,32,2020.0
70023,ALBANY KINGSTON HDFC,10/21/2020,10/21/2020,311471.0,365,HERKIMER STREET,Brooklyn,11213.0,3018640073.0,3053877.0,BK-03,36.0,271.0,BK0302,40.679171,-73.940862,40.679396,-73.941096,2020-10-21,Preservation,Yes,Non Prevailing Wage,10.0,,1.0,,,,,6.0,3.0,2.0,,,,,11.0,,11.0,11,2020.0
70023,ALBANY KINGSTON HDFC,10/21/2020,10/21/2020,320852.0,12,KINGSTON AVENUE,Brooklyn,11213.0,3018630044.0,3053821.0,BK-03,36.0,271.0,BK0302,40.679495,-73.941258,40.679421,-73.94142,2020-10-21,Preservation,Yes,Non Prevailing Wage,7.0,3.0,1.0,,,,,3.0,6.0,2.0,,,,,11.0,,11.0,11,2020.0
70023,ALBANY KINGSTON HDFC,10/21/2020,10/21/2020,320965.0,37,KINGSTON AVENUE,Brooklyn,11213.0,3018710005.0,3054031.0,BK-03,36.0,271.0,BK0302,40.678583,-73.941317,40.678597,-73.940949,2020-10-21,Preservation,Yes,Non Prevailing Wage,4.0,2.0,3.0,,,,3.0,,6.0,,,,,,9.0,,9.0,9,2020.0
70023,ALBANY KINGSTON HDFC,10/21/2020,10/21/2020,320978.0,39,KINGSTON AVENUE,Brooklyn,11213.0,3018710003.0,3054030.0,BK-03,36.0,271.0,BK0302,40.678529,-73.94132,40.678534,-73.941057,2020-10-21,Preservation,Yes,Non Prevailing Wage,6.0,1.0,1.0,,,1.0,3.0,,6.0,,,,,,9.0,,9.0,9,2020.0
70023,ALBANY KINGSTON HDFC,10/21/2020,10/21/2020,334470.0,24,MAC DONOUGH STREET,Brooklyn,11216.0,3018540012.0,3053454.0,BK-03,36.0,269.0,BK0301,40.680831,-73.945234,40.680619,-73.945173,2020-10-21,Preservation,Yes,Non Prevailing Wage,6.0,4.0,2.0,,,,3.0,6.0,2.0,1.0,,,,,12.0,,12.0,12,2020.0
70023,ALBANY KINGSTON HDFC,10/21/2020,10/21/2020,334504.0,30,MAC DONOUGH STREET,Brooklyn,11216.0,3018540014.0,3053455.0,BK-03,36.0,269.0,BK0301,40.680852,-73.945064,40.680625,-73.94501,2020-10-21,Preservation,Yes,Non Prevailing Wage,9.0,6.0,1.0,,,,5.0,6.0,3.0,2.0,,,,,16.0,,16.0,16,2020.0
70023,ALBANY KINGSTON HDFC,10/21/2020,10/21/2020,334524.0,32,MAC DONOUGH STREET,Brooklyn,11216.0,3018540016.0,3053456.0,BK-03,36.0,269.0,BK0301,40.680858,-73.945007,40.680652,-73.944852,2020-10-21,Preservation,Yes,Non Prevailing Wage,13.0,,2.0,,,1.0,4.0,8.0,3.0,1.0,,,,,16.0,,16.0,16,2020.0
70023,ALBANY KINGSTON HDFC,10/21/2020,10/21/2020,334575.0,40,MAC DONOUGH STREET,Brooklyn,11216.0,3018540019.0,3053458.0,BK-03,36.0,269.0,BK0301,40.680885,-73.944779,40.68063,-73.94461,2020-10-21,Preservation,Yes,Non Prevailing Wage,12.0,2.0,2.0,,,,,,16.0,,,,,,16.0,,16.0,16,2020.0
70023,ALBANY KINGSTON HDFC,10/21/2020,10/21/2020,807555.0,12,ALBANY AVENUE,Brooklyn,11216.0,3018580024.0,3323669.0,BK-03,36.0,273.0,BK0302,40.680451,-73.938452,40.680451,-73.938759,2020-10-21,Preservation,Yes,Non Prevailing Wage,8.0,2.0,,,,,,4.0,,6.0,,,,,10.0,,10.0,10,2020.0
70023,ALBANY KINGSTON HDFC,10/21/2020,10/21/2020,807559.0,6,ALBANY AVENUE,Brooklyn,11216.0,3018580024.0,3323663.0,BK-03,36.0,273.0,BK0302,40.680599,-73.938481,40.680451,-73.938759,2020-10-21,Preservation,Yes,Non Prevailing Wage,5.0,2.0,3.0,,,,,4.0,,6.0,,,,,10.0,,10.0,10,2020.0
72480,66 LINDEN STREET,10/19/2020,1/21/2021,991994.0,66,LINDEN STREET,Brooklyn,11221.0,3033310005.0,3076239.0,BK-04,37.0,399.0,BK0402,40.691892,-73.92087,40.691771,-73.920653,2021-01-21,New Construction,No,Non Prevailing Wage,,,,,3.0,,,3.0,,,,,,,3.0,,3.0,8,2021.0
68496,FAIRSTEAD. 117 W 79 ST,10/16/2020,1/13/2023,35687.0,117,WEST 79 STREET,Manhattan,10024.0,1012100026.0,1031763.0,MN-07,6.0,165.0,MN0702,40.782276,-73.976229,40.782441,-73.975933,2023-01-13,Preservation,No,Prevailing Wage,77.0,,,,,1.0,78.0,,,,,,,,78.0,,78.0,78,2023.0
69490,HP MORNINGSIDE HEIGHTS PORTFOLIO HDFC.YR15.FY21,10/16/2020,7/14/2021,3933.0,2111,FREDERICK DOUGLASS BOULEVARD,Manhattan,10026.0,1018480012.0,1055833.0,MN-10,9.0,20102.0,MN1001,40.803216,-73.956262,40.803345,-73.956558,2021-07-14,Preservation,No,Non Prevailing Wage,8.0,,1.0,4.0,,,,,13.0,,,,,,13.0,,13.0,13,2021.0
69490,HP MORNINGSIDE HEIGHTS PORTFOLIO HDFC.YR15.FY21,10/16/2020,7/14/2021,3935.0,2113,FREDERICK DOUGLASS BOULEVARD,Manhattan,10026.0,1018480013.0,1055834.0,MN-10,9.0,20102.0,MN1001,40.80327,-73.956222,40.803408,-73.956511,2021-07-14,Preservation,No,Non Prevailing Wage,4.0,,3.0,2.0,,,,1.0,5.0,3.0,,,,,9.0,,9.0,9,2021.0
69490,HP MORNINGSIDE HEIGHTS PORTFOLIO HDFC.YR15.FY21,10/16/2020,7/14/2021,3937.0,2115,FREDERICK DOUGLASS BOULEVARD,Manhattan,10026.0,1018480014.0,1055835.0,MN-10,9.0,20102.0,MN1001,40.803325,-73.956182,40.803468,-73.956467,2021-07-14,Preservation,No,Non Prevailing Wage,5.0,1.0,1.0,2.0,,,,1.0,5.0,3.0,,,,,9.0,,9.0,9,2021.0
69490,HP MORNINGSIDE HEIGHTS PORTFOLIO HDFC.YR15.FY21,10/16/2020,7/14/2021,3939.0,2117,FREDERICK DOUGLASS BOULEVARD,Manhattan,10026.0,1018480015.0,1055836.0,MN-10,9.0,20102.0,MN1001,40.80338,-73.956142,40.803528,-73.956424,2021-07-14,Preservation,No,Non Prevailing Wage,7.0,1.0,,1.0,,,,1.0,6.0,2.0,,,,,9.0,,9.0,9,2021.0
69490,HP MORNINGSIDE HEIGHTS PORTFOLIO HDFC.YR15.FY21,10/16/2020,7/14/2021,3943.0,2121,FREDERICK DOUGLASS BOULEVARD,Manhattan,10026.0,1018480017.0,1055838.0,MN-10,9.0,20102.0,MN1001,40.80349,-73.956059,40.803649,-73.956337,2021-07-14,Preservation,No,Non Prevailing Wage,4.0,2.0,,3.0,,,,,6.0,3.0,,,,,9.0,,9.0,9,2021.0
69490,HP MORNINGSIDE HEIGHTS PORTFOLIO HDFC.YR15.FY21,10/16/2020,7/14/2021,3945.0,2123,FREDERICK DOUGLASS BOULEVARD,Manhattan,10026.0,1018480018.0,1055839.0,MN-10,9.0,20102.0,MN1001,40.803545,-73.95602,40.80371,-73.95629,2021-07-14,Preservation,No,Non Prevailing Wage,5.0,,1.0,3.0,,,,,6.0,3.0,,,,,9.0,,9.0,9,2021.0
69490,HP MORNINGSIDE HEIGHTS PORTFOLIO HDFC.YR15.FY21,10/16/2020,7/14/2021,6085.0,955,AMSTERDAM AVENUE,Manhattan,10025.0,1018610061.0,1055978.0,MN-07,7.0,193.0,MN0703,40.800979,-73.9653,40.800888,-73.964982,2021-07-14,Preservation,No,Non Prevailing Wage,,,9.0,4.0,,,,9.0,3.0,1.0,,,,,13.0,,13.0,13,2021.0
69490,HP MORNINGSIDE HEIGHTS PORTFOLIO HDFC.YR15.FY21,10/16/2020,7/14/2021,6088.0,963,AMSTERDAM AVENUE,Manhattan,10025.0,1018620002.0,1055984.0,MN-07,7.0,193.0,MN0703,40.801251,-73.965101,40.801143,-73.964791,2021-07-14,Preservation,No,Non Prevailing Wage,7.0,2.0,3.0,1.0,,,,13.0,,,,,,,13.0,,13.0,13,2021.0
69490,HP MORNINGSIDE HEIGHTS PORTFOLIO HDFC.YR15.FY21,10/16/2020,7/14/2021,9824.0,924,COLUMBUS AVENUE,Manhattan,10025.0,1018600031.0,1055937.0,MN-07,7.0,189.0,MN0703,40.798785,-73.963207,40.798892,-73.96347,2021-07-14,Preservation,No,Non Prevailing Wage,4.0,,2.0,2.0,,,,8.0,,,,,,,8.0,,8.0,8,2021.0
69490,HP MORNINGSIDE HEIGHTS PORTFOLIO HDFC.YR15.FY21,10/16/2020,7/14/2021,9826.0,926,COLUMBUS AVENUE,Manhattan,10025.0,1018600032.0,1055938.0,MN-07,7.0,189.0,MN0703,40.798846,-73.963163,40.798958,-73.963423,2021-07-14,Preservation,No,Non Prevailing Wage,2.0,,1.0,4.0,,,,7.0,,,,,,,7.0,,7.0,8,2021.0
69490,HP MORNINGSIDE HEIGHTS PORTFOLIO HDFC.YR15.FY21,10/16/2020,7/14/2021,9828.0,928,COLUMBUS AVENUE,Manhattan,10025.0,1018600033.0,1055939.0,MN-07,7.0,189.0,MN0703,40.798903,-73.96312,40.799021,-73.963376,2021-07-14,Preservation,No,Non Prevailing Wage,,,4.0,4.0,,,,8.0,,,,,,,8.0,,8.0,8,2021.0
69490,HP MORNINGSIDE HEIGHTS PORTFOLIO HDFC.YR15.FY21,10/16/2020,7/14/2021,25230.0,344,MANHATTAN AVENUE,Manhattan,10026.0,1018480004.0,1055825.0,MN-10,9.0,20102.0,MN1001,40.804001,-73.957565,40.803894,-73.957298,2021-07-14,Preservation,No,Non Prevailing Wage,6.0,1.0,,3.0,,,,3.0,5.0,2.0,,,,,10.0,,10.0,10,2021.0
69490,HP MORNINGSIDE HEIGHTS PORTFOLIO HDFC.YR15.FY21,10/16/2020,7/14/2021,37663.0,170,WEST 107 STREET,Manhattan,10025.0,1018610059.0,1055976.0,MN-07,7.0,193.0,MN0703,40.800685,-73.964228,40.800674,-73.964766,2021-07-14,Preservation,No,Non Prevailing Wage,1.0,2.0,6.0,6.0,,,,14.0,1.0,,,,,,15.0,,15.0,15,2021.0
69490,HP MORNINGSIDE HEIGHTS PORTFOLIO HDFC.YR15.FY21,10/16/2020,7/14/2021,37665.0,172,WEST 107 STREET,Manhattan,10025.0,1018610060.0,1055977.0,MN-07,7.0,193.0,MN0703,40.800704,-73.964267,40.80071,-73.964845,2021-07-14,Preservation,No,Non Prevailing Wage,4.0,1.0,2.0,6.0,,,,12.0,1.0,,,,,,13.0,,13.0,15,2021.0
69490,HP MORNINGSIDE HEIGHTS PORTFOLIO HDFC.YR15.FY21,10/16/2020,7/14/2021,37772.0,118,WEST 109 STREET,Manhattan,10025.0,1018630045.0,1056013.0,MN-07,7.0,193.0,MN0703,40.801499,-73.962255,40.801467,-73.962743,2021-07-14,Preservation,No,Non Prevailing Wage,4.0,,1.0,3.0,,,,2.0,6.0,,,,,,8.0,,8.0,15,2021.0
69490,HP MORNINGSIDE HEIGHTS PORTFOLIO HDFC.YR15.FY21,10/16/2020,7/14/2021,37773.0,120,WEST 109 STREET,Manhattan,10025.0,1018630046.0,1056014.0,MN-07,7.0,193.0,MN0703,40.801516,-73.962295,40.8015,-73.962822,2021-07-14,Preservation,No,Non Prevailing Wage,5.0,1.0,3.0,4.0,,,,3.0,9.0,1.0,,,,,13.0,,13.0,15,2021.0
69490,HP MORNINGSIDE HEIGHTS PORTFOLIO HDFC.YR15.FY21,10/16/2020,7/14/2021,37779.0,136,WEST 109 STREET,Manhattan,10025.0,1018630054.0,1056022.0,MN-07,7.0,193.0,MN0703,40.801653,-73.96262,40.801766,-73.963454,2021-07-14,Preservation,No,Non Prevailing Wage,3.0,,,3.0,,,,,,6.0,,,,,6.0,,6.0,10,2021.0
69490,HP MORNINGSIDE HEIGHTS PORTFOLIO HDFC.YR15.FY21,10/16/2020,7/14/2021,37780.0,138,WEST 109 STREET,Manhattan,10025.0,1018630055.0,1056023.0,MN-07,7.0,193.0,MN0703,40.801673,-73.962663,40.801799,-73.963534,2021-07-14,Preservation,No,Non Prevailing Wage,2.0,1.0,,5.0,,,,,,8.0,,,,,8.0,,8.0,10,2021.0
69490,HP MORNINGSIDE HEIGHTS PORTFOLIO HDFC.YR15.FY21,10/16/2020,7/14/2021,37781.0,140,WEST 109 STREET,Manhattan,10025.0,1018630056.0,1056024.0,MN-07,7.0,193.0,MN0703,40.801689,-73.962703,40.801832,-73.963613,2021-07-14,Preservation,No,Non Prevailing Wage,6.0,,1.0,1.0,,,1.0,,1.0,6.0,,,,,8.0,,8.0,12,2021.0
69490,HP MORNINGSIDE HEIGHTS PORTFOLIO HDFC.YR15.FY21,10/16/2020,7/14/2021,37787.0,202,WEST 109 STREET,Manhattan,10025.0,1018800037.0,1056683.0,MN-07,7.0,195.0,MN0703,40.802527,-73.964693,40.802409,-73.964974,2021-07-14,Preservation,No,Non Prevailing Wage,11.0,,1.0,6.0,,1.0,,1.0,12.0,4.0,2.0,,,,19.0,,19.0,26,2021.0
69490,HP MORNINGSIDE HEIGHTS PORTFOLIO HDFC.YR15.FY21,10/16/2020,7/14/2021,37788.0,203,WEST 109 STREET,Manhattan,10025.0,1018810028.0,1056711.0,MN-07,7.0,195.0,MN0703,40.802716,-73.965093,40.802771,-73.964685,2021-07-14,Preservation,No,Non Prevailing Wage,1.0,,2.0,8.0,,,,2.0,8.0,,1.0,,,,11.0,,11.0,16,2021.0
69490,HP MORNINGSIDE HEIGHTS PORTFOLIO HDFC.YR15.FY21,10/16/2020,7/14/2021,37789.0,205,WEST 109 STREET,Manhattan,10025.0,1018810027.0,1056710.0,MN-07,7.0,195.0,MN0703,40.80273,-73.965126,40.802807,-73.964768,2021-07-14,Preservation,No,Non Prevailing Wage,5.0,,,4.0,,,,1.0,6.0,2.0,,,,,9.0,,9.0,16,2021.0
69490,HP MORNINGSIDE HEIGHTS PORTFOLIO HDFC.YR15.FY21,10/16/2020,7/14/2021,37790.0,206,WEST 109 STREET,Manhattan,10025.0,1018800039.0,1056684.0,MN-07,7.0,195.0,MN0703,40.802716,-73.965137,40.802461,-73.965101,2021-07-14,Preservation,No,Non Prevailing Wage,4.0,,1.0,3.0,,,,1.0,3.0,2.0,2.0,,,,8.0,,8.0,25,2021.0
69490,HP MORNINGSIDE HEIGHTS PORTFOLIO HDFC.YR15.FY21,10/16/2020,7/14/2021,37791.0,207,WEST 109 STREET,Manhattan,10025.0,1018810026.0,1056709.0,MN-07,7.0,195.0,MN0703,40.802744,-73.965158,40.80284,-73.964848,2021-07-14,Preservation,No,Non Prevailing Wage,3.0,1.0,2.0,2.0,,,,1.0,5.0,2.0,,,,,8.0,,8.0,16,2021.0
69490,HP MORNINGSIDE HEIGHTS PORTFOLIO HDFC.YR15.FY21,10/16/2020,7/14/2021,37792.0,209,WEST 109 STREET,Manhattan,10025.0,1018810025.0,1056708.0,MN-07,7.0,195.0,MN0703,40.802757,-73.965191,40.802873,-73.964931,2021-07-14,Preservation,No,Non Prevailing Wage,1.0,,1.0,6.0,,1.0,,1.0,7.0,1.0,,,,,9.0,,9.0,16,2021.0
69490,HP MORNINGSIDE HEIGHTS PORTFOLIO HDFC.YR15.FY21,10/16/2020,7/14/2021,37794.0,211,WEST 109 STREET,Manhattan,10025.0,1018810024.0,1056707.0,MN-07,7.0,195.0,MN0703,40.802771,-73.965227,40.802917,-73.965028,2021-07-14,Preservation,No,Non Prevailing Wage,6.0,,2.0,1.0,,,,,8.0,1.0,,,,,9.0,,9.0,25,2021.0
69490,HP MORNINGSIDE HEIGHTS PORTFOLIO HDFC.YR15.FY21,10/16/2020,7/14/2021,37795.0,212,WEST 109 STREET,Manhattan,10025.0,1018800042.0,1056686.0,MN-07,7.0,195.0,MN0703,40.802757,-73.965238,40.802568,-73.965357,2021-07-14,Preservation,No,Non Prevailing Wage,10.0,,,1.0,,,,,3.0,7.0,1.0,,,,11.0,,11.0,20,2021.0
69490,HP MORNINGSIDE HEIGHTS PORTFOLIO HDFC.YR15.FY21,10/16/2020,7/14/2021,37796.0,214,WEST 109 STREET,Manhattan,10025.0,1018800044.0,1056687.0,MN-07,7.0,195.0,MN0703,40.802774,-73.965274,40.80262,-73.96548,2021-07-14,Preservation,No,Non Prevailing Wage,4.0,,,5.0,,,,,6.0,2.0,1.0,,,,9.0,,9.0,20,2021.0
69490,HP MORNINGSIDE HEIGHTS PORTFOLIO HDFC.YR15.FY21,10/16/2020,7/14/2021,37799.0,225,WEST 109 STREET,Manhattan,10025.0,1018810019.0,1056704.0,MN-07,7.0,195.0,MN0703,40.80287,-73.965458,40.803048,-73.965343,2021-07-14,Preservation,No,Non Prevailing Wage,2.0,2.0,3.0,4.0,,,,,4.0,1.0,6.0,,,,11.0,,11.0,25,2021.0
69490,HP MORNINGSIDE HEIGHTS PORTFOLIO HDFC.YR15.FY21,10/16/2020,7/14/2021,37801.0,233,WEST 109 STREET,Manhattan,10025.0,1018810015.0,1056702.0,MN-07,7.0,195.0,MN0703,40.802928,-73.965592,40.803186,-73.965668,2021-07-14,Preservation,No,Non Prevailing Wage,6.0,2.0,,6.0,,,,,5.0,3.0,5.0,1.0,,,14.0,,14.0,25,2021.0
69490,HP MORNINGSIDE HEIGHTS PORTFOLIO HDFC.YR15.FY21,10/16/2020,7/14/2021,37803.0,241,WEST 109 STREET,Manhattan,10025.0,1018810012.0,1056700.0,MN-07,7.0,195.0,MN0703,40.802983,-73.965725,40.803301,-73.965942,2021-07-14,Preservation,No,Non Prevailing Wage,6.0,1.0,1.0,6.0,,,,2.0,12.0,,,,,,14.0,,14.0,16,2021.0
69490,HP MORNINGSIDE HEIGHTS PORTFOLIO HDFC.YR15.FY21,10/16/2020,7/14/2021,37805.0,243,WEST 109 STREET,Manhattan,10025.0,1018810011.0,1056699.0,MN-07,7.0,195.0,MN0703,40.802999,-73.965762,40.803334,-73.966021,2021-07-14,Preservation,No,Non Prevailing Wage,3.0,,1.0,6.0,,,,3.0,7.0,,,,,,10.0,,10.0,16,2021.0
69490,HP MORNINGSIDE HEIGHTS PORTFOLIO HDFC.YR15.FY21,10/16/2020,7/14/2021,37807.0,245,WEST 109 STREET,Manhattan,10025.0,1018810010.0,1056698.0,MN-07,7.0,195.0,MN0703,40.803013,-73.965794,40.80337,-73.966101,2021-07-14,Preservation,No,Non Prevailing Wage,4.0,,,4.0,,,,3.0,4.0,1.0,,,,,8.0,,8.0,15,2021.0
69490,HP MORNINGSIDE HEIGHTS PORTFOLIO HDFC.YR15.FY21,10/16/2020,7/14/2021,37809.0,247,WEST 109 STREET,Manhattan,10025.0,1018810009.0,1056697.0,MN-07,7.0,195.0,MN0703,40.803027,-73.965827,40.8034,-73.96618,2021-07-14,Preservation,No,Non Prevailing Wage,4.0,,,6.0,,,,3.0,6.0,1.0,,,,,10.0,,10.0,15,2021.0
69490,HP MORNINGSIDE HEIGHTS PORTFOLIO HDFC.YR15.FY21,10/16/2020,7/14/2021,37810.0,249,WEST 109 STREET,Manhattan,10025.0,1018810008.0,1056696.0,MN-07,7.0,195.0,MN0703,40.80304,-73.965859,40.803433,-73.96626,2021-07-14,Preservation,No,Non Prevailing Wage,3.0,,,10.0,,,3.0,2.0,8.0,,,,,,13.0,,13.0,17,2021.0
69490,HP MORNINGSIDE HEIGHTS PORTFOLIO HDFC.YR15.FY21,10/16/2020,7/14/2021,37811.0,251,WEST 109 STREET,Manhattan,10025.0,1018810007.0,1056695.0,MN-07,7.0,195.0,MN0703,40.803054,-73.965895,40.803469,-73.966339,2021-07-14,Preservation,No,Non Prevailing Wage,3.0,,1.0,5.0,,,2.0,1.0,6.0,,,,,,9.0,,9.0,16,2021.0
69490,HP MORNINGSIDE HEIGHTS PORTFOLIO HDFC.YR15.FY21,10/16/2020,7/14/2021,38162.0,303,WEST 114 STREET,Manhattan,10026.0,1018480011.0,1055832.0,MN-10,9.0,20102.0,MN1001,40.803235,-73.956576,40.803515,-73.956684,2021-07-14,Preservation,No,Non Prevailing Wage,5.0,,1.0,4.0,,,1.0,5.0,,4.0,,,,,10.0,,10.0,10,2021.0
69490,HP MORNINGSIDE HEIGHTS PORTFOLIO HDFC.YR15.FY21,10/16/2020,7/14/2021,38164.0,305,WEST 114 STREET,Manhattan,10026.0,1018480010.0,1055831.0,MN-10,9.0,20102.0,MN1001,40.803251,-73.956619,40.803548,-73.956764,2021-07-14,Preservation,No,Non Prevailing Wage,10.0,,2.0,3.0,,,,10.0,4.0,1.0,,,,,15.0,,15.0,15,2021.0
69490,HP MORNINGSIDE HEIGHTS PORTFOLIO HDFC.YR15.FY21,10/16/2020,7/14/2021,38166.0,307,WEST 114 STREET,Manhattan,10026.0,1018480009.0,1055830.0,MN-10,9.0,20102.0,MN1001,40.803271,-73.956663,40.803584,-73.956847,2021-07-14,Preservation,No,Non Prevailing Wage,7.0,,2.0,6.0,,,,8.0,3.0,4.0,,,,,15.0,,15.0,15,2021.0
69490,HP MORNINGSIDE HEIGHTS PORTFOLIO HDFC.YR15.FY21,10/16/2020,7/14/2021,38168.0,309,WEST 114 STREET,Manhattan,10026.0,1018480008.0,1055829.0,MN-10,9.0,20102.0,MN1001,40.803287,-73.956702,40.803619,-73.956933,2021-07-14,Preservation,No,Non Prevailing Wage,7.0,1.0,4.0,3.0,,,,11.0,4.0,,,,,,15.0,,15.0,15,2021.0
69490,HP MORNINGSIDE HEIGHTS PORTFOLIO HDFC.YR15.FY21,10/16/2020,7/14/2021,38170.0,311,WEST 114 STREET,Manhattan,10026.0,1018480007.0,1055828.0,MN-10,9.0,20102.0,MN1001,40.803306,-73.956746,40.803658,-73.95702,2021-07-14,Preservation,No,Non Prevailing Wage,9.0,1.0,2.0,3.0,,,,11.0,2.0,2.0,,,,,15.0,,15.0,15,2021.0
69490,HP MORNINGSIDE HEIGHTS PORTFOLIO HDFC.YR15.FY21,10/16/2020,7/14/2021,38173.0,315,WEST 114 STREET,Manhattan,10026.0,1018480005.0,1055826.0,MN-10,9.0,20102.0,MN1001,40.803342,-73.956832,40.803724,-73.957182,2021-07-14,Preservation,No,Non Prevailing Wage,4.0,,3.0,3.0,,,,6.0,2.0,2.0,,,,,10.0,,10.0,10,2021.0
69490,HP MORNINGSIDE HEIGHTS PORTFOLIO HDFC.YR15.FY21,10/16/2020,7/14/2021,38228.0,213,WEST 115 STREET,Manhattan,10026.0,1018310121.0,1055252.0,MN-10,9.0,218.0,MN1001,40.802863,-73.953781,40.803173,-73.953928,2021-07-14,Preservation,No,Non Prevailing Wage,3.0,2.0,,1.0,,,1.0,,1.0,4.0,,,,,6.0,,6.0,6,2021.0
69490,HP MORNINGSIDE HEIGHTS PORTFOLIO HDFC.YR15.FY21,10/16/2020,7/14/2021,38232.0,221,WEST 115 STREET,Manhattan,10026.0,1018310018.0,1055231.0,MN-10,9.0,218.0,MN1001,40.803001,-73.954098,40.803281,-73.954178,2021-07-14,Preservation,No,Non Prevailing Wage,2.0,,1.0,2.0,,,,,3.0,1.0,,1.0,,,5.0,,5.0,5,2021.0
69490,HP MORNINGSIDE HEIGHTS PORTFOLIO HDFC.YR15.FY21,10/16/2020,7/14/2021,38236.0,229,WEST 115 STREET,Manhattan,10026.0,1018310014.0,1055229.0,MN-10,9.0,218.0,MN1001,40.803207,-73.954582,40.803401,-73.954463,2021-07-14,Preservation,No,Non Prevailing Wage,1.0,2.0,2.0,15.0,,,,2.0,4.0,7.0,7.0,,,,20.0,,20.0,20,2021.0
69490,HP MORNINGSIDE HEIGHTS PORTFOLIO HDFC.YR15.FY21,10/16/2020,7/14/2021,38237.0,233,WEST 115 STREET,Manhattan,10026.0,1018310013.0,1055228.0,MN-10,9.0,218.0,MN1001,40.803259,-73.954701,40.803451,-73.954582,2021-07-14,Preservation,No,Non Prevailing Wage,5.0,,1.0,6.0,,1.0,,6.0,2.0,3.0,2.0,,,,13.0,,13.0,13,2021.0
69490,HP MORNINGSIDE HEIGHTS PORTFOLIO HDFC.YR15.FY21,10/16/2020,7/14/2021,38240.0,241,WEST 115 STREET,Manhattan,10026.0,1018310009.0,1055225.0,MN-10,9.0,218.0,MN1001,40.80338,-73.954987,40.803583,-73.954896,2021-07-14,Preservation,No,Non Prevailing Wage,3.0,1.0,,6.0,,,,2.0,6.0,2.0,,,,,10.0,,10.0,10,2021.0
69490,HP MORNINGSIDE HEIGHTS PORTFOLIO HDFC.YR15.FY21,10/16/2020,7/14/2021,38241.0,243,WEST 115 STREET,Manhattan,10026.0,1018310008.0,1055224.0,MN-10,9.0,218.0,MN1001,40.803413,-73.955062,40.803616,-73.954972,2021-07-14,Preservation,No,Non Prevailing Wage,1.0,1.0,,8.0,,,,,4.0,4.0,2.0,,,,10.0,,10.0,10,2021.0
68859,241 WEST 28TH STREET,10/15/2020,12/14/2023,991649.0,241,WEST 28 STREET,Manhattan,10001.0,1007780018.0,1014254.0,MN-05,3.0,95.0,MN0501,40.747769,-73.99459,40.748367,-73.99511,2023-12-14,New Construction,No,Non Prevailing Wage,,,144.0,,,,58.0,75.0,10.0,1.0,,,,,144.0,,144.0,480,2023.0
68405,CG TRIO LLC.PILLARS.FY21 (CARROLL GARDENS),10/14/2020,2/3/2023,217813.0,239,CARROLL STREET,Brooklyn,11231.0,3004490012.0,3007544.0,BK-06,39.0,77.0,BK0601,40.680923,-73.996066,40.680734,-73.996196,2022-06-03,Preservation,No,Non Prevailing Wage,,3.0,3.0,2.0,1.0,,,7.0,2.0,,,,,,9.0,,9.0,9,2022.0
68405,CG TRIO LLC.PILLARS.FY21 (CARROLL GARDENS),10/14/2020,2/3/2023,365721.0,213,SACKETT STREET,Brooklyn,11231.0,3003320052.0,3004178.0,BK-06,39.0,67.0,BK0601,40.684022,-73.998926,40.684203,-73.998922,2022-06-03,Preservation,No,Non Prevailing Wage,,5.0,2.0,,,,,7.0,,,,,,,7.0,,7.0,7,2022.0
68405,CG TRIO LLC.PILLARS.FY21 (CARROLL GARDENS),10/14/2020,2/3/2023,809200.0,275,PRESIDENT STREET,Brooklyn,11231.0,3004350001.0,3007215.0,BK-06,39.0,75.0,BK0601,40.681541,-73.995706,40.681733,-73.995893,2023-02-03,Preservation,No,Non Prevailing Wage,,6.0,8.0,1.0,,,3.0,8.0,4.0,,,,,,15.0,,15.0,15,2023.0
68296,EVERGREEN AND TIEBOUT LLC.PILLARS.FY21,10/13/2020,6/3/2022,77232.0,1160,EVERGREEN AVENUE,Bronx,10472.0,2037380027.0,2023772.0,BX-09,17.0,5002.0,BX0901,40.827316,-73.880774,40.827549,-73.880553,2022-06-03,Preservation,No,Non Prevailing Wage,4.0,14.0,41.0,2.0,,,,38.0,23.0,,,,,,61.0,,61.0,61,2022.0
68296,EVERGREEN AND TIEBOUT LLC.PILLARS.FY21,10/13/2020,6/3/2022,114418.0,2240,TIEBOUT AVENUE,Bronx,10457.0,2031430150.0,2013321.0,BX-05,15.0,38303.0,BX0503,40.855583,-73.897879,40.855578,-73.897587,2022-06-03,Preservation,No,Non Prevailing Wage,6.0,9.0,40.0,1.0,,1.0,,42.0,10.0,5.0,,,,,57.0,,57.0,57,2022.0
70501,148 BLEECKER STREET APARTMENT,10/13/2020,3/18/2022,996509.0,148,BLEECKER STREET,Brooklyn,11221.0,3033060018.0,3325707.0,BK-04,37.0,419.0,BK0402,40.69625,-73.920104,40.696107,-73.919916,2022-03-18,New Construction,No,Non Prevailing Wage,,,,,8.0,,1.0,3.0,4.0,,,,,,8.0,,8.0,26,2022.0
72281,2203 CLARENDON ROAD,10/13/2020,8/19/2022,1002744.0,2203,CLARENDON ROAD,Brooklyn,11226.0,3051660051.0,3425803.0,BK-14,40.0,79201.0,BK1401,40.642787,-73.956273,40.643075,-73.956269,2022-08-19,New Construction,No,Non Prevailing Wage,,,,,7.0,,,1.0,5.0,1.0,,,,,7.0,,7.0,23,2022.0
68351,1414 WALTON LLC.PILLARS.FY21,10/6/2020,6/3/2022,119046.0,1416,WALTON AVENUE,Bronx,10452.0,2028430074.0,2008101.0,BX-04,16.0,223.0,BX0403,40.839964,-73.915637,40.839945,-73.915345,2022-06-03,Preservation,No,Non Prevailing Wage,7.0,36.0,17.0,,,,4.0,32.0,15.0,9.0,,,,,60.0,,60.0,60,2022.0
70500,33-29 103 STREET APARTMENTS,10/5/2020,1/22/2021,984917.0,33-29,103 STREET,Queens,11368.0,4017180063.0,4623016.0,QN-03,21.0,379.0,QN0303,40.757004,-73.865552,40.756726,-73.865152,2021-01-22,New Construction,No,Non Prevailing Wage,,,,,3.0,,,3.0,,,,,,,3.0,,3.0,10,2021.0
70496,1780 SHEEPSHEAD BAY ROAD,10/2/2020,10/1/2021,369161.0,1780,SHEEPSHEAD BAY ROAD,Brooklyn,11235.0,3087717503.0,3426699.0,BK-15,48.0,608.0,BK1503,40.584173,-73.950811,40.58417,-73.951088,2021-10-01,New Construction,No,Non Prevailing Wage,,,,,7.0,,1.0,2.0,4.0,,,,,,7.0,,7.0,23,2021.0
51175,BROOK 156,10/1/2020,4/2/2024,927217.0,740,BROOK AVENUE,Bronx,10451.0,2023607502.0,2129384.0,BX-01,17.0,71.0,BX0102,40.820013,-73.912017,40.819955,-73.911783,2022-11-21,New Construction,No,Non Prevailing Wage,15.0,14.0,19.0,3.0,,1.0,11.0,19.0,14.0,8.0,,,,,52.0,,52.0,52,2022.0
70499,222 EAST 44TH STREET PHASE II,10/1/2020,3/19/2021,13694.0,212,EAST 44 STREET,Manhattan,10017.0,1013177501.0,1000000.0,MN-06,4.0,88.0,MN0603,40.751836,-73.972981,40.751312,-73.972689,2021-03-19,New Construction,No,Non Prevailing Wage,,,,16.0,,,8.0,7.0,1.0,,,,,,16.0,,16.0,429,2021.0
70567,THE COVE 43-12 HUNTER STREET,10/1/2020,9/2/2022,666040.0,43-12,HUNTER STREET,Queens,11101.0,4004340016.0,4620265.0,QN-02,26.0,1902.0,QN0201,40.748103,-73.94206,40.748177,-73.942417,2022-09-02,New Construction,No,Non Prevailing Wage,,,,,37.0,,19.0,13.0,5.0,,,,,,37.0,,37.0,123,2022.0
58479,SOUNDVIEW HOMES - PHASE III,9/30/2020,1/26/2024,989176.0,1739,LACOMBE AVENUE,Bronx,10473.0,2035150020.0,2129207.0,BX-09,18.0,2001.0,BX0902,40.814533,-73.86528,40.814652,-73.866205,2023-12-13,New Construction,No,Non Prevailing Wage,,,,8.0,,,,4.0,,4.0,,,,,,8.0,8.0,8,2023.0
58479,SOUNDVIEW HOMES - PHASE III,9/30/2020,1/26/2024,989177.0,1735,LACOMBE AVENUE,Bronx,10473.0,2035150020.0,2129208.0,BX-09,18.0,2001.0,BX0902,40.814525,-73.865335,40.814652,-73.866205,2023-12-27,New Construction,No,Non Prevailing Wage,,,,8.0,,,,4.0,4.0,,,,,,,8.0,8.0,8,2023.0
58479,SOUNDVIEW HOMES - PHASE III,9/30/2020,1/26/2024,989178.0,1731,LACOMBE AVENUE,Bronx,10473.0,2035150020.0,2129209.0,BX-09,18.0,2001.0,BX0902,40.814519,-73.865389,40.814652,-73.866205,2023-12-14,New Construction,No,Non Prevailing Wage,,,,8.0,,,,1.0,7.0,,,,,,,8.0,8.0,8,2023.0
58479,SOUNDVIEW HOMES - PHASE III,9/30/2020,1/26/2024,989179.0,1727,LACOMBE AVENUE,Bronx,10473.0,2035150020.0,2129210.0,BX-09,18.0,2001.0,BX0902,40.814514,-73.865443,40.814652,-73.866205,2024-01-16,New Construction,No,Non Prevailing Wage,,,,8.0,,,,1.0,7.0,,,,,,,8.0,8.0,8,2024.0
58479,SOUNDVIEW HOMES - PHASE III,9/30/2020,1/26/2024,989181.0,1723,LACOMBE AVENUE,Bronx,10473.0,2035150020.0,2129204.0,BX-09,18.0,2001.0,BX0902,40.814509,-73.865493,40.814652,-73.866205,2023-12-15,New Construction,No,Non Prevailing Wage,,,,4.0,,,,,4.0,,,,,,,4.0,4.0,4,2023.0
58479,SOUNDVIEW HOMES - PHASE III,9/30/2020,1/26/2024,989182.0,1719,LACOMBE AVENUE,Bronx,10473.0,2035150020.0,2129206.0,BX-09,18.0,2001.0,BX0902,40.8145,-73.865548,40.814652,-73.866205,2023-12-13,New Construction,No,Non Prevailing Wage,,,,4.0,,,,,4.0,,,,,,,4.0,4.0,4,2023.0
58479,SOUNDVIEW HOMES - PHASE III,9/30/2020,1/26/2024,996068.0,1715,LACOMBE AVENUE,Bronx,10473.0,2035150001.0,2092605.0,BX-09,18.0,2001.0,BX0902,40.814487,-73.865674,40.815663,-73.86673,2024-01-26,New Construction,No,Non Prevailing Wage,,,,8.0,,,,4.0,4.0,,,,,,,8.0,8.0,8,2024.0
58479,SOUNDVIEW HOMES - PHASE III,9/30/2020,1/26/2024,996069.0,351,BRONX RIVER AVENUE,Bronx,10473.0,2035150020.0,2129205.0,BX-09,18.0,2001.0,BX0902,40.814447,-73.866801,40.814652,-73.866205,2023-12-13,New Construction,No,Non Prevailing Wage,,,,8.0,,,,5.0,3.0,,,,,,,8.0,8.0,8,2023.0
58479,SOUNDVIEW HOMES - PHASE III,9/30/2020,1/26/2024,996070.0,359,BRONX RIVER AVENUE,Bronx,10473.0,2035150020.0,2129212.0,BX-09,18.0,2001.0,BX0902,40.814483,-73.866928,40.814652,-73.866205,2023-12-13,New Construction,No,Non Prevailing Wage,,,,8.0,,,,4.0,,4.0,,,,,,8.0,8.0,8,2023.0
58479,SOUNDVIEW HOMES - PHASE III,9/30/2020,1/26/2024,996071.0,355,BRONX RIVER AVENUE,Bronx,10473.0,2035150020.0,2129211.0,BX-09,18.0,2001.0,BX0902,40.814463,-73.866866,40.814652,-73.866205,2023-12-13,New Construction,No,Non Prevailing Wage,,,,8.0,,,,4.0,,4.0,,,,,,8.0,8.0,8,2023.0
68231,MMN1902 - LEMLE WEST 117 STREET,9/30/2020,3/29/2023,38449.0,138,WEST 117 STREET,Manhattan,10026.0,1019010051.0,1057415.0,MN-10,9.0,218.0,MN1001,40.803422,-73.95093,40.803208,-73.950988,2023-03-29,Preservation,No,Non Prevailing Wage,,12.0,14.0,,,1.0,4.0,11.0,11.0,1.0,,,,,27.0,,27.0,27,2023.0
68231,MMN1902 - LEMLE WEST 117 STREET,9/30/2020,3/29/2023,38468.0,264,WEST 117 STREET,Manhattan,10026.0,1019220053.0,1058380.0,MN-10,9.0,218.0,MN1001,40.804711,-73.953978,40.804461,-73.953949,2022-06-16,Preservation,No,Non Prevailing Wage,,5.0,9.0,,,,4.0,5.0,4.0,1.0,,,,,14.0,,14.0,14,2022.0
70274,51-55 VERONICA PLACE,9/30/2020,6/17/2021,993745.0,49,VERONICA PLACE,Brooklyn,11226.0,3051070093.0,3425585.0,BK-17,40.0,794.0,BK1701,40.649296,-73.952849,40.649272,-73.95268,2021-06-17,New Construction,No,Non Prevailing Wage,,,,,6.0,,,6.0,,,,,,,6.0,,6.0,14,2021.0
70272,2490 3RD AVENUE,9/29/2020,10/1/2021,988947.0,2490,3 AVENUE,Bronx,10454.0,2023187501.0,2130381.0,BX-01,8.0,51.0,BX0101,40.810009,-73.928637,40.809923,-73.928283,2021-10-01,New Construction,No,Non Prevailing Wage,,,,,9.0,,2.0,5.0,2.0,,,,,,9.0,,9.0,28,2021.0
70273,SEA BREEZE TOWER,9/29/2020,10/1/2021,998002.0,271,SEA BREEZE AVENUE,Brooklyn,11224.0,,,BK-13,48.0,35602.0,BK1302,40.575929,-73.971926,,,2021-10-01,New Construction,No,Non Prevailing Wage,,,,,34.0,,7.0,12.0,11.0,4.0,,,,,34.0,,34.0,112,2021.0
66807,EAST BROOKLYN NCP,9/25/2020,10/12/2023,986336.0,581,BELMONT AVENUE,Brooklyn,11207.0,3040120032.0,3428581.0,BK-05,42.0,1150.0,BK0502,40.671759,-73.887944,40.671973,-73.887973,2023-07-21,New Construction,No,Non Prevailing Wage,2.0,6.0,7.0,,,1.0,,10.0,6.0,,,,,,16.0,,16.0,16,2023.0
66807,EAST BROOKLYN NCP,9/25/2020,10/12/2023,991742.0,190,ESSEX STREET,Brooklyn,11208.0,3039560059.0,3428583.0,BK-05,37.0,1168.0,BK0501,40.679859,-73.882732,40.679755,-73.883114,2023-09-21,New Construction,No,Non Prevailing Wage,4.0,2.0,9.0,,,,,9.0,6.0,,,,,,15.0,,15.0,15,2023.0
66807,EAST BROOKLYN NCP,9/25/2020,10/12/2023,996128.0,223-227,VERMONT STREET,Brooklyn,11207.0,3037060012.0,3000000.0,BK-05,37.0,1144.0,BK0502,40.674274,-73.894487,40.674342,-73.894209,2023-10-12,New Construction,No,Non Prevailing Wage,,3.0,8.0,,,,,5.0,6.0,,,,,,11.0,,11.0,11,2023.0
70249,165 STOCKHOLM STREET,9/25/2020,8/25/2022,377604.0,165,STOCKHOLM STREET,Brooklyn,11237.0,3032467501.0,3402017.0,BK-04,37.0,429.0,BK0401,40.699603,-73.9227,40.699652,-73.922988,2022-08-25,New Construction,No,Non Prevailing Wage,,,,,2.0,,,2.0,,,,,,,2.0,,2.0,6,2022.0
70268,141 WOODBINE STREET,9/24/2020,2/5/2021,989746.0,141,WOODBINE STREET,Brooklyn,11221.0,3033500040.0,3076597.0,BK-04,37.0,417.0,BK0402,40.692473,-73.916809,40.692663,-73.916967,2021-02-05,New Construction,No,Non Prevailing Wage,,,,,3.0,,,3.0,,,,,,,3.0,,3.0,8,2021.0
70269,1520 FULTON STREET,9/24/2020,9/16/2022,297501.0,1520,FULTON STREET,Brooklyn,11216.0,3018640014.0,3425135.0,BK-03,36.0,271.0,BK0302,40.679862,-73.939953,40.679579,-73.939931,2022-09-16,New Construction,No,Non Prevailing Wage,,,,,15.0,,,7.0,8.0,,,,,,15.0,,15.0,49,2022.0
70265,1035 CORTELYOU ROAD,9/23/2020,8/10/2021,995981.0,1027,CORTELYOU ROAD,Brooklyn,11218.0,3051417502.0,3118198.0,BK-18,39.0,1522.0,BK1402,40.639396,-73.968501,40.639744,-73.968209,2021-08-10,New Construction,No,Non Prevailing Wage,,,,,3.0,,,,3.0,,,,,,3.0,,3.0,10,2021.0
70266,168 EAST 100TH STREET,9/23/2020,2/5/2021,994198.0,168,EAST 100 STREET,Manhattan,10029.0,1016270042.0,1090703.0,MN-11,8.0,166.0,MN1101,40.788144,-73.948406,40.787817,-73.94819,2021-02-05,New Construction,No,Non Prevailing Wage,,,,,5.0,,,5.0,,,,,,,5.0,,5.0,16,2021.0
70263,83-67 116TH STREET,9/22/2020,3/12/2021,530526.0,83-67,116 STREET,Queens,11418.0,4033210175.0,4617666.0,QN-09,29.0,134.0,QN0901,40.704521,-73.835823,40.704737,-73.83557,2021-03-12,New Construction,No,Non Prevailing Wage,,,,,14.0,,4.0,6.0,4.0,,,,,,14.0,,14.0,48,2021.0
70264,857 HORNADAY PLACE,9/22/2020,11/5/2021,988159.0,2145,MOHEGAN AVENUE,Bronx,10460.0,2031190048.0,2000000.0,BX-06,15.0,363.0,BX0601,40.846865,-73.882325,40.846931,-73.88243,2021-11-05,New Construction,No,Non Prevailing Wage,,,,,5.0,,1.0,1.0,3.0,,,,,,5.0,,5.0,15,2021.0
70261,360 VAN DUZER STREET,9/21/2020,9/21/2020,995582.0,360,VAN DUZER STREET,Staten Island,10304.0,5005150036.0,5013507.0,SI-01,49.0,21.0,SI0102,40.62933,-74.07938,40.629552,-74.079705,2020-09-21,New Construction,No,Non Prevailing Wage,,,,,3.0,,,1.0,2.0,,,,,,3.0,,3.0,8,2020.0
70262,50 CLARKSON AVENUE,9/21/2020,5/13/2022,977102.0,52,CLARKSON AVENUE,Brooklyn,11226.0,3050640036.0,3425069.0,BK-14,40.0,79602.0,BK1401,40.654934,-73.95802,40.654596,-73.957956,2022-05-13,New Construction,No,Non Prevailing Wage,,,,,28.0,,2.0,17.0,9.0,,,,,,28.0,,28.0,93,2022.0
72510,91-03 WHITNEY AVENUE,9/21/2020,4/9/2021,997956.0,91-03,WHITNEY AVENUE,Queens,11373.0,4015520043.0,4618852.0,QN-04,21.0,46902.0,QN0401,40.746861,-73.875035,40.746892,-73.875046,2021-04-09,New Construction,No,Non Prevailing Wage,,,,,10.0,,,1.0,9.0,,,,,,10.0,,10.0,20,2021.0
70260,380 GROVE STREET,9/18/2020,1/21/2022,305043.0,378,GROVE STREET,Brooklyn,11237.0,3033280026.0,3076177.0,BK-04,37.0,441.0,BK0401,40.700335,-73.913751,40.70028,-73.913463,2022-01-21,New Construction,No,Non Prevailing Wage,,,,,12.0,,2.0,6.0,4.0,,,,,,12.0,,12.0,39,2022.0
68781,WELLLIFE. 80-97 CYPRESS AVENUE,9/17/2020,5/20/2022,992093.0,80-97,CYPRESS AVENUE,Queens,11385.0,4037310065.0,4554538.0,QN-05,30.0,565.0,QN0503,40.692336,-73.893687,40.692658,-73.893978,2022-05-20,New Construction,No,Non Prevailing Wage,40.0,,26.0,,,,46.0,8.0,12.0,,,,,,66.0,,66.0,66,2022.0
70258,482 SENECA AVENUE,9/17/2020,9/17/2020,694488.0,484,SENECA AVENUE,Queens,11385.0,4034330035.0,4081973.0,QN-05,34.0,545.0,QN0502,40.705695,-73.912583,40.705453,-73.912659,2020-09-17,New Construction,No,Non Prevailing Wage,,,,,7.0,,,3.0,3.0,1.0,,,,,7.0,,7.0,20,2020.0
70259,58 GREENPOINT AVENUE,9/17/2020,11/22/2022,304809.0,56,GREENPOINT AVENUE,Brooklyn,11222.0,3025620010.0,3064788.0,BK-01,33.0,565.0,BK0101,40.729767,-73.958691,40.729526,-73.958673,2022-11-22,New Construction,No,Non Prevailing Wage,,,,,5.0,,,5.0,,,,,,,5.0,,5.0,14,2022.0
72282,1470 EASTERN PARKWAY APARTMENTS,9/17/2020,6/17/2022,1002458.0,1470,EASTERN PARKWAY,Brooklyn,11233.0,3014740007.0,3427205.0,BK-16,41.0,361.0,BK1601,40.669625,-73.919577,40.669323,-73.919451,2022-06-17,New Construction,No,Non Prevailing Wage,,,,,7.0,,,5.0,,2.0,,,,,7.0,,7.0,21,2022.0
70256,222 JOHNSON AVENUE,9/16/2020,8/19/2022,992615.0,222,JOHNSON AVENUE,Brooklyn,11206.0,3030720040.0,3425084.0,BK-01,34.0,49302.0,BK0104,40.706865,-73.940202,40.706676,-73.940206,2022-08-19,New Construction,No,Non Prevailing Wage,,,24.0,,11.0,,6.0,19.0,10.0,,,,,,35.0,,35.0,116,2022.0
70257,61 SCHAEFER STREET,9/16/2020,2/12/2021,996041.0,61,SCHAEFER STREET,Brooklyn,11207.0,3034210059.0,3079223.0,BK-04,37.0,401.0,BK0402,40.686282,-73.911173,40.686307,-73.911491,2021-02-12,New Construction,No,Non Prevailing Wage,,,,,3.0,,,3.0,,,,,,,3.0,,3.0,8,2021.0
72283,32-72 41ST STREET,9/16/2020,4/11/2023,429245.0,28-32,41 STREET,Queens,11103.0,4006630033.0,4010799.0,QN-01,22.0,147.0,QN0104,40.764836,-73.91313,40.764395,-73.913813,2023-04-11,New Construction,No,Non Prevailing Wage,,,,,8.0,,,6.0,2.0,,,,,,8.0,,8.0,25,2023.0
76706,32-72 41 STREET APARTMENTS,9/16/2020,7/29/2022,1003525.0,32-72,41 STREET,Queens,11103.0,4006760090.0,4594808.0,QN-01,22.0,157.0,QN0104,40.757073,-73.919449,40.756868,-73.919937,2022-07-29,New Construction,No,Non Prevailing Wage,,,,,8.0,,,6.0,2.0,,,,,,8.0,,8.0,25,2022.0
70253,1801 BROADWAY,9/15/2020,5/13/2022,992194.0,1801,BROADWAY,Brooklyn,11207.0,3034567501.0,3080287.0,BK-04,37.0,403.0,BK0402,40.681883,-73.908641,40.682174,-73.908565,2022-05-13,New Construction,No,Non Prevailing Wage,,,,,13.0,,2.0,4.0,7.0,,,,,,13.0,,13.0,41,2022.0
70254,410 EAST 28 STREET,9/15/2020,11/5/2021,255045.0,410,EAST 28 STREET,Brooklyn,11226.0,3052140013.0,3120436.0,BK-17,45.0,828.0,BK1701,40.640487,-73.950394,40.640512,-73.950675,2021-11-05,New Construction,No,Non Prevailing Wage,,,,,3.0,,,,3.0,,,,,,3.0,,3.0,10,2021.0
70255,THE CROWN,9/15/2020,11/22/2022,1004315.0,524,OCEAN VIEW AVENUE,Brooklyn,11235.0,3086750076.0,3421742.0,BK-13,48.0,362.0,BK1303,40.579489,-73.96255,40.579297,-73.962402,2022-11-22,New Construction,No,Non Prevailing Wage,,,,,9.0,,,5.0,4.0,,,,,,9.0,,9.0,27,2022.0
70252,65 WOODBINE STREET,9/14/2020,3/18/2022,970975.0,65,WOODBINE STREET,Brooklyn,11221.0,3033490045.0,3076576.0,BK-04,37.0,399.0,BK0402,40.690625,-73.918628,40.690746,-73.918844,2022-03-18,New Construction,No,Non Prevailing Wage,,,,,3.0,,,3.0,,,,,,,3.0,,3.0,8,2022.0
70251,48 JEFFERSON STREET,9/10/2020,9/10/2020,989749.0,48,JEFFERSON STREET,Brooklyn,11206.0,3031710013.0,3072195.0,BK-04,34.0,391.0,BK0401,40.698646,-73.933228,40.698405,-73.933365,2020-09-10,New Construction,No,Non Prevailing Wage,,,,,3.0,,,3.0,,,,,,,3.0,,3.0,8,2020.0
70250,74-10 BROADWAY,9/8/2020,6/17/2022,1010874.0,40-15,74 STREET,Queens,11373.0,4014857502.0,4618361.0,QN-04,25.0,267.0,QN0401,40.746156,-73.891288,40.746356,-73.89111,2022-06-17,New Construction,No,Non Prevailing Wage,,,,,3.0,,,,3.0,,,,,,3.0,,3.0,10,2022.0
70248,1626 & 1630 BROOKLYN AVENUE,9/4/2020,2/28/2022,214631.0,1630,BROOKLYN AVENUE,Brooklyn,11210.0,3075630059.0,3426664.0,BK-17,45.0,784.0,BK1702,40.633292,-73.941908,40.633303,-73.94221,2022-02-28,New Construction,No,Non Prevailing Wage,,,,,3.0,,,3.0,,,,,,,3.0,,3.0,8,2022.0
70248,1626 & 1630 BROOKLYN AVENUE,9/4/2020,2/28/2022,994564.0,1626,BROOKLYN AVENUE,Brooklyn,11210.0,3075630058.0,3425739.0,BK-17,45.0,784.0,BK1702,40.633363,-73.941915,40.633358,-73.942217,2022-02-28,New Construction,No,Non Prevailing Wage,,,,,3.0,,,3.0,,,,,,,3.0,,3.0,8,2022.0
70247,1259 51ST STREET,9/3/2020,9/3/2020,992631.0,1259,51 STREET,Brooklyn,11219.0,3056480053.0,3138051.0,BK-12,44.0,220.0,BK1202,40.634369,-73.994041,40.634487,-73.993781,2020-09-03,New Construction,No,Non Prevailing Wage,,,,,3.0,,,,3.0,,,,,,3.0,,3.0,7,2020.0
70246,782 NEW YORK AVENUE,9/1/2020,9/1/2020,995346.0,782,NEW YORK AVENUE,Brooklyn,11203.0,3048370065.0,3426836.0,BK-17,40.0,818.0,BK1701,40.654792,-73.94709,40.654638,-73.947317,2020-09-01,New Construction,No,Non Prevailing Wage,,,,,12.0,,,8.0,4.0,,,,,,12.0,,12.0,39,2020.0
70244,65 GRAHAM AVENUE,8/31/2020,7/17/2023,302249.0,65,GRAHAM AVENUE,Brooklyn,11206.0,3030960025.0,3325956.0,BK-01,34.0,491.0,BK0104,40.703869,-73.942643,40.703853,-73.942899,2023-07-17,New Construction,No,Non Prevailing Wage,,,,,3.0,,,,3.0,,,,,,3.0,,3.0,8,2023.0
70245,984 MADISON STREET,8/31/2020,7/16/2021,995595.0,984,MADISON STREET,Brooklyn,11221.0,3033660028.0,3422548.0,BK-04,37.0,397.0,BK0402,40.689126,-73.918897,40.68903,-73.918652,2021-07-16,New Construction,No,Non Prevailing Wage,,,,,3.0,,,3.0,,,,,,,3.0,,3.0,18,2021.0
70243,1609 VOORHIES AVENUE,8/27/2020,12/21/2023,387468.0,1609,VOORHIES AVENUE,Brooklyn,11235.0,3074590146.0,3204947.0,BK-15,48.0,606.0,BK1503,40.585845,-73.952764,40.586067,-73.952584,2023-12-21,New Construction,No,Non Prevailing Wage,,,,,3.0,,,,3.0,,,,,,3.0,,3.0,10,2023.0
70241,42 EAST 132ND STREET,8/25/2020,8/25/2020,993798.0,42,EAST 132 STREET,Manhattan,10037.0,1017560048.0,1089943.0,MN-11,9.0,206.0,MN1102,40.809994,-73.937003,40.809764,-73.93709,2020-08-25,New Construction,No,Non Prevailing Wage,,,3.0,,,,,2.0,1.0,,,,,,3.0,,3.0,12,2020.0
70242,535 GRAND STREET,8/25/2020,7/1/2022,302716.0,535,GRAND STREET,Brooklyn,11211.0,3027797503.0,3069330.0,BK-01,34.0,513.0,BK0102,40.711077,-73.949931,40.711311,-73.94997,2022-07-01,New Construction,No,Non Prevailing Wage,,,,,3.0,,,,3.0,,,,,,3.0,,3.0,10,2022.0
72479,14-55 31ST AVENUE APARTMENTS,8/21/2020,10/22/2021,971669.0,14-53,31 AVENUE,Queens,11106.0,4005340001.0,4595613.0,QN-01,22.0,79.0,QN0102,40.767576,-73.930419,40.767686,-73.929942,2021-10-22,New Construction,No,Non Prevailing Wage,,,,,14.0,,,9.0,5.0,,,,,,14.0,,14.0,45,2021.0
67720,RISEBORO. 37 HILLSIDE AVENUE,8/20/2020,12/12/2023,986618.0,37,HILLSIDE AVENUE,Manhattan,10040.0,1021700118.0,1091669.0,MN-12,10.0,283.0,MN1202,40.858536,-73.929601,40.858187,-73.929684,2023-12-12,New Construction,No,Prevailing Wage,163.0,,,,,1.0,118.0,45.0,1.0,,,,,,164.0,,164.0,164,2023.0
70240,810 FULTON STREET APARTMENTS PHASE II,8/20/2020,4/23/2021,974040.0,475,CLERMONT AVENUE,Brooklyn,11238.0,3020097501.0,3426518.0,BK-02,35.0,199.0,BK0204,40.683304,-73.968891,40.683488,-73.968462,2021-04-23,New Construction,No,Non Prevailing Wage,,,,,37.0,,11.0,18.0,8.0,,,,,,37.0,,37.0,363,2021.0
64383,1921 ATLANTIC AVE,8/19/2020,5/14/2024,185836.0,1921,ATLANTIC AVENUE,Brooklyn,11233.0,3015577501.0,3000000.0,BK-03,41.0,301.0,BK1601,40.676877,-73.920408,40.677262,-73.920494,2022-12-20,New Construction,No,Non Prevailing Wage,60.0,58.0,117.0,,,,52.0,79.0,59.0,45.0,,,,,235.0,,235.0,236,2022.0
70239,1214 GREENE AVENUE,8/19/2020,5/7/2021,303832.0,1214,GREENE AVENUE,Brooklyn,11221.0,3032960041.0,3426531.0,BK-04,37.0,419.0,BK0402,40.695439,-73.922073,40.695496,-73.921666,2021-05-07,New Construction,No,Non Prevailing Wage,,,,,3.0,,,1.0,2.0,,,,,,3.0,,3.0,10,2021.0
72284,2851 UNIVERSITY AVENUE,8/19/2020,11/30/2023,988766.0,2851,UNIVERSITY AVENUE,Bronx,10468.0,2032500139.0,2015429.0,BX-08,14.0,26702.0,BX0801,40.87258,-73.898891,40.872964,-73.8991,2023-11-30,New Construction,No,Non Prevailing Wage,,,,,6.0,,2.0,3.0,1.0,,,,,,6.0,,6.0,18,2023.0
70238,ONE BLUE SLIP,8/18/2020,1/27/2023,948192.0,1,BLUE SLIP,Brooklyn,11222.0,3024727503.0,3418101.0,BK-01,33.0,56302.0,BK0101,40.736165,-73.959012,40.736827,-73.959091,2023-01-27,New Construction,No,Non Prevailing Wage,,,,,108.0,,29.0,54.0,23.0,2.0,,,,,108.0,,108.0,359,2023.0
70237,THE ARCHES,8/14/2020,7/30/2021,997633.0,228,EAST 135 STREET,Bronx,10451.0,2023197501.0,2129363.0,BX-01,8.0,51.0,BX0101,40.809881,-73.930252,40.80984,-73.930841,2021-07-30,New Construction,No,Non Prevailing Wage,,,,,129.0,,28.0,54.0,47.0,,,,,,129.0,,129.0,240,2021.0
70236,1337 GATES AVENUE,8/13/2020,2/26/2021,299127.0,1337,GATES AVENUE,Brooklyn,11221.0,3033330040.0,3076295.0,BK-04,37.0,417.0,BK0402,40.694996,-73.916679,40.69515,-73.91687,2021-02-26,New Construction,No,Non Prevailing Wage,,,,,5.0,,2.0,1.0,1.0,1.0,,,,,5.0,,5.0,15,2021.0
70235,570 NOSTRAND AVENUE,8/12/2020,10/8/2021,346865.0,570,NOSTRAND AVENUE,Brooklyn,11216.0,3018650062.0,3332258.0,BK-03,36.0,247.0,BK0301,40.679235,-73.949634,40.679109,-73.94994,2021-10-08,New Construction,No,Non Prevailing Wage,,,,,8.0,,2.0,2.0,4.0,,,,,,8.0,,8.0,25,2021.0
63799,VICTORY COMMONS,8/11/2020,6/28/2023,989112.0,1007,UNION AVENUE,Bronx,10459.0,2026690080.0,2129155.0,BX-03,17.0,133.0,BX0301,40.824022,-73.901339,40.824152,-73.901801,2023-06-28,New Construction,No,Non Prevailing Wage,18.0,17.0,44.0,15.0,,1.0,6.0,48.0,33.0,8.0,,,,,95.0,,95.0,95,2023.0
72287,150 MARTENSE STREET,8/11/2020,3/5/2021,333313.0,150,MARTENSE STREET,Brooklyn,11226.0,3050900031.0,3116901.0,BK-17,40.0,822.0,BK1701,40.65146,-73.954048,40.65121,-73.954008,2021-03-05,New Construction,No,Non Prevailing Wage,,,,,4.0,,,4.0,,,,,,,4.0,,4.0,12,2021.0
70568,31 AINSLIE STREET APARTMENTS,8/4/2020,8/4/2020,973708.0,31,AINSLIE STREET,Brooklyn,11211.0,3023710050.0,3418393.0,BK-01,34.0,513.0,BK0102,40.713047,-73.953255,40.713148,-73.953165,2020-08-04,New Construction,No,Non Prevailing Wage,,,15.0,,,,3.0,4.0,8.0,,,,,,15.0,,15.0,15,2020.0
68191,WEST 144 CLUSTER LLC.YR15.FY21,8/3/2020,8/3/2020,41505.0,208,WEST 141 STREET,Manhattan,10030.0,1020260041.0,1060414.0,MN-10,9.0,230.0,MN1002,40.819362,-73.941583,40.819266,-73.941926,2020-08-03,Preservation,No,Non Prevailing Wage,17.0,6.0,1.0,,,,,7.0,10.0,7.0,,,,,24.0,,24.0,24,2020.0
68191,WEST 144 CLUSTER LLC.YR15.FY21,8/3/2020,8/3/2020,41507.0,212,WEST 141 STREET,Manhattan,10030.0,1020260043.0,1060415.0,MN-10,9.0,230.0,MN1002,40.819397,-73.941662,40.81934,-73.942099,2020-08-03,Preservation,No,Non Prevailing Wage,6.0,12.0,,,,,,2.0,11.0,5.0,,,,,18.0,,18.0,18,2020.0
68191,WEST 144 CLUSTER LLC.YR15.FY21,8/3/2020,8/3/2020,41699.0,115,WEST 143 STREET,Manhattan,10030.0,1020120022.0,1060138.0,MN-10,9.0,232.0,MN1002,40.819514,-73.938031,40.819755,-73.938056,2020-08-03,Preservation,No,Non Prevailing Wage,10.0,11.0,2.0,,,1.0,,14.0,10.0,,,,,,24.0,,24.0,24,2020.0
68191,WEST 144 CLUSTER LLC.YR15.FY21,8/3/2020,8/3/2020,41701.0,130,WEST 143 STREET,Manhattan,10030.0,1020110050.0,1060121.0,MN-10,9.0,232.0,MN1002,40.819615,-73.938316,40.819605,-73.938858,2020-08-03,Preservation,No,Non Prevailing Wage,7.0,11.0,1.0,,,,2.0,,12.0,5.0,,,,,19.0,,19.0,19,2020.0
68191,WEST 144 CLUSTER LLC.YR15.FY21,8/3/2020,8/3/2020,41705.0,139,WEST 143 STREET,Manhattan,10030.0,1020120017.0,1060135.0,MN-10,9.0,232.0,MN1002,40.819747,-73.938587,40.81992,-73.938446,2020-08-03,Preservation,No,Non Prevailing Wage,1.0,16.0,,,,,,,12.0,5.0,,,,,17.0,,17.0,17,2020.0
68191,WEST 144 CLUSTER LLC.YR15.FY21,8/3/2020,8/3/2020,41782.0,137,WEST 144 STREET,Manhattan,10030.0,1020130012.0,1060162.0,MN-10,9.0,232.0,MN1002,40.820491,-73.938417,40.820719,-73.938398,2020-08-03,Preservation,No,Non Prevailing Wage,10.0,8.0,1.0,,,1.0,2.0,4.0,5.0,9.0,,,,,20.0,,20.0,20,2020.0
68191,WEST 144 CLUSTER LLC.YR15.FY21,8/3/2020,8/3/2020,41789.0,160,WEST 144 STREET,Manhattan,10030.0,1020120057.0,1060153.0,MN-10,9.0,232.0,MN1002,40.820719,-73.939002,40.820464,-73.93898,2020-08-03,Preservation,No,Non Prevailing Wage,8.0,4.0,3.0,,,,1.0,4.0,10.0,,,,,,15.0,,15.0,15,2020.0
68191,WEST 144 CLUSTER LLC.YR15.FY21,8/3/2020,8/3/2020,41899.0,227,WEST 145 STREET,Manhattan,10039.0,1020310017.0,1060478.0,MN-10,9.0,232.0,MN1002,40.82207,-73.940074,40.822468,-73.940312,2020-08-03,Preservation,No,Non Prevailing Wage,2.0,15.0,,,,,,6.0,6.0,5.0,,,,,17.0,,17.0,17,2020.0
63933,SUS. 461 ALABAMA AVENUE. MWBE SITE A.,7/31/2020,10/28/2022,992262.0,461,ALABAMA AVENUE,Brooklyn,11207.0,3038030006.0,3429520.0,BK-05,42.0,1130.0,BK0503,40.664864,-73.896964,40.664883,-73.896686,2022-10-28,New Construction,No,Non Prevailing Wage,43.0,11.0,16.0,,,1.0,55.0,14.0,2.0,,,,,,71.0,,71.0,71,2022.0
70539,NUL 125TH STREET,7/30/2020,5/8/2021,869382.0,125,WEST 125 STREET,Manhattan,10027.0,1019107501.0,1081601.0,MN-10,9.0,222.0,MN1001,40.808215,-73.946502,40.808665,-73.946841,2021-05-08,New Construction,No,Non Prevailing Wage,18.0,68.0,84.0,,,1.0,21.0,86.0,64.0,,,,,,171.0,,171.0,171,2021.0
72288,168 FORCE TUBE AVENUE,7/26/2020,3/5/2021,345797.0,135,NORWOOD AVENUE,Brooklyn,11208.0,3041240018.0,3323894.0,BK-05,37.0,1174.0,BK0501,40.682801,-73.879395,40.682877,-73.879114,2021-03-05,New Construction,No,Non Prevailing Wage,,,,,8.0,,,3.0,4.0,1.0,,,,,8.0,,8.0,26,2021.0
72289,3116 CLARENDON ROAD,7/19/2020,7/8/2022,989479.0,3116,CLARENDON ROAD,Brooklyn,11226.0,3049480007.0,3337664.0,BK-17,45.0,830.0,BK1702,40.643313,-73.947542,40.643072,-73.947207,2022-07-08,New Construction,No,Non Prevailing Wage,,,,,7.0,,,3.0,4.0,,,,,,7.0,,7.0,22,2022.0
72290,643 & 647 SHEFFIELD AVENUE,7/17/2020,3/5/2021,993819.0,643,SHEFFIELD AVENUE,Brooklyn,11207.0,3042980077.0,3421594.0,BK-05,42.0,1128.0,BK0503,40.661021,-73.893524,40.66126,-73.893397,2021-03-05,New Construction,No,Non Prevailing Wage,,,,,3.0,,,1.0,2.0,,,,,,3.0,,3.0,8,2021.0
72290,643 & 647 SHEFFIELD AVENUE,7/17/2020,3/5/2021,995824.0,647,SHEFFIELD AVENUE,Brooklyn,11207.0,3042980076.0,3425698.0,BK-05,42.0,1128.0,BK0503,40.660961,-73.893477,40.661191,-73.893344,2021-03-05,New Construction,No,Non Prevailing Wage,,,,,3.0,,,1.0,2.0,,,,,,3.0,,3.0,8,2021.0
68444,GRACE EPISCOPAL SENIOR,7/15/2020,6/17/2021,498882.0,155-02,90 AVENUE,Queens,11432.0,4097540001.0,4459168.0,QN-12,27.0,240.0,QN1201,40.704578,-73.802097,40.704404,-73.801754,2021-06-17,Preservation,No,Non Prevailing Wage,78.0,1.0,,,,1.0,20.0,59.0,1.0,,,,,,80.0,,80.0,80,2021.0
69286,BELMONT DANIEL.HPO.FY20,7/2/2020,3/11/2021,714902.0,100,BELMONT PLACE,Staten Island,10301.0,5000200008.0,5112989.0,SI-01,49.0,9.0,SI0101,40.642636,-74.079663,40.642589,-74.080347,2021-03-11,Preservation,No,Non Prevailing Wage,,1.0,54.0,,,1.0,,37.0,13.0,6.0,,,,,56.0,,56.0,56,2021.0
69286,BELMONT DANIEL.HPO.FY20,7/2/2020,3/11/2021,812434.0,101,DANIEL LOW TERRACE,Staten Island,10301.0,5000200008.0,5108464.0,SI-01,49.0,9.0,SI0101,40.642429,-74.080981,40.642589,-74.080347,2021-03-11,Preservation,No,Non Prevailing Wage,,7.0,46.0,3.0,,,,38.0,12.0,6.0,,,,,56.0,,56.0,56,2021.0
65503,LIC RAMPS,6/30/2020,,991157.0,27-01,JACKSON AVENUE,Queens,11101.0,4004320021.0,4620935.0,QN-02,26.0,1902.0,QN0201,40.747685,-73.940805,40.747875,-73.941108,2024-10-31,New Construction,No,Non Prevailing Wage,,,7.0,16.0,27.0,,12.0,13.0,25.0,,,,,,50.0,,50.0,164,2024.0
70016,1119 BROADWAY,6/30/2020,6/30/2020,213679.0,1119,BROADWAY,Brooklyn,11221.0,3032410078.0,3073759.0,BK-04,34.0,393.0,BK0401,40.69375,-73.929493,40.693936,-73.929356,2020-06-30,New Construction,No,Non Prevailing Wage,,,,,3.0,,,3.0,,,,,,,3.0,,3.0,10,2020.0
70017,639 FOSTER AVENUE,6/30/2020,1/21/2022,991282.0,639,FOSTER AVENUE,Brooklyn,11230.0,3054280092.0,3128179.0,BK-14,45.0,482.0,BK1402,40.630684,-73.970144,40.630824,-73.97036,2022-01-21,New Construction,No,Non Prevailing Wage,,,,,7.0,,1.0,6.0,,,,,,,7.0,,7.0,22,2022.0
70018,THE STRAND,6/30/2020,2/11/2022,699653.0,18-68,TROUTMAN STREET,Queens,11385.0,4033950015.0,4000000.0,QN-05,34.0,53901.0,QN0502,40.711142,-73.918185,40.71107,-73.917911,2022-02-11,New Construction,No,Non Prevailing Wage,,,,,40.0,,11.0,22.0,6.0,1.0,,,,,40.0,,40.0,132,2022.0
70006,104 LINDEN BOULEVARD,6/29/2020,4/28/2022,327013.0,104,LINDEN BOULEVARD,Brooklyn,11226.0,3050870021.0,3116747.0,BK-17,40.0,822.0,BK1701,40.652369,-73.954782,40.652064,-73.95488,2022-04-28,New Construction,No,Non Prevailing Wage,,,,,5.0,,5.0,,,,,,,,5.0,,5.0,10,2022.0
70007,2232 KIMBALL STREET,6/29/2020,2/5/2025,948620.0,2232,KIMBALL STREET,Brooklyn,11234.0,3085560055.0,3242302.0,BK-18,46.0,662.0,BK1802,40.607722,-73.924146,40.607527,-73.92429,2025-02-05,New Construction,No,Non Prevailing Wage,,,,,2.0,,,,2.0,,,,,,2.0,,2.0,6,2025.0
70008,523 WEST 173RD STREET APARTMENTS,6/29/2020,6/29/2020,969461.0,523,WEST 173 STREET,Manhattan,10032.0,1021300057.0,1090339.0,MN-12,10.0,261.0,MN1201,40.843279,-73.935439,40.843515,-73.935403,2020-06-29,New Construction,No,Non Prevailing Wage,,,2.0,,,,1.0,1.0,,,,,,,2.0,,2.0,8,2020.0
70004,41-53 77TH STREET,6/28/2020,6/28/2020,992862.0,41-53,77 STREET,Queens,11373.0,4014970051.0,4617786.0,QN-04,25.0,267.0,QN0401,40.744418,-73.88814,40.743949,-73.887787,2020-06-28,New Construction,No,Non Prevailing Wage,,,,,3.0,,,,3.0,,,,,,3.0,,3.0,7,2020.0
72292,698 EMPIRE BLVD,6/28/2020,11/22/2022,998089.0,698,EMPIRE BOULEVARD,Brooklyn,11213.0,3014260023.0,3038424.0,BK-09,40.0,331.0,BK0901,40.663837,-73.938824,40.663593,-73.939019,2022-11-22,New Construction,No,Non Prevailing Wage,,,,,9.0,,2.0,5.0,2.0,,,,,,9.0,,9.0,27,2022.0
72476,1525 & 1527 NEW YORK AVENUE,6/28/2020,2/26/2021,995918.0,1525,NEW YORK AVENUE,Brooklyn,11210.0,3050080026.0,3114072.0,BK-17,45.0,784.0,BK1702,40.635492,-73.945008,40.635506,-73.944698,2021-02-26,New Construction,No,Non Prevailing Wage,,,,,3.0,,,2.0,1.0,,,,,,3.0,,3.0,8,2021.0
70002,23-71 31ST STREET,6/27/2020,7/22/2022,417926.0,23-71,31 STREET,Queens,11105.0,4008350011.0,4017170.0,QN-01,22.0,115.0,QN0101,40.772866,-73.914672,40.772734,-73.914408,2022-07-22,New Construction,No,Non Prevailing Wage,,,,,3.0,,,3.0,,,,,,,3.0,,3.0,10,2022.0
70003,350 RUTLAND ROAD,6/27/2020,10/22/2020,996441.0,350,RUTLAND ROAD,Brooklyn,11225.0,3048090023.0,3107160.0,BK-09,40.0,804.0,BK0902,40.659484,-73.949115,40.659269,-73.94914,2020-10-22,New Construction,No,Non Prevailing Wage,,,,,2.0,,,2.0,,,,,,,2.0,,2.0,6,2020.0
68410,272 EAST 7TH STREET,6/26/2020,6/26/2020,11158.0,272,EAST 7 STREET,Manhattan,10009.0,1003760028.0,1004485.0,MN-03,2.0,2602.0,MN0303,40.72349,-73.977477,40.723171,-73.977264,2020-06-26,Preservation,Yes,Non Prevailing Wage,21.0,,,,,,18.0,,3.0,,,,,,21.0,,21.0,21,2020.0
70000,26-26 18TH STREET,6/26/2020,2/5/2021,984642.0,26-26,18 STREET,Queens,11102.0,4009010052.0,4020580.0,QN-01,22.0,83.0,QN0102,40.773508,-73.927221,40.773528,-73.927492,2021-02-05,New Construction,No,Non Prevailing Wage,,,,,3.0,,,3.0,,,,,,,3.0,,3.0,7,2021.0
70001,3506 & 3508 FARRAGUT ROAD,6/26/2020,6/24/2022,986445.0,3506,FARRAGUT ROAD,Brooklyn,11210.0,3050100040.0,3426573.0,BK-17,45.0,784.0,BK1702,40.636567,-73.943033,40.636342,-73.942899,2022-06-24,New Construction,No,Non Prevailing Wage,,,,,3.0,,,3.0,,,,,,,3.0,,3.0,8,2022.0
70001,3506 & 3508 FARRAGUT ROAD,6/26/2020,6/24/2022,992723.0,3508,FARRAGUT ROAD,Brooklyn,11210.0,3050100041.0,3426572.0,BK-17,45.0,784.0,BK1702,40.63657,-73.943018,40.636348,-73.942831,2022-06-17,New Construction,No,Non Prevailing Wage,,,,,3.0,,,3.0,,,,,,,3.0,,3.0,8,2022.0
69998,1044 BEDFORD AVENUE,6/25/2020,6/25/2020,205464.0,1044,BEDFORD AVENUE,Brooklyn,11205.0,3019500033.0,3426102.0,BK-03,36.0,233.0,BK0301,40.68922,-73.955089,40.689176,-73.955359,2020-06-25,New Construction,No,Non Prevailing Wage,,,,,8.0,,,4.0,4.0,,,,,,8.0,,8.0,24,2020.0
69999,938 BUSHWICK AVENUE,6/25/2020,2/23/2023,1005293.0,938,BUSHWICK AVENUE,Brooklyn,11221.0,3032940014.0,3075290.0,BK-04,37.0,395.0,BK0402,40.692692,-73.923815,40.692445,-73.923999,2023-02-23,New Construction,No,Non Prevailing Wage,,,,,3.0,,,2.0,,1.0,,,,,3.0,,3.0,8,2023.0
69997,3512/3514 FARRAGUT APARTMENTS,6/24/2020,6/24/2022,291232.0,3514,FARRAGUT ROAD,Brooklyn,11210.0,3050100043.0,3425529.0,BK-17,45.0,784.0,BK1702,40.636573,-73.942975,40.636356,-73.942687,2022-06-24,New Construction,No,Non Prevailing Wage,,,,,3.0,,,,3.0,,,,,,3.0,,3.0,8,2022.0
69997,3512/3514 FARRAGUT APARTMENTS,6/24/2020,6/24/2022,992724.0,3512,FARRAGUT ROAD,Brooklyn,11210.0,3050100042.0,3425627.0,BK-17,45.0,784.0,BK1702,40.63657,-73.942989,40.63635,-73.942759,2022-06-17,New Construction,No,Non Prevailing Wage,,,,,3.0,,,3.0,,,,,,,3.0,,3.0,8,2022.0
69996,290 UNION AVENUE,6/23/2020,8/20/2020,382912.0,288,UNION AVENUE,Brooklyn,11211.0,3030220003.0,3000000.0,BK-01,34.0,511.0,BK0104,40.708997,-73.950791,40.709118,-73.950491,2020-08-20,New Construction,No,Non Prevailing Wage,,,,,8.0,,,2.0,6.0,,,,,,8.0,,8.0,25,2020.0
69995,102 CENTRAL AVENUE,6/22/2020,9/10/2021,218528.0,102,CENTRAL AVENUE,Brooklyn,11206.0,3031720032.0,3072254.0,BK-04,34.0,425.0,BK0401,40.700458,-73.929349,40.700337,-73.929631,2021-09-10,New Construction,No,Non Prevailing Wage,,,,,3.0,,,3.0,,,,,,,3.0,,3.0,8,2021.0
